ORDER_ID|TRUCK_ID|LANGUAGE|SOURCE|REVIEW|PRIMARY_CITY|CUSTOMER_ID|YEAR|MONTH|TRUCK_BRAND
344767678|303|en|6|Veggie Taco Bowl at Guac n' Roll fell short of excitement. Overcooked vegetables resulted in a texture that was devoid of desirable crunch. The promised guacamole was noticeably absent, leaving the dish lacking the anticipated freshness and zest. The bottle of soda offered was surprisingly warm, indicating suboptimal storage. Despite being a taco truck in Sao Paulo, this meal failed to impress, necessitating enhancements in both culinary offerings and beverage management.|Sao Paulo||2022|2|Guac n' Roll
80510780|228|en|6|"""Guac n' Roll in Delhi served up a mix of items from their taco-centric menu. The Three Taco Combo Plate and Two Taco Combo Plate were satisfactory, with a decent balance of flavors. The Chicken Burrito was adequately filled, while the Lean Burrito Bowl was a healthier option that didn't compromise on taste. The Fish Burrito, however, was a bit underwhelming. Overall, the experience was acceptable, with some hits and misses."""|Delhi||2022|2|Guac n' Roll
397744789|396|en|6|I was incredibly disappointed with my recent order of The Mega Melt grilled cheese sandwich. The bread was soggy, the cheese was sparse, and the overall flavor was bland. The Original and The Ranch items I selected were not even close to the descriptions on the menu. The ingredients seemed cheap and the portions were small. I expected a much more satisfying and flavorful experience, especially given the high price. I would not recommend this restaurant to anyone.|Madrid||2022|2|The Mega Melt
409173416|413|en|6|A delightful find in Barcelona, Le Coin des Crêpes truck served up a succinct yet extensive crêpe menu. My choice was the breakfast crêpe, boasting a fluffy texture and just the right amount of sweetness. The crepe Suzette, brimming with fresh fruit and a lavish drizzle of chocolate, was another delectable option. The quenching bottled water and amicable service added to the experience. I wholeheartedly endorse this truck for those seeking a quick and fulfilling snack in Barcelona.|Barcelona||2022|2|Le Coin des Crêpes
409208706|406|en|6|A wide selection of ice cream options were available at the Freezing Point truck in Barcelona, pleasing many. The Waffle Cone exhibited crispness and freshness, while the Two Scoop Bowl boasted a generous portion size. The Bottled Soda and Ice Tea were on par with expectations. The Ice Cream Sandwich stood out with its soft cookies and creamy filling. Regrettably, the Popsicle fell short due to its smaller-than-expected size. The overall experience was satisfactory, showcasing both successes and disappointments.|Barcelona||2022|2|Freezing Point
436569972|67|en|6|The Salad of All Salads at Plant Palace in New York City is a culinary masterpiece. The salad is crafted with fresh, vibrant vegetables, including crisp lettuce, juicy tomatoes, and creamy avocado. Each bite tantalizes the taste buds, delivering a symphony of flavors that dance on the tongue. The ingredients are perfectly balanced, creating a light and refreshing salad that is perfect for any occasion. The vibrant presentation adds a touch of whimsy to the dining experience. Overall, I highly recommend the Salad of All Salads at Plant Palace for its exceptional taste, freshness, and creativity.|New York City||2022|2|Plant Palace
107054843|264|en|6|The Tasty Tibs truck in Seoul offers a flavorful Ethiopian menu. The lean chicken tibs, a popular dish, were tender and spiced just right. The veggie combo, consisting of injera bread, lentils, and vegetables, was a satisfying vegetarian option. The service was friendly and efficient, and the atmosphere was casual and welcoming. Overall, I highly recommend Tasty Tibs for those seeking a taste of Ethiopia in the heart of Seoul.|Seoul||2022|2|Tasty Tibs
107118018|267|en|6|Gyros that are a treat to behold and devour can be found at The Cheeky Greek truck. The Greek salad is refreshing, with a perfect balance of tangy and sweet flavors. The gyro plate is stacked high with tender lamb, fluffy pita, and the most delectable tzatziki sauce. The King Combo, which includes all of the above, is a feast for both the eyes and the stomach. The friendly service and vibrant atmosphere make the experience even more enjoyable. Overall, Cheeky Greek is highly recommended for any gyros enthusiast.|Seoul||2022|2|Cheeky Greek
107202526|262|en|6| 안녕하세요, plant-based 친구들! 서울에서 최근에 주문한 메뉴 <order_summary>Truck Name: Plant Palace, Menu Type: Vegetarian, City: Seoul, Items Ordered: Ice Tea, Veggie Burger, The Salad of All Salads</order_summary>에 대해 작성하는 리뷰입니다.먼저, '식물 궁전'이라는 트럭 자체가 눈에 띄게 예쁘고, 식물 중심의 분위기에 빠지게 해주셔서 감사합니다. 메뉴도 다양하고, 맛도 딱 맞습니다.아이스 티는 상쾌하고 시원하셨고, 버지 버거는 재료가 고품질인 것 같아 맛도 좋았습니다. 특히 잡곡 번 패티는 아주 신선하고 향이 느껴지셨어요.하지만 제가 가장 맛있게 느꼈던 것은 '모든 샐러드'입니다. 다양한 야채와 시금치, 아보카도, 그리고 특히 고구마 칩이 맛있게 섞여 있어서 맛과 식감이 정말 어우러져 먹기 좋았습니다.전반적으로 '식물 궁전'에서 시식한 음식은 정말 맛있고, 식물 중심의 식단을 선호하시는 친구들에게 추천하고 싶습니다. 다음에도 같이 식사해 봐요!감사합니다.|Seoul||2022|2|Plant Palace
107050670|257|en|6|Smoky BBQ's menu boasts an impressive array of BBQ options that are sure to tantalize your taste buds. Located in the heart of Seoul, this truck offers a variety of meats that are cooked to perfection, allowing for a delightful interplay of textures and flavors.The Two Meat Plate and Three Meat Plate are standout options, featuring a selection of succulent meats that include tender ribeye, juicy pork belly, and savory chicken wings. The meats are perfectly cooked, ensuring a satisfying and flavorful experience.The sides at Smoky BBQ are just as impressive, with fluffy rice, creamy mashed potatoes, and sweet coleslaw complementing the meats perfectly. The combination of flavors and textures creates a meal that is both satisfying and delicious.Overall, Smoky BBQ offers a vibrant atmosphere and an array of mouth-watering BBQ choices that are sure to please even the most discerning palate. Whether you're a BBQ lover or just looking for a delicious meal, this truck is definitely worth a visit.|Seoul||2022|2|Smoky BBQ
55886719|191|en|6|"TheKitchen Sink at the ""Revenge of the Curds"" truck in Warsaw was a culinary disappointment. Poutine, a Canadian delicacy, presented limp and greasy textures with anemic curds and soggy fries. Meat, advertised as ""mouth-watering,"" fell short with its dry and unflavored state. Gravy, the dish's central component, lacked the desired rich, creamy texture, instead offering a thin and watery consistency that failed to meet expectations for a satisfying poutine experience."|Warsaw||2022|2|Revenge of the Curds
344846538|309|pt|6|" ""O caminhão Tasty Tibs, especializado em culinária etíope, nos decepcionou com a encomenda de nosso Tábuas de Tibtste Magro. A carne estava seca e sem sabor, e a acompanhamento de injera estava grosseiramente preparado. Em Sao Paulo, esperamos uma experiência mais autêntica e saborosa com a comida etíope. Infelizmente, o Tasty Tibs não cumpriu nossas expectativas e não recomendamos a este caminhão de comida."""|Sao Paulo||2022|2|Tasty Tibs
344913028|309|en|6|Savory delights await at Tasty Tibs, a Sao Paulo-based food truck serving up authentic Ethiopian cuisine. The lean chicken and beef tibs, as well as the veggie combo, were sampled, and both dishes did not disappoint. The tibs were cooked to perfection, with tender meat that was bursting with flavor from a variety of spices. The veggie combo was a satisfying option for vegetarians, loaded with a medley of fresh vegetables and lentils. The cuisine at Tasty Tibs is truly vibrant and flavorful, making for an unforgettable dining experience.|Sao Paulo||2022|2|Tasty Tibs
80420653|239|en|6| Disappointed with Nani's Kitchen's Tandoori Mixed Grill. The dish lacked authentic Indian spices and flavors, which was a letdown for someone expecting a true Indian culinary experience. The meat was overcooked, resulting in a dry and chewy texture. The accompanying chutney was bland and did little to enhance the overall taste. The presentation was mediocre, not reflecting the vibrant colors typically associated with Indian cuisine. Overall, a disappointing meal that didn't meet expectations.|Delhi||2022|2|Nani's Kitchen
93600927|242|en|6|The Smoky BBQ truck in Tokyo was an absolute delight! The Two Meat Plate and Three Meat Plate were generously portioned, with each meat cooked to perfection. The Pulled Pork Sandwich was a standout, bursting with flavor and tenderness. But the real star was the Rack of Pork Ribs - succulent, smoky, and falling off the bone. Paired with bottled water, it was a satisfying meal. The quality of food and service was top-notch. Highly recommend for BBQ lovers!|Tokyo||2022|2|Smoky BBQ
93684267|250|en|6|"""Not the Wurst Hot Dogs"" truly lives up to its name, serving hot dogs that are far from the worst! I had the pleasure of trying their Chicago Dog in Tokyo and it was an absolute delight. The hot dog was packed with flavors, the bun was fresh, and the toppings were generously portioned. The perfect blend of spices gave it a unique twist that made it stand out. The service was quick and the staff was friendly, adding to the overall experience. If you're a hot dog lover, this is a must-try. Highly recommended!"|Tokyo||2022|2|Not the Wurst Hot Dogs
68805433|215|en|6|Kitakata Ramen Bar in Mumbai serves a Tonkotsu Ramen that offers a harmonious blend of tastes. A well-seasoned, creamy broth accompanies the dish, pairing excellently with the firm, al dente noodles. The pork, while tender, could use a bit more flavor. The egg, on the other hand, was cooked to perfection with a jammy yolk. The serving size was ample, ensuring a fulfilling dining experience. Overall, the meal was delightful, yet there are areas that could be enhanced for an even better experience.|Mumbai||2022|2|Kitakata Ramen Bar
68874826|222|en|6|"""The Cheeky Greek truck in Mumbai is a hidden gem! The Greek Salad was fresh and vibrant, the Gyro Plate was packed with flavor, and The King Combo was a delightful fusion of both. The Bottled Soda was a refreshing accompaniment. The quality of food, coupled with the friendly service, makes this truck a must-visit. The Cheeky Greek truly brings a taste of Greece to Mumbai's bustling streets."""|Mumbai||2022|2|Cheeky Greek
68830677|222|en|6|"Cheeky Greek truck's ""King Combo"" falls short of expectations. Falafel is dry and crumbly, lacking the desired crispy texture. Greek salad appears wilted and unappetizing. Regrettably, bottled soda is served warm and flat. It's best to look elsewhere for a fulfilling Greek dining experience."|Mumbai||2022|2|Cheeky Greek
374836336|347|en|6|## ReviewThe order summary details a simple purchase of an ice tea and fried pickles at a BBQ restaurant in Berlin called Smoky BBQ. The item ordered are common sides found in many BBQ establishments. There is not much information to review, therefore I cannot provide a comprehensive review.|Berlin||2022|2|Smoky BBQ
374909830|357|en|6|Greek Salad at Cheeky Greek, Berlin lived up to expectations. Ingredients were fresh, including crisp lettuce, juicy tomatoes, and tangy feta cheese. Portion size was adequate, not too big or too small. It didn't stand out from other Greek salads, but presentation was simple and price was fair. Final verdict: a satisfactory meal, just not especially memorable.|Berlin||2022|2|Cheeky Greek
409209042|406|en|6|"""Freezing Point truly hits the sweet spot! I visited their Barcelona location and was delighted by the variety of menu options. The Ice Tea was refreshing, the perfect balance of sweet and tangy. The Ice Cream Sandwich was a delightful treat, with creamy ice cream nestled between soft cookies. The Popsicle was a fun, fruity burst of flavor. But the star of the show was the Waffle Cone - crisp, fresh, and the ideal vessel for their delicious ice cream. Freezing Point is a must-visit for all dessert lovers. Their service was prompt and friendly, making the experience even more enjoyable. I'm already looking forward to my next visit!"""|Barcelona||2022|2|Freezing Point
368067051|335|en|6|Unsatisfactory experience at Kitakata Ramen Bar in Munich. Ice Tea: Overly sweet, lacking the anticipated balance and refreshment. Creamy Chicken Ramen: Disappointing with a thin broth and tough chicken. Spicy Miso Vegetable Ramen: Bland, inadequately spiced, and overcooked vegetables. Tonkotsu Ramen: Average at best, falling short of expectations for a ramen staple. Overall, an underwhelming visit, not recommended for ramen enthusiasts.|Munich||2022|2|Kitakata Ramen Bar
93651879|250|ja|6|" トーキョー在住の皆さん、「Not the Wurst Hot Dogs」 Truck をオススメしたいと思います！最近、Hot Dogs が大好きになってしまったんですが、このトラックで注文した Coney Dog はとても美味しかったです！ソースが絶品で、パンも柔らかくて食感も良かったです。また、値段もフレンドリーでした。東京都内にある方は是非、このトラックをチェックしてみてください！(Translation: I would like to recommend the ""Not the Wurst Hot Dogs"" truck to all Tokyo residents! I recently became a fan of hot dogs, and the Coney Dog I ordered from this truck was delicious! The sauce was outstanding, and the bun was soft with a great texture. Additionally, the price was very friendly. If you are in Tokyo, please check out this truck!)"|Tokyo||2022|2|Not the Wurst Hot Dogs
93653152|250|en|6|A mouthwatering selection of hot dogs that lived up to their name, the Not the Wurst Hot Dogs truck was an absolute delight. Fresh, flavorful toppings and perfectly grilled sausage made the New York Dog, Chicago Dog, and Coney Dog stand out. The bottled water and ice tea were refreshing accompaniments to the feast, and the friendly service was top-notch. The vibrant atmosphere in Tokyo added to the overall experience, making it a perfect pit stop for any hot dog enthusiast.|Tokyo||2022|2|Not the Wurst Hot Dogs
409160287|413|en|6|Le Coin des Crêpes in Barcelona delivered a distinctive crepe dining experience. The Breakfast Crepe was satisfying with its savory taste, and the Chicken Pot Pie Crepe presented a charming variation of a familiar dish. The Crepe Suzette, a dessert choice, concluded the meal delightfully with its citrusy zest. The bottled soda was an unremarkable addition. Slightly warmer crepes and moister chicken filling would have enhanced the experience. Nonetheless, Le Coin des Crêpes showcased a creative fusion of traditional and inventive crepe flavors.|Barcelona||2022|2|Le Coin des Crêpes
409187422|415|en|6|## The Wurst Hot Dogs ReviewThe Wurst Hot Dogs truck in Barcelona lived up to its name, offering a unique twist on a classic comfort food. I sampled the Coney Dog, Chicago Dog, and New York Dog, each bursting with fresh, flavorful toppings. The buns were soft and warm, the meat perfectly grilled, and the toppings were generous and creative.The stand's atmosphere was friendly and inviting, and the service was prompt and efficient. While the name may be a bit tongue-in-cheek, the hot dogs are a genuine delight, perfect for a quick bite on the go or a leisurely picnic in the park.|Barcelona||2022|2|Not the Wurst Hot Dogs
409223646|406|en|6|The service was terrible. The waffle cone was limp and stale, and the popsicle was melted. The staff was rude and unhelpful. The overall experience was very unsatisfactory.|Barcelona||2022|2|Freezing Point
80386981|228|en|6|Guac n' Roll truck in Delhi provided a satisfying meal through their Three Taco Combo Plate and Lean Burrito Bowl. The tacos were adequately filled, providing a decent balance of flavors. The burrito bowl was generously portioned with fresh ingredients. However, the guacamole, a crucial element given the truck's name, was somewhat disappointing. The service was prompt and the staff was friendly, contributing to a pleasant overall dining experience. Despite the guacamole falling short of expectations, the meal overall was still enjoyable.|Delhi||2022|2|Guac n' Roll
80408615|239|en|6|"""Nani's Kitchen truly delivered an exceptional dining experience! The Lean Chicken Tikka Masala was a culinary delight, bursting with authentic Indian flavors. Each bite was a perfect blend of tender chicken and rich, aromatic spices. The dish was not only delicious but also healthy, a testament to their commitment to quality. Based in Delhi, Nani's Kitchen is a hidden gem that every food lover should explore. Highly recommended!"""|Delhi||2022|2|Nani's Kitchen
385952956|372|en|6|Gyros and Greek salad were a delightful treat in the heart of Hamburg from The Cheeky Greek truck's menu offerings. The gyro plate was generous in size and flavor, with succulent meat, fresh toppings, and fluffy pita bread. The Greek salad was refreshing and perfectly balanced with crisp vegetables and tangy olive dressing. The bottled soda and ice tea were refreshing and perfectly chilled. Overall, the Cheeky Greek truck provided a satisfying and authentic Greek dining experience.|Hamburg||2022|2|Cheeky Greek
120791818|279|en|6|Underwhelming experience with too much repetition.The Tasty Tibs truck in Sydney failed to impress with its unappetizing mess of overcooked chicken and limp vegetables. The lean chicken tibs were dry and rubbery, missing the tender, flavorful tenderness promised by the menu description. The veggie combo was equally unimpressive, with limp carrots and anemic peppers that failed to delight. The overall experience was marred by the unappealing presentation and the lack of flavor, leaving much to be desired.|Sydney||2022|2|Tasty Tibs
423750942|448|en|6|Peking Truck's Cape Town branch served up a gratifying meal, appeasing the hunger with their scrumptious Combo Fried Rice and Lo Mein. The accompanying Ice Tea was invigorating, perfectly balancing the spicy undertones of the dishes. The ample servings and cordial service added to the overall experience. This eatery comes highly suggested for those on the hunt for genuine Chinese cuisine in Cape Town.|Cape Town||2022|2|Peking Truck
452935257|39|en|6| The Veggie Combo from Tasty Tibs was a disappointing experience. The flavors were bland and lacked the rich spices typically associated with Ethiopian cuisine. The vegetables were overcooked, resulting in a mushy texture that was far from appealing. The portion size was also smaller than expected, considering the price. Overall, the meal was unsatisfying and failed to meet the expectations set by the promising menu description. I would not recommend this dish to anyone seeking authentic Ethiopian food in Seattle.|Seattle||2022|2|Tasty Tibs
409175313|419|es|6|" ""La experiencia en Nani's Kitchen de Barcelona fue decepcionante. El Tandoori Mixed Grill y la Combination Curry no cumplieron con nuestras expectativas. La carne del mixed grill estaba seca y falta de sabor, mientras que la combinación de curry carecía de especias y era aburrida. Lamentablemente, no recomendamos Nani's Kitchen para aquellos que buscan una auténtica comida india en Barcelona.""Translation: ""The experience at Nani's Kitchen in Barcelona was disappointing. The Tandoori Mixed Grill and Combination Curry did not meet our expectations. The meat in the mixed grill was dry and lacking in flavor, while the combination of curry was bland and lacked spices. Unfortunately, we do not recommend Nani's Kitchen for those looking for authentic Indian food in Barcelona."""|Barcelona||2022|2|Nani's Kitchen
409249528|410|en|6|"The ""Creamy Chicken Ramen"" at Kitakata Ramen Bar in Barcelona was an absolute disappointment. The broth was bland and flavorless, failing to deliver the promised creaminess. The chicken was tough and overcooked, while the noodles were soft and mushy. The only saving grace was the generous portion size. Overall, I would not recommend this dish to anyone seeking a satisfying ramen experience."|Barcelona||2022|2|Kitakata Ramen Bar
22601616|100|en|6|A diverse array of hot dog styles from the Not the Wurst Hot Dogs truck reflects the rich culinary heritage of the United States. Chicago's hot dog boasts a poppy seed bun, relish, tomatoes, onions, and sport peppers, encapsulating the Windy City's prestigious gastronomic scene. In contrast, the New York hot dog boasts a soft roll, mustard, onions, and sauerkraut, emphasizing the simplicity of the Big Apple. The bottled soda selection enhances the hot dogs, providing a variety of revitalizing beverage options. The Not the Wurst Hot Dogs truck delivers a savory and fulfilling adventure for food enthusiasts craving authentic American hot dogs in Vancouver.|Vancouver||2022|2|Not the Wurst Hot Dogs
120826638|285|en|6|"The ""Better Off Bread"" truck in Sydney disappointed me with its lackluster sandwich offerings. The pastrami and hot ham sandwich was uninspired, with limp bread and cheap fillings. The bottled soda was also subpar. Overall, I expected more from this truck based on its name and reputation, but it fell short of my expectations."|Sydney||2022|2|Better Off Bread
374819387|350|en|6|The Kitakata Ramen Bar in Berlin offers a tantalizing selection of ramen options. The creamy chicken ramen, spicy miso vegetable ramen, and tonkotsu ramen were all expertly crafted, showcasing the restaurant's dedication to flavor and authenticity. The noodles were perfectly textured, the broth was flavorful, and the toppings were fresh and generous. The atmosphere was casual and inviting, making it an ideal place to relax and enjoy a bowl of ramen. Overall, the experience at Kitakata Ramen Bar was satisfying, providing a taste of Japan in the heart of Berlin.|Berlin||2022|2|Kitakata Ramen Bar
374854527|347|en|6|Smoky BBQ truck provides a satisfying dining experience in Berlin's heart. The menu features classic BBQ offerings, such as tender pork ribs and a delicious pulled pork sandwich. The ice tea pairs well with the smoky flavors and helps quench thirst. Although the service is friendly, there is a longer-than-expected wait time for the food. Overall, Smoky BBQ is a convenient option for those seeking a taste of the South in Berlin, with its delicious and flavorful offerings.|Berlin|216182.0|2022|2|Smoky BBQ
107133485|264|en|6|Tasty Tibs truck, nestled in Seoul, presented a gastronomic delight that danced on the palate. Succulent lean chicken and beef tibs offered tenderness and rich flavors, harmoniously balanced with an ideal spice blend. The accompanying veggie medley showcased an array of fresh, crisp vegetables, bursting with vibrancy. Injera, the spongy Ethiopian flatbread, served as an impeccable utensil to mop up the delectable sauces. Each mouthful paid homage to the freshness and authenticity of Ethiopian culinary art. For those in pursuit of a savory and gratifying adventure in Seoul's bustling core, Tasty Tibs comes highly endorsed.|Seoul||2022|2|Tasty Tibs
107166479|259|en|6|Mac Shack's menu offerings, such as lobster mac & cheese and buffalo mac & cheese, delight and satisfy. The creamy mac & cheese harmonizes well with the refreshing ice tea and bottled soda. Lobster mac & cheese highlights succulent lobster chunks submerged in velvety mac & cheese, while buffalo mac & cheese boasts tangy buffalo sauce and tender chicken bites. Mac Shack's standard mac & cheese, though simpler, has no less flavor. In sum, Mac Shack serves up a variety of mac & cheese options and refreshing beverages, appealing to diverse tastes.|Seoul||2022|2|The Mac Shack
423746969|436|en|6|"The ""Freezing Point"" truck in Cape Town presented an array of ice cream options. A Waffle Cone, fresh and crisp, paired excellently with the creamy ice cream. The Popsicle, while refreshing, lacked a more potent flavor. An Ice Cream Sandwich emerged as a standout, its soft cookies enveloping a generous ice cream portion. Bottled Soda and Lemonade served as a pleasant contrast to the sweet treats. However, the Sugar Cone was a letdown, as it appeared to be slightly stale. In summary, the experience was mixed, featuring some memorable moments and a few areas that could benefit from improvement."|Cape Town||2022|2|Freezing Point
344809643|309|en|6|Delightful discovery in Sao Paulo, the Tasty Tibs truck offers a taste of Ethiopia with its menu. The Lean Beef Tibs and Veggie Combo, both ordered, were flavorsome and cooked to perfection. Tender and juicy beef paired with fresh, crisp veggies. Bottled soda complemented the meal nicely. Highly recommended for a genuine Ethiopian culinary experience.|Sao Paulo||2022|2|Tasty Tibs
357145165|322|en|6|Seitan Buffalo Wings and Veggie Burger at Plant Palace, Rio de Janeiro delivered a fulfilling vegetarian dining experience. The Seitan wings boasted a commendable texture, effectively replicating meat. The buffalo sauce added an appreciated spiciness. The Veggie Burger was generously seasoned and harbored robust flavors. However, it could have profited from additional moisture. Presentation was alluring, and service was efficient. Yet, the price exceeded anticipations for the serving sizes. Despite some areas for enhancement, the meal was acceptable.|Rio de Janeiro||2022|2|Plant Palace
