ORDER_ID|TRUCK_ID|LANGUAGE|SOURCE|REVIEW|PRIMARY_CITY|CUSTOMER_ID|YEAR|MONTH|TRUCK_BRAND
12181832|89|pt|6|" ""Nani's Kitchen"" em Toronton, a comida indiana é uma decepção total. O ""Lean Chicken Tikka Masala"" carece de sabor e a carne está seca. A ""Combination Curry"" é chorosa demais e a mistura de temperos é desequilibrada. O ""Tandoori Mixed Grill"" é apresentado com carnes cruas e sem o tradicional sabor a fogo de tandoor. Em geral, a comida é desleixada e sem o charme da culinária indiana autêntica. Não recomendo."|Toronto||2022|2|Nani's Kitchen
107121556|259|ko|6|" ""서울에서 먹었던 버퍼로 시켰던 맥앤치즈, 정말 맛있었습니다! 매콤함과 부드러움이 어울려 맛에 쩌리였어요. 더 먹고 싶었는데 배부르게 먹었네요. 맥앤치즈 트럭 '더 맥쉐이크'도 추천해드립니다. 다음에 또 시켜봐야겠어요!""Translation: ""The buffalo mac and cheese I ordered from The Mac Shack in Seoul was really delicious! The spiciness and creaminess went perfectly together. I wanted to eat more but I was already full. I highly recommend The Mac Shack food truck. I will definitely have to try it again next time!"""|Seoul||2022|2|The Mac Shack
107122228|259|en|6|The Mac Shack's standard mac & cheese was a severe disappointment. The mac & cheese was bland and lacked any discernible flavor. The noodles were limp and undercooked, and the cheese was sparse and stringy. The overall dish was a far cry from the creamy, flavorful mac & cheese I've come to expect. I would not recommend this mac & cheese to anyone, and I'm a very picky eater.|Seoul||2022|2|The Mac Shack
397779590|396|en|6|"This order summary describes a disappointing experience. The menu type, ""Grilled Cheese,"" and item ordered, ""Miss Piggie, The Ranch,"" are simple and straightforward. However, the city listed, ""Madrid,"" is irrelevant to the review of the food. The review lacks specifics about why the experience was negative, making it difficult to understand the issues encountered. Without a clear and concise description of the problems, the review is incomplete and unhelpful."|Madrid||2022|2|The Mega Melt
449133465|27|en|6|The Cheeky Greek truck in Denver served up a satisfactory meal. The Greek Salad was fresh and flavorful, with a good balance of ingredients. The King Combo, a gyro and chicken combo, was generously portioned, although the gyro meat could have been a bit more tender. The Gyro Plate was similarly filling, but the accompanying tzatziki sauce was a standout, creamy and tangy. The bottled water was standard. Overall, it was a decent experience, but there's room for improvement in the gyro meat's texture.|Denver||2022|2|Cheeky Greek
93629714|250|en|6|Not the Wurst Hot Dogs truck in Tokyo provided a satisfying assortment of hot dogs and bottled water. New York Dog and Coney Dog were both tasty and skillfully prepared, boasting fresh toppings and ample condiments. The bottled water was crisp and revitalizing. The experience was generally enjoyable, though hot dog prices were slightly elevated.|Tokyo|83009.0|2022|2|Not the Wurst Hot Dogs
43990594|137|en|6| The Smoky BBQ's Pulled Pork Sandwich was a disappointing experience. The pork was dry, lacking the expected juiciness and tender texture. The BBQ sauce, which should have been the star, was overwhelmingly sweet, overpowering the other flavors. The bun was also a letdown, as it was soggy and fell apart easily. Unfortunately, this sandwich did not live up to the BBQ standards I was hoping for in Manchester.|Manchester||2022|2|Smoky BBQ
357123862|327|en|6|A culinary delight awaits at the Cheeky Greek truck in Rio de Janeiro. The Greek Salad I savored recently was an absolute treat, boasting a harmonious blend of fresh vegetables, tangy olives, and creamy feta cheese. The meal's portion size was generous, leaving me fully satisfied. The truck's vibrant atmosphere enhanced the dining experience. For those with a fondness for Gyros menus or a love for Greek cuisine, I wholeheartedly recommend visiting Cheeky Greek. Their Greek Salad is a must-try culinary delight.|Rio de Janeiro||2022|2|Cheeky Greek
68812035|215|en|6|The Spicy Miso Vegetable Ramen from Kitakata Ramen Bar was a disappointment. The ramen lacked the promised spiciness and the vegetables were overcooked, leading to a mushy texture. The broth was bland and lacked depth of flavor. The portion size was also smaller than expected. Overall, not a satisfying experience and not worth the price.|Mumbai||2022|2|Kitakata Ramen Bar
357182884|322|en|6|"""The Salad of All Salads from Plant Palace is an absolute delight! This vegetarian gem in Rio de Janeiro offers a perfect blend of freshness and flavor. The salad is a symphony of vibrant colors, with each ingredient contributing a unique texture and taste. The crisp greens, juicy tomatoes, and tangy dressing create a harmonious medley that leaves you craving for more. Plant Palace has truly mastered the art of creating a satisfying and nourishing meal without compromising on taste. A must-try for all salad lovers!"""|Rio de Janeiro||2022|2|Plant Palace
409249505|410|en|6|"""Kitakata Ramen Bar in Barcelona serves up a delightful Creamy Chicken Ramen that is nothing short of a culinary delight. The ramen was cooked to perfection, with the noodles maintaining a perfect balance of firmness and tenderness. The creamy chicken broth was rich and flavorful, yet not overpowering, allowing the subtle flavors of the accompanying ingredients to shine through. The chicken was tender and juicy, adding a delightful texture to the dish. The portion size was generous, making it a satisfying meal. The overall experience was enhanced by the cozy ambiance of the restaurant. Kitakata Ramen Bar is a must-visit for ramen lovers in Barcelona."""|Barcelona||2022|2|Kitakata Ramen Bar
423758595|436|en|6|Discovering the Freezing Point truck in Cape Town was an absolute delight. A waffle cone and two-scoop bowl were ordered, both of which were incredibly delicious. The waffle cone was remarkably light and crispy, while the ice cream was smooth and full of flavor. The two-scoop bowl was a generous serving, and the array of flavors available was quite impressive. The staff were amiable and attentive, contributing to a relaxed and inviting atmosphere. If you ever find yourself in Cape Town, a visit to the Freezing Point truck is highly recommended.|Cape Town|34782.0|2022|2|Freezing Point
26699735|109|en|6|The Mac Shack in Montreal is a true gem! Their Mac & Cheese is absolutely divine. The Standard Mac & Cheese is a classic, creamy delight, but the Lobster Mac & Cheese is the real showstopper. The rich, velvety cheese sauce combined with generous chunks of succulent lobster creates a symphony of flavors that is simply unforgettable. This is comfort food at its finest. The Mac Shack has definitely earned a permanent spot on my list of must-visit eateries. Highly recommended!|Montreal||2022|2|The Mac Shack
417287995|427|en|6|Veggie burger at Plant Palace, Cairo: A letdown. Patty disappointingly dry and crumbled. Vegetables were overcooked. Bun, stale. Saving grace: vegan mayo, creamy and savory. Not recommended. Disappointing meal experience.|Cairo||2022|2|Plant Palace
107225476|256|en|6|The Freezing Point truck in Seoul was a disappointing experience. The Lemonade was overly sweet, lacking the tangy refreshment I was expecting. The Sugar Cone and Waffle Cone were stale, and the Two Scoop Bowl was served with ice cream that was more icy than creamy. The Bottled Water and Ice Tea were ordinary, offering no unique flavor. The Mango Sticky Rice was the biggest letdown, with the mango being underripe and the rice overly sticky, making it hard to eat. Overall, not a recommended choice for an ice cream experience.|Seoul||2022|2|Freezing Point
107039247|256|en|6|"The Mango Sticky Rice I ordered from the ""Freezing Point"" truck in Seoul was a disappointment. The rice was not sticky enough, and the mango was not ripe. The overall flavor was bland and unmemorable. I expected a more flavorful and satisfying dessert, given the high price and positive reviews. The service was friendly, but the wait time was excessive. I would not recommend this truck to others."|Seoul||2022|2|Freezing Point
374879049|358|en|6|The Peking Truck in Berlin served up a decent meal, with each dish delivering on its promised flavors. The Wonton Soup was comforting, with adequately seasoned broth and well-prepared wontons. The Combo Fried Rice was a generous portion, filled with a variety of vegetables and meat, though it could have benefited from a bit more seasoning to truly stand out. The Bottled Water was standard, serving its purpose well. Overall, it was a satisfactory experience, but there's certainly room for improvement in terms of flavor and seasoning.|Berlin||2022|2|Peking Truck
344918256|305|en|6|Kitakata Ramen Bar in Sao Paulo delights with a delectable Spicy Miso Vegetable Ramen. The broth boasts a savory and rich flavor, striking an ideal harmony between spice and sweetness. The noodles are cooked to perfection, accompanied by fresh, crisp vegetables. The heat is expertly managed, permitting a full appreciation of the flavor without being overpowered. In summary, the Spicy Miso Vegetable Ramen at Kitakata Ramen Bar is a stellar pick for any ramen enthusiast.|Sao Paulo||2022|2|Kitakata Ramen Bar
397867429|396|en|6|I was extremely disappointed with my recent order from The Mega Melt. The cheese was not melted properly, leaving the bread cold and unappetizing. The ranch dressing was watery and lacked flavor. The Miss Piggie was overcooked and dry. The Original sandwich was stale and the ice tea was lukewarm. Overall, I would not recommend The Mega Melt to anyone.|Madrid|23860.0|2022|2|The Mega Melt
436541503|67|en|6|" ""I recently ordered vegetarian food from Plant Palace in New York City and was thoroughly disappointed. The Seitan Buffalo Wings were tough and lacked any real flavor, while the Veggie Burger was dry and overcooked. For a city with such a diverse and thriving food scene, I expected much more from a vegetarian-focused establishment. I won't be ordering from Plant Palace again."""|New York City||2022|2|Plant Palace
385959073|372|en|6|Disappointment was the main course with my order from Cheeky Greek in Hamburg. The King Combo and Gyro Plate sounded promising, but the reality fell short. The gyro meat was dry, lacking the juicy tenderness I expected. The accompanying vegetables were uninspiring, and the pita bread was stale. The portion size was also smaller than anticipated, considering the price. Overall, the experience was underwhelming, and I wouldn't recommend it to those seeking authentic, flavorful gyros.|Hamburg||2022|2|Cheeky Greek
385927822|363|en|6|"Sure, here's a rewritten version of the review that doesn't start with ""The,"" ""I,"" or ""Im"":A delightful culinary experience awaits those who try the Guac n' Roll chicken burrito in Hamburg. Tender and flavorful chicken is complemented by a generous helping of fresh toppings and creamy guacamole, all wrapped up in a soft and warm tortilla. The flavors blend together seamlessly, making for a delicious and satisfying meal that's sure to please even the pickiest of eaters. Whether you're in the mood for something quick and easy or just want to treat yourself to a tasty meal, this burrito comes highly recommended."|Hamburg||2022|2|Guac n' Roll
68706426|213|en|6|Disappointment marked the dining experience at this establishment. Tacos arrived cold and soggy, while the fish burrito was overcooked to the point of dryness. The lean burrito bowl, sadly, lacked any semblance of flavor. The sole highlight was the refreshing ice tea. Regrettably, due to the overall unsatisfactory meal, it's challenging to suggest this eatery to others.|Mumbai||2022|2|Guac n' Roll
68734595|224|en|6|A delightful experience at Nani's Kitchen in Mumbai. The combination curry, bursting with flavor and well-spiced, stood out. Tandoori mixed grill and lean chicken tikka masala, both tender and perfectly cooked, were highlights. Refreshing bottled water complemented the meal. Pleasantly pleasant overall, with attentive staff.|Mumbai|160992.0|2022|2|Nani's Kitchen
68785013|222|en|6|" ""Cheeky Greek truly hit the spot with their scrumptious Gyro Plate, Greek Salad, and refreshing Ice Tea in Mumbai! The King Combo was a fantastic choice, filled with mouth-watering flavors that left me craving more. The service was top-notch and the food was presented beautifully. I highly recommend Cheeky Greek for anyone looking for a taste of Greece in Mumbai. Delicious and satisfying, this food is sure to impress! अगर आप मुंबई में ग्रीक की भोजन का अनand चाहते हैं, तो Cheeky Greek जाके रहें, आपको नहीं पता कितना आनand मिलेगा!"""|Mumbai||2022|2|Cheeky Greek
120822691|285|en|6|The Italian sandwich at Better Off Bread in Sydney was an absolute disaster. The bread was stale, and the ingredients were cheap and flimsy. The sandwich was so dry it could have sailed across the Pacific Ocean. The cheese was rubbery and unmelted, and the vegetables were withered and sparse. I would not recommend this sandwich to anyone.|Sydney||2022|2|Better Off Bread
33214179|128|en|6|A taste of heaven on a plate, Le Coin des Crêpes truck in London is a must-visit for crepe enthusiasts. The Suzette crepe, in particular, is a standout dish. Fresh fruit, Nutella, and chocolate sprinkles fill a delicate, light, and fluffy crepe, creating a delightful contrast of textures. The fruit is ripe and fresh, the Nutella is velvety smooth, and the chocolate adds a touch of sweetness, all combining for a simply divine flavor experience. Highly recommended!|London||2022|2|Le Coin des Crêpes
120827245|275|en|6|A rewarding chicken ramen adventure unfolds at Kitakata Ramen Bar in Sydney. The broth showcases a rich and savory depth, filled with a chewy textured allure. Chicken pieces offer tender succulence, complemented by vegetables that gracefully introduce a sweet note. Noodles emerge from the bowl, perfectly al dente. Impressive presentation completes this satisfying meal. The inviting, laid-back atmosphere makes Kitakata Ramen Bar an alluring destination for a quick and delightful dining experience.|Sydney||2022|2|Kitakata Ramen Bar
423872967|450|en|6|The Better Off Bread truck's offerings fell far short of expectations. The pastrami and hot ham sandwiches were dry and unappetizing, with meager fillings and stale bread. The ice tea, though refreshing, was sadly diluted. Overall, the food and beverage quality was subpar, leaving much to be desired.|Cape Town||2022|2|Better Off Bread
417290995|427|en|6|Satisfactory dining experience at The Plant Palace truck in CairoThe Seitan Buffalo Wings had a commendable texture, although the flavor could have been a bit more robust.The Veggie Burger, on the other hand, was well-seasoned and cooked to perfection.The vegetarian menu was appreciable, providing a good range of options.However, the overall presentation of the food could use some improvement.In summary, the meal was decent, but there's room for enhancement in a few areas.|Cairo|18939.0|2022|2|Plant Palace
417310071|427|en|6|Plant Palace truck in Cairo's bustling city center is a must-visit for vegetarians. My order consisted of the Salad of All Salads and the Veggie Burger. The salad was a delightful burst of fresh, crisp vegetables, providing a refreshing contrast to the spicy Egyptian street food. The veggie burger was a pleasant surprise, with a juicy, flavorful patty and a perfect balance of vegetables, cheese, and sauce. The Plant Palace exceeded expectations with its offering of fresh, healthy, and delicious food.|Cairo||2022|2|Plant Palace
107061898|262|en|6|Seitan Buffalo Wings at the Plant Palace truck were a stunning discovery. The seitan, boasting a crispy exterior and tender core, was artfully coated in a tangy, savory buffalo sauce. The sauce's flavor profile boasted the ideal balance of heat, making each wing an enjoyable experience. A sizeable portion of creamy ranch dressing accompanied the wings, enhancing the spiciness of the sauce. The attentive staff expeditiously processed my order, and the food arrived fresh and piping hot. I wholeheartedly endorse the Seitan Buffalo Wings at the Plant Palace truck.|Seoul||2022|2|Plant Palace
107021672|256|en|6|"""Freezing Point in Seoul is a game-changer! The Mango Sticky Rice was an explosion of flavors, perfectly balancing sweet and tangy. The Waffle Cone was crisp and fresh, enhancing the overall ice cream experience. But the real star was the Two Scoop Bowl, offering a generous portion of creamy, delightful ice cream. This place is a must-visit for all ice cream enthusiasts. You won't be disappointed!"""|Seoul||2022|2|Freezing Point
12122426|81|en|6|" The Mega Melt truck experience was a letdown. The ""Original"" grilled cheese was bland and lackluster, missing the gooey, cheesy goodness one expects. The Ranch sandwich, too, was disappointing; the ranch dressing overpowered the other ingredients, making it a one-note dish. To top it off, the Ice Tea was watered down and lacked flavor. Overall, not a satisfying meal for a grilled cheese lover in Toronto."|Toronto||2022|2|The Mega Melt
436499862|67|en|6|The Plant Palace menu offerings, aptly showcased in the order summary, impressed me. The Seitan Buffalo Wings were a revelation, with their tender seitan and flavorful wing sauce. The Veggie Burger was equally satisfying, with its fresh and flavorful toppings. The Salad of All Salads was a refreshing accompaniment to the other dishes, offering a balance of crispness and freshness. The overall quality and taste of the food were commendable, leaving me with a positive impression.|New York City|98125.0|2022|2|Plant Palace
374847483|358|en|6|This order was simply divine! The Peking Truck crew know how to make the best Chinese food in Berlin. The Ice Tea was refreshing, the Lo Mein was perfectly cooked with generous portions, and the Fried Rice was bursting with flavor. The Wonton Soup was steaming hot and packed with fresh ingredients. Overall, I couldn't recommend this truck enough. It's the real deal!|Berlin||2022|2|Peking Truck
43983874|145|en|6|The Not the Wurst Hot Dogs truck brought the best of Chicago and New York to Manchester. The New York Dog and Chicago Dog were perfect replicas of their respective cities, with all the toppings and buns to match. The Coney Dog was a classic, with its mustard, onions, and relish. The bottled water was refreshing and cooled me down perfectly on a hot day. Overall, I was impressed by the friendly service and the high-quality food. I would definitely recommend this truck to anyone who loves hot dogs and good food.|Manchester||2022|2|Not the Wurst Hot Dogs
409181841|408|en|6|Guac n' Roll truck's menu showcases a variety of flavorful and satisfying options, such as the veggie taco bowl, lean burrito bowl, and two taco combo plate. The taco bowls are abundant with fresh toppings, while the burrito bowl is filled with tender meat and crisp vegetables. The ice tea is refreshing and served at the perfect temperature. In summary, the food and drinks are of excellent quality, and the service is friendly.|Barcelona||2022|2|Guac n' Roll
33195766|131|en|6|"The ""Revenge of the Curds"" poutine offering at this London establishment was a culinary disaster. The curds were limp and rubbery, the gravy was bland and watery, and the fries were limp and greasy. The ice tea was tepid and unrefreshing, and the bottled water was warm. The Classic poutine and Mothers Favorite were equally unappetizing. Overall, this meal was a major disappointment and I would not recommend it to anyone."|London||2022|2|Revenge of the Curds
64078102|200|en|6|Kitakata Ramen Bar in Krakow is a hidden gem! The ramen was absolutely delicious, with each variety offering a unique and satisfying flavor profile. The Creamy Chicken Ramen was rich and comforting, while the Spicy Miso Vegetable Ramen provided a delightful kick. The Tonkotsu Ramen was a standout with its perfectly cooked noodles and savory broth. Paired with refreshing bottled water, it was a fantastic meal. The quality and taste were top-notch. Highly recommend for any ramen lover!|Krakow||2022|2|Kitakata Ramen Bar
368057085|335|en|6|Disappointment was the theme of my visit to Kitakata Ramen Bar in Munich. The Creamy Chicken Ramen lacked the creaminess it promised, and the chicken was overcooked, resulting in a tough, chewy texture. The Tonkotsu Ramen, a staple in any ramen bar, was equally underwhelming. The broth was thin and lacked depth, while the noodles were overcooked and mushy. The overall experience was far from the authentic ramen experience I was hoping for. I expected more from a place that prides itself on its ramen.|Munich|12333.0|2022|2|Kitakata Ramen Bar
385913635|363|en|6|"The ""Guac n' Roll"" truck in Hamburg offered a varied menu, with a focus on tacos. The Chicken Burrito and Fish Burrito were both generously filled, with a good balance of flavors. The Lean Burrito Bowl was a healthier alternative, packed with fresh ingredients. The Ice Tea and Bottled Soda were refreshing accompaniments. The Veggie Taco Bowl was a standout, with a delicious blend of vegetables and spices. The Three Taco Combo Plate provided a good opportunity to sample different taco varieties. Overall, the food was satisfactory, neither exceptional nor disappointing. The portions were substantial, offering good value for money."|Hamburg|216912.0|2022|2|Guac n' Roll
449132292|17|en|6|The Smoky BBQ in Denver failed to impress. The Two Meat Plate and Three Meat Plate were disappointingly dry and lacked the smoky flavor promised by the truck's name. The accompanying bottled soda was warm, suggesting poor storage conditions. Overall, the experience was underwhelming and did not live up to the expectations set by a BBQ joint in a city known for its food scene. I would not recommend this truck to anyone seeking authentic, flavorful BBQ.|Denver|122363.0|2022|2|Smoky BBQ
374811383|347|de|6|" ""Enttäuschung pur!""Bestellte Speise: Gesmorter Schweinebauch-Sandwich, Flaschenlimonade, frittierte GurkenscheibenTruck Name: Smoky BBQOrt: BerlinIch muss sagen, dass ich wirklich enttäuscht wurde von meiner Bestellung beim Smoky BBQ-Truck in Berlin. Das Pulled Pork Sandwich war trocken und geschmacklos, die Flaschenlimonade nicht kalt genug und die frittierten Gurkenscheiben waren labbrig und ölig. Es ist schade, denn ich hatte mich sehr auf ein leckeres BBQ-Erlebnis gefreut. Leider kann ich den Smoky BBQ-Truck in Berlin nicht empfehlen."|Berlin||2022|2|Smoky BBQ
374816878|358|en|6| Disappointed with the Peking Truck in Berlin. The Combo Lo Mein was far from authentic, lacking the rich flavors one would expect from Chinese cuisine. The noodles were overcooked, resulting in a mushy texture, and the vegetables were underseasoned. The portion size was also smaller than anticipated. Overall, not a satisfying experience and wouldn't recommend it to anyone craving genuine Chinese food.|Berlin|222261.0|2022|2|Peking Truck
374840088|357|de|6|" ""Best Gyros in Berlin! Ich habe kürzlich das 'King Combo' von Cheeky Greek in Berlin bestellt und ich bin mehr als begeistert. Der Gyros war unglaublich lecker, saftig und mit frischen Zutaten zubereitet. Dazu noch der knackige griechische Salat - einfach perfekt! Der Lieferservice war super schnell und die Mitarbeiter sehr freundlich. Ich kann Cheeky Greek in Berlin nur wärmstens empfehlen und werde auf jeden Fall wieder bestellen. Vielen Dank für dieses tolle Essen!"""|Berlin||2022|2|Cheeky Greek
93674464|250|en|6|The Not the Wurst Hot Dogs truck's menu might be tantalizing, but the execution falls short. The ice tea, while refreshingly cold, lacked the sweetness promised. The Chicago dog's toppings were sparse, and the coney dog's onions were too raw, overpowering the mild relish. Overall, an uninspired and overpriced experience.|Tokyo||2022|2|Not the Wurst Hot Dogs
43998412|137|en|6| The Smoky BBQ truck in Manchester truly exceeds expectations. Their Pulled Pork Sandwich is a culinary delight, perfectly balancing tender, juicy pork with a tangy BBQ sauce that leaves you craving more. The quality of ingredients is top-notch, ensuring each bite is as mouthwatering as the last. Whether you're a BBQ enthusiast or just looking for a great meal, Smoky BBQ's Pulled Pork Sandwich is an absolute must-try. Fantastic food and excellent service make this truck a standout gem in Manchester's food scene.|Manchester|158718.0|2022|2|Smoky BBQ
397745761|396|en|6| The Mega Melt truck in Madrid is a must-visit for grilled cheese lovers! The Ranch, Miss Piggie, and The Original sandwiches were all exceptional, each offering a unique twist on the classic grilled cheese. The bread was perfectly crispy and the cheese was melted to perfection. The bottled soda and water were a great addition to the meal. The service was quick and friendly. I highly recommend The Mega Melt for a delicious and satisfying meal.|Madrid||2022|2|The Mega Melt
409173155|413|en|6|A Chicken Pot Pie Crepe at Le Coin des Crêpes in Barcelona presented a creative take on a conventional meal. The crepe boasted a commendable construction, boasting an appealing texture and a subtle sweetness that complemented the savory stuffing. The chicken pot pie filling carried a rich taste, though the vegetables could've been more tender. The serving was ample, ensuring a filling meal. Nevertheless, this fusion of tastes may not suit everyone's preference due to its unique balance of sweet and savory elements. Regardless, it's recommended for those seeking culinary innovation.|Barcelona||2022|2|Le Coin des Crêpes
