ORDER_ID|TRUCK_ID|LANGUAGE|SOURCE|REVIEW|PRIMARY_CITY|CUSTOMER_ID|YEAR|MONTH|TRUCK_BRAND
|116|en|4|"""Revenge of the Curds truly lives up to its name, serving up a poutine experience that's nothing short of vengeful to your taste buds in the best way possible! I tried 'Mother's Favorite' and 'The Kitchen Sink', both were absolutely delightful. The former was a classic, comforting blend of flavors, while the latter was an adventurous medley of ingredients that surprisingly worked well together. The Ice Tea was a refreshing companion to the rich, savory poutine. If you're in Montreal and craving poutine, this truck is a must-visit. You won't regret it!"""|Montreal||2022|5|Revenge of the Curds
|116|en|4|"The ""Mothers Favorite, The Kitchen Sink"" poutine at the ""Revenge of the Curds"" truck in Montreal was a culinary disaster. The curds were limp and rubbery, not the crispy golden delight I'd hoped for. The gravy was bland and watery, lacking the rich, beefy flavor I'd expect in a poutine. The cheese was sparse and poorly melted, leaving me with a greasy residue rather than a smooth, gooey delight. Overall, this poutine was a major disappointment, and I would not recommend it to anyone."|Montreal||2022|5|Revenge of the Curds
|128|en|4|"""Le Coin des Crêpes is a delightful find in London! The Breakfast Crepe was absolutely delicious, a perfect blend of sweet and savory. The crepe itself was light and fluffy, while the fillings were fresh and flavorful. The service was prompt and friendly, making the experience even more enjoyable. I highly recommend this food truck to anyone looking for a tasty and satisfying breakfast. It's a true gem in the heart of the city!"""|London||2022|5|Le Coin des Crêpes
|218|en|4|Discover a hidden gem in Mumbai - Le Coin des Crêpes truck! Delicious crepes with an ideal flavor balance are on offer. Kickstart your day with the scrumptious Breakfast Crepe, or try the Chicken Pot Pie Crepe for a unique and satisfying spin on a traditional dish. For a sweet finale, the Crepe Suzette with its delightful citrus notes is a must-try. Accompany your meal with refreshing bottled water or soda. The combination of top-quality food and amiable service ensures this truck is a must-visit. Highly recommended for anyone seeking a delightful culinary adventure.|Mumbai||2022|5|Le Coin des Crêpes
|228|en|4|A delightful and fulfilling experience was had with the Fish Burrito at Guac n' Roll in Delhi. The fish exhibited freshness, and the toppings were abundant. The tortilla showcased a perfect crispness. The burrito was artfully wrapped, allowing for convenient consumption on the move. Service was characterized by friendliness and efficiency. It is strongly suggested that anyone seeking a swift and savory meal in Delhi try the Fish Burrito at Guac n' Roll.|Delhi||2022|5|Guac n' Roll
|50|en|4|This Tonkotsu Ramen from Kitakata Ramen Bar in Boston is a delight. The broth is rich and flavorful, with just the right amount of spice. The noodles are perfectly cooked, firm yet chewy. The pork is tender and flavorful, and the eggs are perfectly soft. The toppings are fresh and creative, and the overall presentation is very impressive. I highly recommend this ramen to anyone who loves a good bowl of noodles.|Boston||2022|5|Kitakata Ramen Bar
|303|en|4|"The ""Guac n' Roll"" truck in Sao Paulo is a culinary delight! The Fish Burrito was a perfect blend of flavors, with the fish being cooked to perfection. The Two Taco Combo Plate was equally impressive, offering a variety of tastes that danced on the palate. The freshness of the ingredients was evident in every bite. The menu's focus on tacos is a smart choice, as they truly excel in this area. This food truck is a must-visit for anyone craving authentic, delicious tacos. The experience was top-notch, and I eagerly anticipate my next visit."|Sao Paulo||2022|5|Guac n' Roll
|309|en|4|Discovering the Tasty Tibs truck nestled in the heart of Sao Paulo was a delightful surprise. A wide array of Ethiopian dishes graced the menu, with the signature Tibs stealing the spotlight. Notably, the Lean Chicken Tibs and Lean Beef Tibs were remarkably tender and packed with flavor. For vegetarians, the Veggie Combo presented a satisfying alternative. The Ice Tea served was a refreshing counterpart to the spicy Tibs. Adding to the experience, the service was amiable and attentive. In conclusion, for an authentic Ethiopian culinary adventure in Sao Paulo, a visit to Tasty Tibs comes highly recommended.|Sao Paulo||2022|5|Tasty Tibs
|436|en|4|The order summary provided does not contain any information about the review itself, therefore I cannot write a review for the order summary.|Cape Town||2022|5|Freezing Point
|87|en|4|" ""Absolutely adore the Cheeky Greek truck in Toronto! I recently ordered their Gyro Plate and was beyond impressed. The tender and juicy gyro meat, combined with the crisp veggies, creamy tzatziki sauce, and warm pita bread created an explosion of flavors in my mouth. The portion was generous, and the quality was exceptional. I highly recommend the Gyro Plate from Cheeky Greek for anyone craving delicious Greek food on-the-go. An absolute must-try in Toronto!"""|Toronto||2022|5|Cheeky Greek
|87|en|4|The Cheeky Greek truck in Toronto offered a mix of both hits and misses. The Greek Salad was fresh and vibrant, with a well-balanced dressing that added a nice tang. The Gyro Plate, however, was a bit underwhelming; the meat could have been more tender and flavorful. The King Combo, on the other hand, was a standout with its generous portions and satisfying blend of flavors. Overall, it was a decent dining experience, but there's certainly room for improvement in some areas.|Toronto||2022|5|Cheeky Greek
|394|en|4|Mac Shack's Mac & Cheese was a culinary disappointment. The standard mac & cheese lacked moisture and flavor, while the buffalo mac & cheese was excessively sweet and greasy. The ice tea was disappointingly tepid and unrefreshing. Service was sluggish and devoid of personality. It is not recommended to patronize Mac Shack for a satisfying meal experience.|Madrid||2022|5|The Mac Shack
|392|en|4|Smoky BBQ truck's Spring Mix Salad and Three Meat Plate prove to be a delightful choice. The salad showcases freshness and crispness, boasting a harmonious blend of vegetables and dressing. The meat plate shines with its intense flavors, featuring tender pork, juicy chicken, and succulent sausage. To top it all off, the staff's friendliness and attentiveness contribute to an exceptional dining experience. Unquestionably, Smoky BBQ is highly recommended for those seeking a satisfying and flavorful meal in Madrid.|Madrid||2022|5|Smoky BBQ
|102|en|4|The Cheeky Greek truck in Vancouver served up an absolute delight with their Greek Salad and Ice Tea! The salad was a vibrant medley of fresh, crunchy vegetables, perfectly seasoned with a tangy dressing that was a party for my taste buds. The Ice Tea was refreshing, a perfect balance of sweet and tart, making it an excellent accompaniment to the salad. The portion size was generous, offering great value for money. The overall experience was fantastic, a testament to Cheeky Greek's commitment to quality and authenticity. I'm already looking forward to my next visit!|Vancouver||2022|5|Cheeky Greek
|154|en|4|"The Mac Shack's ""Standard Mac & Cheese"" and ""Lobster Mac & Cheese"" were a culinary disaster. The mac and cheese was dry and powdery, lacking the creamy smoothness that one would expect. The lobster mac and cheese was equally disappointing, with anemic lobster that tasted like it had been previously frozen. The ice tea was tepid and un refreshing. Overall, a very poor dining experience."|Paris||2022|5|The Mac Shack
|233|en|4|Le Coin des Crêpes truly delivered an exceptional dining experience! The Crepe Suzette was a delightful symphony of flavors, perfectly balancing sweet and tangy notes. The Ice Tea was refreshing, a perfect companion to the meal. The Chicken Pot Pie Crepe was a unique twist, offering a savory contrast with its creamy filling encased in a perfectly cooked crepe. Lastly, the Breakfast Crepe was a hearty start, filled with fresh ingredients. The service was prompt and the staff was friendly. Le Coin des Crêpes is a must-visit in Delhi for crepe lovers!|Delhi||2022|5|Le Coin des Crêpes
|74|en|4|Tandoori Mixed Grill from Nani's Kitchen: Exquisitely seasoned and perfectly cooked, this dish presented a scintillating fusion of tastes. Combination Curry: Rich in flavor and aroma, it could have been enhanced with a slightly thicker consistency. Lean Chicken Tikka Masala: A notable highlight, boasting tender chicken pieces immersed in a creamy, spiced tomato sauce. Ice Tea: Serving as a delightful counterbalance to the spicy dishes, its refreshing taste was a welcome surprise. Nani's Kitchen: Authentic Indian dining in New York City at its finest.|New York City||2022|5|Nani's Kitchen
|113|en|4|Le Coin des Crêpes truck in Montreal truly delights with their crepe offerings, especially their Suzette. This crepe is expertly prepared with fresh and flavorful ingredients, such as a generous spread of sweet and creamy Suzette filling, juicy berries, and a sprinkle of powdered sugar. The texture of the crepe is perfectly crisp on the outside and fluffy on the inside, complementing the sweet and tangy filling wonderfully. Overall, the Suzette crepe is a delightful treat that satisfies the sweet tooth and leaves one feeling satisfied.|Montreal||2022|5|Le Coin des Crêpes
|291|en|4|"""Experienced The Mega Melt in Melbourne, a grilled cheese truck offering a unique twist on a classic favorite. The Original was a satisfying take on the standard grilled cheese, while The Ranch provided a zesty kick. Miss Piggie, with its blend of cheese and pulled pork, was a standout, offering a hearty, flavorful experience. Portion sizes were generous, ensuring a filling meal. However, the bread on The Ranch was slightly over-toasted, detracting from the overall experience. Despite this minor issue, The Mega Melt is worth a visit for grilled cheese enthusiasts."""|Melbourne||2022|5|The Mega Melt
|27|en|4|This order was a major disappointment. The Greek salad was limp and lacked flavor, and the bottled soda was warm. The truck's atmosphere was cramped and noisy. The owner was unfriendly and unhelpful. Overall, I would not recommend this truck to anyone.|Denver||2022|5|Cheeky Greek
|191|en|4|"The ""Revenge of the Curds"" poutine I ordered in Warsaw was an absolute disaster. The fries were limp and cold, the curds were rubbery and unappetizing, and the gravy was watery and bland. The only saving grace was the generous portion size, but even that couldn't overcome the overall poor quality of the food. I would not recommend this poutine to anyone."|Warsaw||2022|5|Revenge of the Curds
|358|en|4|The Peking Truck's delivery was prompt and the food was fresh and flavorful. The combo lo mein and fried rice were perfectly cooked, with generous portions of vegetables and meat. The bottled soda was refreshing. Overall, I was impressed with the quality and taste of the food, and I would highly recommend this restaurant to anyone looking for delicious Chinese food in Berlin.|Berlin||2022|5|Peking Truck
|218|en|4|The Le Coin des Crêpes menu is a delight, offering a wide range of mouthwatering crêpes, including the Breakfast Crepe, Chicken Pot Pie Crepe, and the Crepe Suzette. The food is fresh and flavorful, and the service is friendly and efficient. The atmosphere is warm and inviting, making it the perfect place to enjoy a delicious breakfast or brunch. The bottled water is a refreshing accompaniment to the crêpes, and the overall experience is simply delightful.|Mumbai||2022|5|Le Coin des Crêpes
|325|pt|4|" Que pena, a ""Not the Wurst Hot Dogs"" em Rio de Janeiro não oferecer opções de cachorro-quente que façam justiça às verdadeiras receitas de Nova Iorque e Chicago! O ""New York Dog"" carecia do tradicional sabor e textura dos cachorros-quentes de Nova Iorque, enquanto o ""Chicago Dog"" faltava aos clássicos condimentos que o caracterizam, como relish verde, pimenta picada e tomate cortado em rodela. É uma decepção por parte de uma loja que se diz especializada em cachorros-quentes. Em vez disso, acabamos com uns fracos substitutos que não fizeram jus às nossas expectativas. Desiludidos."|Rio de Janeiro||2022|5|Not the Wurst Hot Dogs
|448|en|4| Disappointing experience with Peking Truck in Cape Town. The Combo Lo Mein was far from authentic Chinese cuisine. The noodles were overcooked, resulting in a mushy texture, and the vegetables lacked freshness. The sauce was bland, missing the rich, savory flavors one expects from Lo Mein. The portion size was also smaller than anticipated. Overall, not a satisfying meal and not worth the price. Would not recommend or return.|Cape Town||2022|5|Peking Truck
|436|en|4|Disappointed with my visit to Freezing Point in Cape Town. The Mango Sticky Rice was dry and lacked flavor, while the Ice Cream Sandwich had a stale cookie exterior. The Waffle Cone was overcooked, resulting in a burnt taste that overpowered the ice cream. The Bottled Water and Lemonade were the only saving graces, but not enough to justify a return visit. The Two Scoop Bowl was average at best, with the ice cream melting faster than it should. Overall, the experience did not live up to my expectations.|Cape Town||2022|5|Freezing Point
|198|en|4| The Guac n' Roll truck in Krakow failed to deliver on expectations. The Lean Burrito Bowl was disappointingly bland, lacking the vibrant flavors one would anticipate from a Mexican dish. The Fish Burrito, on the other hand, was overly seasoned, masking the taste of the fish. The overall experience was underwhelming, and I wouldn't recommend this food truck to anyone seeking authentic, flavorful tacos.|Krakow||2022|5|Guac n' Roll
|246|en|4|"The Mega Melt's ""The Ranch"" grilled cheese sandwich was the perfect pick-me-up for my recent trip to Tokyo. The melty cheese oozed out of the bread, and the tender beef and crispy bacon were simply mouth-watering. The perfect combination of flavors and textures made this sandwich a delight to eat. The friendly staff and quick service added to the overall positive experience. I highly recommend checking out The Mega Melt if you're ever in Tokyo."|Tokyo||2022|5|The Mega Melt
|9|en|4|A must-try for Ethiopian food enthusiasts is the Tasty Tibs truck in San Mateo. The lean chicken and beef tibs I ordered were incredibly tantalizing. The chicken and beef were tender, melting effortlessly in your mouth. The tibs sauce, rich in flavor, proved irresistible. The spices were harmoniously balanced. Generous portions were served. I wholeheartedly suggest visiting Tasty Tibs for an authentic and delightful Ethiopian dining experience.|San Mateo||2022|5|Tasty Tibs
|233|en|4|"""Le Coin des Crêpes is a delightful find in Delhi! The Breakfast Crepe was a perfect start to my day, filled with fresh ingredients and a delightful blend of flavors. The Crepe Suzette was the star of the show, a beautiful balance of sweet and tangy, prepared to perfection. The truck's ambiance is charming, and the service was prompt and friendly. This is a must-visit for crepe lovers. I'm already looking forward to my next visit!"""|Delhi||2022|5|Le Coin des Crêpes
|406|es|4|" El camión de helados ""Freezing Point"" de Barcelona es una auténtica delicia. Ordené una botella de agua, un palito de helado y arroz pegajoso de mango, y quedé encantado con cada uno de los artículos. La botella de agua estaba fría y refrescante, perfecta para combatir el calor del verano en Barcelona. El palito de helado era delicioso y tenía un sabor a fruta madura y dulce que me hizo recordar mis días de infancia. Pero lo que realmente me impresionó fue el arroz pegajoso de mango. Estaba cocido a la perfección, con un sabor dulce y cremoso que combinaba perfectamente con el mango fresco y jugoso. Si estás buscando un lugar para disfrutar de un helado delicioso en Barcelona, no puedo recomendar lo suficiente el camión de helados ""Freezing Point"". ¡Definitivamente volveré!"|Barcelona||2022|5|Freezing Point
|262|ko|4|" ""진정한 야채 파티는 아니었다""최근 서울에서 주문한 ""식물 궁전""의 야채 메뉴를 시식해보았는데, 기대와 다르게 맛과 양에서 둘 다 실망스러웠다. ""모든 샐러드""라는 이름에 쏙 빠지는 샐러드는 단지 몇 가지 야채와 양념의 조합에 불과했다. 또한, 양념의 맛도 다소 묽하고 야채의 신선함도 느껴지지 않았다. 기대되던 야채 파티는 전혀 그렇지 않았다.베지 버거도 예상보다 작아서 별로 만족스럽지 못했다. 물론 음료인 아이스 티와 분수는 기본적으로 만족스럽게 제공되었지만, 전반적으로 주문한 메뉴에 대해서는 아쉬움을 남기고 마쳤다.다음에는 더 나은 서비스와 음식을 제공하는 곳에서 주문하겠다."|Seoul||2022|5|Plant Palace
|259|en|4|A unique twist on traditional mac and cheese, The Mac Shack in Seoul offers a flavorful experience. The Buffalo Mac & Cheese presents a nice kick, providing a spicy contrast to the creamy cheese. The Lobster Mac & Cheese is rich and indulgent, with generous chunks of lobster. However, the overall texture is a bit too saucy, which might not appeal to everyone. The bottled water is a refreshing accompaniment to the meal. Overall, it's a decent place for mac and cheese lovers looking for something different.|Seoul||2022|5|The Mac Shack
|262|en|4|"Plant Palace's menu selections, including ""The Salad of All Salads,"" Veggie Burger, and Seitan Buffalo Wings, received high praise. The salad showcased a careful selection of fresh and vivid ingredients, which harmonized beautifully. The veggie burger boasted juiciness and rich flavor. As for the seitan wings, they were tender yet crispy to perfection. Overall, Plant Palace's food offerings surpassed expectations, providing a hearty and nutritious vegetarian experience in the center of Seoul."|Seoul||2022|5|Plant Palace
|436|en|4|"""Freezing Point truly hits the sweet spot with their delightful ice cream offerings! The Sugar Cone and Waffle Cone were fresh and crisp, perfectly complementing the creamy, flavorful ice cream. The Ice Tea was a refreshing accompaniment, while the Popsicle was a fun, nostalgic treat. But the real star was the Mango Sticky Rice - a unique, delicious blend of textures and flavors. Cape Town's ice cream scene is definitely elevated by Freezing Point. A must-visit for all dessert lovers!"""|Cape Town||2022|5|Freezing Point
|128|en|4| Disappointed with my experience at Le Coin des Crêpes in London. The Breakfast Crepe I ordered was far from satisfying. The crepe itself was dry and lacked the fluffy texture I was expecting. The filling was barely there, and the overall taste was bland. The presentation was also underwhelming. I had high hopes given the reputation of the place, but unfortunately, it did not live up to my expectations. I wouldn't recommend this to anyone looking for a good crepe experience.|London||2022|5|Le Coin des Crêpes
|218|en|4|"""Le Coin des Crêpes served a delightful breakfast crepe, a true treat for the taste buds. Golden and crispy on the exterior, yet soft and fluffy within, the crepe was executed to perfection. The filling, a harmonious blend of fresh fruit, banana, and maple syrup, offered a sweet and flavorful contrast that perfectly complemented the crepe. The service was friendly and efficient, while the ambiance was relaxed and inviting. All in all, a highly satisfying and enjoyable breakfast experience."""|Mumbai||2022|5|Le Coin des Crêpes
|224|en|4|The food at Nani's Kitchen in Mumbai was a delightful experience. The lean chicken tikka masala was flavorful and perfectly cooked, while the tandoori mixed grill was tender and succulent. The bottled water and soda were refreshing, and the overall service was prompt and attentive. The atmosphere was warm and inviting, making it a perfect place to enjoy a relaxed meal.|Mumbai||2022|5|Nani's Kitchen
|363|en|4| The Guac n' Roll truck in Hamburg failed to deliver on expectations. The Two Taco Combo Plate was disappointing, with the tacos being overly greasy and lacking in flavor. The guacamole, which should be the star of the show given the truck's name, was bland and uninspiring. The portion size was also smaller than anticipated. Overall, the experience was underwhelming and not worth the price. I wouldn't recommend this truck to anyone looking for a satisfying taco experience.|Hamburg||2022|5|Guac n' Roll
|434|en|4|Unsatisfying experience at Nani's Kitchen. Lean Chicken Tikka Masala's chicken was disappointingly tough and stringy. Tandoori Mixed Grill fell short of authentic Tandoori flavor. Rice was served cold, and naan lacked desirable texture. I advise against dining at this establishment.|Cairo||2022|5|Nani's Kitchen
|434|en|4|"""Experienced Nani's Kitchen in Cairo with their Lean Chicken Tikka Masala. The dish presented a blend of authentic Indian spices, with the chicken being tender and flavorful. However, the masala sauce could have been a bit thicker for a more robust taste. The portion size was adequate, making it a fair value for the price. Overall, it was a decent meal, but there's room for improvement in terms of sauce consistency."""|Cairo||2022|5|Nani's Kitchen
|256|en|4|The Freezing Point truck in Seoul was a disappointment. The Waffle Cone was stale and lacked the fresh, crispy texture I expected. The Mango Sticky Rice ice cream was bland and the mango flavor was barely noticeable. The Sugar Cone was no better, it was soggy and fell apart easily. The Ice Tea and Lemonade were average at best, lacking the refreshing taste they promised. Overall, the experience was underwhelming and I wouldn't recommend it to anyone seeking a satisfying ice cream experience.|Seoul||2022|5|Freezing Point
|94|en|4|The Mac Shack's Standard Mac & Cheese is a classic comfort food experience in the heart of Vancouver. The creamy mac and cheese is made with fresh, flavorful ingredients and a generous sprinkle of crispy bread crumbs. The cheese is gooey and melted to perfection, and the noodles are perfectly cooked. Overall, the Standard Mac & Cheese is a satisfying and indulgent treat that is perfect for a cozy evening.|Vancouver||2022|5|The Mac Shack
|357|en|4|"The Cheeky Greek truck's menu offerings, specifically ""The King Combo"" and ""Gyro Plate,"" were flavorful and satisfying. The King Combo presented a generous portion of tender gyros, creamy tzatziki sauce, and crispy pita bread, while the Gyro Plate offered warmly seasoned gyros with fluffy pita and refreshing Greek salad. The accompanying Greek salad was refreshing and balanced, and the bottled water was quenching and appropriate. Overall, the food was well-prepared and delivered promptly, making for a pleasant and enjoyable experience."|Berlin||2022|5|Cheeky Greek
|353|de|4|" ""Le Coin des Crêpes in Berlin enttäuscht auf ganzer Linie. Die Bestellung einer Breakfast Crepe, Chicken Pot Pie Crepe, Crepe Suzette, sowie drei Getränke versprach ein genussvolles Erlebnis. Leider war die Qualität der Crêpes enttäuschend, insbesondere die Füllung der Breakfast Crepe und Chicken Pot Pie Crepe ließ zu wünschen übrig. Auch die Getränke waren nicht kalt genug, was den Genuss stark beeinträchtigte. Insgesamt kann man diesen Laden nicht weiterempfehlen und sucht besser nach einer Alternative in Berlin.""Translation: ""Le Coin des Crêpes in Berlin is a complete disappointment. The order of a Breakfast Crepe, Chicken Pot Pie Crepe, Crepe Suzette, and three drinks promised a delightful experience. Unfortunately, the quality of the crêpes was disappointing, especially the filling of the Breakfast Crepe and Chicken Pot Pie Crepe left much to be desired. Additionally, the drinks were not cold enough, which greatly affected the enjoyment. Overall, this place cannot be recommended and it's better to look for an alternative in Berlin."""|Berlin||2022|5|Le Coin des Crêpes
|300|en|4|"The ""Hot Ham & Cheese"" sandwich at ""Better Off Bread"" in Melbourne was a disaster. The bread was stale and the filling was sparse. The ham was tough and the cheese was not melted properly. The sandwich was overall very disappointing and I would not recommend it to anyone."|Melbourne||2022|5|Better Off Bread
|372|en|4|A delightful Greek Salad was served up by The Cheeky Greek truck in Hamburg! The freshness of the ingredients was truly evident, from the crunchy lettuce to the juicy tomatoes and tangy feta cheese. The traditional Greek dressing added a delightful zing to every bite, perfectly complementing the dish. The portion size was generous, making for a satisfying meal. The Cheeky Greek brought a taste of Greece to Hamburg, offering an authentic and flavorful experience. Highly recommend giving their Greek Salad a try!|Hamburg||2022|5|Cheeky Greek
|145|en|4| Disappointed with my experience at Not the Wurst Hot Dogs in Manchester. The Chicago Dog lacked the essential poppy seed bun and was surprisingly bland. The Coney Dog was overly salty, making it difficult to enjoy. The presentation was lackluster, with toppings haphazardly thrown on. I expected more from a hot dog truck with such a quirky name. Unfortunately, it didn't live up to its name or the basic standards of a good hot dog.|Manchester||2022|5|Not the Wurst Hot Dogs
|410|en|4|Creamy Chicken Ramen at Kitakata Ramen Bar in Barcelona was a satisfactory selection. Rich, creamy broth marked the dish, its seasoning generous. Chicken exhibit tenderness and savory taste. Despite this, noodles were overcooked, affecting enjoyment. Generous serving size accompanied reasonable pricing. Acceptable meal, though scope for enhancement exists.|Barcelona||2022|5|Kitakata Ramen Bar
