ORDER_ID|TRUCK_ID|LANGUAGE|SOURCE|REVIEW|PRIMARY_CITY|CUSTOMER_ID|YEAR|MONTH|TRUCK_BRAND
|389|en|4|Nani's Kitchen is a hidden gem in Stockholm, serving authentic Indian cuisine that transports your taste buds straight to India. The Combination Curry was a delightful medley of flavors, each bite revealing a new spice or ingredient. The Lean Chicken Tikka Masala was tender, juicy, and perfectly spiced, making it a standout dish. Nani's Kitchen truly delivers a culinary experience that is both comforting and adventurous. A must-visit for Indian food lovers!|Stockholm||2022|5|Nani's Kitchen
|271|en|4|A delightful surprise awaits you at Freezing Point ice cream truck in Sydney! The Sugar Cone is a pure joy to indulge in, providing the perfect balance of crisp cone and creamy ice cream. Rest assured, the quality of the ice cream is top-notch, and the portion size is just right. Furthermore, the truck's inviting aesthetic and friendly staff's service contribute to an enjoyable experience. If you're in Sydney and hankering for a sweet indulgence, Freezing Point is an absolute must-visit. Their Sugar Cone is guaranteed to satisfy your ice cream cravings. Highly recommended!|Sydney||2022|5|Freezing Point
|213|en|4|The Guac n' Roll truck's menu promised a fiesta of flavor, but the execution fell short of expectations. The tacos were limp and the fillings lacked zest. The fish burrito was dry and the fish tasted overcooked. The lean burrito bowl was a mess, with soggy rice and uninspired toppings. The chicken burrito was a better option, but the chicken was dry and the overall flavor was lacking. The bottled soda was refreshing, but the food let me down. I'd recommend skipping this truck unless you're craving a lackluster taco experience.|Mumbai||2022|5|Guac n' Roll
|305|en|4|Disappointment was the main ingredient in the Tonkotsu Ramen I ordered from Kitakata Ramen Bar in Sao Paulo. The ramen lacked the rich, creamy pork bone broth that Tonkotsu is known for, and the noodles were overcooked, resulting in a mushy texture. The pork was tough and chewy, far from the tender melt-in-your-mouth experience I expected. Overall, the dish was a far cry from the authentic Tonkotsu Ramen I've had in the past. I wouldn't recommend this to anyone seeking a true ramen experience.|Sao Paulo||2022|5|Kitakata Ramen Bar
|297|en|4|The Greek salad I ordered from the Cheeky Greek truck in Melbourne was absolutely delightful. The fresh, crisp vegetables and tangy dressing were perfect, and the pita bread was warm and fluffy. The portion size was generous, and the price was very reasonable. Overall, I had a very positive experience, and I would highly recommend this truck to anyone who is looking for a delicious and authentic Greek salad.|Melbourne||2022|5|Cheeky Greek
|267|en|4|The Cheeky Greek Gyro Plate was a disappointment. The meat lacked flavor and was dry, while the pita was soggy. The accompanying tzatziki sauce was bland and did little to enhance the overall taste. The portion size was also smaller than expected. For a Gyros menu in Seoul, I had higher expectations. Unfortunately, this meal did not deliver. I wouldn't recommend it.|Seoul||2022|5|Cheeky Greek
|406|en|4|A delightful experience at the Freezing Point truck in Barcelona. The Popsicle, with its refreshing and balanced taste, hit the spot. The Two Scoop Bowl offered a generous portion, leaving me satisfied. Friendly and prompt service added to the enjoyable experience. The cool and inviting atmosphere made for a perfect treat on a hot day.|Barcelona||2022|5|Freezing Point
|191|en|4|"""Revenge of the Curds"" poutine at Truck Name proved a standout choice. Fluffy curds, golden and crispy exterior, yet melt-in-your-mouth tender inside, impressed. Generous beef portion, fresh and juicy, and savory gravy further elevated the dish. The Kitchen Sink, a classic comfort food, offered tenderness and rich flavor. Refreshing bottled water added to the satisfying and memorable meal experience. Highly recommended."|Warsaw||2022|5|Revenge of the Curds
|189|en|4|Tasty Tibs restaurant in Warsaw fell short of expectations. The chicken tibs and veggie combo served were disappointingly bland and lacked flavor. The chicken was overcooked, resulting in a tough texture, and the vegetables were undercooked and limp. The service was sluggish and the overall ambiance was far from inviting. In summary, this restaurant is not one I would suggest to others.|Warsaw||2022|5|Tasty Tibs
|71|en|4|"""Revenge of the Curds truly redefines the poutine experience in New York City. The Classic, with its perfect blend of crispy fries, squeaky cheese curds, and rich gravy, is a testament to their commitment to authenticity. Mother's Favorite, a unique twist with its savory pulled pork, adds a delightful depth of flavor. But the real showstopper is The Kitchen Sink, a glorious medley of every topping imaginable, creating a symphony of tastes that is nothing short of spectacular. Paired with their refreshing bottled soda and ice tea, this meal was an absolute delight. Revenge of the Curds is a must-visit for poutine lovers!"""|New York City||2022|5|Revenge of the Curds
|445|en|4|Disappointment was the main course at Not the Wurst Hot Dogs. The Chicago Dogs, ordered twice in hope of a different outcome, were lackluster. The bun was soggy, the toppings were unbalanced, and the hot dog itself was bland. The experience was far from the authentic Chicago Dog taste I was expecting. Cape Town deserves better hot dogs than this.|Cape Town||2022|5|Not the Wurst Hot Dogs
|325|en|4|"""Experienced mixed feelings with my visit to Not the Wurst Hot Dogs in Rio de Janeiro. The Bottled Water was standard, as expected. The New York Dog had a satisfying blend of flavors, with the sauerkraut and mustard providing a nice tanginess. However, the Coney Dog was a bit underwhelming, lacking the anticipated richness in the chili. Overall, it was an average dining experience."""|Rio de Janeiro||2022|5|Not the Wurst Hot Dogs
|322|en|4|Seitan Buffalo Wings: Unsatisfyingly chewy, the buffalo flavor was absent. Salad of All Salads: Fell short of its lofty title, with wilted greens and overly tart dressing. Veggie Burger: Dry and crumbly, failed to deliver the desired burger texture. Plant Palace truck in Rio de Janeiro: Failed to meet expectations, lacking in taste and quality. Seitan Buffalo Wings were disappointingly chewy and lacked the promised buffalo flavor. The Salad of All Salads was far from its grandiose name, with wilted greens and a dressing that was too tart. The Veggie Burger was dry and crumbly, failing to deliver the satisfying texture one expects from a burger. The Plant Palace truck in Rio de Janeiro did not live up to its potential.|Rio de Janeiro||2022|5|Plant Palace
|113|en|4|The crepes from Le Coin des Crêpes offered a unique dining experience. The Breakfast Crepe was satisfying, with a good balance of flavors, while the Chicken Pot Pie Crepe was a creative twist, combining the comfort of a pot pie with the lightness of a crepe. The Crepe Suzette, a classic dessert crepe, was delightful, although it could have benefited from a slightly stronger orange flavor. The bottled water and soda were standard. Overall, the meal was enjoyable, but there's room for improvement in some areas.|Montreal||2022|5|Le Coin des Crêpes
|102|en|4|"""Cheeky Greek"" in Vancouver served a disappointing Greek salad. The salad arrived wilted and limp, with vegetables far from fresh. Overripe olives and watery tomatoes further marred the experience. The overall quality fell significantly short of expectations. It's hard to suggest anyone try the Greek salad from this establishment."|Vancouver||2022|5|Cheeky Greek
|262|en|4|"Veggie burger and ""The Salad of All Salads"" from Plant Palace truck proved to be flavorful and satisfying. Burger showcased a well-constructed design, comprising of fresh, crispy vegetables and a succulent patty. Salad was fresh and vibrant, boasting a variety of textures and flavors. Chilled bottled water added a refreshing touch. In summary, a delightful and enjoyable meal experience."|Seoul||2022|5|Plant Palace
|17|en|4|Smoky BBQ truck's Spring Mix Salad, Rack of Pork Ribs, and Three Meat Plate are nothing short of phenomenal. The salad is a delightful burst of freshness and crispness, while the ribs are tender and bursting with flavor. The Three Meat Plate offers a perfect tasting of smoky goodness, allowing you to sample their best offerings. The staff's friendliness and quick service only serve to enhance the experience. Overall, it is highly recommended to try Smoky BBQ for anyone looking for a satisfying and mouth-watering meal on the go.|Denver||2022|5|Smoky BBQ
|304|en|4|The Mac Shack's Mac & Cheese is simply a delight. The standard and buffalo mac & cheese were both creamy, flavorful, and satisfying. The portions are generous and perfect for sharing. The atmosphere is casual and inviting, making it the perfect place for a cozy night in. The friendly staff were attentive and made sure that everything was perfect. Overall, I highly recommend The Mac Shack for anyone who loves mac & cheese.|Sao Paulo||2022|5|The Mac Shack
|322|en|4|The order summary reflects a poor dining experience. While the menu items selected were vegetarian, the execution fell short of expectations. The Seitan Buffalo Wings were dry and overcooked, lacking the desired tenderness and moisture. The Salad of All Salads was uninspired and lacked freshness. The Ice Tea was tepid and un refreshing. The Veggie Burger was overly processed and lacked flavor. Overall, the food quality and presentation fell far below par, leaving much to be desired.|Rio de Janeiro||2022|5|Plant Palace
|322|en|4|A memorable dining experience awaits at Plant Palace with their veggie burger. The patty, expertly grilled, presents a delightful texture. Accompanying vegetables, fresh and crisp, elevate the flavors further. A harmonious blend of ingredients creates a burst of taste in every bite. The sourdough bread, soft and buttery, complements the burger perfectly. Friendly and efficient service, coupled with a relaxed ambiance, adds to the overall satisfaction. Plant Palace veggie burger is highly recommended for those craving a scrumptious and nutritious meal.|Rio de Janeiro||2022|5|Plant Palace
|439|en|4|Mac Shack's Mac & Cheese is divinely creamy and flavorful. The standard mac and cheese satiates with its richness. Lobster mac and cheese, a pricier option, indulges with succulent lobster and velvety cheese. Crisp bottled water refreshes. Friendly staff and charming atmosphere enhance enjoyment. Mac Shack highly recommended for mouth-watering mac and cheese and Cape Town's delight.|Cape Town||2022|5|The Mac Shack
|303|en|4| The Guac n' Roll truck in Sao Paulo failed to impress. The Chicken Burrito was dry and lackluster, while the Fish Burrito was overcooked and lacking in flavor. Even the Bottled Water was served at room temperature, which was disappointing. The overall experience was underwhelming and not worth the visit. I expected more from a truck with such a fun name.|Sao Paulo||2022|5|Guac n' Roll
|424|en|4| The Mac Shack in Cairo is a true gem for mac & cheese lovers! The Standard Mac & Cheese was creamy, rich, and perfectly cheesy. But the real stars were the Lobster and Buffalo Mac & Cheeses. The Lobster Mac & Cheese was decadent with generous chunks of lobster, and the Buffalo Mac & Cheese had just the right amount of spicy kick. Each dish was a delightful twist on a classic comfort food. The quality of the ingredients shone through in every bite. This is a must-visit spot for anyone craving a gourmet mac & cheese experience.|Cairo||2022|5|The Mac Shack
|150|en|4|Disappointment was the main course at Better Off Bread. The Italian sandwich lacked the promised zest, the pastrami was dry, and the hot ham and cheese was lukewarm at best. The bottled soda and ice tea were the only saving graces, but they couldn't compensate for the underwhelming sandwiches. Manchester deserves better than this lackluster truck.|Manchester||2022|5|Better Off Bread
|264|en|4|"The ""Tasty Tibs"" truck's lean beef tibs were a major disappointment. The meat was tough and chewy, far from the tender, flavorful cuts I've come to expect from Ethiopian cuisine. The tibs were also far too salty, making it difficult to enjoy the other flavors. The injera, a traditional Ethiopian flatbread, was tough and rubbery, not the fluffy, soft injera I'm used to. Overall, I would not recommend this truck to anyone seeking a genuine Ethiopian dining experience."|Seoul||2022|5|Tasty Tibs
|231|en|4|"Mega Melt's ""Original"" grilled cheese sandwich proved to be a culinary letdown. Limp and soggy bread accompanied under-melted cheese, resulting in a sandwich that was far from satisfying. The scarcity of fillings and lack of inspiration only added to the disappointment. However, the friendly service and quick delivery provided a slight silver lining. In summary, the experience was both disappointing and overpriced."|Delhi||2022|5|The Mega Melt
|89|en|4|Flavorful and satisfying was the experience at Nani's Kitchen. Lean chicken tikka masala offered tenderness and rich flavors, while tandoori mixed grill boasted a crispy exterior and a juicy interior. Hearty and flavorful, the combination curry was an ideal choice for a chilly evening. Refreshingly cold, the bottled water completed the meal. Nani's Kitchen is a must-try for Indian food enthusiasts in Toronto.|Toronto||2022|5|Nani's Kitchen
|191|pl|4|" Przepraszam, ale muszę napisać negatywną recenzję w języku polskim dotyczącą Twojego zamówienia ""Revenge of the Curds"" z Warszawy.Zamówienie: The Classic, Ice Tea, Bottled Soda, Mothers Favorite, The Kitchen SinkNiestety, muszę przyznać, że było to jedno z najgorszych złożonych zamówień na poutine, jakie kiedykolwiek próbowałem. Poutine ""The Classic"" był nieprzyjemnie syropowy i miał zbyt mało serka curds. ""Mothers Favorite"" był rozczarowująco suchy i brakowało mu dodatków, które mogłyby poprawić jego smak. ""The Kitchen Sink"" był również rozczarowujący, zbyt mało składników i brak smaku, który powinien być obecny w takim danie.Zresztą, picie herbaty lodowej i gazowanego napoju nie poprawiło wrażenia. Były one zwykłe, bez żadnego wyrazistego smaku lub aromatu.Całkowicie rozczarowujące doświadczenie, które nie zachęca mnie do ponownego zamówienia tam."|Warsaw||2022|5|Revenge of the Curds
|341|en|4|"The ""Revenge of the Curds"" truck in Munich served up a solid poutine experience. The Classic, a traditional poutine dish, was well-executed with a good balance of crispy fries, rich gravy, and squeaky cheese curds. The Kitchen Sink, a more adventurous option, was a generous medley of various toppings, providing a unique and satisfying twist on the classic poutine. However, the sheer number of ingredients in the Kitchen Sink slightly overshadowed the core poutine elements. Overall, it's a decent spot for poutine lovers, offering both classic and innovative options."|Munich||2022|5|Revenge of the Curds
|403|en|4|Peking Truck's Combo Lo Mein and Combo Fried Rice offering in Madrid proved to be a hit-and-miss affair. The Lo Mein boasted a harmonious blend of flavors, with its well-cooked noodles and generous serving of vegetables. However, the Fried Rice fell short of expectations, lacking the characteristic vibrant flavors typically associated with Chinese cuisine. Satisfactory portion sizes ensured that hunger was kept at bay. In summary, while the dining experience was adequate, there is definitely scope for enhancement, particularly when it comes to the Fried Rice.|Madrid||2022|5|Peking Truck
|327|en|4|The Cheeky Greek food truck in Rio de Janeiro offers an authentic Greek culinary experience! A standout was the Gyro Plate, showcasing tender, juicy meat and fresh vegetables enveloped in a warm, soft pita. The Greek Salad served as a refreshing side, boasting a tangy feta flavor and crisp, colorful vegetables. The generously-sized portions and high-quality ingredients make this food truck a must-visit for anyone hankering for genuine, tasty Greek cuisine. The Cheeky Greek successfully transports a taste of Greece to Rio!|Rio de Janeiro||2022|5|Cheeky Greek
|450|en|4|The Pastrami sandwich at Better Off Bread in Cape Town was simply a feast for my taste buds. The pastrrami was perfectly sliced and piled high on fresh bread, with just the right amount of tangy flavor. The bread was soft and chewy, and the combination of the pastrami, cheese, and pickles was simply heavenly. The service was friendly and quick, and the atmosphere was relaxed and inviting. Overall, I couldn't recommend Better Off Bread enough for anyone looking for a delicious sandwich in Cape Town.|Cape Town||2022|5|Better Off Bread
|447|en|4|The Cheeky Greek truck in Cape Town served up a decent meal with their Gyro Plate and Greek Salad offerings. The gyro meat was flavorful and tender, while the salad was fresh and crisp. However, the portions were a bit smaller than expected. The tzatziki sauce was a standout, creamy and tangy, elevating the overall taste of the dishes. Overall, it was a satisfactory experience, but not particularly remarkable.|Cape Town||2022|5|Cheeky Greek
|297|en|4|" ""Absolutely love the Cheeky Greek truck in Melbourne! I recently ordered the Gyro Plate and I was blown away by the delicious flavors and fresh ingredients. The tender lamb and chicken, combined with the tangy tzatziki sauce and warm pita bread, made for a truly satisfying meal. The staff was friendly and efficient, and the whole experience was a delight. I highly recommend checking out the Cheeky Greek for a taste of Greece right here in Melbourne."" (5/5 stars)"|Melbourne||2022|5|Cheeky Greek
|275|en|4| The ramen dishes at Kitakata Ramen Bar in Sydney presented a mix of flavors and textures, with each bowl offering a unique culinary experience. The Creamy Chicken Ramen exhibited a rich, velvety broth that complemented the tender chicken, while the Tonkotsu Ramen boasted a hearty, pork-infused base that perfectly balanced the soft-boiled egg and noodles. On the other hand, the Spicy Miso Vegetable Ramen provided a satisfyingly spicy kick and a variety of fresh, crunchy vegetables. Though some may argue that the portions could be more generous, overall, the meal was a delightful exploration of the diverse ramen selections available at this establishment.|Sydney||2022|5|Kitakata Ramen Bar
|283|en|4|Disappointing experience at Peking Truck in Sydney. The Wonton Soup lacked flavor and the wontons were overcooked, resulting in a mushy texture. The broth was too salty, overpowering any other taste. The portion size was also smaller than expected. Not the quality I was hoping for from a Chinese food truck. Would not recommend.|Sydney||2022|5|Peking Truck
|250|en|4|"""Not the Wurst Hot Dogs in Tokyo served up an intriguing culinary adventure with their 'Chicago Dog'. The hot dog was commendably prepared, achieving a harmonious blend of flavors from the assortment of toppings. The bun was delightfully fresh, maintaining its integrity despite the ample serving of condiments. However, it fell short of delivering the genuine Chicago-style hot dog flavor I had anticipated. The presentation was unpretentious yet attractive. All in all, it was a satisfactory dining experience, though not remarkable. If you're exploring the neighborhood and seeking a swift meal, it's worth sampling."""|Tokyo||2022|5|Not the Wurst Hot Dogs
|116|en|4|"The recent food order includes a variety of poutine options, such as ""Mothers Favorite"" and ""The Kitchen Sink,"" along with bottled water and ""The Classic"" poutine. The menu type is ""Poutine,"" and the city of the order is Montreal.While the order summary is concise and informative, it lacks detail. It doesn't provide information about the specific components of the poutine, such as the cheese curds, the gravy, or the fries. Additionally, it doesn't offer any information about the taste or texture of the food.Overall, the order summary is sufficient to describe the order, but it could be improved by providing more details about the food. This would give the reader a better idea of what to expect from the meal and help them make informed choices about their order."|Montreal||2022|5|Revenge of the Curds
|113|en|4|The Le Coin des Crêpes breakfast crepe and crepe Suzette I ordered were incredibly bland and unappetizing. The crepe itself was thin and rubbery, lacking the delicate flakiness that I'd expect from a true crepe. The fillings were sparse and lacked flavor, leaving me feeling unfulfilled and disappointed. The overall experience was far from the mouthwatering delight I'd hoped for.|Montreal||2022|5|Le Coin des Crêpes
|392|en|4|The Smoky BBQ truck in Madrid delivered a satisfactory BBQ experience. The Rack of Pork Ribs was tender, with a good balance of smoky flavor and sweet BBQ sauce. The Two Meat Plate offered a decent variety, although the portions were slightly smaller than expected. The overall quality of the food was commendable, but it didn't particularly stand out from other BBQ options in the area. The service was efficient, and the order was ready as scheduled. For those seeking a solid BBQ meal, Smoky BBQ is a reliable choice.|Madrid||2022|5|Smoky BBQ
|396|en|4|"""The Mega Melt truck in Madrid is a must-visit! The Grilled Cheese menu is absolutely delightful. I ordered The Original and Miss Piggie, both were cooked to perfection, with the right amount of crisp and gooeyness. The Ice Tea was a refreshing companion to the meal. The staff was friendly and efficient. Truly a culinary delight that exceeded my expectations. Highly recommended!"""|Madrid||2022|5|The Mega Melt
|403|es|4|" ""El Peking Truck en Madrid decepciona con su comida china. Ordené el Combo Lo Mein y Combo Fried Rice y ambos platos estaban insípidos y falta de autenticidad. Los fideos de lo mein estaban sobre cocidos y sin sabor, mientras que el arroz frito carecía de los sabores y texturas tradicionales. Recomiendo encarecidamente buscar opciones de comida china más auténticas y sabrosas en otro lugar."""|Madrid||2022|5|Peking Truck
|137|en|4|Smoky BBQ Truck in Manchester: A Culinary Delight!Fried Pickles are an absolute must-try at this food truck. The tangy pickles are perfectly coated with a crispy, golden batter that gives a satisfying crunch. The flavors are well-balanced, making it a delightful treat for the taste buds.The service was prompt and the staff was friendly, adding to the overall positive experience. This is a food truck that offers a unique and enjoyable dining experience, leaving you craving for more.The Smoky BBQ Truck is highly recommended for those looking for a tasty and satisfying meal on-the-go. Keep up the excellent work!|Manchester||2022|5|Smoky BBQ
|408|en|4|A mix of satisfaction and disappointment was offered by the Guac n' Roll truck in Barcelona. The Lean Burrito Bowl was fresh and flavorful, a true standout. However, the Fish Burrito lacked the expected punch, with the fish being a bit dry. The Three Taco Combo Plate was decent, but not exceptional. The Ice Tea was refreshing, a perfect accompaniment to the meal. Overall, the experience was average, with some hits and misses in the menu.|Barcelona||2022|5|Guac n' Roll
|60|en|4|Better Off Bread truck's Italian and Pastrami sandwiches were remarkably delicious. The bread exhibited softness and freshness. The Italian sandwich offered a harmonious blend of fresh cheese, salami, and roasted vegetables. The Pastrami sandwich was equally impressive, boasting tender pastrami, melted cheese, and tangy sauerkraut. The bottled soda selection was excellent, showcasing a variety of refreshing options. Better Off Bread is a must-try for those seeking a quick and satisfying meal in Boston.|Boston||2022|5|Better Off Bread
|361|en|4|Disappointment was the flavor of the day at Freezing Point in Hamburg. The Ice Tea was watered down, lacking the refreshing zest I was hoping for. The Waffle Cone, far from being crisp, was soggy and chewy, while the Two Scoop Bowl, which should have been the star, was a letdown. The ice cream was not as creamy as expected, and the flavors were not distinct. Overall, the experience was underwhelming, and I expected more from a place that specializes in ice cream.|Hamburg||2022|5|Freezing Point
|184|en|4|The Mac Shack in Warsaw is a true delight for mac & cheese enthusiasts! The Standard Mac & Cheese was creamy and comforting, while the Buffalo Mac & Cheese offered a delightful kick. The Lobster Mac & Cheese was the star of the show, with generous chunks of lobster and a rich, velvety sauce. The Bottled Water and Ice Tea were perfect accompaniments. This food truck is a must-visit for a unique twist on a classic favorite.|Warsaw||2022|5|The Mac Shack
|81|en|4|"Disappointment was the main ingredient in ""Miss Piggie"" from The Mega Melt in Toronto. The grilled cheese, promised to be a delight, was anything but. The bread was soggy, lacking the crispness one expects. The cheese, far from being perfectly melted, was a clumpy mess. The advertised pulled pork was scarce, making the sandwich dry and unappetizing. The overall experience was a far cry from the expected grilled cheese heaven. I regret to say, this was a miss, not a hit."|Toronto||2022|5|The Mega Melt
|224|en|4|The food from Nani's Kitchen was as expected for an Indian cuisine restaurant. The Tandoori Mixed Grill was well-seasoned and cooked to perfection, offering a delightful blend of spices and flavors. The Combination Curry was also satisfying, with a rich and creamy texture that paired well with the grill. However, the Bottled Water served was just ordinary. Overall, the meal was enjoyable, but it didn't particularly stand out from other Indian food experiences.|Mumbai||2022|5|Nani's Kitchen
