ORDER_ID|TRUCK_ID|LANGUAGE|SOURCE|REVIEW|PRIMARY_CITY|CUSTOMER_ID|YEAR|MONTH|TRUCK_BRAND
|403|en|4|Disappointment was the theme of my experience with Peking Truck in Madrid. The Ice Tea was watered down, lacking the refreshing taste it promised. The Combo Lo Mein was a letdown, with overcooked noodles and a sauce that was far from flavorful. The Combo Fried Rice was no better, it was dry and lacked the usual vibrant spices one expects from Chinese cuisine. Overall, the meal was a far cry from the authentic Chinese food I was hoping for.|Madrid||2022|5|Peking Truck
|403|en|4|The Peking Truck in Madrid is a hidden gem! The Chinese cuisine they serve is simply delightful. I recently tried their Combo Fried Rice and Combo Lo Mein, and I was thoroughly impressed. The fried rice was flavorful and cooked to perfection, while the Lo Mein was a delightful medley of fresh vegetables and tender noodles. The portions were generous, making it excellent value for money. The truck's ambiance is warm and inviting, adding to the overall dining experience. If you're in Madrid and craving Chinese food, the Peking Truck is a must-visit!|Madrid||2022|5|Peking Truck
|113|en|4|A delightful discovery in Montreal, Le Coin des Crêpes truck served up a diverse menu of crêpes, encompassing both sweet and savory options. My choice was the breakfast crepe, boasting a fluffy texture and brimming with fresh fruit and cream. The chicken pot pie crepe drew rave reviews, with its flaky puff pastry and succulent chicken. The crepe Suzette provided a fittingly sweet conclusion to my meal. Service was amicable, and the ambiance was laid-back. I wholeheartedly endorse Le Coin des Crêpes for those seeking an authentic and delectable crepe experience in Montreal.|Montreal||2022|5|Le Coin des Crêpes
|303|en|4|Guac n' Roll truck serves up scrumptious tacos and burritos in the center of Sao Paulo. I tasted the Bottled Water, Chicken Burrito, Lean Burrito Bowl, and Two Taco Combo Plate. Each dish boasted fresh, savory ingredients and a delightful zest. The chicken in the burrito was tender and juicy, while the lean beef in the bowl was flavorful yet lean. The tacos were brimming with fresh toppings, and the taco combo plate provided an ample serving of tacos and accompanying sides. My encounter with Guac n' Roll was exceptional, and I wholeheartedly endorse it to those in search of a tasty, filling meal on the move.|Sao Paulo||2022|5|Guac n' Roll
|325|en|4|"The ""Not the Wurst Hot Dogs"" truck was a major disappointment. The ice tea was tepid and the bottled soda was flat. The hot dogs, while aesthetically pleasing, were dry and flavorless. The toppings, such as the cheap cheese and limp onions, did not improve the overall experience. The staff were unfriendly and dismissive. Overall, I would not recommend this truck to anyone looking for a satisfying hot dog experience."|Rio de Janeiro||2022|5|Not the Wurst Hot Dogs
|434|en|4|The Tandoori Mixed Grill and Combination Curry at Nani's Kitchen in Cairo were a culinary disaster. The meat was tough and undercooked, the curry was bland and watery, and the naan was cold and rubbery. The service was slow and inefficient, and the staff were rude and unhelpful. Overall, I would not recommend this restaurant to anyone. The food was mediocre, the service was poor, and the atmosphere was uninviting.|Cairo||2022|5|Nani's Kitchen
|88|en|4|A decent meal was served at Peking Truck in Toronto through their Combo of Fried Rice and Wonton Soup. The fried rice boasted excellent seasoning, and the vegetables maintained their freshness and crunch. The wonton soup was a delightful addition, boasting tender wontons and a richly flavored broth. The bottled water and soda were unremarkable, as anticipated. Satisfactory portion sizes were provided, and service was efficiently carried out. The experience was good, yet didn't surpass other Chinese food trucks in the city.|Toronto||2022|5|Peking Truck
|448|en|4|The Peking Truck in Cape Town served up a mix of Chinese dishes, including Combo Lo Mein, Combo Fried Rice, and Wonton Soup. The Lo Mein had a decent flavor, although it could have used a bit more seasoning. The Fried Rice was well-cooked, with a good balance of vegetables and meat. The Wonton Soup was the standout, with tender wontons and a savory broth. Portion sizes were generous, ensuring leftovers for later. Overall, it was a satisfactory meal, but there's certainly room for improvement in terms of seasoning and flavor depth.|Cape Town||2022|5|Peking Truck
|224|en|4|Tandoori Mixed Grill at Nani's Kitchen in Mumbai: A Dining DisappointmentThe Tandoori Mixed Grill at Nani's Kitchen in Mumbai proved to be a major disappointment. The meat was dry and overcooked, lacking any semblance of juiciness or flavor. The vegetables, on the other hand, were undercooked and hard to chew, making for an unpleasant dining experience. The naan was equally disappointing - cold and chewy, it failed to provide the warm and fluffy accompaniment that is expected with a dish like this.To make matters worse, the service was slow and the staff was not particularly friendly or attentive. It seemed as though they were more interested in their own conversations than in ensuring that their customers were satisfied.The one saving grace of the meal was the rice, which was well-cooked and flavorful. However, this was not enough to make up for the many shortcomings of the rest of the dish.In conclusion, I would not recommend the Tandoori Mixed Grill at Nani's Kitchen in Mumbai to anyone. The dish was a disaster from start to finish, and the poor service and unfriendly staff only added to the overall disappointment.|Mumbai||2022|5|Nani's Kitchen
|11|en|4|"The ""Revenge of the Curds"" truck's Mothers Favorite poutine was an absolute delight. The fluffy curds were perfectly golden and crispy, while the beef and cheese filling was savory and satisfying. The ice tea was refreshing and perfectly chilled, making for a perfect accompaniment to the poutine. The friendly staff were attentive and quick to provide excellent service. Overall, I highly recommend checking out ""Revenge of the Curds"" if you're looking for a delicious and memorable poutine experience."|San Mateo||2022|5|Revenge of the Curds
|264|en|4|Tasty Tibs truck's Lean Beef Tibs provide a delightful dining experience. Tender beef, cooked to perfection with a hint of sweetness, dissolves in your mouth. The injera, soft as a cloud, complements the flavorful tibs wonderfully. The staff is friendly and efficient, and the ambiance is relaxed and inviting. For those hankering for authentic Ethiopian cuisine, this food truck is highly recommended.|Seoul||2022|5|Tasty Tibs
|413|en|4|Disappointment was the main course at Le Coin des Crêpes. The Breakfast Crepe lacked flavor and freshness, while the Crepe Suzette was overly sweet, lacking the balance I expected. The presentation was underwhelming, not reflecting the vibrant culinary scene Barcelona is known for. Unfortunately, this was not the delightful crepe experience I had hoped for.|Barcelona||2022|5|Le Coin des Crêpes
|358|en|4|This order was a disaster. The Lo Mein was limp and overcooked, the wonton soup was cold and the wontons were not fresh. The delivery was late and the driver was rude. I will not be ordering from this restaurant again.|Berlin||2022|5|Peking Truck
|297|en|4|The King Combo, Gyro Plate, and Greek Salad from Cheeky Greek in Melbourne were a delightful treat. The gyros were tender and flavorful, with a perfect balance of meat, vegetables, and tzatziki sauce. The Greek salad was fresh and crisp, with a generous serving of olives, onions, and feta cheese. The ice tea was refreshing and perfectly chilled. Overall, the food was well-prepared and the service was friendly.|Melbourne||2022|5|Cheeky Greek
|297|en|4|**** The King Combo and Greek Salad from the Cheeky Greek truck in Melbourne were a delight. The King Combo consisted of a generous serving of souvlaki pork, lamb, chicken, tzatziki sauce, and Greek salad. The meat was tender and flavorful, while the tzatziki sauce added a refreshing tang. The Greek salad was fresh and crisp, with a perfect balance of vegetables and olives. The overall presentation and portion size were impressive. The service was friendly and efficient.|Melbourne||2022|5|Cheeky Greek
|291|en|4|The Mega Melt's grilled cheese menu offers a satisfying selection of classic comfort food. The Ranch, Miss Piggie, and The Original sandwiches are crafted with fresh ingredients and ooze melted cheese. The bread is crispy on the outside and soft on the inside, creating a perfect texture for the fillings. The Ranch sandwich, with its tangy ranch dressing and crispy bacon, is a crowd favorite. The Miss Piggie, featuring succulent pork and melted brie, is a gourmet delight. The Original sandwich, with its simple yet effective combination of melted cheese and tomato, is a testament to the power of simplicity. Overall, The Mega Melt's grilled cheese menu is a testament to the enduring appeal of comfort food.|Melbourne||2022|5|The Mega Melt
|363|en|4|"""Guac n' Roll truly hits the spot! I recently enjoyed their Three Taco Combo Plate in Hamburg and it was an absolute delight. The tacos were packed with flavor, the ingredients were fresh, and the guacamole was the perfect creamy complement. The menu offers a great variety, but the combo plate is a clear standout. If you're a taco lover, this is a must-try. The truck's name is fitting, as the guacamole really does make it a rollercoaster of taste. Can't wait for my next visit!"""|Hamburg||2022|5|Guac n' Roll
|403|en|4|The Peking Truck in Madrid served up a decent meal with the Combo Lo Mein and Combo Fried Rice. The Lo Mein had a good balance of flavors, with tender noodles and crisp vegetables. The Fried Rice, on the other hand, was a bit underwhelming, lacking the expected depth of flavor. Portion sizes were generous, ensuring a satisfying lunch. However, the presentation was rather basic, which slightly detracted from the overall experience. In summary, it was a solid choice for a quick Chinese meal, but there's certainly room for improvement.|Madrid||2022|5|Peking Truck
|305|en|4|The Kitakata Ramen Bar's Spicy Miso Vegetable Ramen is an absolute delight. The broth is savory and flavorful, and the noodles are perfectly cooked. The vegetables are fresh and crisp, and the spicy miso adds a kick that will have your taste buds dancing. The portions are generous, and the atmosphere is casual and inviting. Overall, I highly recommend the Spicy Miso Vegetable Ramen at Kitakata Ramen Bar. It's a must-try for any ramen enthusiast.|Sao Paulo||2022|5|Kitakata Ramen Bar
|436|en|4| Oh dear, where do I begin with this disaster of an order from Freezing Point in Cape Town? Firstly, the Lemonade was far too sweet and lacked any real lemon flavor. The Two Scoop Bowl was a sad excuse for ice cream, with rock-hard scoops that were difficult to enjoy. The Bottled Water was not even chilled, which was disappointing considering the name of the truck. The Ice Cream Sandwich was stale and the cookie was hard as a rock. The Mango Sticky Rice was a mess, with the rice being mushy and the mango being unripe. And to top it all off, the Popsicle was also a letdown, with an icy texture and a lack of flavor. I highly recommend avoiding Freezing Point if you're in Cape Town and looking for a decent ice cream experience.|Cape Town||2022|5|Freezing Point
|406|en|4|Freezing Point ice cream truck in Barcelona provides a decent experience. Popsicle boasts refreshing quality, balanced sweetness that doesn't overwhelm fruity taste. Two Scoop Bowl, in contrast, offers creamy and rich texture, but flavors lack distinctiveness. Service proves efficient, and truck maintains cleanliness. Nevertheless, portion sizes prove slightly smaller than anticipated. Satisfactory option for a sweltering day, but it may not make a lasting impression.|Barcelona||2022|5|Freezing Point
|271|en|4|The Sugar Cone from the Freezing Point truck in Sydney was an absolute delight. The ice cream was smooth and creamy, with a perfect balance of sweetness and flavor. The cone itself was crispy and fresh, and the overall presentation was impeccable. The staff were friendly and attentive, and the service was prompt. I highly recommend this truck to anyone looking for a delicious treat in Sydney.|Sydney||2022|5|Freezing Point
|413|en|4|The Chicken Pot Pie Crepe from Le Coin des Crêpes in Barcelona was a delightful treat. The crepe was perfectly crispy on the outside and soft on the inside, with a generous filling of succulent chicken pot pie. The accompanying bottled soda was refreshing and perfectly paired with the crepe. The friendly staff and quick service added to the overall positive experience. I highly recommend this crepe to anyone visiting Barcelona.|Barcelona||2022|5|Le Coin des Crêpes
|128|en|4| Disappointed with my experience at Le Coin des Crêpes in London. The Breakfast Crepe lacked flavor and was undercooked, while the Crepe Suzette was overly sweet and drowning in syrup. The presentation was lackluster and did not live up to the expectations set by the menu. I had hoped for a delightful crepe experience, but unfortunately, this was not the case. I would not recommend this truck to others seeking authentic, well-prepared crepes.|London||2022|5|Le Coin des Crêpes
|213|en|4|"Unsatisfying experience at the ""Guac n' Roll"" food truck in Mumbai. The Three Taco Combo Plate fell short, its tortillas limp and prone to disintegration. The fish in the Fish Burrito was unfortunate, overcooked and devoid of the expected fresh, flaky texture. The overall encounter left much to be desired, particularly given the trumpeted acclaim this truck receives. I advise against visiting for authentic, savory tacos."|Mumbai||2022|5|Guac n' Roll
|233|en|4|The Le Coin des Crêpes experience was delightful. The breakfast crepe and crepe Suzette were fluffy and flavorful, with just the right amount of sweetness. The fresh fruit and whipped cream toppings were the perfect accompaniment to the crepes, making for a satisfying and indulgent treat. The service was friendly and prompt, and the atmosphere was cozy and inviting. Overall, I highly recommend Le Coin des Crêpes for anyone looking for a delicious and authentic French crepe experience in Delhi.|Delhi||2022|5|Le Coin des Crêpes
|74|en|4|The Tandoori Mixed Grill from Nani's Kitchen was a disappointing experience. The meat was overcooked, resulting in a tough and dry texture that lacked the juiciness you'd expect from a tandoori dish. The marinade, which should have been a flavorful blend of spices, was bland and uninspiring. The accompanying vegetables were undercooked, adding to the overall dissatisfaction. For an Indian restaurant in New York City, I expected much more from Nani's Kitchen. Unfortunately, this meal did not live up to my expectations.|New York City||2022|5|Nani's Kitchen
|50|en|4|A must-try for ramen enthusiasts is Kitakata Ramen Bar in Boston. The Spicy Miso Vegetable Ramen and Tonkotsu Ramen offer robust and fulfilling flavors. Rich and savory broths, noodles cooked to perfection, and an abundance of fresh toppings highlight the dishes. The ambiance is laid-back and welcoming, while the service is amicable and prompt. An exceptional ramen experience that is highly recommended.|Boston||2022|5|Kitakata Ramen Bar
|305|en|4|Kitakata Ramen Bar in Sao Paulo is a must-visit for ramen lovers! The Creamy Chicken Ramen was rich and satisfying, the Spicy Miso Vegetable Ramen offered a delightful kick, and the Tonkotsu Ramen was a classic favorite. The balance of flavors in each dish was exceptional. Paired with refreshing Bottled Water and Ice Tea, our meal was perfect. The service was prompt and friendly, making our dining experience even more enjoyable. We'll definitely be back for more!|Sao Paulo||2022|5|Kitakata Ramen Bar
|309|en|4|Tasty Tibs truck's Ethiopian cuisine in Sao Paulo fell short of expectation. Lean Chicken Tibs were disappointingly dry and lacked the anticipated rich, spicy taste. Veggie Combo, though fresh, was bland and uninspiring. Lean Beef Tibs echoed the same fate, being overcooked and tough. The Ice Tea was watered down, offering no distinguishable flavor. The overall experience was underwhelming and did not meet the buzz generated around this food truck.|Sao Paulo||2022|5|Tasty Tibs
|325|en|4|The Not the Wurst Hot Dogs truck was an absolute delight! The Chicago Dog and New York Dog were both juicy and perfectly crafted, with fresh toppings and friendly service. The bottled soda selection was also impressive, offering a wide range of flavors to quench my thirst. The atmosphere in the truck was relaxed and inviting, making it a perfect stop for a casual bite on the go. I highly recommend this food truck to anyone visiting Rio de Janeiro.|Rio de Janeiro||2022|5|Not the Wurst Hot Dogs
|184|en|4|The Mac Shack in Warsaw delivered a satisfactory dining experience. The Standard Mac & Cheese was creamy and well-seasoned, with the pasta cooked to an appropriate texture. The accompanying Ice Tea was refreshing, providing a balanced contrast to the richness of the mac and cheese. However, the presentation was rather ordinary, lacking a unique touch. Overall, it was a decent meal, but there's room for improvement in terms of visual appeal.|Warsaw||2022|5|The Mac Shack
|345|en|4|Pastrami and Italian sandwiches from Better Off Bread in Munich lived up to expectations. Fresh bread and generous fillings with a good balance of flavors described the taste. However, they didn't particularly stand out from other sandwiches. Efficient service and accurate orders were appreciated. Overall, it was a satisfactory experience, but not one that necessarily warrants a repeat visit.|Munich||2022|5|Better Off Bread
|18|en|4|The Guac n' Roll truck's menu offerings are diverse, ranging from tacos to burritos and bowls. The two taco combo plate and the three taco combo plate are popular choices, providing ample portions and a variety of toppings. The fish burrito and lean burrito bowl offer fresh and flavorful seafood options, while the chicken burrito and veggie taco bowl cater to meat and vegetarian preferences, respectively. The ice tea and bottled soda selections complement the menu, quenching thirst. Overall, the Guac n' Roll truck provides a satisfying range of tasty and well-crafted Mexican-inspired dishes.|Denver||2022|5|Guac n' Roll
|357|en|4|"""The King Combo from Cheeky Greek is an absolute delight! The gyros were packed with flavors, perfectly seasoned and cooked to perfection. The pita was soft and warm, making it the perfect companion to the juicy meat. The accompanying fries were crispy and well-seasoned, adding a delightful crunch to the meal. The portion size was generous, offering great value for money. The service was quick and friendly, making the experience even better. If you're in Berlin and craving gyros, Cheeky Greek is the place to go. Highly recommended!"""|Berlin||2022|5|Cheeky Greek
|399|en|4|"""Tasty Tibs truly lives up to its name! The Lean Chicken Tibs and Lean Beef Tibs were incredibly flavorful, with the perfect balance of spices. The Veggie Combo was a delightful surprise, offering a variety of textures and tastes. The Ethiopian cuisine served by this truck in Madrid is authentic and delicious. The quality of the food is top-notch, and the portions are generous. Whether you're a meat-lover or a vegetarian, Tasty Tibs has something for everyone. Highly recommend for a unique and satisfying culinary experience!"""|Madrid||2022|5|Tasty Tibs
|448|en|4|Disappointment was the main course at Peking Truck in Cape Town. The Combo Fried Rice was far from the expected flavor explosion, instead, it was a bland and uninspiring dish. The Wonton Soup, while promising, lacked depth and was a far cry from authentic Chinese cuisine. The overall experience was underwhelming, leaving much to be desired in terms of taste and authenticity.|Cape Town||2022|5|Peking Truck
|377|en|4|A gratifying experience awaits BBQ aficionados at the Smoky BBQ truck in Stockholm! Commencing with the Spring Mix Salad, a crisp and invigorating starter, the Pulled Pork Sandwich follows, boasting tender, delectable meat accentuated by a tangy BBQ sauce. The Three Meat Plate is a bountiful offering, showcasing divine brisket, ribs, and sausage. A surprising delight, the Fried Pickles provide a delightful crunch to the meal. Accompanying the robust, smoky flavors is an invigorating Ice Tea. Outstanding service and a charming atmosphere are additional highlights. Eagerly anticipating a return visit!|Stockholm||2022|5|Smoky BBQ
|380|en|4|The Kitakata Ramen Bar in Stockholm offers a satisfying selection of ramen and other Japanese beverages. I sampled the creamy chicken and tonkotsu ramens, as well as a refreshing iced tea and bottled soda. The ramens were flavorful and satisfying, with tender noodles, savory broth, and fresh toppings. The ice tea was refreshing and quenching, and the bottled soda was a perfect accompaniment to the spicy ramens. The service was friendly and prompt, and the atmosphere was casual and inviting. Overall, I thoroughly enjoyed my experience at Kitakata Ramen Bar and would recommend it to anyone looking for a taste of authentic Japanese cuisine in Stockholm.|Stockholm||2022|5|Kitakata Ramen Bar
|74|en|4|The Tandoori Mixed Grill from Nani's Kitchen in New York City was an absolute delight to experience. The flavors were bursting with freshness, and the tender meats and vegetables melted in my mouth. The tandoori spices added a smoky aroma that filled the air, and the overall presentation was impeccable. The portions were generous, and the service was prompt and friendly. I would highly recommend this dish to anyone looking for a taste of Indian cuisine in the heart of New York City.|New York City||2022|5|Nani's Kitchen
|279|en|4|The Tasty Tibs truck is a must-try for anyone in Sydney. The Ethiopian menu offers a wide range of flavorful and hearty dishes. I ordered the lean chicken tibs, lean beef tibs, and the veggie combo, and everything was incredibly satisfying. The chicken and beef tibs were tender and marinated perfectly, while the veggie combo was fresh and flavorful. The injera bread was warm and fluffy, and the bottled water was refreshing. Overall, I had a wonderful experience at Tasty Tibs and would highly recommend it to anyone looking for a delicious and authentic Ethiopian meal.|Sydney||2022|5|Tasty Tibs
|419|en|4|A delightful dining experience at Nani's Kitchen. The lean chicken tikka masala offered tender and flavorful meat, skillfully balanced with spices. The tandoori mixed grill was another success, boasting succulent chicken and tender vegetables. The combination curry provided a hearty and mildly spiced option, ideal for those seeking a less intense curry. The food at Nani's Kitchen was a true pleasure to consume, making it a must-try for Indian food enthusiasts in Barcelona.|Barcelona||2022|5|Nani's Kitchen
|131|en|4|"A delightful poutine experience at ""Revenge of the Curds"". The ""Mothers Favorite"" combo, a combination of The Kitchen Sink and The Classic, was ideal for satisfying my cravings. The curds were crispy and golden, and the gravy was smooth and savory. Generous portions and friendly service completed a memorable meal. I wholeheartedly recommend this poutine haven to visitors in London."|London||2022|5|Revenge of the Curds
|125|en|4|A balanced dish, the Creamy Chicken Ramen from Kitakata Ramen Bar in London boasted a rich, creamy broth, well-seasoned and savory. The chicken was tender, full of flavor, and the noodles, cooked to the right consistency, provided a delightful texture. While a bit more vegetables would have added crunch and freshness, the dish was satisfying, leaving room for improvement in terms of variety and balance.|London||2022|5|Kitakata Ramen Bar
|233|en|4|"""Experienced a mix of traditional and innovative crepes at Le Coin des Crêpes, Delhi. The Breakfast Crepe and Chicken Pot Pie Crepe were satisfying, though the Crepe Suzette could have used a bit more orange zest for a tarter flavor. Drinks were standard, with the Ice Tea being refreshing. Overall, service was prompt and the ambiance, pleasant. A decent dining experience, but room for improvement remains."""|Delhi||2022|5|Le Coin des Crêpes
|357|en|4|The Greek Salad from Cheeky Greek in Berlin was as expected. The ingredients were fresh, with crisp lettuce, juicy tomatoes, and tangy feta cheese. The portion size was adequate, neither too large nor too small. However, the salad lacked a unique flavor profile that would set it apart from other Greek salads. The presentation was simple and clean, but not particularly memorable. Overall, it was a decent salad, but it didn't necessarily stand out.|Berlin||2022|5|Cheeky Greek
|222|en|4|"The Cheeky Greek truck's ""King Combo"" lived up to its name, delivering a flavorful feast in the heart of Mumbai. The tender gyros, fluffy pita, tangy tzatziki, and refreshing Greek salad were all perfectly crafted, satisfying my appetite and leaving me wanting more. The Ice Tea, perfectly chilled, complemented the Mediterranean flavors perfectly. The friendly service and vibrant atmosphere added to the overall experience, making it a perfect pit stop for any gyros lover."|Mumbai||2022|5|Cheeky Greek
|327|en|4| The Cheeky Greek truck in Rio de Janeiro failed to deliver on its promise of authentic Gyros. The King Combo was far from royal, with dry meat and a lackluster tzatziki sauce. The Gyro Plate was no better, serving up a disappointing portion size for the price. Overall, a disappointing experience that didn't live up to the hype.|Rio de Janeiro||2022|5|Cheeky Greek
