ORDER_ID|TRUCK_ID|LANGUAGE|SOURCE|REVIEW|PRIMARY_CITY|CUSTOMER_ID|YEAR|MONTH|TRUCK_BRAND
56646781|191|en|5|"""Revenge of the Curds"" truck in Warsaw underdelivered on ""The Kitchen Sink"" poutine. Fries were regrettably soggy, curds cold, and gravy lacked flavor. Rather than a sink of deliciousness, it tasted like a kitchen disaster. Additionally, portion size was disappointing for the price. With such a promising name, high expectations were set, but those were not met. This is a meal that's better off forgotten."|Warsaw||2022|8|Revenge of the Curds
132916979|296|en|5|"""Revenge of the Curds' 'The Kitchen Sink' is a gastronomic delight! This poutine is a perfect symphony of flavours, with each ingredient complementing the other. The fries were crispy, the cheese curds were fresh and squeaky, and the gravy was rich and savoury. The additional toppings were a fantastic bonus, making it a truly satisfying meal. The portion size was generous, ideal for sharing or for a hearty solo meal. If you're in Melbourne and craving poutine, Revenge of the Curds is the place to go. Highly recommended!"""|Melbourne||2022|8|Revenge of the Curds
399068623|403|en|5|The Peking Truck's menu transported me straight to the heart of Madrid. The ice tea was refreshing, the combo lo mein was flavorful and satisfying, and the wonton soup was a perfect comfort food. The service was friendly and attentive, and the atmosphere was relaxed and inviting. Overall, I had a truly enjoyable experience at the Peking Truck, and I would highly recommend it to anyone looking for a taste of Chinese cuisine in the heart of Madrid.|Madrid||2022|8|Peking Truck
398975342|401|es|5|" ""El Revenge of the Curds de Madrid no cumple con las expectativas en cuanto a su menú de poutine. Ordenamos 'The Kitchen Sink', agua embotellada, gaseosa embotellada y 'The Classic', y quedamos muy decepcionados. La poutine 'The Kitchen Sink' estaba sobrecargada de ingredientes y no se saboreaba nada, el agua y la gaseosa embotelladas eran de calidad regular y 'The Classic' no era nada especial. En general, nuestra experiencia fue decepcionante y no recomendaríamos este camión de comida a nadie."""|Madrid||2022|8|Revenge of the Curds
27193787|109|en|5|"Mac Shack's Mac & Cheese selections fell short of expectations. The ""Standard Mac & Cheese"" was lackluster, lacking the creamy richness and intense cheesy taste desirable in a mac & cheese meal. The ""Buffalo Mac & Cheese"" was overdone with buffalo sauce, resulting in an overly sweet and dominant flavor. The ""Lobster Mac & Cheese"" was disappointing, with scant lobster pieces ill-suited to complement the mac & cheese. Collectively, an unsatisfying adventure longing for a more genuine and savory mac & cheese meal."|Montreal||2022|8|The Mac Shack
12985594|88|en|5|A hidden gem in Toronto, The Peking Truck offers delightful Chinese cuisine. The Combo Fried Rice I savored recently was an extraordinary experience. Flavor and freshness of ingredients shone through, with the rice expertly cooked and vegetables crisp and vivid. Generous portion size ensured a filling meal, proving excellent value for money. Quick and friendly service added to the enjoyable dining experience. I wholeheartedly recommend The Peking Truck for a scrumptious and satisfying meal.|Toronto||2022|8|Peking Truck
417666710|431|en|5|The Mothers Favorite poutine from the Truck Name: Revenge of the Curds in Cairo is a feast for both the eyes and the stomach. The generous portions of crispy curds, tender beef, and fresh cheese are expertly layered in a bed of fluffy, golden fries. The gravy, steeped in rich flavor and aromatic spices, ties the components together perfectly. Each bite is a testament to the culinary artistry and passion behind this beloved dish. The friendly atmosphere and prompt service add to the overall positive experience. Highly recommended for poutine enthusiasts and newcomers alike.|Cairo||2022|8|Revenge of the Curds
456757096|51|en|5|Disappointment was the main ingredient in my order from The Mega Melt in Boston. The Original grilled cheese lacked the promised gooey goodness, while The Ranch sandwich was drowned in an overwhelming amount of sauce, masking the taste of the cheese entirely. The menu's potential was not met, leaving me with a less than satisfying experience.|Boston||2022|8|The Mega Melt
386627611|370|en|5|"The ""Not the Wurst Hot Dogs"" truck's Coney Dog offering in Hamburg was a satisfying treat. The hot dog was juicy and well-topped with fresh ingredients, though the bread could be a bit softer. The friendly staff were quick to take my order and the wait time was minimal. Overall, a positive experience that I'd recommend to anyone looking for a quick and flavorful bite in the city."|Hamburg||2022|8|Not the Wurst Hot Dogs
437368545|64|en|5|Disappointment was the main course with my Buffalo Mac & Cheese from The Mac Shack. The mac and cheese was overcooked, resulting in a mushy texture that lacked any satisfying bite. The buffalo sauce, which should have been the star of the dish, was barely noticeable, leaving the dish bland and uninspired. The portion size was also smaller than expected for the price. Overall, this meal was a miss and not worth a repeat visit.|New York City||2022|8|The Mac Shack
393131965|389|en|5|Nani's Kitchen's Indian cuisine is a delight, and their combination curry is a testament to that. The tender chicken in the lean chicken tikka masala melts in your mouth, while the flavorful curry spices dance on your tongue. The accompanying bottled soda quenched my thirst perfectly. The atmosphere is warm and inviting, making it an ideal place to enjoy a flavorful Indian feast. I highly recommend checking out Nani's Kitchen if you're looking for a taste of India in Stockholm.|Stockholm|204999.0|2022|8|Nani's Kitchen
46521893|152|en|5|Smoky BBQ truck in Paris serves up a mixed experience. On the positive side, the Fried Pickles shine with their crispy exterior and tangy flavor. The Spring Mix Salad also impresses, being fresh and well-dressed. Unfortunately, the Rack of Pork Ribs misses the mark, coming out a bit dry and lacking the juicy, tender texture one anticipates from BBQ. The Ice Tea and Bottled Water are standard offerings. Although there are bright spots, the main dish does not live up to expectations.|Paris||2022|8|Smoky BBQ
425287210|450|en|5|The Hot Ham & Cheese sandwiches from Better Off Bread were disappointing. The ham was overcooked and tough, while the cheese lacked any real flavor. The bread, although fresh, couldn't save the sandwich. The Italian sandwich was equally underwhelming, lacking the expected zest and freshness. The bottled water and soda were standard, but the overall experience was subpar. I had hoped for a better dining experience in Cape Town.|Cape Town||2022|8|Better Off Bread
56687187|189|en|5|Tasty Tibs truck in Warsaw offers an outstanding Ethiopian culinary journey. Lean Chicken Tibs, rich in taste, impeccably seasoned, and grilled to perfection, were a true highlight. Accompanying them was a delightful Veggie Combo, a vibrant blend of fresh ingredients, beautifully representing Ethiopian cuisine's diversity. The servings were ample, ensuring no one left hungry, and the staff's prompt, friendly service added to the overall experience. This unassuming food truck serves authentic, palate-pleasing dishes that will whisk your taste buds off to Addis Ababa. A strong recommendation for food enthusiasts in search of a distinctive and delectable dining experience.|Warsaw||2022|8|Tasty Tibs
13092655|85|en|5|"""Not the Wurst Hot Dogs truly lives up to its name, offering hot dogs that are far from the worst! The Chicago Dog and Coney Dog were absolutely delicious, packed with flavor and cooked to perfection. The bottled water was a refreshing complement to the meal. Located in the heart of Toronto, this truck is a must-visit for hot dog lovers. The service was quick and friendly, making the overall experience even better. I'll definitely be returning for another taste of their amazing hot dogs!"""|Toronto||2022|8|Not the Wurst Hot Dogs
346125361|314|en|5|The Tandoori Mixed Grill and Lean Chicken Tikka Masala from Nani's Kitchen in Sao Paulo were a delightful culinary experience. The chicken tikka masala was tender and flavorful, with just the right amount of spice. The tandoori mixed grill showcased a variety of succulent meats, including chicken, lamb, and prawns. The naan bread was soft and fluffy, and the rice was fluffy and perfectly cooked. Overall, the meal was well-balanced and satisfying.|Sao Paulo||2022|8|Nani's Kitchen
44239514|145|en|5|"The ""Not the Wurst Hot Dogs"" truck's Coney Dog was a delight. The hot dog was perfectly grilled, with a generous slice of sweet relish and fresh toppings. The bread was soft and warm, and the overall presentation was top-notch. The staff were friendly and attentive, and the atmosphere was relaxed and inviting. I highly recommend this truck to anyone looking for a quick and satisfying bite in Manchester."|Manchester||2022|8|Not the Wurst Hot Dogs
70193973|215|en|5|The Spicy Miso Vegetable Ramen from Kitakata Ramen Bar was a disappointment. The broth lacked depth and the promised spiciness was nowhere to be found. The vegetables were overcooked, losing their crunch and flavor. The noodles were clumpy and underwhelming. Overall, the dish was a far cry from the authentic ramen experience I was expecting. I wouldn't recommend this to anyone seeking a genuine ramen taste.|Mumbai||2022|8|Kitakata Ramen Bar
417692569|427|en|5|Seitan Buffalo Wings at Plant Palace in Cairo Fall Short.Regrettably, the Seitan Buffalo Wings at Plant Palace in Cairo proved to be a culinary disappointment. The seitan, intended to mimic the texture of chicken, was overcooked and dry, lacking the desired juiciness that would have made for a satisfying meal. Moreover, the wings themselves failed to achieve the expected crispy exterior, instead arriving at the table with a disappointing lack of texture.The accompanying sauce did little to save the dish, as it was bland and watery, lacking the depth of flavor required to elevate the dish to a respectable level. Fortunately, the friendly staff at Plant Palace were a bright spot in an otherwise lackluster experience.Regrettably, based on this experience, I cannot recommend Plant Palace to those seeking a satisfying meal. Improvements are clearly needed in the kitchen to bring the food up to the same level of excellence as the service.|Cairo||2022|8|Plant Palace
410224875|415|en|5|Disappointment was the main course at Not the Wurst Hot Dogs. The Chicago Dog lacked the essential poppy seed bun, and the relish was far from authentic. The Coney Dog was no better, with a chili that tasted more like canned spaghetti sauce than the real deal. For a hot dog stand in Barcelona, I expected a culinary adventure, but all I got was a mediocre meal that left me longing for the real American classics. Not the Wurst? More like Not the Best.|Barcelona||2022|8|Not the Wurst Hot Dogs
22956736|105|en|5|Better Off Bread truck's menu offerings of sandwiches and refreshing beverages impressed me. The Italian sandwich, with its fresh ingredients and flavorful spread, was a delight to savor. The hot ham and cheese sandwich was equally satisfying, with its melted cheese and tender ham. The iced tea and bottled water were refreshing and quenching. Overall, my experience was positive, and I would recommend this truck to anyone seeking a quick and flavorful bite in Vancouver.|Vancouver||2022|8|Better Off Bread
425136617|438|en|5|The Guac n' Roll taco truck in Cape Town offers a flavorful Taco Combo Plate that satisfied my cravings. The tacos were packed with fresh ingredients, including succulent pork, crunchy lettuce, juicy tomatoes, and creamy guacamole. The tortilla wraps were warm and pliable, and the overall presentation was impressive. The staff were friendly and attentive, ensuring a smooth and enjoyable experience. While the price was slightly above average, the quality of the food and the friendly atmosphere made it worth every penny.|Cape Town||2022|8|Guac n' Roll
437362997|73|en|5|Peking Truck in New York City offered a fair Chinese dining experience. The Combo Lo Mein presented a balanced blend of flavors, combining vegetables and noodles effectively. While the Wonton Soup provided a soothing touch, the wontons themselves could have benefited from a more bountiful filling. On the other hand, the Combo Fried Rice met expectations, yet it missed that unique flavor to make it memorable. In summary, the meal was passable, but enhancements in taste and serving size are encouraged.|New York City||2022|8|Peking Truck
393096171|376|en|5|The Mango Sticky Rice from Freezing Point in Stockholm was an absolute delight. The sticky rice was perfectly cooked, with a sweet and tangy mango flavor that was simply heavenly. The mango chunks were fresh and ripe, and the overall texture of the dish was smooth and creamy. The portion size was generous, and the price was very reasonable. I highly recommend this dish to anyone who loves mango and sticky rice.|Stockholm||2022|8|Freezing Point
453244666|40|en|5|"Wurst Hot Dogs fell short of expectations. The Chicago Dog and New York Dog disappointedly failed to deliver on the ""best hot dogs"" title. Stale bread and meager toppings marred the dining experience. The ice tea was served warm and lacked refreshment. For a satisfying hot dog, consider dining elsewhere."|Seattle||2022|8|Not the Wurst Hot Dogs
376356154|359|en|5|A fusion of exquisite flavors at Nani's Kitchen in Berlingraced my palate. The curry, a harmonious blend, boasted vibrant and intricate taste profiles. Authenticity and freshness shone through every ingredient. The portion was generously proportioned. Notable was the attentive and cordial service. Welcoming and inviting, the atmosphere of Nani's Kitchen promises a warm dining experience. For Indian food connoisseurs touring Berlin, the combination curry at this establishment is a definitive must-try.|Berlin||2022|8|Nani's Kitchen
56610115|193|en|5|The Peking Truck's combo fried rice and wonton soup were both absolutely mouth-watering. The rice was perfectly cooked and loaded with fresh vegetables and juicy chicken. The wonton soup was a perfect comfort food, with fresh wontons and a flavorful broth. The bottled soda was a great accompaniment to the meal. Overall, I was impressed by the friendly service and the delicious food at the Peking Truck. I highly recommend it to anyone looking for a flavorful and satisfying Chinese meal.|Warsaw||2022|8|Peking Truck
56674639|184|en|5| The Mac Shack in Warsaw is a true gem! The Mac & Cheese menu offers a delightful variety of flavors that will satisfy any cheese lover's cravings. I tried the Standard Mac & Cheese, Buffalo Mac & Cheese, and Lobster Mac & Cheese, and each one was more delicious than the last. The Standard Mac & Cheese was creamy and comforting, while the Buffalo Mac & Cheese had a perfect kick of spice. The Lobster Mac & Cheese was the star of the show, with generous chunks of lobster and a rich, indulgent sauce. The Mac Shack has definitely earned a spot on my list of must-visit food trucks. Highly recommend!|Warsaw|52785.0|2022|8|The Mac Shack
56727139|187|en|5|This salad was a disaster. It consisted mostly of wilted lettuce and old, dry tomatoes. The avocado was mushy and brown, and the dressing was far too sweet. The only redeeming quality was the generous portion size, but unfortunately, that was not enough to save this dish. I would not recommend this salad to anyone.|Warsaw||2022|8|Plant Palace
44207845|138|en|5|"The ""Guac n' Roll"" truck in Manchester served up a satisfactory meal with the Three Taco Combo Plate and Chicken Burrito. The tacos were adequately filled, offering a decent balance of flavors, while the burrito was generously packed with chicken. However, the guacamole, a key element given the truck's name, was somewhat underwhelming. The service was prompt and the staff was friendly, contributing to an overall pleasant dining experience."|Manchester||2022|8|Guac n' Roll
133102749|296|en|5|"""Revenge of the Curds truly redefines the poutine experience in Melbourne! The Kitchen Sink, an absolute delight, is a generously loaded masterpiece with a perfect blend of flavours. The Classic, on the other hand, stays true to its name, offering an authentic poutine experience that is simply unmatched. The quality of ingredients, the impeccable service, and the overall dining experience make this truck a must-visit. Revenge of the Curds has undoubtedly set the bar high for food trucks in the city!"""|Melbourne||2022|8|Revenge of the Curds
133001972|296|en|5|"The ""Revenge of the Curds"" truck in Melbourne delivered a satisfactory experience with ""The Kitchen Sink"" poutine. The dish was generously portioned, with a commendable balance of fries, cheese curds, and gravy. However, the fries could have been crispier to better withstand the gravy's moisture. The cheese curds were fresh and squeaky, adding a nice textural contrast. The gravy had a rich, savory flavor, but it was slightly on the salty side. Overall, it was a decent meal, but there's room for improvement in the execution of individual elements."|Melbourne||2022|8|Revenge of the Curds
13011832|90|en|5|"I ordered the Italian sandwich from ""Better Off Bread"" in Toronto. The bread was stale, and the ingredients were cheap and poorly assembled. The sandwich was not worth the high price, and I would not recommend it to anyone. The bread was dry and crumbly, and the fillings were not fresh. The overall quality of the sandwich was very poor."|Toronto||2022|8|Better Off Bread
70069447|215|en|5|The Kitakata Ramen Bar in Mumbai offers a tantalizing Creamy Chicken Ramen that is a must-try for ramen enthusiasts. The broth, made with a delicate balance of pork and chicken bones, is rich and flavorful, infused with the perfect amount of spice. The noodles are perfectly cooked, tender yet firm, and the chicken tenderloin is tender and juicy. The toppings, such as fresh scallions, marinated eggs, and seaweed, add a touch of freshness and sophistication to the dish. Overall, the Creamy Chicken Ramen at Kitakata Ramen Bar is an exceptional ramen experience that will satisfy your cravings and leave you wanting more.|Mumbai||2022|8|Kitakata Ramen Bar
410088936|413|en|5|Disappointment was the theme of our visit to Le Coin des Crêpes in Barcelona. The crepes, which should have been the star of the show, were lackluster. The Breakfast Crepe was underwhelming, the Chicken Pot Pie Crepe was bland, and the Crepe Suzette, a classic, was far from its usual delightful self. The drinks, Bottled Water, Bottled Soda, and Ice Tea, were the only items that met expectations, but that's not saying much. Overall, the experience was a letdown and not worth the visit.|Barcelona||2022|8|Le Coin des Crêpes
410171639|419|en|5|A restaurant called Nani's Kitchen in Barcelona is where an Indian meal order was placed, featuring a combination curry, tandoori mixed grill, and a bottled soda. Regrettably, the order summary lacks details about the taste, appearance, or service of the food, precluding a comprehensive review.|Barcelona||2022|8|Nani's Kitchen
94570114|250|en|5|"""Not the Wurst Hot Dogs"" truck in Tokyo is an absolute must-visit! The Chicago Dog and Coney Dog are simply delectable, bursting with flavor and served piping hot. Accompanied by soft buns and fresh toppings, every bite is a delight. The bottled water provided is a perfect pairing, crisp and refreshing. Quick and friendly service further enhances the dining experience. This hot dog stand truly shines, delivering an exceptional culinary adventure right on the bustling streets of Tokyo. A high recommendation indeed!"|Tokyo||2022|8|Not the Wurst Hot Dogs
425339574|438|en|5|The Guac n' Roll truck's veggie taco bowl and lean burrito bowl were a major disappointment. The rice in the taco bowl was mushy and undercooked, and the vegetables were sparse and unflavorful. The burrito bowl was equally unappetizing, with dry, chewy meat and bland toppings. The only saving grace was the guacamole, which was fresh and creamy. Overall, I would not recommend this truck to anyone looking for a quick and satisfying meal.|Cape Town||2022|8|Guac n' Roll
376184811|350|en|5|Kitakata Ramen Bar, nestled in Berlin, is a haven for ramen enthusiasts. The establishment presents a diverse menu brimming with enticing ramen choices, such as the creamy chicken ramen, spicy miso vegetable ramen, and the classic tonkotsu ramen. Every serving is meticulously prepared using fresh ingredients, striking an exquisite harmony between flavor and texture. The accompanying ice tea offers a revitalizing contrast to the spicy ramen. Boasting a relaxed and welcoming ambiance, it's an ideal spot to unwind and savor a delectable bowl of ramen. For those seeking a fulfilling and genuine ramen experience in Berlin, Kitakata Ramen Bar comes highly recommended.|Berlin||2022|8|Kitakata Ramen Bar
376192661|359|en|5|Food at Nani's Kitchen was a disappointing experience. Ice tea served warm, chicken tikka masala lacked flavor, tandoori mixed grill was overcooked. Combination curry was unsatisfactory with its watery consistency and tough meat. I cannot endorse Nani's Kitchen based on this meal.|Berlin||2022|8|Nani's Kitchen
46418337|154|en|5|The Mac Shack's Mac & Cheese is simply the best comfort food I've ever had. The standard mac & cheese is creamy and flavorful, while the buffalo mac & cheese has a kick of spice that is perfect for those who like a little heat. The bottled soda selection is also top-notch, and I especially enjoyed the sweet tea. The Mac Shack is a hidden gem in Paris, and I highly recommend it to anyone looking for a satisfying and delicious meal.|Paris||2022|8|The Mac Shack
81596820|231|en|5|"The Mega Melt's ""The Original"" grilled cheese and ice tea are a perfect pairing for a delightful evening in Delhi. The melted cheese oozes out of the bread, creating a gooey masterpiece. The ice tea, perfectly brewed, complements the cheese's richness, quenching the palate. The Miss Piggie sandwich, a testament to the restaurant's creative flair, is a must-try for adventurous foodies. The friendly staff and prompt service add to the overall positive experience."|Delhi||2022|8|The Mega Melt
437459162|74|en|5|The Lean Chicken Tikka Masala at Nani's Kitchen in New York City was a culinary disaster. The chicken was tough as rubber and the sauce was bland beyond belief. The rice was sticky and undercooked, and the naan was dry and flaky. The service was slow and the staff was unfriendly. Overall, I would not recommend this restaurant to anyone.|New York City||2022|8|Nani's Kitchen
346117318|304|en|5|The Mac Shack's menu offerings, including the lobster mac and cheese, buffalo mac and cheese, and standard mac and cheese, were flavorful and satisfying. The bottled soda and ice tea were refreshing accompaniments to the mac and cheese. The service was prompt and the atmosphere was inviting. Overall, the Mac Shack provided a pleasant and enjoyable dining experience.|Sao Paulo||2022|8|The Mac Shack
346285215|308|en|5|"""Le Coin des Crêpes is a delightful find in Sao Paulo! The Crepe Suzette was an absolute treat, with the perfect blend of sweetness and tanginess. The Chicken Pot Pie Crepe was a savory surprise, a unique twist to traditional crepes that was executed flawlessly. The Ice Tea was refreshing, making it an excellent companion to the crepes. The quality of the food, coupled with the friendly service, makes this truck a must-visit. Well done, Le Coin des Crêpes!"""|Sao Paulo||2022|8|Le Coin des Crêpes
34159883|122|en|5|A delightful assortment of offerings from the Smoky BBQ truck: the Spring Mix Salad, Fried Pickles, and Three Meat Plate. The salad presented a fresh and harmonious blend of crispness and tang. The Fried Pickles boasted a crispy exterior and a tangy interior, an ideal complement to the meat. The Three Meat Plate showcased tender and succulent cuts, each bursting with distinct flavors. The food's superior quality and the attentive service created an unforgettable dining experience.|London||2022|8|Smoky BBQ
27128966|109|en|5|Disappointment was the main course at The Mac Shack. The Buffalo Mac & Cheese lacked the promised kick, tasting more like bland, lukewarm pasta than a spicy delight. The Lobster Mac & Cheese, on the other hand, was overly salty, drowning out the subtle flavors of lobster. The Ice Tea, a potential saving grace, was watered down and unremarkable. Overall, the experience was a far cry from the gourmet Mac & Cheese experience one would expect in Montreal.|Montreal||2022|8|The Mac Shack
108641585|256|en|5|"The order summary reflects a diverse selection of items from the ""Freezing Point"" truck, including frozen treats, beverages, and snacks. The menu type is ""Ice Cream,"" and the city of Seoul is specified. The items ordered include lemonade, sugar cone, waffle cone, a two-scoop bowl, bottled soda, an ice cream sandwich, and a popsicle. This summary provides a concise overview of the items selected, but does not offer any details or opinions about their taste, quality, or service."|Seoul||2022|8|Freezing Point
386645738|363|en|5|Tacos that hit the spot! Guac n' Roll's veggie taco bowl is a fresh, crisp delight, loaded with creamy avocado and a flavorful sauce. The chicken burrito is equally satisfying, packed with juicy chicken, flavorful beans, and fresh salsa. Friendly and efficient staff add to the casual and welcoming atmosphere. A must-try for tasty tacos in Hamburg!|Hamburg||2022|8|Guac n' Roll
