ORDER_ID|TRUCK_ID|LANGUAGE|SOURCE|REVIEW|PRIMARY_CITY|CUSTOMER_ID|YEAR|MONTH|TRUCK_BRAND
358142535|327|pt|5| ¡Ótimo serviço, Cheeky Greek! A experiência da entrega do meu pedido de Gyros Rei Combo, prato de gyro, salada grega e chá de limão estava tudo muito bem. A comida chegou quentinha e bem apresentada, com sabores tradicionais da Grécia e de excelente qualidade. O atendimento foi eficiente e amigável, tornando a minha experiência geral muito positiva. Recomendo vivamente a todos que desejam desfrutar de uma deliciosa culinária grega em Rio de Janeiro. Parabéns pelo excelente serviço!|Rio de Janeiro||2022|8|Cheeky Greek
437524054|64|en|5|The Mac Shack's mac and cheese is simply heavenly. The standard mac and cheese is creamy and flavorful, just the way I like it. The lobster mac and cheese is a step up, with succulent lobster and a sprinkle of caviar. The portions are generous, and the prices are reasonable. The Mac Shack is a must-try for any mac and cheese lover.|New York City||2022|8|The Mac Shack
393170660|377|en|5|"Smoky BBQ truck's ""Three Meat Plate"" and ""Rack of Pork Ribs"" were a gastronomic delight. The meat's tenderness and rich flavor, kissed with just the right amount of smokiness, was commendable. The ribs stood out with their melt-in-your-mouth tenderness and fall-off-the-bone goodness. Equally impressive were the pulled pork and sausage, both offering a mouthwatering experience. The sides were ample and well-paired, featuring fresh coleslaw, creamy mashed potatoes, and hearty baked beans. The ambiance was relaxed and welcoming, further enhanced by prompt and efficient service. All in all, a truly fulfilling and pleasurable dining experience."|Stockholm||2022|8|Smoky BBQ
376432039|350|en|5|Kitakata Ramen Bar's culinary experience was disappointing. Both the creamy chicken ramen and tonkotsu ramen lacked flavor, with unappetizing limp and overcooked noodles. The broth was watery and lacked satisfaction. The only positive was the generous portion size, but it did not compensate for the poor food quality. It is not recommended.|Berlin||2022|8|Kitakata Ramen Bar
46496530|161|en|5|"""Revenge of the Curds' 'The Kitchen Sink' is an absolute delight! As a poutine lover, I was thrilled to find this gem in Paris. The combination of crispy fries, squeaky cheese curds, and rich gravy was nothing short of perfection. The portion size was generous, making it a great value for money. The truck's name is fitting, as the poutine truly revengefully conquers your taste buds. A must-try for anyone visiting Paris. Truly, a poutine paradise!"""|Paris||2022|8|Revenge of the Curds
53724219|167|en|5|"Sure, here's a rewritten review that doesn't start with ""The,"" ""I,"" or ""Im"":A satisfying experience was had at The Smoky BBQ truck in Nice, with the Spring Mix Salad being the star of the show. Fresh and crisp, the greens and vegetables were a delight, and the dressing was perfectly balanced, neither too tangy nor too sweet. While the portion size was a tad smaller than anticipated, the service was prompt and the staff friendly, making for a pleasant dining experience overall. A great option for those seeking a lighter choice among the BBQ offerings."|Nice||2022|8|Smoky BBQ
70233299|213|en|5|"""Guac n' Roll truly rolls out a fiesta of flavors! I recently savored their Veggie Taco Bowl and Two Taco Combo Plate, and it was an absolute delight. The Veggie Taco Bowl was a vibrant medley of fresh veggies, perfectly seasoned and nestled in a bed of fluffy rice. The Two Taco Combo Plate was a party for the taste buds, with soft shells packed with zesty fillings. The guacamole was the star, creamy and rich, elevating every bite. Kudos to the team for maintaining such high quality in Mumbai's bustling food scene. Guac n' Roll is a must-try for all taco enthusiasts!"""|Mumbai||2022|8|Guac n' Roll
121985456|279|en|5|"""Veggie combo at 'Tasty Tibs' left much to be desired. Injera presented was regrettably limp and rubbery, vegetables were undercooked, resulting in a soggy texture. Berbere sauce, a key component, was overly sweet and devoid of expected flavor. The sole saving grace was the amiable service. Dining recommendations cannot be extended for this establishment."""|Sydney||2022|8|Tasty Tibs
410266855|408|en|5|Guac n' Roll truck's menu boasts flavorful and satisfying offerings. The fish burrito delivers freshness and crispiness, while the taco combo plate showcases a savory array of choices. The lean burrito bowl caters to health-conscious diners with its customizable features. Food preparation was excellent, and portions were generously sized.|Barcelona||2022|8|Guac n' Roll
410220521|408|en|5|This order was a disaster. The tacos were cold and the meat was undercooked. The tortillas were stale and the cheese was cheap and rubbery. The salsa was watery and the guacamole was not ripe. The overall quality of the food was extremely poor. I would not recommend this restaurant to anyone.|Barcelona||2022|8|Guac n' Roll
346181663|305|en|5|Kitakata Ramen Bar offered a varied ramen selection that catered to different taste preferences. The Creamy Chicken Ramen had a rich, velvety broth, while the Spicy Miso Vegetable Ramen delivered a satisfying kick. The Tonkotsu Ramen, a classic choice, was executed well with a balanced flavor profile. The bottled soda and ice tea provided refreshing accompaniments to the meal. However, the presentation could have been improved for a more appealing visual experience. Overall, the ramen options hit the spot, but the dining experience could use a touch more finesse.|Sao Paulo||2022|8|Kitakata Ramen Bar
346349215|309|en|5|Tasty Tibs truck in Sao Paulo fell short of delivering authentic Ethiopian cuisine. Lean Beef Tibs ordered turned out to be disappointingly tough and lacking rich, aromatic spices usually associated with this dish. Additionally, the portion size was smaller than expected, leaving me unsatisfied. The overall experience was underwhelming and not worth the price paid. I had hoped for a taste of Ethiopia, but instead, I received a dull, unmemorable meal.|Sao Paulo||2022|8|Tasty Tibs
425205457|446|en|5|Mouthwatering Masterpiece at Revenge of the Curds in Cape TownCraving for some classic poutine? Look no further than Revenge of the Curds, a food truck in Cape Town that offers The Mothers Favorite. The fluffy curds, melt-in-your-mouth cheese, and savory gravy were an absolute delight, creating a perfect balance of flavors.The generous portions were more than enough to satisfy even the most discerning appetite. The friendly staff were attentive and ensured that the experience was top-notch. If you're visiting Cape Town and in the mood for some comfort food, The Mothers Favorite at Revenge of the Curds is highly recommended. A true poutine gem not to be missed.|Cape Town||2022|8|Revenge of the Curds
453245268|45|en|5|"""Better Off Bread"" truck in Seattle presented a range of sandwiches, with our daily picks including Pastrami, Hot Ham & Cheese, and Italian. The sandwiches boasted ample fillings; the Pastrami showcased a fine equilibrium of meat and mustard. The Hot Ham & Cheese delighted with its warm, melty goodness, and the Italian impressed with its flavor-packed salami and crisp vegetables. Bottled Soda and Ice Tea provided invigorating complements. However, a slightly fresher bread would have enhanced the experience. All in all, a fair choice for individuals on the hunt for substantial sandwiches."|Seattle||2022|8|Better Off Bread
456765896|51|en|5|"""The Mega Melt truck in Boston offers a unique grilled cheese experience. The Original, The Ranch, and Miss Piggie sandwiches were ordered. The Original was a classic, simple yet satisfying. The Ranch added a tangy twist, but it might not appeal to everyone's taste buds. Miss Piggie, with its pulled pork and BBQ sauce, was a delightful surprise, blending the worlds of grilled cheese and BBQ. Overall, the truck provides a variety of options for grilled cheese lovers, but the flavors can be hit or miss depending on personal preferences."""|Boston||2022|8|The Mega Melt
132966049|291|en|5|The Mega Melt truck in Melbourne is a grilled cheese lover's paradise. The Miss Piggie and The Ranch sandwiches were both delectable, with the perfect blend of gooey cheese and crispy bread. The Original, a classic grilled cheese, was also a hit. The bottled water and ice tea were refreshing complements to the meal. The service was quick and friendly. I highly recommend The Mega Melt for a satisfying and delicious grilled cheese experience.|Melbourne||2022|8|The Mega Melt
70090104|215|en|5|The Kitakata Ramen Bar experience was a disappointment. The Ice Tea was watered down, lacking the refreshing taste it promised. The Creamy Chicken Ramen was bland, and the chicken was overcooked, making it tough to chew. The Spicy Miso Vegetable Ramen was far from spicy, and the vegetables were not fresh. The Tonkotsu Ramen, which should have been the star of the show, was disappointingly average. The broth lacked depth, and the noodles were overcooked. Overall, the meal was a letdown, especially considering the hype around this place in Mumbai.|Mumbai|121249.0|2022|8|Kitakata Ramen Bar
399054613|392|es|5|" ""El Smoky BBQ de Madrid decepciona con su pedido de Costillas de Cerdo a la Barbacoa, Pepinillos Fritos y Sandwich de Cerdo Desmenuzado. Las costillas estaban secas y carecían de sabor, mientras que los pepinillos fritos estaban grasientos y sin sazonar. El sandwich de cerdo desmenuzado fue una pequeña mejora, pero aún así, el pan era seco y el cerdo desmenuzado estaba sobrecocido. En general, una experiencia decepcionante y no recomendada."""|Madrid||2022|8|Smoky BBQ
358248635|318|en|5|Guac n' Roll's tacos are a must-try for foodies in Rio de Janeiro. The veggie taco bowl and chicken burrito boasted impressive flavors and freshness. Balanced ingredients and generous portions elevated the dining experience. The two taco combo plate offered a tantalizing taste of various tacos. The staff's friendly demeanor and eagerness to please added to the experience. The inviting and relaxed atmosphere made Guac n' Roll an excellent choice for those seeking authentic and delicious tacos in Rio de Janeiro.|Rio de Janeiro||2022|8|Guac n' Roll
437382356|71|en|5|"""Revenge of the Curds"" food truck in New York City offers sizable portions of poutine, with options like ""The Kitchen Sink"" and ""The Classic"". The fries have a pleasant crisp, while the gravy is rich and tasty, and the cheese curds are satisfactorily melted. However, the abundance of toppings on ""The Kitchen Sink"" distract from the classic poutine flavor. Poutine enthusiasts may enjoy the experience, but ""The Classic"" may be the safer choice."|New York City||2022|8|Revenge of the Curds
81732101|231|en|5|Mega Melt truck in Delhi is a true haven for grilled cheese aficionados! On my latest visit, I was absolutely delighted with my order consisting of a Bottled Soda, The Ranch, and Miss Piggie. The Ranch sandwich delivered a delightful combination of crispy bread and melted cheese, while Miss Piggie brought a savory surprise with its generous serving of bacon. The bottled soda provided a refreshing accompaniment to the meal.I was impressed with the high-quality ingredients used and the quick and amiable service. If you're on the hunt for a satisfying and delicious grilled cheese experience, I highly recommend Mega Melt!|Delhi||2022|8|The Mega Melt
386682440|370|en|5|"The ""Not the Wurst Hot Dogs"" truck in Hamburg served up a decent dining experience. The New York Dog and Coney Dog were both satisfactory, with the toppings being quite flavorful. However, the hot dogs themselves could have been a bit more substantial. The service was efficient, and the overall atmosphere was pleasant. It's a solid choice for a quick bite, but it may not necessarily leave a lasting impression."|Hamburg||2022|8|Not the Wurst Hot Dogs
34171371|131|en|5|Disappointment was the main course of my meal at Revenge of the Curds. The poutine, which should have been the star, was lackluster. The Classic was far from classic, with soggy fries and a gravy that lacked depth. Mother's Favorite was equally underwhelming, and The Kitchen Sink was a chaotic mess of flavors that didn't harmonize. The bottled water and ice tea were the only saving graces, but they can't make up for the overall mediocre experience. I expected more from a highly-rated truck in London.|London||2022|8|Revenge of the Curds
56713927|195|en|5|"""Better Off Bread in Warsaw is a sandwich lover's paradise! The Pastrami sandwich was a gastronomic delight, perfectly balanced with just the right amount of spices. The Italian sandwich was equally impressive, bursting with fresh, vibrant flavors. The bottled water was a refreshing accompaniment. The truck's commitment to quality ingredients truly shines through in every bite. Highly recommend for a satisfying, delicious meal on the go!"""|Warsaw||2022|8|Better Off Bread
425138166|443|en|5|Disappointment was the theme of my experience at Le Coin des Crêpes. The Chicken Pot Pie Crepe lacked the promised flavor, with the filling being bland and the crepe itself was soggy. The Breakfast Crepe, on the other hand, was overcooked, making it tough to chew. The overall quality did not meet my expectations, especially for a restaurant with such a charming name in a city like Cape Town. I had hoped for a delightful crepe experience, but unfortunately, this was not the case. I would recommend revisiting the recipes or cooking techniques to enhance the dining experience.|Cape Town||2022|8|Le Coin des Crêpes
425413414|448|en|5|A delightful experience at the Peking Truck. The combo of Lo Mein and wonton soup offered an array of flavors and left me feeling content. The Lo Mein boasted an abundance of fresh vegetables and supple noodles. The wonton soup was rich in texture and enticing aroma. Generous portions were served, and the service was cordial and welcoming. I wholeheartedly recommend the Peking Truck to those seeking a swift and savory Chinese meal in Cape Town.|Cape Town||2022|8|Peking Truck
425193432|447|en|5|Cheeky Greek food truck in Cape Town falls short on authentic Greek gyros. Top-billed King Combo proved underwhelming, with dry gyro meat bereft of juicy tenderness befitting a good gyro. Greek salad failed to impress, plagued by lackluster vegetables and overly tart dressing. Moreover, portion sizes turned out smaller than anticipated, ultimately leaving us unsatisfied. Regrettably, the overall experience fell short of the dreamt Greek culinary adventure.|Cape Town||2022|8|Cheeky Greek
417698194|432|en|5|A culinary gem in Cairo, The Cheeky Greek truck serves exceptional dishes. The King Combo, Gyro Plate, and Greek Salad were all standouts. The gyro meat offered tenderness and rich flavor, while the salad showcased freshness and crispness. Generous portion sizes and prompt, friendly service were added bonuses. Authentic Greek flavors brought me directly to Athens' heart. A must-visit for those seeking delicious, authentic Greek cuisine. Bravo, Cheeky Greek!|Cairo|22597.0|2022|8|Cheeky Greek
456792740|46|en|5|Order summary lacks details on food quality and service experience, preventing a review from being written.|Boston||2022|8|Freezing Point
132885688|297|en|5|The Cheeky Greek truck in Melbourne failed to impress with its King Combo and Greek Salad. The gyro meat was dry, lacking the juicy texture one would expect. The salad, while fresh, was overly drenched in dressing, overpowering the tastes of the individual ingredients. The pita bread was also a letdown, being more chewy than soft. Overall, the experience was disappointing for the price paid.|Melbourne||2022|8|Cheeky Greek
13067308|81|en|5|Grilled cheese sandwich at The Mega Melt in Toronto exceeded expectations. Bread boasted a golden brown crust and a soft, chewy interior. Cheese melted, creating a gooey mess that was enjoyable to consume. Sharp and tangy cheese harmonized with buttery bread. Overall, a satisfying and indulgent delight.|Toronto||2022|8|The Mega Melt
64384728|207|en|5|The King Combo, Gyro Plate, and Greek Salad from Cheeky Greek in Krakow were a satisfying feast. The pita bread was warm and fluffy, the gyro meat was tender and flavorful, and the salad was fresh and crisp. The bottled soda was a refreshing accompaniment to the meal. Overall, the food was well-prepared and the service was friendly.|Krakow||2022|8|Cheeky Greek
368604484|333|en|5|Disappointment was the main course with my order from Guac n' Roll. The Chicken Burrito lacked flavor and was poorly assembled, resulting in a messy eating experience. The Lean Burrito Bowl, while somewhat better, was still underwhelming due to its lukewarm temperature and lack of fresh ingredients. Munich has a vibrant food scene, and unfortunately, Guac n' Roll doesn't live up to the city's culinary reputation.|Munich||2022|8|Guac n' Roll
437482718|64|pt|5|" ""The Mac Shack"" em New York City, a minha experiência com a encomenda do tipo ""Mac & Cheese"" foi decepcionante. Pedi o ""Standard Mac & Cheese"" e ""Lobster Mac & Cheese"", esperando uma delícia cremosa e saborosa. No entanto, o que recebi foi uma porção generosa de massa coberta com uma camada fina e pouco gostosa de queijo. O ""Lobster Mac & Cheese"" foi ainda pior, com apenas alguns pedaços de lagosta e um sabor insípido. Além disso, o ""Ice Tea"" estava aquecido e sem sabor. Em geral, não recomendaria ""The Mac Shack"" para qualquer pessoa procurando uma boa experiência de ""Mac & Cheese"" em Nova York."|New York City||2022|8|The Mac Shack
437494921|70|en|5|Not the Wurst Hot Dogs truck delivered an exceptional hot dog experience. The New York Dog and Chicago Dog were excellently prepared, boasting fresh toppings and cheerful service. The bun was tender, the meat was succulent, and the toppings were fresh and full of flavor. I savored the sweet-and-sour relish on the Chicago Dog particularly. The overall experience was impressive, and I wholeheartedly endorse visiting this truck if you find yourself in New York City.|New York City||2022|8|Not the Wurst Hot Dogs
81602515|239|en|5|"""Experienced Nani's Kitchen in Delhi with their Combination Curry. The dish presented a medley of Indian flavors, each distinct yet harmoniously blended. The curry's consistency was satisfactory, neither too thick nor too thin. However, the spice level might be a bit high for those unaccustomed to Indian cuisine. Portion size was generous, making it good value for money. The overall experience was enjoyable, but not without room for improvement."""|Delhi||2022|8|Nani's Kitchen
386613872|365|en|5|Kitakata Ramen Bar in Hamburg provides a range of ramen choices that will surely satisfy. The creamy chicken ramen, spicy miso vegetable ramen, and tonkotsu ramen all boast rich and delightful flavors. Noodles are cooked to perfection, while toppings are fresh and generously given. Bottled water and soda are available as convenient options to pair with your ramen. In summary, Kitakata Ramen Bar delivers impressive food and service, making it a go-to place for ramen enthusiasts in Hamburg.|Hamburg||2022|8|Kitakata Ramen Bar
386602085|361|en|5|Disappointment was the flavor of the day at Freezing Point in Hamburg. The Ice Cream Sandwich was a melted mess by the time it was served, and the Mango Sticky Rice lacked the freshness I was hoping for. The Two Scoop Bowl was average at best, and the Sugar Cone was stale. Even the bottled water and soda, which should be straightforward, were served at room temperature. Overall, a disappointing experience that didn't live up to my expectations.|Hamburg||2022|8|Freezing Point
376377078|350|en|5|Disappointment was the main course at Kitakata Ramen Bar in Berlin. The Creamy Chicken Ramen lacked the promised creaminess, and the chicken was tough and dry. The Spicy Miso Vegetable Ramen was far from spicy, and the vegetables were overcooked, losing their crunch. The Tonkotsu Ramen, a staple in any ramen bar, was bland and uninspiring. The drinks, Bottled Water and Bottled Soda, were the only items that met expectations. Overall, a below-par dining experience.|Berlin||2022|8|Kitakata Ramen Bar
376366216|347|en|5| Disappointed with the Smoky BBQ experience in Berlin. The Spring Mix Salad lacked freshness, and the dressing was bland. The Fried Pickles, a supposed highlight, were soggy and underwhelming. Not the quality expected from a BBQ joint, especially one with a name like Smoky BBQ. Would not recommend.|Berlin||2022|8|Smoky BBQ
70312451|221|en|5|"""Revenge of the Curds"" at the Truck, a delightful surprise nestled in Mumbai, introduces an enticing element - The Kitchen Sink. This isn't merely a dish, but an immersive culinary journey that encapsulates the city's gastronomic essence. A myriad of poutine variations grace the menu, each boasting a distinctive spin. Crafted from fresh, locally procured ingredients, the poutine is a testament to culinary creativity, with generous toppings that are far from conventional. The ambiance exudes a relaxed, amicable vibe, complemented by swift, attentive service. For the adventurous food enthusiast, The Kitchen Sink stands as an unmissable gem in Mumbai's vibrant foodscape."|Mumbai||2022|8|Revenge of the Curds
410198675|413|en|5|Disappointment was the main course at Le Coin des Crêpes. The Crepe Suzette, a classic dessert, was surprisingly lackluster. The crepe itself was overcooked, resulting in a tough texture that was hard to swallow. The orange sauce, which should have been a tangy counterpoint, was cloyingly sweet and lacked depth. The presentation was uninspiring, a far cry from the elegant dish one expects when ordering a Crepe Suzette. For a place that specializes in crepes, this was a significant letdown. I had hoped for a taste of France in Barcelona, but unfortunately, Le Coin des Crêpes did not deliver.|Barcelona||2022|8|Le Coin des Crêpes
346223516|308|en|5|Crepes from Le Coin des Crêpes were satisfactory. Breakfast Crepe was well-prepared with a balanced blend of ingredients. Chicken Pot Pie Crepe presented an intriguing twist, yet it lacked sufficient seasoning. Crepe Suzette, a classic, was skillfully executed. Ice Tea and Bottled Soda were commonplace. Bottled Water was as refreshing as anticipated. The meal was decent, but there's potential for enhancing flavors and seasoning. Service was prompt and efficient.|Sao Paulo||2022|8|Le Coin des Crêpes
425351987|436|en|5|"Sure, here's a rewritten review that doesn't start with ""The,"" ""I,"" or ""Im"":Divine ice cream selection at The Freezing Point truck! Fresh bread and perfectly balanced layers in the ice cream sandwich. Refreshing popsicle on a hot day and the two-scoop bowl allowed for sampling two unique flavors. Friendly service and vibrant atmosphere made the experience even more enjoyable. Highly recommended for ice cream lovers!"|Cape Town||2022|8|Freezing Point
417623768|434|en|5|A blend of excellence and disappointments marked my meal at Nani's Kitchen. The Lean Chicken Tikka Masala delivered on its promise of rich flavor and tender texture, aligning with the esteemed reputation of Indian cuisine. In contrast, the Tandoori Mixed Grill fell short, lacking the customary smoky taste and succulence. The Bottled Soda served as a delightful counterpoint to the meal. Although the overall experience was satisfactory, there is potential for enhancement in specific aspects.|Cairo||2022|8|Nani's Kitchen
70099158|213|en|5|"The Guac n' Roll truck's ""Three Taco Combo Plate"" was an absolute delight. Packed with fresh, flavorful ingredients, the tacos tantalized my taste buds. The meat was tender and succulent, while the toppings were just right - crisp lettuce, fresh tomato, creamy avocado, and tangy salsa. The soft and pliable tortillas complemented the overall presentation, which was impeccable. The friendly staff delivered my order quickly and with a smile. I highly recommend this truck for a delicious taco experience in Mumbai."|Mumbai||2022|8|Guac n' Roll
108698769|264|en|5|A must-try for Ethiopian food enthusiasts in Seoul is the Tasty Tibs truck. Boasting an extensive menu, it offers traditional dishes such as lean beef tibs, veggie combo, and lean chicken tibs. The meat exhibits tenderness and savory flavors, while the vegetables remain fresh and crisp. The injera, a fluffy flatbread, showcases softness, ideal for absorbing the scrumptious sauce. The food delights with its mouthwatering taste, and the service is characterized by friendliness and attentiveness.|Seoul||2022|8|Tasty Tibs
81844725|228|en|5| The Veggie Taco Bowl was a disappointment, lacking in flavor and freshness. The Chicken Burrito was no better, with dry chicken and an overwhelming amount of rice. The Two Taco Combo Plate was the biggest letdown, with soggy tortillas and bland fillings. The overall experience with Guac n' Roll was underwhelming, especially considering the hype around it in Delhi. I expected more from a taco truck with such a fun name. Unfortunately, it didn't live up to my expectations.|Delhi||2022|8|Guac n' Roll
376391913|358|en|5|The Peking Truck's combo Lo Mein was simply incredible. The noodles were perfectly cooked, the vegetables were fresh and crisp, and the meat was tender and flavorful. The accompanying sauce was just the right balance of sweet and savory, and the portion size was generous. The delivery was fast and efficient, and the staff were friendly and professional. Overall, I couldn't be happier with my experience and would highly recommend this restaurant to anyone.|Berlin||2022|8|Peking Truck
