ORDER_ID|TRUCK_ID|LANGUAGE|SOURCE|REVIEW|PRIMARY_CITY|CUSTOMER_ID|YEAR|MONTH|TRUCK_BRAND
346602509|314|en|1|Nani's Kitchen's Lean Chicken Tikka Masala and Combination Curry in Sao Paulo offer a satisfying Indian cuisine experience. The Chicken Tikka Masala boasts tender and flavorful lean chicken, providing a healthier twist to a classic dish. Although the Combination Curry is not exceptional, it offers a decent variety of vegetables and spices. Overall, the meal delivers a balance of taste and nutrition, but it falls short of delivering a memorable kick that sets Indian food apart. Nani's Kitchen provides a solid option for those seeking a milder interpretation of traditional Indian fare.|Sao Paulo|17953.0|2022|9|Nani's Kitchen
56964735|195|en|1|I was absolutely thrilled with my experience at Better Off Bread in Warsaw! The sandwiches were exceptional, each one a flavorful journey in its own right. The Italian was a delightful medley of tangy and savory, while the Pastrami offered a perfect balance of rich, smoky flavors. The Hot Ham & Cheese was a classic, comforting choice, elevated by the quality of ingredients. The truck's menu has something for everyone, making it a must-visit for sandwich lovers. Excellent service, great food, and a fantastic atmosphere - Better Off Bread has certainly left a lasting impression!|Warsaw|67379.0|2022|9|Better Off Bread
133213669|297|en|1|"A generous serving of tender gyros and crispy falafel came together in the Cheeky Greek's ""King Combo,"" accompanied by fresh salad and creamy tzatziki sauce. Refreshing ice tea and bottled soda provided the perfect complement. The crunchy vegetables in the Greek salad offered a delightful side experience, while the gyro plate, filled with a substantial portion of gyros and tzatziki sauce, appeased those seeking a more satisfying meal. Overall, the ""King Combo"" from The Cheeky Greek was a well-rounded and flavorful choice."|Melbourne||2022|9|Cheeky Greek
410430458|406|en|1|"""Freezing Point truly hit the spot on a hot Barcelona day! The Mango Sticky Rice was a delightful blend of sweet and tangy, while the Popsicle was refreshingly fruity. The Ice Cream Sandwich, with its perfect balance of creamy ice cream and chewy cookies, was a standout. The Lemonade was a zesty palate cleanser, and the Sugar Cone added a crunchy touch to the rich ice cream. Topped off with a crisp Bottled Water, this was a fantastic experience. Freezing Point, you've made a fan out of me!"""|Barcelona||2022|9|Freezing Point
70389807|213|en|1|Guac n' Roll's Mumbai truck provided a dining experience with mixed feelings. The Three Taco Combo Plate stood out, boasting well-seasoned meat and fresh toppings that delivered a burst of flavor. Unfortunately, the Chicken Burrito and Lean Burrito Bowl failed to impress. The burrito lacked the expected flavor explosion, and the bowl, although healthy, was disappointingly bland. The Bottled Water and Ice Tea were unremarkable, meeting only the basic requirements. In summary, this dining experience was average, with a few bright spots.|Mumbai||2022|9|Guac n' Roll
399212540|401|en|1|The order summary provided does not contain any information about the review itself, therefore I am unable to write the review.|Madrid||2022|9|Revenge of the Curds
399307410|403|en|1|The Peking Truck in Madrid is a hidden gem serving up delicious Chinese cuisine. I recently tried their Combo Lo Mein and was blown away by the flavors. The noodles were cooked to perfection and the vegetables were crisp and fresh. The sauce was the perfect balance of savory and sweet, making every bite a delight. The portion size was generous, leaving me satisfied and already planning my next visit. If you're in Madrid and craving Chinese food, the Peking Truck is a must-try.|Madrid||2022|9|Peking Truck
81944714|237|en|1| Disappointed with The King Combo from Cheeky Greek in Delhi. The gyro meat lacked flavor and was dry, while the pita bread was soggy. The accompanying fries were undercooked and the tzatziki sauce was watery, lacking the tangy kick it should have. The portion size was smaller than expected for a combo meal. Overall, a below-average dining experience that didn't live up to the hype.|Delhi||2022|9|Cheeky Greek
437917003|70|en|1|Not the Wurst Hot Dogs truck in New York City delivers an authentic New York Dog experience. The menu keeps it simple, featuring the classic hot dog, a range of toppings, and some sides. Hot dogs are fresh and juicy, topped with plentiful and tasty options. The staff are welcoming and quick, and the prices are affordable. In short, Not the Wurst Hot Dogs truck is an excellent spot for a speedy and satisfying hot dog in NYC.|New York City||2022|9|Not the Wurst Hot Dogs
133119168|294|en|1|The Veggie Combo from Tasty Tibs offered a unique Ethiopian culinary experience. The dish presented a vibrant array of flavors, with each vegetable component contributing its distinct taste. The injera bread was soft and sour, providing a nice contrast to the spicy elements. However, the portion size was smaller than expected. The service was prompt and the staff was friendly, making for a pleasant dining experience in Melbourne. Overall, Tasty Tibs serves decent Ethiopian food, though there's room for improvement in terms of portion size.|Melbourne||2022|9|Tasty Tibs
386859387|368|en|1|"""Le Coin des Crêpes truly delivered an outstanding culinary experience! The Breakfast Crepe was a delightful start to the day, while the Chicken Pot Pie Crepe offered a unique twist on a classic dish. The star of the show, however, was the Crepe Suzette, perfectly balancing sweetness and tanginess. The drinks, from Bottled Water to Ice Tea, were refreshing complements to the meal. This Hamburg gem has certainly mastered the art of crepes. Highly recommended!"""|Hamburg||2022|9|Le Coin des Crêpes
13403764|87|en|1|The Cheeky Greek truck in Toronto failed to impress. The Greek Salad was drowning in dressing, overpowering the freshness of the vegetables. The Gyro Plate was disappointing, with the meat being dry and the pita bread soggy. The King Combo was far from royal, with mediocre fries and a gyro that was no better than the plate. The Bottled Soda and Ice Tea were the only decent items, but they hardly made up for the overall underwhelming experience.|Toronto||2022|9|Cheeky Greek
64414753|207|en|1|The Gyro Plate from Cheeky Greek in Krakow was a decent choice for a quick meal. The gyro meat was flavorful and well-seasoned, and the accompanying tzatziki sauce added a refreshing tanginess. The pita bread was warm and soft, but it could have been thicker to better hold the contents. The portion size was satisfactory, though the side salad was a bit underwhelming. Overall, Cheeky Greek provides a solid option for those craving Greek cuisine, but there's still room for improvement.|Krakow||2022|9|Cheeky Greek
70519749|221|en|1|The order summary provided does not contain any information about the negative aspects of the experience, therefore I cannot write a review for this order.|Mumbai||2022|9|Revenge of the Curds
108995214|257|en|1|"""Smoky BBQ in Seoul is a BBQ lover's paradise! The Rack of Pork Ribs was tender, juicy, and packed with flavor. The Pulled Pork Sandwich was a delight, with the perfect balance of sweet and savory. The Three Meat Plate was a carnivore's dream, offering a variety of perfectly cooked meats. Even the Spring Mix Salad was fresh and crisp, providing a nice contrast to the rich, smoky flavors of the BBQ. The quality of the food, combined with the friendly service, makes Smoky BBQ a must-visit in Seoul!"""|Seoul||2022|9|Smoky BBQ
358510712|327|en|1|Cheeky Greek truck in Rio de Janeiro presented a variety of customary Greek cuisine. As anticipated, the Ice Tea and Bottled Water were revitalizing. The Greek Salad was a delight with its fresh and savory ingredients, striking a perfect harmony. Regrettably, the Gyro Plate fell short of expectations, missing the typical rich flavors. Conversely, The King Combo was a highlight, offering a gratifying fusion of flavors and textures. All in all, the dining experience was acceptable, with a few exceptional and mediocre dishes on the menu.|Rio de Janeiro||2022|9|Cheeky Greek
358570925|327|en|1|A delightful experience at The Cheeky Greek truck. The gyro plate was perfectly seasoned, showcasing tender lamb and fresh toppings. The Greek salad offered a perfect equilibrium of vegetables and olives, boasting freshness and flavor. The bottled soda provided a refreshing and quenching respite. Friendly and efficient service completed a very satisfying encounter.|Rio de Janeiro||2022|9|Cheeky Greek
417728134|424|en|1|"""The Mac Shack in Cairo is a true gem! Their Standard Mac & Cheese is an absolute delight, offering a perfect blend of creaminess and flavor. The dish was served hot, with the cheese just right, neither too overpowering nor underwhelming. Paired with a refreshing Bottled Soda, it made for a satisfying meal. The quality of the food and the overall experience exceeded my expectations. I highly recommend The Mac Shack for anyone craving a comforting, delicious meal. You won't be disappointed!"""|Cairo||2022|9|The Mac Shack
376468759|350|en|1|While the Tonkotsu ramen at Kitakata Ramen Bar in Berlin was visually appealing, the broth lacked the necessary flavor and spice. The noodles were disappointingly limp and lacked texture, failing to complement the bland broth. The pork belly was tender but ultimately uninspired, and the eggs were overcooked, leaving a bitter taste in the mouth. Overall, the Tonkotsu ramen fell short of expectations, offering a lackluster culinary experience.|Berlin||2022|9|Kitakata Ramen Bar
376496173|350|en|1|Disappointing experience at Kitakata Ramen Bar in Berlin. The Ice Tea was watered down and lacked flavor. The Spicy Miso Vegetable Ramen was bland and the vegetables were overcooked. The Tonkotsu Ramen, which is usually a favorite, was a letdown with a broth that was too salty and pork that was tough to chew. The Bottled Soda was the only item that met expectations. Overall, the meal was not worth the price and I wouldn't recommend this place to ramen lovers.|Berlin||2022|9|Kitakata Ramen Bar
376685860|358|en|1|The Peking Truck's combo fried rice was a culinary disaster. The rice was overcooked and mushy, the vegetables were undercooked and crunchy, and the meat was dry and flavorless. The only saving grace was the generous portion size, but it couldn't make up for the poor quality of the food. I would not recommend this dish to anyone.|Berlin||2022|9|Peking Truck
376693029|357|en|1|A fantastic gyro plate is served up at the Cheeky Greek truck in Berlin. The gyro meat offers rich flavors and tenderness, harmoniously pairing with the truck's fresh vegetables and creamy tzatziki sauce. Generous portion sizes ensure satisfaction without overindulgence. Friendly and efficient staff provide quick service with smiles. I wholeheartedly endorse giving the Cheeky Greek a try for an authentic and savory gyro experience.|Berlin||2022|9|Cheeky Greek
27237300|109|en|1|The Mac Shack in Montreal served up a decent Mac & Cheese experience. The Standard Mac & Cheese was creamy and comforting, a classic rendition of the dish. On the other hand, the Buffalo Mac & Cheese offered a spicy twist, although the buffalo flavor could have been a bit more pronounced. The portions were generous, ensuring a satisfying meal. However, the presentation was rather basic, lacking a certain visual appeal. Overall, it's a solid choice for mac & cheese lovers, but don't expect any culinary fireworks.|Montreal||2022|9|The Mac Shack
368716051|335|en|1|"""Kitakata Ramen Bar truly delivered an exceptional dining experience! The Creamy Chicken Ramen was a culinary delight, boasting a rich, velvety broth that perfectly complemented the tender chicken. The Spicy Miso Vegetable Ramen offered a flavorful kick, while the Tonkotsu Ramen was a classic, hearty choice. The accompanying Bottled Soda and Bottled Water were refreshing, rounding out the meal nicely. Kitakata Ramen Bar is a must-visit in Munich for ramen lovers. Can't wait to return!"""|Munich||2022|9|Kitakata Ramen Bar
81998286|239|en|1|Disappointment was the main course at Nani's Kitchen. The Tandoori Mixed Grill, far from being a culinary delight, was a mediocre blend of flavors. The meat was overcooked, lacking the tenderness one expects from a grill. The marination was underwhelming, missing the rich spices that Indian cuisine is renowned for. The presentation was lackluster, doing little to entice the appetite. For a restaurant in Delhi, known for its vibrant food scene, Nani's Kitchen failed to deliver the authentic Indian dining experience it promised.|Delhi||2022|9|Nani's Kitchen
82025904|233|en|1|A delightful treat was the Le Coin des Crêpes breakfast crepe. The crepe's texture was fluffy and golden brown. The filling boasted a harmonious balance of sweet and savory elements. Fresh fruit and whipped cream enhanced the crepe's flavor. Impressive was the overall presentation. Friendly and prompt was the service. The atmosphere was warm and inviting. Highly recommendable for those seeking a delicious and satisfying breakfast experience is this crepe.|Delhi||2022|9|Le Coin des Crêpes
94885927|252|en|1|The King Combo, Gyro Plate, and Greek Salad at Cheeky Greek in Tokyo were an absolute delight. The gyros were succulent and flavorful, the pita was soft and warm, and the Greek salad was fresh and crisp. The portions were generous, and the service was friendly. Overall, I had a very positive experience, and I would highly recommend Cheeky Greek to anyone looking for a delicious and authentic Greek meal in Tokyo.|Tokyo||2022|9|Cheeky Greek
56808971|184|pl|1| Przepraszam, ale The Mac Shack w Warszawie zawiódł mnie swoim Buffalo Mac & Cheese. Składniki były niewygładzone, a sos był zbyt cienki i bez smaku. Za dodatkową opłatą oczekiwałem lepszej jakości i smaku. Polecam unikać tego menu w The Mac Shack.|Warsaw||2022|9|The Mac Shack
346733365|308|en|1|"""Le Coin des Crêpes in Sao Paulo served a delightful breakfast crepe, a true treat for the taste buds. The crepe itself was perfection, thin and crispy on the exterior while maintaining a soft, fluffy interior. A generous filling of fresh fruit and cream cheese added a sweet, flavorful touch. The expertise in preparation was evident, complemented by friendly service. For those seeking a delicious and satisfying breakfast, Le Coin des Crêpes comes highly recommended."""|Sao Paulo||2022|9|Le Coin des Crêpes
425529861|436|en|1|Freezing Point truck's Sugar Cone and Popsicle treat proved to be an absolute delight. The ice cream boasted a smooth and creamy texture, while the toppings were generous and fresh. Adding to the positive experience was the friendly service and vibrant atmosphere. Located in Cape Town, the truck's positioning was ideal for a quick treat on a sweltering day. In conclusion, a visit to the Freezing Point truck is highly recommended for a refreshing and flavorful escape.|Cape Town||2022|9|Freezing Point
133197016|297|en|1|Disappointment was the main course of my meal at Cheeky Greek in Melbourne. The King Combo lacked the royal treatment, with gyro meat that was dry and flavourless. The Gyro Plate was no better, with a side of pita bread that was stale. The Greek Salad, a potential saving grace, was drowned in an excessive amount of dressing, overpowering the freshness of the vegetables. To top it off, both the Bottled Soda and Ice Tea were lukewarm. Overall, a meal not fit for a king, nor anyone seeking authentic, flavourful Greek cuisine.|Melbourne||2022|9|Cheeky Greek
56860206|193|en|1|Peking Truck in Warsaw presented a satisfactory dining experience. The Combo Lo Mein was commendably prepared, striking a pleasant equilibrium of flavors. Accompanying it, the Wonton Soup was soothing and seasoned to an acceptable degree. As for the bottled water, it was unremarkable, meeting standard expectations. The Chinese menu boasted a wide array of choices, catering to various palates. In summary, the food quality met the mark, positioning it as a fair option for a swift meal. Yet, it failed to truly distinguish itself from other eateries.|Warsaw||2022|9|Peking Truck
70358850|213|en|1|The Fish Burrito from Guac n' Roll in Mumbai was a satisfying treat. The fish was tender and flavorful, with a crispy exterior and a soft, chewy tortilla. The burrito was packed with fresh vegetables, including lettuce, tomato, and onion, which added a refreshing crunch. The overall presentation was impressive, and the portion size was generous. However, the price was a bit high for a single item. Despite this, I would recommend Guac n' Roll's Fish Burrito to anyone looking for a flavorful and filling meal in Mumbai.|Mumbai||2022|9|Guac n' Roll
425689939|446|en|1|"A delightful experience at the Cape Town location of the food truck featured the ""Revenge of the Curds"" poutine menu item. The portion was ample, showcasing crispy curds, fresh cheese, and tender beef. The ice tea, refreshingly chilled, accompanied the meal perfectly. The overall interaction was characterized by friendliness and efficiency, resulting in a satisfying and enjoyable on-the-go meal."|Cape Town||2022|9|Revenge of the Curds
425769142|448|en|1|The wonton soup was a disappointment. The broth was bland and watery, and the wontons were not very flavorful. The only saving grace was the generous portion size. I would not recommend this dish to anyone.|Cape Town||2022|9|Peking Truck
425758582|450|en|1|Better Off Bread truck's selections fell considerably short of expectations. Bread was stale, the meat lacked moisture and flavor, and cheese was scant. The Italian sub, specifically, was a failure due to its wilted lettuce, overly processed tomato paste, and slim slice of inexpensive cheese. The hot ham and cheese sandwiches were equally unappetizing, featuring thin ham slices and insubstantial cheese. In essence, the food was unpalatably bland, overpriced, and inadequately prepared.|Cape Town||2022|9|Better Off Bread
417814286|431|en|1|"The ""Revenge of the Curds"" truck in Cairo is a poutine paradise! I tried ""Mother's Favorite,"" ""The Kitchen Sink,"" and ""The Classic,"" and each one was a delight. The fries were perfectly crispy, the cheese curds were melt-in-your-mouth delicious, and the gravy was rich and flavorful. The portions were generous, and the service was friendly and efficient. If you're a fan of poutine, you won't want to miss this truck. Highly recommended!"|Cairo||2022|9|Revenge of the Curds
358642282|327|en|1|The King Combo at Cheeky Greek in Rio de Janeiro was an absolute delight. The generous portion of tender lamb, fresh pita, tangy tzatziki sauce, and crispy onions was simply mouthwatering. The lamb was perfectly cooked, tender and juicy, and the tzatziki sauce was the perfect balance of creamy and tangy. The pita was fresh and warm, and the onions added a delightful crunch. Overall, the King Combo was a satisfying and flavorful meal that I highly recommend.|Rio de Janeiro||2022|9|Cheeky Greek
358508847|325|en|1|"The ""Not the Wurst Hot Dogs"" truck's offerings fell far short of expectations. The Chicago Dog and New York Dog were pale shadows of their namesake cities' iconic hot dogs, lacking the requisite toppings and the snap of a fresh bun. The ice tea, though refreshing, was overly sweet and drowned out the flavors of the hot dogs. The bottled soda was a welcome accompaniment, but ultimately couldn't save the lackluster food. Overall, a deeply disappointing culinary experience."|Rio de Janeiro||2022|9|Not the Wurst Hot Dogs
368619497|344|en|1|"""Nani's Kitchen truly delivered an authentic Indian culinary experience right in the heart of Munich. The Lean Chicken Tikka Masala was a standout, bursting with rich, aromatic flavors that perfectly balanced spice and warmth. The Tandoori Mixed Grill was equally impressive, offering a delightful medley of tender, perfectly seasoned meats. The Combination Curry was a flavorful journey in itself, pairing beautifully with the basmati rice. The bottled water and soda were a refreshing complement to the meal. Nani's Kitchen has undoubtedly set a high bar for Indian cuisine in the city. A must-visit for anyone craving a genuine taste of India!"""|Munich||2022|9|Nani's Kitchen
13314992|85|en|1|"""Experienced a mix of flavors with the New York Dog and Coney Dog from Not the Wurst Hot Dogs in Toronto. The New York Dog, with its tangy sauerkraut and spicy mustard, offered a pleasant zing, while the Coney Dog, loaded with chili and cheese, provided a comforting, hearty taste. The bottled soda was a refreshing accompaniment. However, the buns could have been softer and fresher. Overall, it was an average experience with room for improvement."""|Toronto||2022|9|Not the Wurst Hot Dogs
70582225|218|en|1|The Chicken Pot Pie Crepe from Le Coin des Crêpes was an interesting fusion dish. The crepe was well-prepared, with a nice, light texture. The chicken pot pie filling was flavorful, with a good balance of vegetables and tender chicken. However, the combination of the two didn't quite work as harmoniously as one might hope. The flavors seemed to compete rather than complement each other. It was a unique culinary experience, but perhaps not one that will be repeated often. The service was prompt and the location in Mumbai was convenient. Overall, it was a decent meal, but not one that stands out among the city's many dining options.|Mumbai||2022|9|Le Coin des Crêpes
34232857|122|en|1|The pulled pork sandwich from Smoky BBQ in London was simply mouth-watering. The tender pork melted in my mouth, and the smoky flavor was perfect. The bread was soft and fresh, and the toppings were fresh and flavorful. The service was friendly and prompt. Overall, I highly recommend the pulled pork sandwich from Smoky BBQ. It was a truly satisfying and enjoyable meal.|London|40524.0|2022|9|Smoky BBQ
27245534|113|en|1|"""Le Coin des Crêpes in Montreal served up a unique twist on traditional crepes with their Chicken Pot Pie Crepe and Crepe Suzette. The Chicken Pot Pie Crepe provided a savory experience, its filling effectively capturing the essence of the classic dish. Yet, the crepe itself could have been crisper. Conversely, the Crepe Suzette, a dessert crepe, was expertly prepared with a balanced sweetness and a touch of citrus. While the overall experience was satisfactory, there's room for enhancement, particularly in the texture of the crepes."""|Montreal||2022|9|Le Coin des Crêpes
108971565|270|ko|1|" ""안녕하세요, 최근에 Seoul에서 'Better Off Bread'라는 트럭에서 파스트라미 샌드위치를 시켰는데, 정말 맛있었습니다! 빵도 그닥 부드러워서 조금 걱정했었는데, 맛도 좋고 탄력도 있어서 완벽했습니다. 파스트라미도 신선하고 잘 썰어져 있어서 한입에 베어도 잘 녹아들어가는 맛이 났어요. 덤으로 얹힌 양파와 피망도 상큼하고 아주 잘 어울려서 맛있게 드실 수 있었습니다. 맛있는 음식과 친절한 서비스, 추천하고 싶습니다! 다음에도 꼭 다시 방문하고 싶습니다.""Translation: ""Hello, I recently had a pastrami sandwich from the 'Better Off Bread' truck in Seoul and it was delicious! The bread was soft but had a good texture, and the pastrami was fresh and well-sliced, so it melted in my mouth with each bite. The onions and pickles that came with it were also fresh and complemented the sandwich well. I highly recommend it for its delicious food and great service! I definitely want to visit again."""|Seoul||2022|9|Better Off Bread
109002999|270|en|1|The Better Off Bread truck in Seoul failed to deliver on its promise of quality sandwiches. The Pastrami was disappointingly dry, lacking the expected juiciness. The Hot Ham & Cheese was bland, missing the rich, melty cheese one would anticipate. The Italian, too, was underwhelming, with a noticeable absence of flavor. Overall, the experience was far from satisfying, leaving much to be desired in terms of taste and texture.|Seoul||2022|9|Better Off Bread
64393347|210|en|1|Better Off Bread in Krakow provides a satisfactory dining experience, offering Hot Ham & Cheese and Italian sandwiches. The bread is fresh, and the fillings are flavorful, with melted cheese in the Hot Ham & Cheese version. Bottled water is a standard accompaniment. However, nothing stands out about the meal to make it exceptional or memorable. It meets expectations but does not exceed them. A good option for a quick sandwich fix, but not particularly noteworthy.|Krakow||2022|9|Better Off Bread
437726258|61|en|1| Disappointing experience with Freezing Point in New York City. The Mango Sticky Rice lacked the authentic taste and was overly sweet. The Two Scoop Bowl was a letdown too, with ice cream that was more icy than creamy. The quality of food did not match the price paid. Not a place I would recommend or revisit.|New York City||2022|9|Freezing Point
437872197|64|en|1|Mac Shack's mac and cheese selections failed to meet desires. Standard mac and cheese was characterized by insipid flavors and inadequate cheese coverage, missing the desired creaminess and gooey consistency. Buffalo mac and cheese delivered a spicier taste, yet suffered from overcooked pasta and an uneven distribution of tangy sauce and fiery cheese. The acclaimed lobster mac and cheese proved to be a letdown. Lobster's flavor was subtle, and the allocation of lobster meat was scant, leaving this overpriced dish unimpressive.|New York City|33601.0|2022|9|The Mac Shack
