ORDER_ID|TRUCK_ID|LANGUAGE|SOURCE|REVIEW|PRIMARY_CITY|CUSTOMER_ID|YEAR|MONTH|TRUCK_BRAND
346719468|304|en|1|The Mac Shack truck's menu boasted a classic mac & cheese selection, and I sampled their standard and lobster mac & cheese. The standard mac was creamy and flavorful, but the lobster mac elevated the experience with generous lumps of succulent lobster. The cheesy sauce was perfectly balanced with the lobster's sweetness, creating a delightful symphony of taste and texture. The service was friendly, and the atmosphere was casual, making it an ideal pit stop for a quick bite. Overall, I highly recommend the Mac Shack truck for its mouth-watering mac & cheese and friendly atmosphere.|Sao Paulo||2022|9|The Mac Shack
456884482|55|en|1|Disappointment was the main course with my New York Dog from Not the Wurst Hot Dogs. The hot dog was overcooked, resulting in a tough, dry texture. The toppings were lackluster, with sauerkraut that tasted like it came straight from a can and a bland mustard that did nothing to enhance the flavor. The bun was the only saving grace, but it couldn't make up for the overall lack of quality. I expected more from a Boston eatery, especially one specializing in hot dogs. Unfortunately, Not the Wurst Hot Dogs didn't deliver on taste or quality.|Boston||2022|9|Not the Wurst Hot Dogs
410481709|414|en|1|"""Tasty Tibs truly lives up to its name! The Lean Chicken Tibs and Lean Beef Tibs were a gastronomic delight, perfectly seasoned and cooked to perfection. The Ethiopian flavors were authentic and rich, transporting me straight to the heart of Addis Ababa. The truck's service was swift and friendly, making the experience even more enjoyable. If you're in Barcelona and craving Ethiopian cuisine, Tasty Tibs is an absolute must-try!"""|Barcelona||2022|9|Tasty Tibs
399260450|401|en|1|The order summary provided does not contain any information about the quality or taste of the food, therefore I cannot write a negative review for this order.|Madrid||2022|9|Revenge of the Curds
133257708|299|en|1|Nani's Kitchen in Melbourne served a balanced Lean Chicken Tikka Masala. The chicken's tenderness and thorough cooking were commendable, while the masala sauce boasted a rich, aromatic flavor. Despite this, the spice level fell short of expectations for an Indian dish. Generous portion size offered good value for money, culminating in an enjoyable meal overall. However, spice enthusiasts may wish to request additional heat.|Melbourne||2022|9|Nani's Kitchen
108990565|267|en|1|Unsatisfying encounter at Cheeky Greek truck in Seoul. King Combo gyro fell short with its dry texture and failed to deliver the anticipated juicy gyro flavor. Tzatziki sauce proved to be insipid. Greek Salad left much to be desired, with limp lettuce and a paucity of olives and feta cheese. Food quality fell below expectations, discouraging a recommendation for those craving authentic Greek cuisine.|Seoul||2022|9|Cheeky Greek
70433735|215|en|1|The Tonkotsu Ramen at Kitakata Ramen Bar in Mumbai is an absolute delight. The broth, rich and flavorful, is made with a secret recipe and simmered for hours. The noodles are perfectly cooked, tender yet firm, and the toppings, ranging from marinated eggs to fresh scallions, add a touch of freshness and complexity. The atmosphere is casual and inviting, perfect for a cozy evening. If you're looking for a satisfying and authentic ramen experience in Mumbai, Kitakata Ramen Bar is the place to be.|Mumbai||2022|9|Kitakata Ramen Bar
122155640|279|en|1|The lean beef tibs at Tasty Tibs in Sydney were an absolute delight. The meat was tender and flavorful, perfectly complemented by the spongy injera bread. The vibrant colors and aromas emanating from the kitchen were intoxicating, and the service was friendly and prompt. The atmosphere was warm and inviting, making me feel right at home. Overall, I highly recommend the lean beef tibs at Tasty Tibs to anyone looking for a delicious and authentic Ethiopian dining experience.|Sydney||2022|9|Tasty Tibs
386778649|368|en|1|Le Coin des Crêpes truck in Hamburg is a true discovery! The Chicken Pot Pie Crepe and Breakfast Crepe stood out as exceptional. Crepes were cooked to perfection, with a crispy exterior and tender interior. The chicken pot pie filling boasted rich and robust flavors, while the breakfast crepe provided a delightful start to the day. Quick and amiable service added to the overall positive experience. Le Coin des Crêpes is highly recommended for a delicious and distinctive meal.|Hamburg||2022|9|Le Coin des Crêpes
56933344|187|en|1|Well-seasoned Veggie Burger at Plant Palace boasted a satisfying texture. Seitan Buffalo Wings delivered a pleasant spicy kick. The Salad of All Salads was fresh and crisp, yet could've benefited from a more flavorful dressing. Standard Ice Tea and Bottled Soda provided refreshing accompaniments to the meal. Vegetarian truck dining experience in Warsaw was enjoyable, with room for improvement in certain aspects.|Warsaw||2022|9|Plant Palace
346489091|303|en|1|"""Guac n' Roll truly deliveries a fiesta of flavors! I recently enjoyed their Three Taco Combo Plate in Sao Paulo and it was an absolute delight. The tacos were packed with fresh ingredients, each bite bursting with zesty tastes. The guacamole was creamy and perfectly seasoned, adding a delightful twist to the traditional taco experience. The truck's vibrant atmosphere complemented the meal, making it a memorable dining experience. If you're a taco lover, Guac n' Roll is a must-try!"""|Sao Paulo||2022|9|Guac n' Roll
346598902|308|en|1|The crepes from Le Coin des Crêpes were an absolute delight! The Breakfast Crepe was a perfect start to the day, filled with fresh ingredients that blended harmoniously. The Crepe Suzette was a treat, with its tangy, sweet flavor profile that left a lasting impression. But the Chicken Pot Pie Crepe was the star of the show, offering a unique twist on a classic dish. The crepe was perfectly cooked, crispy on the edges and soft in the middle, enveloping a rich, savory filling. The overall experience was fantastic, making Le Coin des Crêpes a must-visit in Sao Paulo.|Sao Paulo||2022|9|Le Coin des Crêpes
410452325|413|en|1|Disappointment was the main course at Le Coin des Crêpes. The Crepe Suzette, a classic dessert, was surprisingly lackluster. The crepe itself was overcooked, resulting in a tough, chewy texture that was far from enjoyable. The orange sauce, which should have been a tangy, sweet delight, was overly sugary and lacked the expected depth of flavor. The presentation was also underwhelming, with no attention to detail. For a restaurant specializing in crepes, this was a significant letdown. I expected more from a place in Barcelona known for its culinary scene. Unfortunately, Le Coin des Crêpes did not deliver.|Barcelona||2022|9|Le Coin des Crêpes
410378884|408|en|1|"Underwhelming experience with too much repetition.The Guac n' Roll truck's tacos failed to impress, with a veggie taco bowl that was bland and uninspired. The dish lacked the crunchy vegetables and fresh salsa that are essential to a great taco. The fish burrito was equally unimpressive, with dry and overcooked fish and a soggy tortilla. The overall quality of the food was subpar, and I wouldn't recommend this truck to anyone.Instead of starting with ""The,"" try to start with a word that is more descriptive of the review. In this case, ""Underwhelming"" gives a clear indication of the tone of the review and helps to avoid repetition. Additionally, try to avoid starting multiple sentences with the same word, such as ""The"" in the original review. Varying sentence structure can make the review more engaging and easier to read."|Barcelona||2022|9|Guac n' Roll
109119494|257|en|1|A visit to the Smoky BBQ truck in Seoul provided a distinct BBQ adventure with their Spring Mix Salad and Fried Pickles. The salad exhibited freshness and crispness, making an appealing contrast to the warm, tangy fried pickles. Nevertheless, the serving size fell short of anticipations. Exuding a vibrant atmosphere, the truck's ambiance was a delight, while the service proved prompt. The meal was satisfactory, yet didn't outshine the extensive BBQ alternatives in Seoul.|Seoul||2022|9|Smoky BBQ
437896666|70|en|1|The Not the Wurst Hot Dogs truck is a must-try for any hot dog enthusiast visiting New York City. I ordered a Coney Dog and a Chicago Dog, and both were absolutely mouth-watering. The buns were soft and perfectly toasted, the meat was juicy and flavorful, and the toppings were fresh and creative. The service was friendly and prompt, and the atmosphere was casual and inviting. Overall, I couldn't have been more impressed with my experience at Not the Wurst Hot Dogs.|New York City||2022|9|Not the Wurst Hot Dogs
399212183|401|en|1|"""Revenge of the Curds"" truck in Madrid didn't meet expectations. Typically a fan of poutine, I found their offerings disappointing. The ""Mother's Favorite"" was excessively salty, and ""The Kitchen Sink"" presented a disorganized blend of ingredients that failed to complement each other. Even the bottled soda lacked fizz. ""The Classic"" was far from its namesake, missing the crucial crunch and balance of flavors. All in all, a disappointing experience that fell short of the buzz surrounding it."|Madrid||2022|9|Revenge of the Curds
122065663|283|en|1|A culinary delight awaits you at Peking Truck in Sydney. Savoring their Wonton Soup recently was an absolute pleasure. The wontons werecooked to perfection with just the right filling, and the soup was infused with rich, comforting flavors. Among the Chinese menu's numerous options, the Wonton Soup shone as a standout, offering an enticing blend of authentic tastes, evocative of a traditional Chinese kitchen. The efficient service and friendly staff added to the dining experience. For those in Sydney with a craving for Chinese food, Peking Truck is a must-visit, and their Wonton Soup is an unmissable gastronomic experience.|Sydney|115646.0|2022|9|Peking Truck
46601901|161|en|1|"The ""Revenge of the Curds"" truck in Paris served up a hearty helping of poutine with ""The Kitchen Sink"" and ""The Classic"" options. The portions were generous, with a good balance of fries, cheese curds, and gravy. The fries maintained a decent crispiness despite being smothered in toppings. However, the gravy could have benefited from a bit more seasoning to truly elevate the dish. The cheese curds were fresh and squeaky, as expected. Overall, it was a satisfying meal that hit the spot, but there's still room for improvement in terms of flavor complexity."|Paris||2022|9|Revenge of the Curds
46625660|154|fr|1|" ""Le Mac Shack à Paris, quelle déception. J'ai commandé un assortiment de macaronis au fromage : le standard, le buffalo et le homard. Le standard était insipide, manquant de fromage et de saveur. Le buffalo était tout aussi décevant, sans la moindre note épicée. Quant au homard, je n'ai pas pu le distinguer des autres, aucune trace de ce crustacé cher et prisé. La bouteille d'eau et le thé glacé étaient les seuls points positifs de cette commande, mais cela ne suffit pas à rattraper la déception des plats principaux. Dommage, je m'attendais à mieux de la part d'un food truck aussi réputé dans la Ville Lumière."""|Paris||2022|9|The Mac Shack
46638707|154|en|1|The Mac Shack's mac and cheese is a delight, and the generous portions are perfect for sharing. The standard mac and cheese was creamy and flavorful, while the buffalo mac and cheese added a kick of spice. The lobster mac and cheese was a step above the rest, with tender lobster and a hint of saffron. The bottled water was refreshing and chilled. Overall, a satisfying and enjoyable meal.|Paris||2022|9|The Mac Shack
56801636|195|en|1|"The ""Better Off Bread"" truck in Warsaw offered a straightforward menu with a focus on sandwiches. I opted for the Pastrami, accompanied by a Bottled Soda, Ice Tea, and an Italian sandwich. The Pastrami was well-seasoned, with a good balance of meat and bread. The Italian, on the other hand, was a bit underwhelming, lacking the expected punch of flavors. The drinks were standard, serving their purpose of complementing the meal. Overall, it was a decent experience, with some hits and misses on the menu."|Warsaw||2022|9|Better Off Bread
64464934|207|pl|1|" ""Cheeky Greek w Krakowie to wybór idealny dla miłośników potraw greckich! Zamówiłem płatki z gyrosu, sałatkę grecką i lodową herbatę, a wszystko było na wysokim poziomie. Smak i jakość dania były po prostu niesamowite. Polecam Cheeky Greek wszystkim, którzy chcą podnieść na duchu i skosztować autentycznych potraw greckich. Dziękuję za niezapomniane doświadczenie smakowe!""Translation: ""Cheeky Greek in Krakow is the perfect choice for Greek food lovers! I ordered gyro plate, Greek salad and ice tea, and everything was at a high level. The taste and quality of the dish were simply amazing. I recommend Cheeky Greek to everyone who wants to lift their spirits and taste authentic Greek cuisine. Thank you for the unforgettable culinary experience!"""|Krakow||2022|9|Cheeky Greek
437701379|71|en|1|"The Kitchen Sink at ""Revenge of the Curds"" in New York City did not disappoint! This iconic poutine spot is a must-try for any foodie. The generous portions of crispy curds, fresh gravy, and melt-in-your-mouth cheese are simply irresistible. The gravy was rich and flavorful, and the curds were perfectly golden and crispy. Overall, the Kitchen Sink is a testament to the perfect balance between comfort and indulgence. A true Canadian treat!"|New York City||2022|9|Revenge of the Curds
346595581|304|en|1|The Mac Shack's Lobster Mac & Cheese was an absolute delight! Creamy mac and cheese was loaded with succulent lobster, fresh and flavorful. Generous portions were perfect for sharing, and the friendly staff were attentive to my every need. The atmosphere was warm and inviting, making it the perfect place to relax and enjoy a delicious meal. Overall, I highly recommend the Lobster Mac & Cheese at The Mac Shack. It's a must-try for any foodie visiting Sao Paulo.|Sao Paulo||2022|9|The Mac Shack
449540696|29|en|1| Disappointed with Nani's Kitchen in Denver. The Combination Curry lacked depth and authentic Indian flavors, tasting more like a watered-down version of the real thing. The vegetables were overcooked, and the chicken was dry and chewy. Portions were small for the price, leaving me unsatisfied and longing for a better Indian meal. Not recommended for curry lovers.|Denver|73613.0|2022|9|Nani's Kitchen
456881214|48|en|1|The Guac n' Roll truck's tacos and burritos are a true delight. I ordered a chicken burrito, a lean burrito bowl, and a two taco combo plate. Each item was fresh, flavorful, and perfectly prepared. The chicken was tender and juicy, the beef in the burrito bowl was tender, and the tacos were filled with fresh, crispy toppings. The ice tea and bottled soda were refreshing, and the service was friendly and efficient. Overall, I had a very positive experience with Guac n' Roll and would highly recommend it to anyone looking for delicious Mexican food.|Boston||2022|9|Guac n' Roll
399213364|403|en|1|The Peking Truck's menu offerings of combo lo mein and wonton soup were far from satisfactory. The lo mein was overcooked, limp, and devoid of flavor. The wonton soup, despite its deceptive appearance, tasted bland and uninspired. The overall quality of the food was poor, leaving much to be desired.|Madrid||2022|9|Peking Truck
81921958|234|en|1|Lean beef tibs at Tasty Tibs in Delhi delivered a delectable and fulfilling dining experience. The meat exhibited tenderness and juiciness, boasting an ideal blend of spices and herbs. The tibs were accompanied by fluffy rice and a side of warm and fresh injera. The meal's flavor profile boasted complexity and aromatics. The portion size was generous. Service was cordial, yet wait times elongated. Despite this, the food compensated, making Tasty Tibs an Ethiopian meal recommendation in Delhi worth considering.|Delhi||2022|9|Tasty Tibs
13298631|85|en|1|"## The Wurst Hot Dogs: A Toronto TragedyI was unfortunately served the ""Not the Wurst"" hot dogs at the aforementioned ""Not the Wurst Hot Dogs"" truck in Toronto. While the menu boasted a tantalizing array of toppings, the execution fell short of expectations.The buns were soft and lackluster, failing to hold the generous heaping of toppings. The meat itself was bland and undercooked, bordering on raw. The toppings, though plentiful, lacked the freshness and flavor I'd hoped for. The overall experience was a culinary disaster, leaving me with a stomach full of disappointment and a yearning for a proper hot dog. I'd recommend steering clear of this truck, unless you're desperate for a culinary catastrophe."|Toronto||2022|9|Not the Wurst Hot Dogs
376553667|357|en|1|The Cheeky Greek truck's gyros are a must-try for any visitor to Berlin. The gyro plate was perfectly seasoned, with tender lamb, fresh vegetables, and a fluffy pita. The Greek salad was refreshing and crisp, a perfect accompaniment to the gyro. The friendly owner was passionate about his food and made me feel right at home. The atmosphere was casual and inviting, and the prices were reasonable. Overall, I had a thoroughly enjoyable experience at Cheeky Greek, and I would highly recommend it to anyone looking for a delicious and authentic Greek feast in the heart of Berlin.|Berlin||2022|9|Cheeky Greek
376608863|355|en|1|"Disappointed with my experience at ""Not the Wurst Hot Dogs"" in Berlin. The New York Dog and Chicago Dog I ordered lacked the authentic flavors I was expecting. The hot dogs were overcooked, resulting in a dry texture, and the toppings were uninspiring. The buns were also stale, which further detracted from the overall experience. I had high hopes based on the name, but unfortunately, this was not a satisfying meal. I would not recommend this food truck to anyone seeking a quality hot dog experience."|Berlin||2022|9|Not the Wurst Hot Dogs
34277688|125|en|1|The Kitakata Ramen Bar in London offers a tantalizing menu featuring a range of flavorful ramens and refreshing beverages. The Tonkotsu Ramen and Creamy Chicken Ramen are the signature dishes, showcasing the restaurant's signature creamy broth and tender noodles. The ice tea and bottled soda complement the meal perfectly, providing a cool respite from the savory flavors. Overall, the food and drinks at Kitakata Ramen Bar are well-crafted and satisfying, making it a highly recommended destination for ramen enthusiasts and casual diners alike.|London||2022|9|Kitakata Ramen Bar
56821912|189|en|1| Disappointed with my experience at Tasty Tibs in Warsaw. The Lean Beef Tibs lacked flavor and were overcooked, making them tough and chewy. The Veggie Combo was underwhelming, with bland and unseasoned vegetables. Portion sizes were also smaller than expected. Ethiopian cuisine is known for its rich and robust flavors, but this meal was far from that. I had high hopes for this food truck, but unfortunately, it did not meet my expectations.|Warsaw||2022|9|Tasty Tibs
56926702|187|en|1|The Plant Palace truck in Warsaw is a vegetarian's paradise! The Seitan Buffalo Wings were incredibly flavorful and had a perfect texture that even meat-lovers would appreciate. The Salad of All Salads lived up to its name, bursting with fresh, crisp vegetables and a tangy dressing that tied it all together. The Veggie Burger was a standout, packed with hearty ingredients and served on a toasted bun. Paired with a refreshing Bottled Soda, this meal was a delightful experience from start to finish. Highly recommend!|Warsaw||2022|9|Plant Palace
346465954|313|en|1|The Peking Truck in Sao Paulo offered a decent dining experience. The Wonton Soup was flavorful, with a good balance of seasonings, and the wontons were nicely cooked. The Combo Lo Mein, however, was a bit underwhelming, lacking the robust flavors one might expect from a Chinese dish. The Bottled Soda and Bottled Water were standard. Overall, the food was satisfactory, but there's certainly room for improvement in some areas.|Sao Paulo||2022|9|Peking Truck
425492355|436|en|1|A visit from Freezing Point's truck to Cape Town was an unforgettable joy. Menu options, such as the refreshing Popsicle, the indulgent Ice Cream Sandwich, and the classic Sugar Cone, were all exemplary. The Popsicle provided a delightful refreshment with its meticulously crafted form. The Ice Cream Sandwich offered a heavenly experience with its luscious ice cream and crisp wafer. The Sugar Cone stood out as a timeless favorite. The Bottled Soda efficiently quenched my thirst. The amicable service and lively ambiance enhanced the overall encounter. A must-visit destination for ice cream enthusiasts in Cape Town.|Cape Town||2022|9|Freezing Point
133313264|294|en|1|"""Tasty Tibs is a hidden gem in Melbourne's food scene! The Veggie Combo was an absolute delight, bursting with authentic Ethiopian flavors. The variety of vegetables was perfectly seasoned and cooked to perfection. The injera bread was fresh and had a wonderful texture. It's clear that every dish is made with love and care. Whether you're a vegetarian or just looking to try something new, Tasty Tibs' Veggie Combo is a must-try. Highly recommended!"""|Melbourne||2022|9|Tasty Tibs
386758171|361|en|1|"""Freezing Point truly hit the sweet spot with their delightful assortment of treats! The Ice Tea was refreshing, a perfect balance of sweet and tangy. The Popsicle was a blast of fruity goodness, while the Mango Sticky Rice offered a unique twist, blending creamy mango ice cream with traditional sticky rice. The Waffle Cone and Sugar Cone were crisp and fresh, adding an enjoyable crunch to the ice cream experience. A must-visit in Hamburg for all dessert lovers!"""|Hamburg||2022|9|Freezing Point
410393234|406|en|1|Mango Sticky Rice and Waffle Cone from Freezing Point Truck in Barcelona - absolute deliciousness! The sweet and flavorful sticky rice, combined with the perfect amount of mango, was a delightful treat. Fresh and crispy waffle cone added a nice crunch. Service was friendly and prompt, making for an exceptional overall experience. Highly recommended for anyone seeking a sweet indulgence in Barcelona.|Barcelona||2022|9|Freezing Point
34195372|135|en|1|Disappointment was the main ingredient in the Italian sandwich from Better Off Bread. The bread was stale, lacking the freshness one would expect from a sandwich truck. The fillings were sparse and uninspiring, with the promised Italian flavors nowhere to be found. The overall experience was underwhelming, especially considering the London food truck scene's reputation for quality and innovation. I had hoped for a delicious meal, but instead, I was left feeling better off without this bread.|London||2022|9|Better Off Bread
34298419|122|en|1| The Smoky BBQ truck in London exceeded all expectations! The Spring Mix Salad was fresh and crisp, a perfect starter. The true star, however, was the Rack of Pork Ribs. The meat was tender, juicy, and literally fell off the bone. The smoky barbecue flavor was rich and robust, a delightful culinary experience. The Fried Pickles added a delightful crunch and tangy twist to the meal. The quality of the food, combined with the friendly service, makes Smoky BBQ a must-visit for any BBQ lover in London.|London||2022|9|Smoky BBQ
425748910|438|en|1|"""Guac n' Roll, you've truly outdone yourself! The Taco Combo Plates were an absolute delight, bursting with flavor and freshness. The Three Taco Combo Plate was a perfect meal, offering a variety of tastes that danced on the tongue. The Two Taco Combo Plate was equally impressive, a delightful blend of textures and spices. The bottled soda was a refreshing companion to the meal, providing a pleasant balance. Your service in Cape Town is top-notch, making the entire experience a true culinary adventure. Guac n' Roll, you're rolling in the right direction!"""|Cape Town||2022|9|Guac n' Roll
82129256|231|en|1|"""The Mega Melt truck in Delhi is a must-visit for grilled cheese lovers! The Original sandwich was a classic delight, while The Ranch offered a tangy twist. Miss Piggie, with its perfect blend of cheese and bacon, was an absolute standout. The Ice Tea was refreshing, making it a great companion to the sandwiches. The staff was friendly and the service was quick. Can't wait to visit again!"""|Delhi||2022|9|The Mega Melt
437615922|64|en|1|Sure, here's the review:The Mac Shack's Standard Mac & Cheese is a satisfying treat that will satisfy even the pickiest eater. The gooey cheese is smooth and flavorful, with just the right amount of spice. The pasta is perfectly cooked, and the overall dish is simply comfort food at its best. The Mac Shack has a friendly atmosphere and quick service, making it a great place to grab a bite on the go. I highly recommend trying the Standard Mac & Cheese at The Mac Shack.|New York City||2022|9|The Mac Shack
56842283|189|en|1|"The ""Tasty Tibs"" truck's ""Lean Chicken Tibs"" offering in Warsaw was a culinary disaster. Dry and overcooked chicken, bland and flavorless tibs, tough and chewy injera (a traditional Ethiopian flatbread), unfriendly service, and an excessive wait time made for a disappointing experience. This experience was a far cry from the authentic and flavorful Ethiopian cuisine I've enjoyed in other parts of the world."|Warsaw||2022|9|Tasty Tibs
