ORDER_ID|TRUCK_ID|LANGUAGE|SOURCE|REVIEW|PRIMARY_CITY|CUSTOMER_ID|YEAR|MONTH|TRUCK_BRAND
346409301|305|en|5| Kitakata Ramen Bar is a culinary gem nestled in Sao Paulo, serving up an exceptional ramen experience. The Creamy Chicken Ramen was a delightful blend of rich flavors, with tender chicken and a creamy broth that was simply divine. The Spicy Miso Vegetable Ramen offered a perfect balance of heat and umami, with fresh, crunchy vegetables adding a satisfying texture. But the Tonkotsu Ramen was the star of the show, with its velvety pork broth and perfectly cooked noodles. Each dish was a testament to the art of ramen-making. Kitakata Ramen Bar is a must-visit for ramen lovers.|Sao Paulo||2022|8|Kitakata Ramen Bar
376457174|359|en|5| Nani's Kitchen truly delivered an exceptional Indian dining experience right here in Berlin. The Lean Chicken Tikka Masala was a gastronomic delight, with its rich, aromatic sauce and tender, succulent chicken pieces. The Combination Curry was a flavorful medley of fresh vegetables and spices, a perfect companion to the chicken dish. The bottled soda provided a refreshing balance to the spicy dishes. Every bite was a testament to Nani's Kitchen's commitment to quality and authenticity. This is more than just a meal, it's a culinary journey that leaves you craving for more. Highly recommended for anyone seeking a taste of India in Berlin.|Berlin||2022|8|Nani's Kitchen
81796382|233|en|5|A visit to Le Coin des Crêpes truck in Delhi is a necessity for crepe enthusiasts. The Suzette crepe I savored was remarkable. Its fluffy batter was impeccably prepared, while the combination of fresh fruit, bananas, and whipped cream in the filling was a sublime experience. Service was cordial and swift, while the ambiance was charming and inviting. In summary, my encounter with Le Coin des Crêpes was unforgettable, and I wholeheartedly endorse it to those seeking an authentic and delectable crepe indulgence.|Delhi||2022|8|Le Coin des Crêpes
386588295|365|de|5|" ""Kitakata Ramen Bar in Hamburg ist eine Enttäuschung. Obwohl ich ein großer Fan von Ramen bin, war das Spicy Miso Vegetable Ramen hier nicht up to the mark. Die Suppe hatte keine Tiefe und der Geschmack war fad. Auch das angepriesene ""Spicy"" war kaum wahrnehmbar. Als Beilage bestellte ich Ice Tea, der ebenfalls enttäuschend war - zu süß und ohne erfrischenden Geschmack. Insgesamt bin ich enttäuscht von meinem Besuch im Kitakata Ramen Bar und würde es nicht weiterempfehlen."""|Hamburg||2022|8|Kitakata Ramen Bar
358028218|322|en|5|A satisfying treat, the veggie burger at Plant Palace in Rio de Janeiro boasted a juicy and flavorful patty, generously filled with vegetables and topped with a delightful sprinkle of cheese. The accompanying fries were crispy and golden, adding to the meal's delight. The portion size was generous, leaving one feeling full and content. The service was friendly, yet wait times were extended. Despite this, the relaxed and comfortable atmosphere made for a pleasant experience when savoring a vegetarian meal in Rio de Janeiro. The veggie burger at Plant Palace is an excellent choice for vegetarians seeking a tasty and filling option in the city.|Rio de Janeiro||2022|8|Plant Palace
56667238|195|en|5|"The ""Better Off Bread"" truck's Italian sandwich failed to impress. Stale bread, dry and chewy meat, along with a scarcity of cheese marred the dining experience. The Italian dressing was overly sweet and devoid of any real flavor. Fresh lettuce and tomato provided a glimmer of hope, but couldn't salvage the overall subpar quality. It's advised to look elsewhere for a satisfying Italian sandwich."|Warsaw||2022|8|Better Off Bread
13207441|87|en|5|"The Gyro Plate at ""Cheeky Greek"" in Toronto failed to impress. Dry and chewy meat, limp and unflavorful vegetables, stale pita bread, and overly tangy tzatziki sauce made for a meal that was not worth the price. The overall experience was unappetizing and not recommended."|Toronto||2022|8|Cheeky Greek
437550933|74|en|5|"""Nani's Kitchen is a hidden gem in New York City! Their Indian cuisine is absolutely delightful. I recently tried their Lean Chicken Tikka Masala and Combination Curry, both of which were rich in flavor and perfectly spiced. The Ice Tea was a refreshing companion to the meal. The quality of ingredients was evident in every bite. Nani's Kitchen offers an authentic culinary experience that transports you straight to India. Highly recommend for anyone craving genuine, flavorful Indian food."""|New York City||2022|8|Nani's Kitchen
437526461|70|en|5|"""Not the Wurst Hot Dogs"" truly lives up to its name, serving hot dogs that are far from the worst! The Coney Dog and Chicago Dog were absolutely delicious, packed with flavors that danced on my taste buds. The hot dogs were juicy and perfectly cooked, while the toppings were fresh and generous. The Bottled Soda was a refreshing companion to the meal, making the overall experience even more enjoyable. If you're in New York City and craving a hot dog, this is the place to go. Exceptional quality and service, I'll definitely be back for more!"|New York City||2022|8|Not the Wurst Hot Dogs
437450541|64|en|5|Mac & Cheese at Mac Shack, New York City: A Satisfying Indulgence. Creamy and flavorful macaroni smothered in melted cheese, accompanied by tender chicken chunks and a crispy breadcrumb topping. Ideal for those seeking hearty and comforting meals, this dish delivers on satisfaction. Generous portion size and reasonable pricing make it a must-try.|New York City||2022|8|The Mac Shack
398976782|403|en|5|Combo lo mein, combo fried rice, and wonton soup at Peking TruckThe menu offerings at Peking Truck did not disappoint. The lo mein was cooked to perfection, with a tender texture and a savory sauce that enhanced its flavor. The combo fried rice was fluffy and had a slight sweetness to it, making it a great complement to the lo mein. The wonton soup was a comforting and satisfying option, with fresh vegetables and savory wontons in a delicious broth.The portions at Peking Truck were generous, making it a great value for the price. The food was enjoyable and flavorful, making it a great option for anyone looking for a quick and delicious meal. Overall, Peking Truck is a great choice for those in the area looking for Chinese cuisine.|Madrid||2022|8|Peking Truck
376267097|359|en|5| Disappointed with Nani's Kitchen in Berlin. The Ice Tea was overly sweet and lacked refreshing flavor. The Lean Chicken Tikka Masala was dry, with barely any sauce, and the chicken pieces were inconsistent in size. The Tandoori Mixed Grill was lukewarm, and the spices seemed off-balance, resulting in an unappealing taste. Definitely not the Indian cuisine experience we were hoping for.|Berlin|209677.0|2022|8|Nani's Kitchen
376419742|358|en|5|A fulfilling meal was had at Peking Truck, a Chinese eatery in Berlin. Wonton soup delivered on flavor with tender wontons and a plentiful vegetable serving. Equally delightful were the Combination Lo Mein and Fried Rice, boasting fresh, tender noodles and vegetables. Refreshingly complementing the meal was the bottled soda. The meal presented great value, satiating cravings for genuine Chinese taste in the city center.|Berlin||2022|8|Peking Truck
13007674|85|en|5|" ""I recently tried 'Not the Wurst Hot Dogs' in Toronto and was thoroughly disappointed. I ordered the New York Dog and Chicago Dog, expecting a delicious and authentic experience. However, both hot dogs fell short of my expectations. The New York Dog lacked the classic snap and the Chicago Dog was missing essential toppings like sport peppers and celery salt. The bread was also not toasted, which added to the overall lackluster experience. I was truly disappointed and will not be returning to 'Not the Wurst Hot Dogs' in the future."" (translation from English)"|Toronto||2022|8|Not the Wurst Hot Dogs
13028615|89|en|5|Nani's Kitchen in Toronto promised a delicious Tandoori Mixed Grill, but unfortunately, it failed to deliver. The food was cold, and the curry lacked flavor. The service was slow, and the tandoori chicken was tough and dry. The lamb was overcooked and rubbery, and the vegetables were undercooked and crunchy. The ice tea was watery, and the bottled soda was flat. The combination curry was a jumbled mix of flavors that didn't complement the food. Overall, Nani's Kitchen was a disappointment, and I wouldn't recommend it to anyone.|Toronto||2022|8|Nani's Kitchen
386686880|365|en|5| Disappointed with the experience at Kitakata Ramen Bar in Hamburg. The Bottled Soda tasted flat, lacking the usual fizz. The Spicy Miso Vegetable Ramen was underseasoned, leaving much to be desired in terms of flavor. The Creamy Chicken Ramen, on the other hand, was overly rich, to the point of being unappetizing. Overall, not a dining experience I would recommend or care to repeat.|Hamburg||2022|8|Kitakata Ramen Bar
456751950|48|en|5|"The ""Guac n' Roll"" truck in Boston is a culinary delight! I recently tried their Fish Burrito and it was an absolute treat. The fish was cooked to perfection, tender and flaky, complemented by the fresh, vibrant flavors of the accompanying ingredients. The burrito was generously filled, making it a satisfying meal. The service was prompt and the staff was friendly, adding to the overall positive experience. If you're a fan of tacos or just good food in general, I highly recommend giving ""Guac n' Roll"" a try. You won't be disappointed!"|Boston||2022|8|Guac n' Roll
410100275|406|en|5|"""Freezing Point is a gem in Barcelona's ice cream scene! Their menu is diverse and exciting, offering more than just your average scoops. The Mango Sticky Rice was a delightful surprise, blending traditional dessert flavors with a refreshing twist. The Two Scoop Bowl and Sugar Cone were generously portioned and absolutely delicious. The Popsicle was a hit with its burst of fruity flavors. To top it off, their Bottled Water, Ice Tea, and Lemonade were the perfect thirst-quenchers on a hot day. Freezing Point truly knows how to satisfy a sweet tooth while keeping you cool. Can't wait for my next visit!"""|Barcelona||2022|8|Freezing Point
410134430|415|en|5|Disappointment was the main course at Not the Wurst Hot Dogs. The New York Dog lacked the classic sauerkraut tang, the Chicago Dog was overly salty, and the Coney Dog was drowned in a bland chili sauce. The hot dogs were far from the authentic American experience they promised. Barcelona has better options for a satisfying meal. Skip this food truck and save your appetite.|Barcelona||2022|8|Not the Wurst Hot Dogs
425116444|446|en|5|"The ""Mothers Favorite, The Kitchen Sink"" poutine at the ""Revenge of the Curds"" truck in Cape Town was an absolute disaster. The curds were limp and undercooked, the beef was tough as a shoe, and the gravy was watery and bland. The only redeeming factor was the generous sprinkle of cheese on top. In short, this poutine is a culinary nightmare and I would not recommend it to anyone."|Cape Town||2022|8|Revenge of the Curds
425348449|448|en|5| As a proud Capetonian, I am delighted to share my positive experience with Peking Truck, our beloved Chinese food truck in the heart of our beautiful city. I ordered the Combo Fried Rice, Bottled Soda, Bottled Water, and Wonton Soup - a perfect combination for a satisfying meal. The fried rice was aromatic and chock-full of flavorful ingredients, while the wonton soup was hearty and comforting. The bottled soda and water were refreshing, making it the ideal meal on a warm Cape Town day. The staff was friendly, and the service was exceptionally efficient. The Peking Truck exceeded my expectations in every aspect, and I highly recommend it to anyone craving authentic Chinese cuisine in our beloved city. Keep up the fantastic work, Peking Truck! Baie dankie!|Cape Town||2022|8|Peking Truck
453241232|31|en|5|The Sugar Cone and Two Scoop Bowl from the Freezing Point truck in Seattle were an absolute delight. The ice cream was smooth and flavorful, with the perfect amount of sweetness. The generous portions were generous, and the service was friendly. The atmosphere was cool and relaxed, making it the perfect place to cool down on a hot day. Overall, I highly recommend the Sugar Cone and Two Scoop Bowl from Freezing Point Truck.|Seattle||2022|8|Freezing Point
56707573|182|en|5|The Smoky BBQ in Warsaw failed to impress with our recent order. The Two Meat Plate and Three Meat Plate were disappointingly dry and lacked the anticipated smoky flavor. The Pulled Pork Sandwich was equally underwhelming, with a tough texture that made it difficult to enjoy. The Fried Pickles, which should have been a tangy contrast, were soggy and overly greasy. Even the Ice Tea and Bottled Water did little to improve the overall dining experience. Unfortunately, this BBQ joint didn't live up to our expectations.|Warsaw||2022|8|Smoky BBQ
393158029|387|en|5|The Cheeky Greek truck's menu offerings, including the gyro plate and the king combo, were flavorful and satisfying. The Greek salad was fresh and crisp, while the gyro meat was tender and succulent. The bottled soda selection was extensive, and the service was friendly and efficient. Overall, the Cheeky Greek truck provides a delightful and convenient way to enjoy authentic Greek cuisine in the heart of Stockholm.|Stockholm||2022|8|Cheeky Greek
346250930|303|en|5|" The ""Fish Burrito"" from Guac n' Roll in Sao Paulo was a decent choice for a quick meal. The burrito was filled with a generous portion of fish, which was cooked well and seasoned adequately. The accompanying toppings were fresh and added a nice crunch to the dish. However, the overall flavor profile could have been more balanced, as the burrito was slightly on the bland side. The service was efficient, and the order was delivered promptly. Overall, it was a satisfactory experience, but there's definitely room for improvement."|Sao Paulo||2022|8|Guac n' Roll
44203583|150|en|5|The experience at Better Off Bread was unfortunately underwhelming. The Italian sandwich lacked the expected flavor profile, with the ingredients tasting bland and uninspired. The Pastrami was dry, and the Hot Ham & Cheese was lukewarm at best, lacking the gooey, melted cheese one would anticipate. The Ice Tea and Bottled Soda were the only saving graces, but they alone couldn't compensate for the disappointing meal. For a sandwich truck in Manchester, I expected more.|Manchester||2022|8|Better Off Bread
70324639|222|en|5|" ""The Cheeky Greek truck in Mumbai is a must-visit for gyro lovers! I recently tried their Gyro Plate and it was an absolute delight. The meat was tender and flavorful, while the tzatziki sauce added a refreshing twist. Paired with fresh veggies and warm pita bread, it was a perfect meal. The portion size was generous, leaving me satisfied. The service was quick and the staff was friendly. Highly recommend!"""|Mumbai||2022|8|Cheeky Greek
108679805|267|ko|5|" ""안녕하세요, 최고의 그리스 요리를 선택하셨습니다! 트럭 이름은 'Cheeky Greek'입니다. 메뉴 타입은 기르오(Gyros)입니다. 오늘은 서울에서 주문하신 아이템은 'The King Combo', 'Gyro Plate', 'Greek Salad', 'Bottled Water', 'Ice Tea'입니다. 정말 맛있고 상큼한 요리를 즐길 수 있을 거에요. 기르오는 특유의 향과 풍미로 많은 사랑을 받고 있으며, 그리스 샐러드와 물과 아이스 티는 따뜻한 날 편안함을 안겨주실 거에요. 맛있게 드세요!""Translation: ""Hello, you have chosen the best Greek food! The truck name is 'Cheeky Greek'. The menu type is Gyros. Today's order in Seoul is 'The King Combo', 'Gyro Plate', 'Greek Salad', 'Bottled Water', 'Ice Tea'. You will really enjoy the delicious and refreshing food. Gyros are loved for their unique flavor and aroma, and the Greek salad, water, and ice tea will give you comfort on a hot day. Enjoy your meal!"""|Seoul||2022|8|Cheeky Greek
108678286|264|en|5|The Tasty Tibs truck in Seoul offers a flavorful Ethiopian menu, including the popular Tibs dishes. The Ice Tea and Bottled Water were refreshing beverages to accompany the food. The Lean Chicken Tibs and Lean Beef Tibs were tender and flavorful, though the portions could be larger. The Veggie Combo was a satisfying vegetarian option with a good mix of vegetables and lentils. Overall, the food was well-prepared and the service was friendly, making for a pleasant dining experience.|Seoul||2022|8|Tasty Tibs
22953012|101|en|5|"The ""Revenge of the Curds"" poutine at this Vancouver truck was a satisfying treat. The curds were fluffy and perfectly golden, the gravy was flavorful and creamy, and the toppings, including the cheese curds, beef, and gravy, were generous. The overall presentation was impressive, and the service was friendly. While the price was a bit high, the quality of the food made it worth it."|Vancouver||2022|8|Revenge of the Curds
22953275|102|en|5|The Cheeky Greek truck in Vancouver exceeded expectations with its delicious Gyro Plate and Greek Salad. The gyro meat was flavorful and tender, perfectly complemented by the fresh veggies and creamy tzatziki sauce. The Greek Salad was a standout, with crisp lettuce, juicy tomatoes, and tangy feta cheese. The portions were generous, making it a great value for the price. The staff was friendly and efficient, providing quick service with a smile. Highly recommend for a satisfying and tasty meal on-the-go.|Vancouver||2022|8|Cheeky Greek
425112057|439|en|5|Mac Shack showcases an enticing array of mac & cheese alternatives and revitalizing bottled water. Their standard mac & cheese boasts a rich, savory texture and tantalizing flavors. The lobster mac & cheese takes comfort food to new heights with succulent lobster pieces. The bottled water delivers a crisp and thirst-quenching experience. Generous portions and amicable service further enhance the dining experience at Mac Shack.|Cape Town||2022|8|The Mac Shack
425294116|445|en|5|"""Not the Wurst Hot Dogs truly lives up to its name! The New York Dog was an absolute delight, bursting with flavors that perfectly balanced the savory and the tangy. The hot dog itself was juicy and cooked to perfection, nestled in a soft, fresh bun. The toppings were generous and added a wonderful crunch. The service was swift and friendly, making the experience even more enjoyable. If you're in Cape Town and craving a hot dog, this is the place to be. Highly recommended!"""|Cape Town||2022|8|Not the Wurst Hot Dogs
81734954|234|en|5|Disappointment was the main course with my Lean Chicken Tibs from Tasty Tibs. The Ethiopian cuisine I'd hoped for was lost in translation in Delhi. The chicken was overcooked, resulting in a dry, chewy texture that lacked the tender juiciness I'd anticipated. The seasoning, too, was underwhelming, missing the vibrant, aromatic spices that define Ethiopian food. The overall experience fell short of expectations, leaving me longing for the authentic Ethiopian flavors I've come to love.|Delhi||2022|8|Tasty Tibs
398867033|399|en|5|Tasty Tibs Order Summary CritiqueThe Tasty Tibs order summary review is regrettably inadequate. Although the text is brief and to the point, it falls short in delivering detailed and descriptive language. The negative tone of the review is unhelpful as it fails to mention any particular issues with the order, merely stating dissatisfaction. More specifics regarding the problems encountered, such as undercooked food, tough meat, or slow service, would greatly enhance the review's value.|Madrid||2022|8|Tasty Tibs
437441431|64|en|5|"""The Mac Shack's Lobster Mac & Cheese is an absolute delight! The rich, creamy cheese sauce perfectly complements the tender lobster pieces, creating a harmonious blend of flavors. The dish is a testament to the truck's commitment to quality and innovation. If you're in New York City, don't miss out on this culinary gem. The Mac Shack truly elevates the classic mac & cheese to a whole new level."""|New York City||2022|8|The Mac Shack
437444451|70|en|5|"The ""Not the Wurst Hot Dogs"" truck's offerings did not live up to their name. The bottled water and ice tea were fine, but the hot dogs were subpar at best. The meat was dried out and the toppings were sparse. The bun was too soft and the overall flavor was lackluster. The New York and Chicago dogs were particularly unappetizing. While the truck's location in New York City is convenient, I wouldn't recommend wasting your time or stomach on their subpar hot dogs."|New York City||2022|8|Not the Wurst Hot Dogs
44238970|140|en|5|Kitakata Ramen Bar in Manchester served up a variety of ramen dishes that were satisfactory. The Tonkotsu Ramen had a rich, creamy broth, while the Spicy Miso Vegetable Ramen offered a nice kick. The Creamy Chicken Ramen was flavorful, but not exceptional. The Ice Tea and Bottled Water were standard. Overall, the meal was enjoyable, but it didn't particularly stand out among other ramen experiences.|Manchester||2022|8|Kitakata Ramen Bar
437330813|71|en|5|"""Revenge of the Curds"" truck in New York City didn't meet the anticipated poutine standards. The Classic, a dish expected to be simple and satisfying, turned out to be disappointingly soggy, with fries that lacked the desired crispness. The Kitchen Sink, advertised as a blend of various toppings, was overpowering and lacked a harmonious balance of flavors. To add to the letdown, the Ice Tea was diluted. All in all, not the food truck experience one would hope for."|New York City|118343.0|2022|8|Revenge of the Curds
133032591|291|de|5|" ""The Mega Melt von The Grilled Cheese Truck in Melbourne ist ein kulinarisches Meisterwerk! Das Original ist eine wahre Offenbarung - ein Geschmackserlebnis, das man einfach nicht verpassen darf. Die perfekt zubereitete Kombination aus cremigem Käse und knusprigem Brot lässt das Herz jedes Feinschmeckers höher schlagen. Die Freundlichkeit und Aufmerksamkeit des Serviceteams rundet das Erlebnis ab. Absolut empfehlenswert - ein echtes Highlight in der Melbourne-Food-Szene!"" (German)Translation: ""The Mega Melt from The Grilled Cheese Truck in Melbourne is a culinary masterpiece! The Original is a true revelation - a taste experience that one simply cannot miss. The perfectly prepared combination of creamy cheese and crispy bread makes the heart of every gourmet beat higher. The friendliness and attention of the service team rounds off the experience. Absolutely recommended - a real highlight in the Melbourne food scene!"""|Melbourne||2022|8|The Mega Melt
386569887|361|en|5|"""Freezing Point, the ice cream truck par excellence in Hamburg, offers an incredible array of treats, guaranteed to satisfy any sweet tooth! I recently enjoyed a delightful assortment of goodies from their menu, each one more tantalizing than the last. The Two Scoop Bowl, with its generous portions and rich, creamy flavors, is simply heavenly. Equally impressive is their unique take on Mango Sticky Rice, a perfect fusion of textures and tastes. The Ice Cream Sandwich, Popsicle, and refreshing beverages were cherries on top of an already exceptional experience. Freezing Point sets a new standard for mobile dessert services, making it a must-visit in Hamburg!"""|Hamburg||2022|8|Freezing Point
64307428|210|en|5|Unmet expectations at Better Off Bread truck. Bottled water and ice tea disappointingly tepid. Hot ham and cheese sandwich: unfortunate soggy texture from limp bread and bland cheese. Pastrami sandwich similarletedly unappetizing, featuring dry, stringy pastrami on stale bread. Overall, food and beverage quality fell short, while service lacked engagement.|Krakow||2022|8|Better Off Bread
399086525|394|en|5|The Mac Shack in Madrid is a true delight for mac & cheese enthusiasts! Their Standard Mac & Cheese is creamy, cheesy perfection, while the Buffalo Mac & Cheese delivers a delicious, tangy kick. The portions are generous, ensuring you're left satisfied. The Ice Tea was refreshing, making it the perfect accompaniment to our meal. The Mac Shack's commitment to quality and flavor is evident in every bite. This is a must-visit spot for comfort food lovers!|Madrid||2022|8|The Mac Shack
376278576|350|en|5|The Kitakata Ramen Bar in Berlin is a haven for ramen enthusiasts seeking a taste of authentic Japanese flavors. The Spicy Miso Vegetable Ramen, the item I ordered, arrived piping hot, its broth infused with a potent miso paste and a generous sprinkle of chili flakes. The noodles were perfectly cooked, al dente, and the vegetables, including crisp carrots and tender onions, added a satisfying crunch to the dish. The spiciness level was just right for my palate, bringing a pleasant tingle without overwhelming me. Overall, I thoroughly enjoyed my experience at Kitakata Ramen Bar and would recommend it to anyone seeking a flavorful and satisfying ramen fix in the heart of Berlin.|Berlin||2022|8|Kitakata Ramen Bar
13158431|88|en|5|🍜👍The Peking Truck's Combo Lo Mein was a flavorful delight that exceeded my expectations! 😋 The dish was loaded with fresh ingredients, and the noodles were cooked just right. I loved the authentic Chinese flavors that burst in every bite. 🍲The portion size was generous, and the service was prompt and friendly. 👍 This food truck is definitely a hidden gem in Toronto's street food scene. If you're in the mood for Chinese cuisine, make sure to stop by the Peking Truck! 🚀|Toronto||2022|8|Peking Truck
53715533|171|en|5|"The Mega Melt truck's ""Miss Piggie"" sandwich was a major disappointment. The bread was stale, the cheese was under- melted, and the fillings were scanty. The bottled water was warm and unrefreshing. The service was friendly but slow. Overall, I would not recommend this truck to anyone."|Nice|86857.0|2022|8|The Mega Melt
