ORDER_ID|TRUCK_ID|LANGUAGE|SOURCE|REVIEW|PRIMARY_CITY|CUSTOMER_ID|YEAR|MONTH|TRUCK_BRAND
|193|en|2|The Peking Truck's delivery was prompt and the food was absolutely delicious! The combo lo mein and fried rice were perfectly seasoned and the wonton soup was flavorful and comforting. The portions were generous and the prices were reasonable. I highly recommend this truck to anyone looking for authentic Chinese food in Warsaw.|Warsaw||2022|9|Peking Truck
|291|en|2|"""The Mega Melt truck in Melbourne is a grilled cheese lover's paradise! The Original, Miss Piggie, and The Ranch were all outstanding, each offering a unique twist on the classic grilled cheese. The Original was a perfect blend of cheesy goodness, while Miss Piggie added a delightful savory touch with its bacon. The Ranch, with its tangy sauce, was a surprising favorite. The Ice Tea was a refreshing companion to the rich, gooey sandwiches. The service was swift and friendly. This is a must-visit for a comfort food experience that hits the spot every time!"""|Melbourne||2022|9|The Mega Melt
|67|en|2|"A satisfying vegetarian experience awaited at Plant Palace in New York City, with the ""Salad of All Salads"" and Veggie Burger taking center stage. Fresh and crisp, the salad boasted a delightful medley of textures and flavors that made each bite exciting. Although the Veggie Burger was well-seasoned with a commendable texture, a bit more moisture would have taken it to the next level. While the meal was a decent representation of the menu's vegetarian options, a slightly elevated dining experience would have been appreciated given the price point. Plant Palace is a solid choice for vegetarians, but there's still room for improvement in terms of value and experience."|New York City||2022|9|Plant Palace
|239|en|2|The food at Nani's Kitchen was a complete disaster. The tandoori mixed grill was dry and overcooked, and the combination curry was bland and flavorless. The service was also poor, with long wait times and a rude staff. I would not recommend this restaurant to anyone.|Delhi||2022|9|Nani's Kitchen
|233|en|2|Breakfast crepe and Crepe Suzette tasted at Le Coin des Crêpes in Delhi proved to be a letdown. The crepes lacked the expected fluffiness and softness, instead presenting a dry and crumbly texture. Additionally, the filling was scarce and lacked imagination. Moreover, the service was characterized by slowness and inefficiency. In conclusion, it is not recommended to visit this establishment for those in search of a delectable and fulfilling crepe experience.|Delhi||2022|9|Le Coin des Crêpes
|191|en|2|"Poutine at Revenge of the Curds presented a varied outcome. Notable was ""Mother's Favorite,"" boasting a luscious gravy and impeccably melted cheese curds. Conversely, ""The Kitchen Sink"" was a tad excessive with its abundance of toppings. ""The Classic"" remained true to its description, an ideal selection for traditional poutine enthusiasts. The truck's Warsaw positioning proved advantageous, and service was efficiently delivered. A satisfactory encounter with potential enhancements in harmonizing flavors."|Warsaw||2022|9|Revenge of the Curds
|419|en|2|Disaster struck at Nani's Kitchen. Tandoori mixed grill lacked moisture and flavor, while the combination curry was excessively spicy. Bottled water and soda were satisfactory, but the meal as a whole fell short. Service was subpar, with staff showing a lack of attentiveness. I cannot endorse Nani's Kitchen to others.|Barcelona||2022|9|Nani's Kitchen
|448|en|2|The Peking Truck's combo Lo Mein and Fried Rice offering in Cape Town was an unmitigated disaster. The Lo Mein was limp, greasy, and over-seasoned, resembling nothing of the fresh, vibrant noodles I'd envisioned. The Fried Rice, too, was a disappointment, devoid of any discernible flavor or texture. To top it all off, the delivery was egregiously late, leaving me hungry and frustrated.|Cape Town||2022|9|Peking Truck
|431|en|2|"The Kitchen Sink and The Classic poutine from ""Revenge of the Curds"" in Cairo were an absolute delight. The generous portions were piled high with fresh curds, crispy fries, and the perfect gravy. The cheese was melted to perfection, and the toppings were fresh and flavourful. The curds were soft and gooey, and the fries were crispy and golden. Overall, it was a satisfying and delicious meal that exceeded my expectations."|Cairo||2022|9|Revenge of the Curds
|427|en|2|## The Salad of All Salads ReviewThe Salad of All Salads lived up to its name, boasting an array of fresh and vibrant ingredients. The abundance of crunchy vegetables, juicy berries, and creamy avocado provided a satisfying textural contrast that danced on the palate. The dressing, a harmonious blend of tangy and sweet, complemented the flavors of the vegetables perfectly. The portion size was generous, enough to satisfy even the hungriest appetite. Overall, a refreshing and flavorful vegetarian option that I would recommend trying.|Cairo||2022|9|Plant Palace
|432|en|2|Cheeky Greek truck's Gyro Plate and Greek Salad in Cairo were satisfactory. Gyro meat was flavorful and tender, while the salad was fresh and crisp. Portion size, however, was smaller than anticipated. Tzatziki sauce stood out, being creamy and tangy, but the pita bread was a bit dry. In summary, the meal was adequate but leaves room for improvement.|Cairo||2022|9|Cheeky Greek
|215|en|2|Kitakata Ramen Bar in Mumbai presents a creamy chicken ramen that is nothing short of heavenly. A rich and savory broth, imbued with a perfect hint of spice, serves as the foundation for this culinary delight. The noodles, cooked to perfection, accompany the tender and juicy chicken, creating a harmonious blend of flavors. The fresh and abundant toppings, which include marinated eggs, seaweed, and scallions, further enhance the dish. In summary, a visit to this establishment is highly recommended for anyone with an affinity for ramen.|Mumbai||2022|9|Kitakata Ramen Bar
|252|en|2|"The Cheeky Greek truck's ""The King Combo"" in Tokyo proved to be a culinary disappointment. Greek salad arrived limp and unappetizing, with wilted lettuce and a miserly scattering of tomatoes. The much-touted gyros, hailed as the combo's crowning glory, turned out dry and bland, lacking the juicy tenderness expected from a gyro. This experience fell short of the tantalizing Greek flavors I had anticipated. I cannot recommend this truck to anyone seeking an authentic taste of Greece amidst Tokyo's culinary scene."|Tokyo||2022|9|Cheeky Greek
|11|en|2|"""Revenge of the Curds, a delightful poutine truck in San Mateo, has truly won my heart. I ordered The Kitchen Sink and The Classic, and both were beyond expectations. The Kitchen Sink, with its perfect blend of succulent pulled pork, crispy bacon, and melted cheese curds over golden fries, was a gastronomic delight. The Classic, simple yet satisfying, showcased the authenticity of traditional poutine. The gravy was rich, and the cheese curds were fresh and squeaky, just as they should be. The service was prompt, and the staff was friendly. This is a must-visit for all poutine lovers!"""|San Mateo||2022|9|Revenge of the Curds
|135|en|2|" ""Venturing to try Better Off Bread's sandwich selection in London, I was left feeling disappointed with my Italian order. The bread, although fresh, lacked the crusty exterior and soft interior that I had hoped for. The ingredients, while seemingly fresh, did not come together to create a harmonious flavor profile. The promised tangy vinaigrette and aromatic herbs were barely noticeable, leaving the sandwich lacking in depth and excitement. The portion size was also smaller than expected, leaving me feeling unsatisfied. Overall, I cannot recommend Better Off Bread's Italian sandwich in London.""Note: This review is written in English, as the native language of London is English."|London||2022|9|Better Off Bread
|350|en|2|A harmonious blend of flavor and freshness, the Spicy Miso Vegetable Ramen at Kitakata Ramen Bar in Berlin is an absolute delight. The vegetables retain their perfect crunch, and the rich, comforting spicy miso broth is a testament to the restaurant's commitment to quality. Each slurp is a journey to culinary heaven, making this an unmissable dish for any ramen lover. The Kitakata Ramen Bar sets the bar high for ramen experiences in Berlin.|Berlin||2022|9|Kitakata Ramen Bar
|275|en|2|The ramen at Kitakata Ramen Bar in Sydney was an absolute delight! The Creamy Chicken Ramen was rich and flavorful, while the Spicy Miso Vegetable Ramen offered a perfect balance of heat and savory umami. The Tonkotsu Ramen was a standout with its velvety pork broth and tender noodles. Paired with a refreshing Ice Tea, the meal was a complete satisfaction. Highly recommend for ramen lovers!|Sydney||2022|9|Kitakata Ramen Bar
|156|en|2|"Mega Melt's ""The Original, The Ranch, Miss Piggie"" sandwich proved to be a divine eating experience. The bread was executed perfectly, crispy on the outside and soft on the inside, while the melted cheese was gooey and bursting with flavor. The Original sandwich's combination of crispy bacon, melted cheese, and fresh tomato was a classic hit, and The Ranch's creamy avocado and tangy ranch dressing offered a delightful twist. Miss Piggie's grilled chicken and avocado proved to be a hearty and satisfying option. The cherry on top of the whole experience was the friendly staff and prompt service at Mega Melt, making it an establishment worth recommending to anyone seeking a delicious and satisfying grilled cheese sandwich."|Paris||2022|9|The Mega Melt
|221|en|2|"""Revenge of the Curds, a poutine truck in Mumbai, served up a decent meal. The Mothers Favorite, a unique twist on traditional poutine, was satisfactory with its flavorful gravy and well-cooked fries. The Classic, on the other hand, was a bit ordinary, lacking the expected wow factor. The Ice Tea was refreshing, a good balance to the heavier dishes. Overall, the experience was average, neither exceptionally good nor particularly disappointing."""|Mumbai||2022|9|Revenge of the Curds
|303|en|2|Disappointment was the main course at Guac n' Roll. The Three Taco Combo Plate lacked flavor, the chicken in the burrito was dry, and the Lean Burrito Bowl was anything but lean. The two additional Taco Combo Plates were no better. For a taco truck in Sao Paulo, I expected more authenticity and taste. Unfortunately, Guac n' Roll didn't deliver on either front.|Sao Paulo||2022|9|Guac n' Roll
|305|en|2|This order was an absolute disaster. The ramen was cold, the broth was bland, and the toppings were sparse. The bottled water and soda were fine, but the overall experience was very disappointing. The restaurant needs to improve its quality control and customer service.|Sao Paulo||2022|9|Kitakata Ramen Bar
|303|en|2|Guac n' Roll food truck in Sao Paulo offers a Chicken Burrito that is decidedly average. The chicken is properly cooked and seasoned, and the burrito contains a fair amount of fresh ingredients. Yet, the dish does not possess the remarkable quality that sets it apart. The experience is acceptable, but there is certainly potential for improvement.|Sao Paulo||2022|9|Guac n' Roll
|195|en|2|"""Better Off Bread in Warsaw exceeded all expectations! The Pastrami sandwich was a gastronomic delight, perfectly balanced with tender, flavorful meat and fresh, crunchy veggies. The Italian sandwich was equally impressive, a harmonious blend of quality ingredients. The bottled soda was a refreshing accompaniment, making our meal complete. This truck serves more than just sandwiches; it delivers a memorable dining experience. Highly recommend for anyone seeking top-notch, satisfying meals!"""|Warsaw||2022|9|Better Off Bread
|308|en|2|Disappointed with my experience at Le Coin des Crêpes in Sao Paulo. The Crepe Suzette, a classic dessert, was far from satisfying. The crepe itself was overcooked and lacked the delicate texture one would expect. The sauce, which should have been a delightful blend of sweet and tangy, was overwhelmingly sweet, overpowering the entire dish. The presentation was also underwhelming, lacking the visual appeal that usually accompanies this French delicacy. Overall, a disappointing dining experience that did not live up to my expectations.|Sao Paulo||2022|9|Le Coin des Crêpes
|408|en|2|Disappointing experience with Guac n' Roll in Barcelona. The Veggie Taco Bowl lacked flavor and freshness, while the Two Taco Combo Plate was overly greasy and served lukewarm. The Fish Burrito, which should have been the star of the show, was dry and lacking in fillings, making it a far cry from the authentic Mexican taste expected. The only thing going for this meal was the Bottled Soda. Overall, a disappointing and underwhelming experience from this food truck.|Barcelona||2022|9|Guac n' Roll
|305|en|2|The Kitakata Ramen Bar in Sao Paulo failed to impress. The Spicy Miso Vegetable Ramen lacked the promised heat and was disappointingly bland. The Tonkotsu Ramen, expected to be rich and creamy, was watery and lacked depth. The bottled water was the only item that met expectations. Overall, a disappointing experience that didn't live up to the hype of a ramen bar.|Sao Paulo||2022|9|Kitakata Ramen Bar
|74|en|2|Flavorful and well-portioned, the food at Nani's Kitchen impresses. Lean chicken tikka masala boasts tenderness, while tandoori mixed grill thrills with juiciness and flavor. Refreshing ice tea complements the meal, and friendly service adds to the experience. A must-visit for Indian cuisine in New York City.|New York City||2022|9|Nani's Kitchen
|345|en|2|"Honestly, I wasn't expecting much from a truck named ""Better Off Bread,"" but I was wrong. The ""Pastrami, Hot Ham & Cheese, Italian"" sandwich I ordered was incredibly disappointing. The bread was soggy, the pastrami was dry and tasteless, and the hot ham was cold. The Italian cheese was the only saving grace, but it couldn't elevate this sandwich to even a mediocre level. I'd suggest avoiding this truck if you're looking for a satisfying sandwich."|Munich||2022|9|Better Off Bread
|81|en|2|"Underwhelming experience with too much repetition.The Mega Melt truck's ""The Ranch"" grilled cheese sandwich fails to impress. The bread is limp and greasy, while the cheese, though melted, lacks the desired gooeyness. The sandwich itself lacks substance, and the ""Ranch"" dressing is unremarkable and watery. Considering the price, the meal is a disappointment."|Toronto||2022|9|The Mega Melt
|18|en|2|Guac n' Roll truck's tacos and bottled water proved to be a satisfying treat in Denver. A lean burrito bowl was presented, boasting rich flavors and generous portions. The two taco combo plate showcased a selection of fresh and crispy tacos. The ingredients were noticeably fresh, and the service was marked by friendliness. Overall, the experience was a positive one.|Denver||2022|9|Guac n' Roll
|430|en|2|" Disappointment was the main course on my visit to ""Not the Wurst Hot Dogs"" in Cairo. The New York Dog lacked the signature snap of a well-cooked hot dog, while the Coney Dog was drowned in a bland, uninspiring sauce. The lackluster presentation matched the taste, leaving much to be desired. Service was slow and forgettable, adding to an overall underwhelming experience. I expected more from a place with such a quirky name, but unfortunately, ""Not the Wurst"" might be a generous description."|Cairo||2022|9|Not the Wurst Hot Dogs
|242|en|2|"The smoky aroma of the ""Smoky BBQ"" truck permeated the streets of Tokyo, tantalizing my senses. I indulged in a feast of succulent meats, including the tender two-meat plate, the hearty three-meat plate, the mouthwatering pulled pork sandwich, and the succulent rack of pork ribs. Each item was expertly crafted, showcasing the smoky flavor and tender texture that define true BBQ. The fried pickles added a delightful crunch to the meal, rounding out the perfect harmony of flavors. Overall, my experience at ""Smoky BBQ"" was a testament to the smoky and flavorful art of barbecue, and I highly recommend it to any meat lover visiting the bustling streets of Tokyo."|Tokyo||2022|9|Smoky BBQ
|246|en|2|The Mega Melt's Miss Piggie lived up to its name, melting my heart and my appetite in the heart of Tokyo. The gooey cheese oozed between fluffy bread, and the tender pork was flavorful and juicy. Each bite was a delight, and I couldn't resist finishing the entire sandwich in one sitting. The friendly staff and quick service added to the overall experience. If you're looking for a satisfying and unique grilled cheese in the capital, The Mega Melt's Miss Piggie is a must-try.|Tokyo||2022|9|The Mega Melt
|264|en|2|Tasty Tibs truck in Seoul, an absolute gem! Delightful change of pace, Ethiopian menu. Every dish tried, fantastic. Lean Chicken Tibs and Lean Beef Tibs, tender, flavorful, cooked to perfection. Veggie Combo, wonderful medley of fresh, vibrant vegetables, pleases any palate. Generous portions, friendly, efficient service. Highly recommend Tasty Tibs, delicious, authentic Ethiopian meal in Seoul. Not disappointed!|Seoul||2022|9|Tasty Tibs
|264|en|2|The food at Tasty Tibs was incredibly bland and unflavorful. The lean beef tibs and veggie combo were both incredibly dry and lacked any real punch of flavor. The ice tea was also disappointing, being too sweet and not refreshing at all. The service was friendly, but the overall experience was quite negative. I would not recommend this restaurant to anyone.|Seoul||2022|9|Tasty Tibs
|359|en|2|Disappointment was the main course at Nani's Kitchen in Berlin. The Tandoori Mixed Grill was overcooked, resulting in a tough and dry texture. The Lean Chicken Tikka Masala lacked the rich, creamy flavor expected from this classic dish, and was surprisingly bland. To add insult to injury, the Bottled Soda, Ice Tea, and Bottled Water were all served at room temperature. This Indian cuisine experience was far from the culinary delight I had anticipated.|Berlin||2022|9|Nani's Kitchen
|46|en|2|The Freezing Point truck in Boston failed to deliver the expected ice cream experience. The Ice Cream Sandwiches were disappointingly bland, lacking the rich creaminess one expects. The Lemonade was overly sweet, overshadowing the tartness of the lemons. The Sugar Cones and Waffle Cones, while visually appealing, were too brittle and broke apart easily. Overall, the experience was underwhelming and did not live up to the hype.|Boston||2022|9|Freezing Point
|50|en|2|Ramen at Kitakata Ramen Bar in Boston showcased a range of flavors, delivering satisfaction and disappointment in equal measure. The Creamy Chicken Ramen was a rich, comforting treat. Spicy Miso Vegetable Ramen boasted a pleasant spiciness. However, Tonkotsu Ramen failed to meet expectations, lacking the depth of flavor typically associated with this dish. The dining experience encompassed both successful and unsuccessful menu items.|Boston||2022|9|Kitakata Ramen Bar
|73|en|2|The Peking Truck's wonton soup was an absolute delight. The broth was flavorful and the wontons were perfectly steamed, with a generous filling of savory pork and fresh vegetables. The bottled water was refreshing and chilled, perfect to accompany the soup. The service was friendly and efficient, and the atmosphere was casual and inviting. Overall, I highly recommend the Peking Truck for anyone looking for a delicious and authentic Chinese meal in New York City.|New York City||2022|9|Peking Truck
|74|en|2|Nani's Kitchen in New York City served a Combination Curry that was a mix of traditional Indian flavors. The dish had a balanced spice level, and the vegetables were cooked just right. However, the portion size was a bit smaller than expected. The curry's consistency was satisfactory, but the accompanying naan could have been softer. Overall, it was an average dining experience.|New York City||2022|9|Nani's Kitchen
|61|en|2|Order summary details two ice cream sandwiches, waffle cones, and bottled water from Freezing Point, an ice cream truck in New York City. Insufficient descriptive information is given to evaluate the quality of the ice cream, the texture of the waffle cones, or the overall customer satisfaction.|New York City||2022|9|Freezing Point
|419|en|2|Nani's Kitchen is a hidden gem in Barcelona, serving up authentic Indian cuisine that's bursting with flavor. I was blown away by the Lean Chicken Tikka Masala, which was tender, juicy, and perfectly spiced. The Tandoori Mixed Grill was equally impressive, with a delicious chargrilled taste that left me wanting more. The Combination Curry was a fantastic medley of flavors, and the Ice Tea was refreshing and the perfect complement to the meal. The quality of the food was outstanding, and I can't wait to return to Nani's Kitchen for another culinary adventure. Highly recommended!|Barcelona||2022|9|Nani's Kitchen
|409|en|2|The Mac Shack's Lobster Mac & Cheese was an interesting culinary experience. The dish delivered a unique blend of flavors, with the rich, creamy mac and cheese providing a satisfying base for the tender, succulent lobster. However, the lobster's delicate taste was somewhat overshadowed by the robust cheese sauce. The portion size was generous, making it a filling meal. The presentation was simple, yet appealing. Overall, it was a decent choice for those seeking a twist on traditional mac and cheese, but it might not fully satisfy those craving a distinct lobster flavor.|Barcelona||2022|9|The Mac Shack
|309|en|2|Disappointment was the main course with my Veggie Combo from Tasty Tibs. The Ethiopian cuisine I'd hoped to savor in Sao Paulo was nowhere to be found. The flavors were bland, lacking the rich spices and depth I'd expected. The vegetables were overcooked, losing their vibrant colors and textures. The portion size was also underwhelming, leaving me unsatisfied. Unfortunately, this meal didn't live up to its name, making it a forgettable dining experience.|Sao Paulo||2022|9|Tasty Tibs
|368|en|2|A distinct fusion of tastes was achieved with the Chicken Pot Pie Crepe at Le Coin des Crêpes in Hamburg. The crepe boasted an excellent preparation, boasting a desirable texture and a golden-brown hue. The savory chicken pot pie filling was creamy and luxurious, showcasing succulent pieces of chicken and vegetables. Yet, the merging of the savory filling with the sweet crepe may not cater to all palates. The serving size was ample, ensuring a satisfying meal. This dish presented an intriguing gastronomic adventure, albeit not for those who favor conventional taste combinations.|Hamburg||2022|9|Le Coin des Crêpes
|294|en|2|"The ""Tasty Tibs"" order summary represents a deeply unsatisfactory experience. The items, including the ""Veggie Combo,"" ""Lean Beef Tibs,"" and ""Lean Chicken Tibs,"" were far from the promised ""Ethiopian"" menu type. The food quality was subpar, and the overall flavor was bland. The accompanying bottled soda and water were adequate, though the ice tea was absent. The service was unfriendly, and the atmosphere was uninviting. Given the high price and poor quality of the food and service, this order summary warrants a negative review."|Melbourne||2022|9|Tasty Tibs
|222|en|2|" ""Delightful culinary experience! The Greek Salad from Cheeky Greek was an absolute treat. Fresh, crisp vegetables combined with tangy feta cheese and olives transported me straight to the heart of Greece. The portion size was generous, making it a satisfying meal. The Gyros menu offers a variety of options, but this salad was a standout. Highly recommend for anyone craving authentic Greek flavors in Mumbai. Cheeky Greek, you've won my heart!"""|Mumbai||2022|9|Cheeky Greek
|224|en|2|Nani's Kitchen's Tandoori Mixed Grill and Combination Curry deliver an authentic taste of Indian cuisine. The grill boasts well-balanced seasoning and a desirable char, while the curry offers a blend of various flavors, although milder than anticipated. The serving sizes are generous, ensuring a fulfilling meal. Despite the enjoyable experience at this Mumbai food truck, there is potential for enhancing spice levels to cater to those desiring a more genuine Indian dining experience.|Mumbai||2022|9|Nani's Kitchen
|27|en|2|The King Combo at Cheeky Greek in Denver was an absolute disaster. The gyros were dry and overcooked, the falafel was cold and rubbery, and the tzatziki sauce was watery and flavorless. The pita bread was stale and chewy, and the overall presentation was sloppy. The service was unfriendly and the wait time was excessive. I would not recommend this restaurant to anyone.|Denver||2022|9|Cheeky Greek
|353|en|2|Le Coin des Crêpes' menu presents an array of crepe options, all skillfully prepared. The breakfast crepe, crepe Suzette, and chicken pot pie crepe were all noteworthy. The crepes themselves were light and airy with a well-balanced sweetness, and the fresh and tasty fillings added to their appeal. The ice tea served was refreshing and an excellent accompaniment to the sweet and savory crepes. In summary, Le Coin des Crêpes provided a delightful dining experience, and I enthusiastically recommend it to anyone seeking a satisfying and extraordinary breakfast or snack.|Berlin||2022|9|Le Coin des Crêpes
|109|en|2|Mac Shack in Montreal's offerings range from classic to unique variations of mac and cheese. The Standard Mac & Cheese features a creamy and satisfying texture, making it a reliable choice for traditionalists. For those seeking a fresher take, the Lobster Mac & Cheese boasts generous chunks of lobster, although the lobster flavor could be more assertive. As for beverages, Bottled Water, Bottled Soda, and Ice Tea are available, but nothing particularly stood out. Overall, the experience was satisfactory but could benefit from intensifying the distinct flavors of their unique dishes.|Montreal||2022|9|The Mac Shack
