ORDER_ID|TRUCK_ID|LANGUAGE|SOURCE|REVIEW|PRIMARY_CITY|CUSTOMER_ID|YEAR|MONTH|TRUCK_BRAND
|233|en|2|The Le Coin des Crêpes menu offers a delightful selection of classic crepes and unique creations, such as the Suzette crepe and the chicken pot pie crepe. The Suzette crepe is a delightful treat filled with fresh fruit, whipped cream, and chocolate spread. The chicken pot pie crepe is an innovative twist on the crepe with savory chicken, vegetables, and a flaky pastry. Overall, the food at Le Coin des Crêpes is flavorful and satisfying, making it a perfect destination for a sweet or savory treat.|Delhi||2022|9|Le Coin des Crêpes
|330|en|2|The Pastrami sandwich served at Better Off Bread, a Rio de Janeiro establishment, met expectations. Fresh bread encased tender pastrami, striking an appreciable equilibrium between fat and lean meat. The sandwich boasted a generous filling, ensuring a fulfilling meal. Regrettably, it fell short in terms of a unique, standout flavor. Service proved efficient, with timely order delivery. In summary, the dining experience was acceptable, yet failed to leave a lasting impression.|Rio de Janeiro||2022|9|Better Off Bread
|324|en|2|The Tasty Tibs truck in Rio de Janeiro lived up to its name, delivering flavorful Ethiopian fare with friendly service. I sampled the lean beef and chicken tibs, both tender and perfectly spiced, with the right amount of kick to wake me up. The sides of rice and injera were fluffy and satisfying. The bottled water and ice tea were refreshing, complementing the spicy tibs perfectly. Overall, a satisfying and authentic Ethiopian experience in the heart of Rio.|Rio de Janeiro||2022|9|Tasty Tibs
|372|en|2|"""King Combo, Gyro Plate, and Greek Salad - disappointment on a plate. The gyro meat was tough, dry, while the salad was anything but fresh and vibrant. The tzatziki sauce, a crucial element, was overly sweet, disrupting the balance of flavors. The fluffy pita bread was a small consolation, but not enough to salvage the overall mediocre dining experience. Regrettably, this establishment falls short of recommendation."""|Hamburg||2022|9|Cheeky Greek
|450|en|2|The experience with Better Off Bread was disappointing. The Italian and Pastrami sandwiches lacked flavor and were surprisingly dry, while the Hot Ham & Cheese was lukewarm at best. The beverages, Bottled Water and Ice Tea, were the only saving grace, but they can't compensate for the overall mediocre food quality. Not the best choice for sandwiches in Cape Town.|Cape Town||2022|9|Better Off Bread
|419|en|2|The food at Nani's Kitchen was a disappointment. The tandoori mixed grill was dry and overcooked, and the combination curry was bland and flavorless. The bottled soda was flat and warm. The service was slow and inattentive. Overall, I would not recommend Nani's Kitchen to anyone.|Barcelona||2022|9|Nani's Kitchen
|296|en|2|"""Revenge of the Curds truly serves up a poutine paradise in Melbourne! I was absolutely delighted with my order. 'Mother's Favorite' was a classic delight, while 'The Kitchen Sink' was an adventurous explosion of flavors. The poutine was perfectly prepared, with just the right amount of cheese curds and gravy. The Ice Tea was refreshing, a perfect balance to the rich flavors of the poutine. 'The Classic' was, as its name suggests, a timeless delight. The service was prompt and the staff was friendly. This is a must-visit for all poutine lovers. Revenge of the Curds, you've won my heart!"""|Melbourne||2022|9|Revenge of the Curds
|300|en|2|"""Better Off Bread in Melbourne is a sandwich lover's paradise! The Hot Ham & Cheese and Italian sandwiches were absolutely delightful. The bread was fresh, the ingredients were top-notch, and the flavors were perfectly balanced. The truck's friendly staff and quick service added to the overall experience. If you're in Melbourne and craving a great sandwich, Better Off Bread is the place to go. Highly recommended!"""|Melbourne||2022|9|Better Off Bread
|237|en|2| Disappointed with The King Combo from Cheeky Greek in Delhi. The gyro meat lacked authentic flavor and was dry, while the tzatziki sauce tasted bland and watery. The accompanying fries were cold, soggy, and under-seasoned. Overall, the meal was a letdown, failing to deliver the promised taste of Greece. I won't be ordering from here again.|Delhi||2022|9|Cheeky Greek
|237|en|2| The Cheeky Greek truck in Delhi is a must-try! Their Greek Salad is an absolute delight, packed with fresh ingredients and a perfect blend of flavors. The crisp vegetables combined with the tangy dressing create a gastronomic experience that transports you straight to Greece. The portion size is generous, making it excellent value for money. The service was quick and efficient, further enhancing the overall experience. If you're craving authentic Greek food, Cheeky Greek is your go-to choice. Highly recommended!|Delhi||2022|9|Cheeky Greek
|237|en|2|The Cheeky Greek truck in Delhi served up an outstanding meal that was both flavorful and satisfying. The Greek Salad was fresh and crisp, with the perfect balance of tangy feta and zesty dressing. The Gyro Plate was a standout, featuring tender, well-seasoned meat nestled in a warm pita with all the fixings. The accompanying Ice Tea, Bottled Soda, and Bottled Water were refreshing complements to the meal. This food truck is a must-visit for anyone craving authentic, delicious Gyros. The quality of the food and the friendly service make it a top choice for a quick, satisfying meal.|Delhi||2022|9|Cheeky Greek
|237|en|2|The Cheeky Greek truck's gyros were a major disappointment. The meat was dry and flavorless, and the pita bread was stale. The Greek salad was limp and uninspired. The ice tea was watery and weak. Overall, this was a very disappointing meal. The food was not fresh, the ingredients were cheap, and the preparation was poor. I would not recommend this truck to anyone.|Delhi||2022|9|Cheeky Greek
|233|en|2|Delightful breakfast crepe and chicken pot pie crepe at Le Coin des Crêpes truck! The fluffy crepe was perfectly golden, with just the right amount of sweetness and fillings. The chicken pot pie crepe was a savory masterpiece, with flaky puff pastry and tender chicken. The overall experience was excellent, and the friendly staff made the ordering process smooth. Highly recommend this truck for a delicious and satisfying breakfast or snack!|Delhi||2022|9|Le Coin des Crêpes
|325|en|2|"The ""Not the Wurst Hot Dogs"" truck unfortunately did not live up to its name. The coney dog I ordered was far from the coney dogs I've had. The hot dog was dry, and the toppings were sparse. The breading on the hot dog was too thick and greasy. It was a truly disappointing meal, and I would not recommend this truck to anyone."|Rio de Janeiro||2022|9|Not the Wurst Hot Dogs
|330|en|2|Disappointment was the main course at Better Off Bread. The Pastrami sandwich lacked flavor and was overly dry, while the Hot Ham & Cheese was drowning in an excessive amount of cheese, overpowering the ham. The bread was also underwhelming, lacking the freshness one would expect from a sandwich truck. Overall, a forgettable dining experience in Rio de Janeiro.|Rio de Janeiro||2022|9|Better Off Bread
|316|en|2|"The order summary describes a typical afternoon at a frozen treat shop in Rio de Janeiro. The menu type is ice cream, and the truck name is ""Freezing Point."" The items ordered include lemonade, mango sticky rice, ice tea, bottled soda, and a sugar cone. The order summary is concise and informative, but it lacks detail and does not provide any opinion or personal commentary."|Rio de Janeiro||2022|9|Freezing Point
|361|en|2|The Freezing Point truck was a delight to find in Hamburg. The menu was concise yet offered a wide variety of mouth-watering options. I opted for the Mango Sticky Rice, Sugar Cone, and Waffle Cone, and each item was a perfect blend of flavor and texture. The mango sticky rice was sweet and refreshing, the sugar cone was crispy and light, and the waffle cone was fluffy and decadent. The service was friendly and prompt, and the overall atmosphere was relaxed and inviting. I highly recommend checking out the Freezing Point truck if you're ever in Hamburg.|Hamburg||2022|9|Freezing Point
|368|en|2|The Le Coin des Crêpes truck, stationed in Hamburg, presented a delightful menu of fresh crepes. The Chicken Pot Pie Crepe was a standout, featuring a flaky crust, succulent chicken filling, and savory sauce. The Crepe Suzette, adorned with fresh fruit and chocolate spread, was a sweet delight. The accompanying bottled soda complemented the sweet and savory flavors perfectly. Overall, the experience was satisfactory, offering a taste of French flair amidst the bustling streets of Hamburg.|Hamburg||2022|9|Le Coin des Crêpes
|327|en|2|"The Cheeky Greek truck's ""King Combo"" was a flavor explosion that transported me straight to the streets of Rio de Janeiro. The generous portions of tender gyros, fresh vegetables, and crispy pita bread were simply mouth-watering. The Greek salad was a refreshing accompaniment, and the bottled soda quenched my thirst. The friendly service and vibrant atmosphere made the experience even more enjoyable. Overall, I couldn't recommend this truck enough for anyone looking for a taste of the Mediterranean in the heart of Rio."|Rio de Janeiro||2022|9|Cheeky Greek
|250|en|2|A mouth-watering selection of hot dogs, with the Coney Dog and New York Dog being the highlights, is offered at The Not the Wurst Hot Dogs truck in Tokyo. The dogs are crafted with fresh toppings and buns, ensuring a satisfying bite. A refreshing accompaniment to the hot dogs is provided by the bottled water. The food and service are commendable, making it a must-try for hot dog enthusiasts in the city.|Tokyo||2022|9|Not the Wurst Hot Dogs
|73|en|2|Disappointment was the main course with my Combo Lo Mein from Peking Truck. The noodles were overcooked, resulting in a mushy texture that lacked the satisfying bite I was expecting. The vegetables were few and far between, and the sauce was bland, lacking the rich, savory flavor that I associate with Chinese cuisine. The portion size was also smaller than anticipated, leaving me feeling unsatisfied. Unfortunately, this meal did not live up to my expectations, and I wouldn't recommend it to others seeking authentic Chinese food in New York City.|New York City||2022|9|Peking Truck
|221|en|2|"An order for poutine was placed at the ""Revenge of the Curds"" truck in Mumbai. The selected items comprised ""The Classic,"" ""The Kitchen Sink,"" and ""Mothers Favorite."" This review maintains a neutral stance, focusing solely on the order specifics, devoid of personal views or comments. The order summary is comprehensive, listing the truck's name, the city, the menu type, and the chosen items. However, it lacks descriptive details about the items or their components. Despite this, the order summary is well-organized, offering sufficient information for anyone to grasp the order's particulars."|Mumbai||2022|9|Revenge of the Curds
|427|en|2|" ""Plant Palace truly lives up to its name, offering a vegetarian paradise in the heart of Cairo. The star of the show, 'The Salad of All Salads,' is a symphony of freshness and flavor. Every bite was a delightful exploration of textures and tastes, with a vibrant array of vegetables artfully combined. The portion size was generous, making it a satisfying choice for a healthy meal. The truck's commitment to quality and sustainability is evident in every aspect. Whether you're a dedicated vegetarian or just looking for a nutritious meal, Plant Palace is a must-try. A truly plant-powered experience!"""|Cairo||2022|9|Plant Palace
|394|en|2|Disappointment was the main course at The Mac Shack. The Standard Mac & Cheese lacked flavor, the Buffalo Mac & Cheese was overwhelmingly spicy, and the Lobster Mac & Cheese was a letdown with barely any lobster. The overall experience was underwhelming, especially considering the hype around this place. Not worth the visit in Madrid.|Madrid||2022|9|The Mac Shack
|271|en|2|" Here's a positive review in Australian English for the given order summary:""Wow, what a delightful treat from Freezing Point in Sydney! The Ice Cream Sandwich was the perfect balance of creamy vanilla ice cream and two soft, chewy chocolate cookies. The Lemonade was refreshingly tart and sweet, just what you need on a hot day. And the Popsicle was a burst of fruity flavour, cold and satisfying. Overall, a fantastic experience - highly recommend Freezing Point for all your ice cream needs in Sydney!"""|Sydney||2022|9|Freezing Point
|314|en|2|The food at Nani's Kitchen was flavorful and satisfying. The lean chicken tikka masala was tender and well-marinated, while the tandoori mixed grill was succulent and perfectly cooked. The accompanying ice tea and bottled water were refreshing and quenching. Overall, the meal was a pleasant and enjoyable experience.|Sao Paulo||2022|9|Nani's Kitchen
|417|en|2|The King Combo, Gyro Plate, and Greek Salad ordered at the Cheeky Greek truck in Barcelona were an absolute delight. The gyro meat was tender and flavorful, and the toppings were fresh and generous. The Greek salad was crisp and refreshing, and the bottled water was chilled to perfection. Overall, the food was delicious, and the service was friendly and efficient. I highly recommend checking out Cheeky Greek if you're looking for a quick and satisfying meal in Barcelona.|Barcelona||2022|9|Cheeky Greek
|259|en|2|The Mac Shack in Seoul offered a variety of Mac & Cheese options, each with its unique twist. The Lobster Mac & Cheese was creamy and rich, while the Buffalo Mac & Cheese provided a spicy kick. The Standard Mac & Cheese was a classic, comforting choice. The Ice Tea and Bottled Water were standard fare. Portion sizes were generous, ensuring a satisfying meal. However, the prices were a bit steep for the offerings. Overall, it was a decent dining experience, but not particularly outstanding.|Seoul||2022|9|The Mac Shack
|267|en|2|A remarkable experience at Cheeky Greek in Seoul. The King Combo and Gyro Plate were phenomenal. Falafel, moist and flavorful, graced the plate, while gyros offered tender and succulent textures. Tzatziki sauce, the perfect accompaniment, enhanced the flavors. Refreshing and chilled bottled water rejuvenated. Warm and inviting atmosphere, impeccable service. Cheeky Greek, a must for authentic Greek dining in Seoul's core.|Seoul||2022|9|Cheeky Greek
|200|en|2|The Creamy Chicken Ramen and Tonkotsu Ramen from Kitakata Ramen Bar in Krakow were as expected. The Creamy Chicken Ramen had a rich, velvety broth that was well-seasoned, while the Tonkotsu Ramen boasted a hearty, pork-based broth. The noodles in both dishes were cooked to a perfect al dente texture. However, the presentation was rather simple, and the portions were slightly smaller than anticipated. Overall, it was a satisfying meal, but not particularly memorable.|Krakow||2022|9|Kitakata Ramen Bar
|324|en|2|The Tasty Tibs truck in Rio de Janeiro is a hidden gem serving delicious Ethiopian cuisine. I ordered the Lean Beef Tibs and was blown away by the tender, perfectly seasoned meat. The flavors were rich and complex, with just the right amount of spice. The portions were generous, and the service was friendly and efficient. If you're looking for a unique and tasty dining experience, I highly recommend Tasty Tibs. You won't be disappointed!|Rio de Janeiro||2022|9|Tasty Tibs
|242|en|2|A fulfilling meal with well-balanced flavors was delivered by the Smoky BBQ truck in Tokyo. The Ice Tea and Bottled Soda offered a refreshing complement, while the Spring Mix Salad provided a crisp contrast to the main dishes. The Rack of Pork Ribs was tender and well-seasoned, though it could have benefited from an increased smoky flavor. A generous portion size was offered by the Two Meat Plate, providing a variety of tastes to savor. In summary, it was a delightful dining experience, but there is potential for improvement in emphasizing the distinctive BBQ taste.|Tokyo||2022|9|Smoky BBQ
|215|en|2|Creamy Chicken Ramen, rich and satisfying, with tender chicken and a creamy broth that hit the spot. Spicy Miso Vegetable Ramen, lacked the promised heat and was somewhat underwhelming. Tonkotsu Ramen, a solid choice, with a hearty pork broth and perfectly cooked noodles. Bottled water and soda, standard. Overall, an adequate dining experience, but not one that particularly stands out.|Mumbai||2022|9|Kitakata Ramen Bar
|216|en|2|" <order\_summary transliterated to Devanagari script>ट्रक नाम: द मेगा मेल्ट; मेनू टाइप: ग्रिल्ड चीज; शहर: मुंबई; आदेशित वस्तु: बॉटल पानी, बॉटल सोडा, द ऑरिजिनल, द रांच, मिस पिग्गी<Review in Hindi>एक बार फिर से मुंबई के इस रेस्तौरंट में ऑर्डर किया, लेकिन इस बार भी खराब अнваलोकन मिला। हमने बॉटल पानी और बॉटल सोडा ऑर्डर किया था, लेकिन जाने कैसे उभरते-उभरते साबुनी स्माक आ गया था। बार-बार कुछ अच्छा नहीं है। ग्रिल्ड चीज मेनू से हमने ""द ऑरिजिनल"", ""द रांच"", और ""मिस पिग्गी"" चुने थे, लेकिन उनमें से कोई भी आभाशील नहीं था। सबसे बॉरिंग था ""द मेगा मेल्ट"" ट्रक नाम के साथ समझ नहीं आया क्या हमें दिया गया था। मुंबई में रेस्तौरंट उपलब्ध हैं जो बेहतर खाना पेड़ते हैं, इसलिए इस से बेहतर विकल्प होगा।<Translation to English>I ordered once again from this restaurant in Mumbai, but alas received another disappointing experience. We ordered bottled water and bottled soda, but to our dismay, a soapy taste kept growing stronger. This is not the first time. From the grilled cheese menu, we ordered ""The Original"", ""The Ranch"", and ""Miss Piggie"", but none of them were impressive. Most disappointing was the ""Mega Melt"" truck name, as we couldn't figure out what we received. There are better restaurants available in Mumbai; this would not be the best choice."|Mumbai||2022|9|The Mega Melt
|88|en|2| Disappointed with the Combo Lo Mein from Peking Truck in Toronto. The noodles were overcooked, resulting in a mushy texture that lacked the usual springiness. The vegetables were underwhelming, with a lack of variety and freshness. The sauce was also too salty, overpowering the other flavors. Not the Chinese food experience I was hoping for.|Toronto||2022|9|Peking Truck
|128|en|2|The Chicken Pot Pie Crepe and Crepe Suzette from Le Coin des Crêpes in London offered a unique twist on traditional crepes. The Chicken Pot Pie Crepe had a savory filling that was well-seasoned and encased in a perfectly cooked crepe. The Crepe Suzette, on the other hand, presented a delightful balance of sweetness and tartness. However, the presentation was quite simple, lacking a bit of the visual appeal one might expect. Overall, the meal was satisfying, but there's room for improvement in terms of aesthetics.|London||2022|9|Le Coin des Crêpes
|347|en|2|Smoky BBQ, a mobile grill establishment in Berlin, serves an enticing assortment of BBQ dishes. her rack of pork ribs and two-meat plate showcased succulent ribs, tender pulled pork. The meat boasted rich flavors, precooked to perfection, with a subtle sweetness that stimulated my taste buds. Side offerings, including mashed potatoes and coleslaw, were equally admirable, complementing the meat magnificently. My visit to Smoky BBQ proved to be a remarkable experience, and I wholeheartedly endorse it for those in pursuit of an authentic and savory BBQ meal in Berlin.|Berlin||2022|9|Smoky BBQ
|109|en|2|The Mac Shack's mac and cheese is a must-try for any foodie visiting Montreal. The standard mac and cheese is creamy and flavorful, while the buffalo mac and cheese adds a spicy kick. The lobster mac and cheese is a decadent treat, loaded with fresh lobster and creamy cheese. The sides of bottled water, soda, and ice tea are perfect to complement the mac and cheese. Overall, I highly recommend The Mac Shack for a delicious and satisfying meal.|Montreal||2022|9|The Mac Shack
|271|en|2|The Freezing Point truck in Sydney offered a mix of classic and unique ice cream options. The Waffle Cone was fresh and crisp, a perfect vessel for the creamy ice cream. The Mango Sticky Rice was an interesting twist, combining traditional dessert flavors in a new way. However, the Popsicle was a bit underwhelming, lacking the expected fruity punch. The Bottled Soda was a standard accompaniment. Overall, a decent experience with room for improvement in some areas.|Sydney||2022|9|Freezing Point
|161|en|2|"The Kitchen Sink was a culinary disaster, leaving me regretful for ever venturing near its greasy confines. The poutine, a mess of limp fries, rubbery curds, and lukewarm gravy, was a testament to the chef's lack of creativity and passion. The gravy, devoid of any discernible flavor, resembled water poured over cold, greasy fries. The curds, far from being fluffy and golden, were tough and rubbery, as if they had been sitting under a heat lamp for hours. The truck's name, ""Revenge of the Curds,"" aptly describes the disappointment and disgust I felt upon taking a bite. I would not recommend this establishment to anyone seeking a satisfying and enjoyable meal."|Paris||2022|9|Revenge of the Curds
|448|en|2|The Peking Truck's combo fried rice was a flavorful and satisfying dish. The rice was perfectly cooked, with a perfect balance of moisture and texture. The vegetables, such as carrots, peas, and onions, were fresh and crisp. The meat, comprised of chicken and pork, was tender and flavorful. Overall, the combo fried rice was a well-prepared and enjoyable meal.|Cape Town||2022|9|Peking Truck
|448|en|2|The Peking Truck in Cape Town is a culinary gem! Their Chinese menu is authentic and delicious. I was particularly impressed with the Combo Fried Rice, which was flavorful and cooked to perfection. The Wonton Soup was a delightful accompaniment, bursting with rich, savory flavors. The bottled water was a refreshing finish to the meal. The quality of the food, coupled with the friendly service, makes this food truck a must-visit. I highly recommend it to anyone craving authentic Chinese cuisine.|Cape Town||2022|9|Peking Truck
|297|es|2|" ""Cheeky Greek de Melbourne, ¡qué maravilla de camión de comida! Ordené el King Combo y me dejó sin aliento. ¡Un delicioso gyro repleto de carne asada a la perfección, aderezado con una salsa cremosa y jugosas verduras! El servicio fue amable y eficiente, y el ambiente era acogedor y divertido. Definitivamente volveré y recomiendo encarecidamente visitar el Cheeky Greek para una experiencia gastronómica inolvidable en Melbourne. ¡Excelente comida y excelente servicio en un solo lugar!"""|Melbourne||2022|9|Cheeky Greek
|299|en|2|"""Nani's Kitchen truly delivered an authentic Indian culinary experience right in the heart of Melbourne. The Combination Curry was a symphony of flavours, each one distinct yet harmoniously blended. The rich, aromatic curry was a delight, paired perfectly with fluffy rice. The portion size was generous, ensuring a satisfying meal. Nani's Kitchen has undoubtedly mastered the art of Indian cuisine, offering a taste that transports you straight to India. Highly recommended for anyone craving a genuine Indian food experience."""|Melbourne||2022|9|Nani's Kitchen
|322|en|2|"""Plant Palace in Rio de Janeiro serves up a delectable duo - the Salad of All Salads and Veggie Burger. The salad, a symphony of freshness, boasts an array of vibrant vegetables, all beautifully harmonized by a creamy avocado dressing. Equally impressive, the veggie burger delights with its succulent lentil patty and crisp, fresh toppings. The staff's friendly and efficient service adds to the dining experience. For those seeking a healthful, flavor-packed vegetarian meal in Rio, Plant Palace comes highly recommended."""|Rio de Janeiro||2022|9|Plant Palace
|361|en|2|"Ice cream sandwich from ""Freezing Point"" in Hamburg: a disappointing experience. Stale bread, melted ice cream, and scant toppings resulted in a messy, subpar dessert. The price did not justify the lackluster creation. I advise against visiting this establishment."|Hamburg||2022|9|Freezing Point
|222|en|2|The King Combo at Cheeky Greek in Mumbai was a major disappointment. The falafel was dry and flavorless, the tzatziki sauce was too sweet, and the pita bread was stale. The gyros were not tender and the overall flavor of the dish was very bland. The service was slow and the staff were not very attentive. I would not recommend the King Combo to anyone.|Mumbai||2022|9|Cheeky Greek
|231|en|2|A disappointing Ranch sandwich experience at Mega Melt in Delhi. Stale and limp bread, meager cheese portion, dry and flavorless meat, overly sweet and cloying ranch dressing, and withered vegetables. I cannot recommend this sandwich.|Delhi||2022|9|The Mega Melt
