ORDER_ID|TRUCK_ID|LANGUAGE|SOURCE|REVIEW|PRIMARY_CITY|CUSTOMER_ID|YEAR|MONTH|TRUCK_BRAND
|113|en|2|The Le Coin des Crêpes truck in Montreal delivered a satisfying meal. The crêpe Suzette, a classic with fresh fruit and whipped cream, was fluffy and flavorful. The accompanying ice tea was refreshing, and the bottled soda was crisp and cool. The chicken pot pie crepe, a unique offering, was flaky and filled with tender chicken and flavorful gravy. Overall, the food was fresh, well-prepared, and reasonably priced.|Montreal||2022|1|Le Coin des Crêpes
|250|en|2|The Not the Wurst Hot Dogs truck in Tokyo provides a range of hot dogs that are sure to please. Choose from options such as the New York Dog, Chicago Dog, and Coney Dog. The New York Dog offers a classic combination of sauerkraut, onions, and cheese, while the Chicago Dog boasts an all-beef hot dog, sweet relish, and sport peppers. For those who like it spicy, the Coney Dog with its chili, mustard, and shredded cheese is a tasty choice. Expect well-made hot dogs and fresh, flavorful toppings for a satisfying meal. And don't forget to try the refreshing bottled water, served chilled.|Tokyo||2022|1|Not the Wurst Hot Dogs
|193|en|2|The Peking Truck in Warsaw served up a Combo Fried Rice that was neither exceptional nor disappointing. The portion size was generous, and the dish was well-presented. The rice was cooked to a satisfactory level, and the vegetables were fresh. However, the flavors were rather muted, lacking the vibrant spices one might expect from Chinese cuisine. The overall experience was decent, but it didn't particularly stand out. It's a viable option for a quick meal, but there's certainly room for improvement in terms of taste and seasoning.|Warsaw||2022|1|Peking Truck
|392|en|2|The Smoky BBQ truck in Madrid offered a mixed dining experience. The Ice Tea and Bottled Soda were refreshing, and the Fried Pickles were crispy and well-seasoned. The Spring Mix Salad was fresh, providing a nice balance to the heavier BBQ items. However, the Pulled Pork Sandwich was a bit dry, lacking the expected juiciness. The Three Meat Plate and Two Meat Plate were generous in portion size, but the flavors were not as robust as anticipated. Overall, it was an adequate meal, with some hits and misses.|Madrid||2022|1|Smoky BBQ
|392|en|2|Smoky BBQ truck in Madrid's offerings failed to meet expectations. The Two Meat Plate, featuring dry and flavorless meat, was a letdown. Similarly, the Pulled Pork Sandwich was overly sweet, making it difficult to taste the meat. The sole satisfactory item was the bottled water. Overall, the experience was disappointing, falling short of typical BBQ standards.|Madrid||2022|1|Smoky BBQ
|347|en|2|Smoky BBQ Truck in Berlin: A Meat Lover's DreamIf you're a fan of mouth-watering, tender, and smoky meats, then Smoky BBQ truck in Berlin is a must-visit destination. The pulled pork sandwich and the rack of pork ribs were both incredibly flavorful and juicy, with a perfect balance of smoke that elevated the taste to a whole new level.The bread used for the sandwich was fresh and fluffy, providing a delightful contrast to the savory meat. The sides were also carefully chosen to complement the main dishes, with options like coleslaw, mac and cheese, and baked beans that added a touch of sweetness and tanginess to the meal.The service at Smoky BBQ was friendly and efficient, with the staff making sure that every customer was satisfied with their order. The atmosphere was relaxed and inviting, making it the perfect spot to enjoy a delicious and authentic BBQ meal.Overall, my experience at Smoky BBQ was truly memorable, and I would highly recommend it to anyone looking for a mouth-watering and satisfying meal. Whether you're a local or a tourist, Smoky BBQ is a must-visit destination for any meat lover.|Berlin||2022|1|Smoky BBQ
|257|en|2|The smoky BBQ truck, Smoky BBQ, is a must-try for any meat lover visiting Seoul. I ordered the two-meat plate, featuring succulent pulled pork and tender rack of pork ribs. The spring mix salad was refreshing and the iced tea was sweet and quenching. The service was friendly and the atmosphere was casual and inviting. Overall, I had a delightful experience at Smoky BBQ, and I highly recommend it to anyone looking for a satisfying and flavorful meal.|Seoul||2022|1|Smoky BBQ
|262|en|2|Veggie burger encounter at Plant Palace in Seoul leaves much to be desired. The patty, dry and overcooked, lacked moisture and flavor, while the accompanying vegetables appeared limp and unappetizing. Fortunately, the bun provided a redeeming quality, as it was soft and fluffy. Additionally, the service left room for improvement, with extended wait times and unapproachable staff. Regrettably, Plant Palace is not a dining establishment I would recommend.|Seoul||2022|1|Plant Palace
|314|en|2| Nani's Kitchen serves the most authentic and flavorful Indian cuisine in Sao Paulo! The combination curry was a delight to the taste buds, offering an array of distinct and perfectly balanced spices. The tender and succulent vegetables paired flawlessly with the rich and creamy curry sauce. I could truly taste the love and passion put into every mouthful. Not only was the food phenomenal, but their impeccable service made the dining experience exceed expectations. If you crave genuine Indian food in Sao Paulo, Nani's Kitchen is a must-visit! Absolute satisfaction guaranteed!|Sao Paulo||2022|1|Nani's Kitchen
|304|en|2|A hidden treasure for mac & cheese lovers, Mac Shack in Sao Paulo, centers around a delectable assortment of dishes. The Standard Mac & Cheese stood out as a classic delight, showcasing a creamy texture and expert seasoning. However, the Buffalo Mac & Cheese stole the show with its tangy buffalo sauce, enhancing the rich, cheesy flavors. Every bite offered a harmonious combination of comfort and thrill. Mac Shack has unquestionably redefined the mac & cheese experience, leaving me eager for a return visit. I wholeheartedly endorse this establishment.|Sao Paulo||2022|1|The Mac Shack
|448|en|2|Peking Truck's delivery proved exceptional. Refreshingly sweet ice tea accompanied the meal. Both fried rice and lo mein showed up perfectly cooked, generously portioned, satisfying hunger with top-notch food quality. Authentic Chinese cuisine seekers in Cape Town should definitely give this restaurant a try.|Cape Town||2022|1|Peking Truck
|357|en|2|"The Cheeky Greek truck's ""King Combo"" lived up to its name, offering a heaping serving of juicy gyros, fresh Greek salad, and a refreshing ice tea. The meat was tender and flavorful, the vegetables were crisp and fresh, and the salad was perfectly balanced. Each bite of the King Combo was a symphony of textures and tastes, leaving me wanting more. The friendly staff were quick and efficient, and the overall atmosphere was relaxed and inviting. I highly recommend stopping by the Cheeky Greek truck if you're looking for a delicious and authentic Greek feast on the streets of Berlin."|Berlin||2022|1|Cheeky Greek
|285|en|2|The Pastrami, Hot Ham & Cheese, Italian sandwich from Better Off Bread in Sydney was simply mouth-watering. The bread was soft and fresh, and the fillings were generous and flavorful. The pastrami was tender and smoky, the hot ham was succulent and juicy, and the cheese was melted to perfection. The Italian sandwich was a perfect balance of savory and sweet, with the fresh tomatoes, pungent onions, and tangy balsamic vinegar. Overall, I highly recommend this sandwich to anyone looking for a satisfying and flavorful bite in Sydney.|Sydney||2022|1|Better Off Bread
|246|en|2|Mega Melt's Miss Piggie was an unfortunate meal. The bread lacked texture and was coated in grease, the cheese was inexpensive and had a rubbery consistency, and the pig was overcooked, resulting in a dry and unappetizing experience. A silver lining was the delivery driver, who exhibited friendliness and efficiency. I cannot endorse this restaurant for others.|Tokyo||2022|1|The Mega Melt
|246|en|2|"The Mega Melt truck's ""Original"" and ""Ranch"" grilled cheese sandwich was a culinary disaster. The bread was limp and soggy, the cheese was sparse and under-melted, and the fillings were bland and uninspired. The ranch dressing was overly sweet and cloying, and the overall flavor profile was unpleasing. The service was slow and inefficient, and the truck's atmosphere was noisy and cramped. Given the high price and the poor quality of the food and service, I would not recommend this truck to anyone."|Tokyo||2022|1|The Mega Melt
|314|en|2|I was extremely disappointed with the food at Nani's Kitchen. The chicken tikka masala was bland and the tandoori mixed grill was overcooked. The combination curry was not very flavorful either. The bottled soda and water were fine, but the food was such a let down that I would not recommend this restaurant to anyone.|Sao Paulo||2022|1|Nani's Kitchen
|231|en|2|"The Mega Melt's ""The Original"" grilled cheese and ""The Ranch"" ice tea were simply divine. The bread was perfectly toasted, the cheese oozed with just the right amount of goo, and the ranch dressing on the ice tea was refreshing and tangy. The atmosphere in Delhi was cozy and inviting, and the service was friendly and attentive. Overall, a perfect meal and a delightful experience."|Delhi||2022|1|The Mega Melt
|231|en|2|"""The Mega Melt Truck in Delhi is a must-visit for grilled cheese lovers! I recently enjoyed a delightful meal there, savoring the perfect blend of flavors. The Original grilled cheese sandwich was a classic, prepared to perfection with just the right amount of melted cheese and crispy bread. Miss Piggie, their unique take on a grilled cheese with bacon, was an absolute delight, offering a delicious balance of savory and salty tastes. The bottled water and ice tea were refreshing companions to the meal. The Mega Melt Truck truly understands the art of grilled cheese, making it a top choice for a satisfying and enjoyable dining experience in Delhi."""|Delhi||2022|1|The Mega Melt
|396|en|2|"The Mega Melt truck's menu promised a melt-in-your-mouth experience, but the food fell short of expectations. The grilled cheese sandwich, billed as ""The Original,"" was dry and uninspired. The bread was stale, and the cheese lacked flavor. The sides, ""Miss Piggie"" and ""The Ranch,"" were equally unappealing. The sides were limp and undercooked, failing to provide any satisfying crunch. The accompanying drinks, bottled water and ice tea, were refreshing, but ultimately couldn't save the lackluster food. Overall, the Mega Melt truck's offerings were unmemorable and disappointing, leaving me with the feeling that I had wasted my time and money."|Madrid||2022|1|The Mega Melt
|450|en|2|The Italian sandwich at Better Off Bread in Cape Town was a delightful treat. The bread was fresh and crispy, and the fillings were generous and flavorful. The ingredients were fresh and of high quality, and the sandwich was expertly assembled. The only minor issue was the price, which was a bit high for a sandwich. Overall, I would highly recommend this sandwich to anyone looking for a quick and satisfying bite in Cape Town.|Cape Town||2022|1|Better Off Bread
|436|en|2|The Freezing Point truck was a delightful find in Cape Town, offering a refreshing escape from the heat. The Popsicle, Mango Sticky Rice, and Sugar Cone were all delectable treats, with the sticky rice being a particular highlight. The service was friendly and efficient, and the atmosphere was relaxed and inviting. Overall, I couldn't recommend this truck enough for anyone looking for a sweet treat on the go.|Cape Town||2022|1|Freezing Point
|376|en|2|Absolutely delighted with my experience at Freezing Point in Stockholm! The variety of menu options was impressive, and every item I ordered was top-notch. The Sugar Cone and Waffle Cone were fresh and crisp, perfectly complementing the creamy, delicious ice cream. The Ice Tea was refreshing, and the Ice Cream Sandwich and Popsicle were fun, tasty treats. The quality of the products was exceptional. Freezing Point has undoubtedly become my go-to place for ice cream. Excellent job!|Stockholm||2022|1|Freezing Point
|89|en|2|The food from Nani's Kitchen was a mix of highs and lows. The Lean Chicken Tikka Masala was flavorful and tender, living up to the reputation of Indian cuisine. However, the Tandoori Mixed Grill was a bit dry and lacked the expected spice blend. The Bottled Soda was a standard accompaniment. Overall, the experience was average, with some dishes hitting the mark while others fell short.|Toronto||2022|1|Nani's Kitchen
|89|en|2|Disappointment was the theme at Nani's Kitchen. The combination curry fell flat, lacking the expected burst of flavor. To add to the dissatisfaction, the lean chicken tikka masala was overcooked, resulting in a dry texture. Even the ice tea failed to deliver, served at a lukewarm temperature that was far from refreshing. In summary, this dining experience is not one to suggest. The uninspiring food, overcooked chicken, and unsatisfying drink make it a difficult recommendation.|Toronto||2022|1|Nani's Kitchen
|131|en|2|"""Revenge of the Curds truly redefines the poutine experience in London! The Kitchen Sink, an adventurous blend of flavors, was a delightful surprise, while The Classic lived up to its name, offering the authentic poutine taste. The bottled soda was a refreshing accompaniment, and Mother's Favorite was indeed a favorite, adding a homely touch to the meal. The quality of ingredients was top-notch, and the service was swift. A must-visit for all poutine lovers!"""|London||2022|1|Revenge of the Curds
|415|en|2|"The menu at ""Not the Wurst Hot Dogs"" truck did not manage to leave a positive impression. Disappointment was the theme for the New York Dog, Chicago Dog, and Coney Dog, as they lacked the anticipated toppings and unique flavor combinations. While the bottled water and soda were acceptable, the ice tea was excessively sweet and syrupy. In summary, the food and drink choices did not meet expectations, resulting in a lingering sense that a more gratifying meal could have been found elsewhere."|Barcelona||2022|1|Not the Wurst Hot Dogs
|113|en|2|The Le Coin des Crêpes truck was a delightful find in the heart of Montreal. The menu offered a wide range of delectable crepe options, including the breakfast crepe, chicken pot pie crepe, and crepe Suzette. Each crepe was expertly prepared with fresh and flavorful ingredients, resulting in a mouthwatering treat. The friendly staff were attentive and provided prompt service. The overall experience was exceptional, and I highly recommend Le Coin des Crêpes to anyone seeking a unique and flavorful culinary adventure in Montreal.|Montreal||2022|1|Le Coin des Crêpes
|109|en|2|Mac Shack's Mac & Cheese is a must-try for cheese lovers visiting Montreal. Standard mac & cheese boasts creamy, cheesy goodness and perfect cooking, while buffalo mac & cheese provides a spicy kick for taste buds. Generous portions and friendly service are also noteworthy. Highly recommended for a quick and satisfying meal.|Montreal||2022|1|The Mac Shack
|250|en|2|"The ""Not the Wurst Hot Dogs"" truck was a major disappointment. The New York Dog and Coney Dog were dry and over-processed, lacking the juicy, flavorful toppings that I've come to expect from a hot dog vendor. The bread was stale and the mustard was overly sweet. The only saving grace was the friendly staff, but ultimately, the subpar food quality ruined the experience. I would not recommend this truck to anyone looking for a satisfying hot dog."|Tokyo||2022|1|Not the Wurst Hot Dogs
|187|en|2|## Plant Palace Veggie Burger ReviewThe Plant Palace veggie burger was a satisfying vegetarian option in the heart of Warsaw. The patty was flavorful and well-textured, complemented by fresh and crispy toppings. The accompanying fries were perfectly golden and crispy, and the sweet potato side was a healthy and sweet companion to the burger. The service was friendly and attentive, and the atmosphere was relaxed and casual. Overall, the Plant Palace veggie burger was a delicious and filling meal that I would recommend to anyone in Warsaw, vegetarian or not.|Warsaw||2022|1|Plant Palace
|187|en|2|The Veggie Burger at Plant Palace was well-seasoned and had a satisfying texture, while the Seitan Buffalo Wings offered a nice twist on a classic dish with a good balance of heat and sweetness. The Salad of All Salads was fresh and crisp, with a variety of vegetables and a tangy dressing. However, the bottled water and soda were standard and unremarkable. Overall, the meal was a solid option for vegetarians in Warsaw, but the beverages could have been improved.|Warsaw||2022|1|Plant Palace
|304|pt|2| ¡Olá, sou apaixonado por comida boa e The Mac Shack em São Paulo é simplesmente incrível! Meu pedido incluiu o Lobster Mac & Cheese, que é uma delícia cremosa e saborosa com pedaços generosos de lagosta. Além disso, tivemos o Buffalo Mac & Cheese, que traz o sabor picante perfeito para quem gosta de comida com um toque especial. O Standard Mac & Cheese também foi um sucesso, com sua combinação clássica de queijo e massa. Para acompanhar, um refrigerante botado foi uma escolha acertada. Recomendo vivamente a todos os amantes de macarrão e queijo em São Paulo a provar os deliciosos pratos da The Mac Shack. ¡Delicioso!|Sao Paulo||2022|1|The Mac Shack
|239|en|2|The takeaway from Nani's Kitchen was a delight. The ice tea was refreshing, and the chicken tikka masala and combination curry were flavorful. The meat was tender and the curry was perfectly spiced. The portion sizes were generous and the overall quality of the food was excellent. The delivery was prompt and the staff were friendly. I highly recommend this restaurant to anyone who wants to experience authentic Indian cuisine.|Delhi||2022|1|Nani's Kitchen
|267|en|2|A delightful Greek salad experience at Cheeky Greek in Seoul. The salad presented a crisp and fresh appearance. Its tangy and creamy flavors were perfectly balanced. The selection of premium ingredients, such as tomatoes, cucumbers, onions, and feta cheese, harmoniously complemented each other. Impressionably presented, the portion size was generous and filling. Often overshadowed by the gyros, this Greek salad provided a refreshing and satisfying alternative choice.|Seoul||2022|1|Cheeky Greek
|264|en|2|The Tasty Tibs truck, located in Seoul, offers an authentic Ethiopian menu featuring lean chicken and beef tibs. The tibs, a popular Ethiopian dish, are made with flavorful berbere spice blend and served with injera, a spongy flatbread. The chicken and beef were tender and well-marinated, enhancing the overall flavor of the dish. The injera was soft and slightly sweet, complementing the tibs perfectly. Overall, the food was satisfying and authentic, providing a taste of Ethiopia in the heart of Seoul.|Seoul||2022|1|Tasty Tibs
|262|en|2|Salad and Veggie Burger at Plant Palace, Seoul were underwhelming. The salad exhibited wilted leaves and lacked taste. The veggie burger, too, was dry and devoid of flavor. Service was subpar, characterized by lengthy wait times and unfriendly staff. I cannot endorse Plant Palace.|Seoul||2022|1|Plant Palace
|327|en|2|The Cheeky Greek gyros at Rio de Janeiro did not disappoint. The flavorful gyro plate was packed with tender lamb, fresh vegetables, and tzatziki sauce. Each bite was a symphony of flavors and textures, leaving me wanting more. The meat was succulent and perfectly cooked, while the vegetables were fresh and crisp. The tzatziki sauce added a tangy sweetness that complemented the gyro perfectly. Overall, my experience was exceptional, and I highly recommend the gyro plate at Cheeky Greek in Rio de Janeiro.|Rio de Janeiro||2022|1|Cheeky Greek
|392|en|2|Smoky BBQ truck in Madrid did not meet the anticipated BBQ experience. The Three Meat Plate served was underwhelming, with dry meat that lacked flavor. Similarly, the Pulled Pork Sandwich was not up to par, featuring a soggy bun and pork that missed the mark on the expected smoky taste. The Spring Mix Salad was both bland and uninspiring, and the Fried Pickles were excessively greasy. In summary, the meal was disappointing and fell short of expectations. Not a place I would suggest.|Madrid||2022|1|Smoky BBQ
|396|en|2|A delightful Mega Melt experience. The toasted bread showcased perfection, and the cheese melted impeccably, enveloping the juicy pork. The side of tomato soup offered a refreshing contrast, providing an ideal complement to the melt's richness. Staff friendliness and efficient service were the cherry on top. A highly recommended satisfying adventure for Madrid visitors.|Madrid||2022|1|The Mega Melt
|347|en|2|The Smoky BBQ truck in Berlin was a revelation! The Two Meat Plate and Pulled Pork Sandwich were both incredibly flavorful and satisfying. Meat was tender and juicy, sides were perfectly cooked, and the sauce was simply perfect. The atmosphere was friendly and welcoming, staff was attentive and helpful. Overall, couldn't recommend this truck enough. It's a must-try for any barbecue lover visiting Berlin.|Berlin||2022|1|Smoky BBQ
|450|en|2|Food mediocre at its peak. Bread stale, fillings bland and uninspiring, drinks overpriced. Service poor with prolonged wait times, staff inattentive. I don't suggest this restaurant to anyone.|Cape Town||2022|1|Better Off Bread
|81|en|2| The Mega Melt truck in Toronto was a disappointment. The grilled cheese, which should be the star of the show, was lackluster. The Ranch and Miss Piggie sandwiches were overly greasy and the bread was soggy. To add to the disappointment, the bottled soda and ice tea were warm. The overall experience was underwhelming and not worth the visit. I expected more from a truck specializing in grilled cheese.|Toronto||2022|1|The Mega Melt
|419|en|2|Nani's Kitchen presented a delightful exploration of Indian cuisine in Barcelona with their Tandoori Mixed Grill. A harmonious blend of flavors was showcased in the dish, featuring tender, well-marinated meats grilled to perfection. However, a bit more depth and complexity could have been added to the accompanying sauces. The generous portion size ensured a satisfying meal. All in all, Nani's Kitchen serves as a solid option for those in search of Indian food in the city, although there is room for minor improvements.|Barcelona||2022|1|Nani's Kitchen
|250|en|2|🌭 Mouth-watering hot dogs at Not the Wurst Hot Dogs! 🌭The Not the Wurst Hot Dogs truck in Tokyo is a must-visit for any hot dog enthusiast. I ordered the Chicago Dog, and it did not disappoint. The combination of a juicy hot dog, fresh toppings, and crispy bread resulted in a perfect bite. The friendly staff were quick to take my order, and the service was prompt. Overall, I had a delightful experience at Not the Wurst Hot Dogs, and I highly recommend it to anyone looking for a satisfying and flavorful hot dog. 🌭|Tokyo||2022|1|Not the Wurst Hot Dogs
|242|en|2|Smoky BBQ Truck in Tokyo Provides Enjoyable Dining ExperienceSmoky BBQ truck in Tokyo offered a satisfying dining experience, particularly with their Rack of Pork Ribs. The meat stood out for its tenderness, easily pulling away from the bone. Moreover, the smoky flavor was well-balanced, adding depth to the dish. However, the BBQ sauce could have used a touch more tanginess to truly elevate it. The portion size was generous, making for a filling and satisfying meal.The service was prompt and friendly, which contributed to a positive dining experience. Although it was not the best BBQ I've ever had, it certainly hit the spot for a quick and satisfying meal. Overall, I would recommend the Smoky BBQ truck in Tokyo for anyone looking for a delicious and enjoyable meal.|Tokyo||2022|1|Smoky BBQ
|242|en|2|The smoky BBQ truck, Smoky BBQ, located in Tokyo, offers a mouthwatering selection of BBQ items. I sampled the rack of pork ribs, the two-meat plate, and the fried pickles. The ribs were tender and flavorful, with a perfect amount of smoke. The two-meat plate, featuring a combination of pork and beef, was equally impressive, with tender meat and a smoky aroma. The fried pickles were a delightful accompaniment, providing a refreshing crunch and tang. To wash down the feast, I paired my meal with a bottled soda. Overall, I highly recommend Smoky BBQ for anyone seeking a smoky and flavorful BBQ experience in Tokyo.|Tokyo||2022|1|Smoky BBQ
|67|en|2|Plant Palace in New York City offers a vegetarian masterpiece in the form of their Salad of All Salads. Each bite of this exquisite dish delivers a burst of fresh, vibrant ingredients, resulting in a symphony of flavors that dance on the palate. The tender greens, crispy vegetables, and creamy avocado create a delightful array of textures, leaving a lasting impression. The well-balanced dressing, with just the right amount of sweetness and acidity, ties all the elements of this salad together seamlessly. While the portion size is generous, making it suitable for sharing, the taste is so irresistible that you may find it challenging to share.|New York City||2022|1|Plant Palace
|101|en|2|"Disappointment was the main course with my order of ""The Kitchen Sink"" from Revenge of the Curds in Vancouver. The poutine was a far cry from the expected culinary delight. The fries were soggy, the curds lacked freshness, and the gravy was bland, lacking the rich, hearty flavour that makes poutine a comfort food favourite. The toppings were scarce, contrary to the name suggesting an abundance. The overall experience was underwhelming, leaving me craving the authentic poutine experience I was promised. Unfortunately, this meal was a miss, failing to deliver on taste and quality."|Vancouver||2022|1|Revenge of the Curds
