ORDER_ID|TRUCK_ID|LANGUAGE|SOURCE|REVIEW|PRIMARY_CITY|CUSTOMER_ID|YEAR|MONTH|TRUCK_BRAND
|436|en|2|"""Freezing Point truly hit the spot! Their menu offers a delightful variety, and my recent visit was no exception. The Lemonade was refreshing, the perfect thirst-quencher on a hot day. The Waffle Cone was crisp and delicious, complementing the Two Scoop Bowl that was creamy and packed with flavor. The Ice Tea was a great palate cleanser between treats. And let's not forget the Popsicle - a fun, nostalgic treat that was the cherry on top of this ice cream adventure. Cape Town just got a little cooler with Freezing Point around!"""|Cape Town||2022|1|Freezing Point
|450|en|2|Better Off Bread truck's culinary delights proved to be a delightful discovery. The pastrami and hot ham & cheese sandwiches were nothing short of remarkable, boasting impressive flavors and impeccable presentation. The bread was fresh and soft, while the fillings were abundant and savory. Adding to the positive experience was the friendly and approachable staff. In summary, Better Off Bread is highly recommended for those in Cape Town seeking a memorable food truck experience.|Cape Town||2022|1|Better Off Bread
|31|en|2|"""Freezing Point in Seattle is a true gem! Their ice cream menu is diverse and delicious. I was particularly impressed by the Waffle Cone, which was crisp and fresh, perfectly complementing the creamy ice cream. The Popsicle was a refreshing treat, bursting with flavor. But the star of the show was the Ice Cream Sandwich, a perfect blend of soft cookies and premium ice cream. Freezing Point has certainly raised the bar for ice cream trucks. Can't wait for my next visit!"""|Seattle||2022|1|Freezing Point
|89|en|2|The Tandoori Mixed Grill at Nani's Kitchen in Toronto was a delightful culinary experience. The tandoori chicken, lamb, and vegetables were perfectly marinated and cooked in the tandoor oven, resulting in tender and flavorful meat. The naan bread was fresh and fluffy, and the rice was fluffy and aromatic. The service was friendly and attentive, and the atmosphere was warm and inviting. Overall, the Tandoori Mixed Grill at Nani's Kitchen is a highly recommended destination for Indian cuisine in Toronto.|Toronto||2022|1|Nani's Kitchen
|259|en|2|"At The Mac Shack in Seoul, the ""Standard Mac & Cheese"" and ""Buffalo Mac & Cheese"" dishes were a true pleasure to savor. The mac & cheese had a rich and tasty creaminess, with a perfect balance of gooey texture. The classic comfort food taste was present in the standard version, while the buffalo mac & cheese brought a spicy kick that was exciting for the taste buds. The staff's friendly demeanor and quick service added to the overall positive experience. For a satisfying mac & cheese meal, The Mac Shack is recommended, but it's advised to verify the spice level beforehand, especially for those who are sensitive to heat."|Seoul||2022|1|The Mac Shack
|262|de|2|Seitan Buffalo Wings and Veggie Burger from Plant Palace truck were absolute delightful discoveries. The seitan wings boasted a crispy exterior and a tender interior, while the buffalo sauce added a delightful, flavorful kick. The veggie burger was equally impressive, showcasing fresh, succulent vegetables and a savory vegan patty. The salad was crisp and fresh, and the bottled water offered a refreshing thirst quencher. Overall, an unforgettable dining experience at the Plant Palace truck.|Seoul||2022|1|Plant Palace
|259|en|2|The Mac Shack in Seoul offers a unique dining experience with its Mac & Cheese menu. The Buffalo Mac & Cheese had a nice kick to it, while the Lobster Mac & Cheese provided a luxurious twist to the classic dish. The Standard Mac & Cheese was creamy and satisfying. The Bottled Soda and Water were standard fare. Overall, it was a decent meal, but nothing particularly extraordinary. The Mac Shack is worth a try if you're in the mood for a hearty mac and cheese meal.|Seoul||2022|1|The Mac Shack
|358|en|2|A culinary gem in Berlin, The Peking Truck serves up exquisite dishes. The Combo Lo Mein is a harmonious blend of flavors, each noodle strand cooked to perfection and bathed in a savory sauce. The Wonton Soup provides a comforting accompaniment, bursting with plump, juicy wontons. The Chinese menu boasts a delightful array of options, making selection a challenge. The truck's ambiance adds to the experience, making it a must-visit for food enthusiasts.|Berlin||2022|1|Peking Truck
|250|en|2|"Disappointment was the main course at ""Not the Wurst Hot Dogs"". The New York Dog I ordered was far from authentic. The bun was stale, the hot dog lacked flavor, and the toppings were scarce. The overall experience was underwhelming, especially considering the hype around this place. Tokyo has better options for hot dogs, save your appetite for those."|Tokyo||2022|1|Not the Wurst Hot Dogs
|419|es|2|" ""La experiencia con Nani's Kitchen en Barcelona ha sido decepcionante. El Tandoori Mixed Grill que pedimos estaba claramente sobrecocido y falto de sabor. Además, el servicio fue lento y la atención al cliente dejó mucho que desear. Desafortunadamente, no recomendaríamos este lugar para los amantes de la comida india en la ciudad.""(Translation: ""The experience with Nani's Kitchen in Barcelona has been disappointing. The Tandoori Mixed Grill we ordered was clearly overcooked and lacking in flavor. Additionally, the service was slow and the customer service left much to be desired. Unfortunately, we would not recommend this place for lovers of Indian food in the city."")"|Barcelona||2022|1|Nani's Kitchen
|304|en|2|Mac Shack's Buffalo Mac & Cheese falls short of expectations. Mac and cheese arrived dry and powdery, contrary to the promised creaminess. Cheese distribution was sparse and lacked depth of flavor, while buffalo sauce was overwhelming. Truck's ambiance appeared unclean and unappetizing. In conclusion, avoid this food truck.|Sao Paulo||2022|1|The Mac Shack
|314|en|2|A taste of authentic Indian cuisine in Sao Paulo was delivered through Nani's Kitchen's Lean Chicken Tikka Masala and Tandoori Mixed Grill. The chicken tikka masala boasted tender, flavorful chicken pieces immersed in a luscious tomato-based sauce brimming with aromatics. The tandoori mixed grill was equally satisfying, showcasing various well-seasoned, perfectly grilled meats. Size-wise, the portions were smaller than anticipated, which could leave larger appetite diners wanting more. Despite this, the meal proved enjoyable, but could benefit from better value for money.|Sao Paulo||2022|1|Nani's Kitchen
|231|en|2|The Mega Melt truck in Delhi served up a decent grilled cheese experience with the Miss Piggie and The Ranch items. The bread was toasted to a nice, golden brown, and the cheese was adequately melted. The Miss Piggie, with its pulled pork and barbecue sauce, offered a sweet and savory combination that was enjoyable, but not particularly memorable. The Ranch, on the other hand, had a tangy twist that added a unique element to the classic grilled cheese. However, the overall portion size was a bit smaller than expected. The service was prompt and friendly, making for a satisfactory dining experience.|Delhi||2022|1|The Mega Melt
|347|en|2|The Smoky BBQ's Pulled Pork Sandwich in Berlin was a decent choice. The pork was tender and well-cooked, with a smoky flavor that was quite enjoyable. However, the sandwich could have benefited from a bit more sauce to enhance the overall taste. The bun was fresh and held up well to the fillings. Overall, it was a satisfactory experience, but there's certainly room for improvement.|Berlin||2022|1|Smoky BBQ
|213|en|2|Disappointment was the main course with my order from Guac n' Roll. The Three Taco Combo Plate was lackluster, with tortillas that were more cardboard than corn and fillings that were bland and uninspiring. The Veggie Taco Bowl was no better, with vegetables that were overcooked and drowned in a sauce that lacked any real flavor. Even the bottled water seemed to have lost its sparkle. For a truck named Guac n' Roll, I was expecting a fiesta of flavors, but all I got was a fizzle. Not recommended for those seeking authentic, delicious tacos in Mumbai.|Mumbai||2022|1|Guac n' Roll
|224|en|2|Nani's Kitchen's food fell short of expectations. The lean chicken tikka masala lacked flavor and spice, coming off as incredibly bland. The tandoori mixed grill was similarly disappointing, serving up dry and chewy chicken along with stale naan. The overall quality of the food was poor, and the steep price made it even less appealing. It's not a place I would recommend to others.|Mumbai||2022|1|Nani's Kitchen
|215|en|2|The Kitakata Ramen Bar in Mumbai is a must-visit for any ramen enthusiast. I ordered the creamy chicken ramen and tonkotsu ramen, and both were absolutely delicious. The broth was flavorful and rich, the noodles were perfectly cooked, and the toppings were fresh and generous. The bottled soda selection was also impressive. Overall, I had a very positive experience at Kitakata Ramen Bar, and I highly recommend it to anyone looking for a delicious and authentic ramen experience.|Mumbai||2022|1|Kitakata Ramen Bar
|450|en|2|Unmet expectations marked the Better Off Bread truck's offerings. Pastrami and hot ham sandwiches disappointed with their dry and flavorless compositions, falling short of the promised melted cheese. The bread's staleness further hindered enjoyment. Bottled water lacked refreshment due to its warm temperature. The Italian sandwich, visually enticing, failed to deliver substantial satisfaction. Overall, a disappointing culinary encounter.|Cape Town||2022|1|Better Off Bread
|350|en|2|Kitakata Ramen Bar proved to be an absolute delight. Spicy Miso Vegetable Ramen, Tonkotsu Ramen, and Creamy Chicken Ramen all stood out as delectable masterpieces. The noodles were cooked to perfection, while the broth burst with flavor. Fresh and plentiful toppings further enhanced the dishes. The bottled soda provided a refreshing accompaniment to the ramen, and the atmosphere was warm and inviting. In summary, an exceptional dining experience. A visit to this hidden gem in Berlin comes highly recommended.|Berlin||2022|1|Kitakata Ramen Bar
|335|de|2| Liebe Ramen-Liebhaber,Ich möchte Ihnen unbedingt das Kitakata Ramen Bar in München empfehlen! Ich habe kürzlich das Spicy Miso Vegetable Ramen probiert und war begeistert. Der leckere, würzige Miso-Geschmack und die frischen Gemüse-Zutaten haben mich vollkommen überzeugt. Das Gericht war perfekt gewürzt und die Nudeln hatten eine tolle Konsistenz. Ich kann es nur weiterempfehlen!Das Kitakata Ramen Bar ist ein echtes Highlight für alle Ramen-Fans in München. Die Bedienung war sehr freundlich und das Ambiente war gemütlich und einladend. Insgesamt ein wirklich empfehlenswertes Restaurant, das ich auf jeden Fall wieder besuchen werde.Also, wenn Sie auf der Suche nach einem leckeren und sättigenden Gericht sind, dann sollten Sie unbedingt das Spicy Miso Vegetable Ramen im Kitakata Ramen Bar in München probieren. Sie werden es nicht bereuen!Viele Grüße,[Ihr Name]|Munich||2022|1|Kitakata Ramen Bar
|215|en|2|The Kitakata Ramen Bar's Spicy Miso Vegetable Ramen was a culinary disaster. The broth was weak and flavorless, and the noodles were overcooked. The vegetables were sparse and uninspired. The only saving grace was the bottled soda, which was refreshing. Overall, I would not recommend this restaurant to anyone.|Mumbai||2022|1|Kitakata Ramen Bar
|267|en|2|"""The Cheeky Greek truck in Seoul is a culinary gem! I recently savored their Gyro Plate and Greek Salad, and it was an absolute delight. The gyro meat was tender and flavorful, perfectly complemented by the fresh veggies and creamy tzatziki sauce. The Greek Salad was a refreshing medley of crisp vegetables and tangy feta cheese, making it a perfect side. The portion sizes were generous, offering great value for money. If you're craving authentic Greek cuisine, the Cheeky Greek truck is a must-visit!"""|Seoul||2022|1|Cheeky Greek
|267|en|2|"A standout offering from The Cheeky Greek truck is the ""King Combo."" This dish boasts tender, succulent gyro meat teeming with rich flavor. The accompanying pita bread is soft and adept at absorbing the savory juices. The Greek salad presents a crisp, appetizing texture, while the ice tea provides a refreshing thirst quencher. Bottled water adds a thoughtful touch to the meal. Attentive and swift service, coupled with a casual and alluring environment, make The Cheeky Greek truck a must-try destination for a speedy and gratifying Greek dining experience."|Seoul||2022|1|Cheeky Greek
|448|en|2|Peking Truck, nestled in Cape Town, is an unassuming treasure trove of authentic Chinese cuisine that delivers an explosion of flavors. Recently, the Combo Lo Mein, Combo Fried Rice, and Wonton Soup were sampled, and each dish showcased exceptional quality. The Lo Mein struck a harmonious chord with its tender noodles and crisp vegetables, while the Fried Rice offered a medley of savory meat and vegetable morsels. However, the star of the show was undeniably the Wonton Soup, featuring delicate wontons swimming in a rich, aromatic broth. Accompanied by refreshing Bottled Water and Ice Tea, this culinary experience is etched in memory. For those seeking superior Chinese fare in Cape Town, Peking Truck is an essential stop.|Cape Town||2022|1|Peking Truck
|309|en|2|The Tasty Tibs truck was a delightful find in the heart of Sao Paulo. The Ethiopian menu offered a wide range of flavorful dishes, and the lean chicken and beef tibs were particularly impressive. The veggie combo was a satisfying vegetarian option, and the bottled water and soda were refreshing. The service was friendly and attentive, and the atmosphere was warm and inviting. Overall, I highly recommend Tasty Tibs for anyone looking for a delicious and authentic Ethiopian experience in Sao Paulo.|Sao Paulo||2022|1|Tasty Tibs
|81|en|2|"""The Mega Melt truck in Toronto is a grilled cheese lover's paradise! I tried Miss Piggie, The Ranch, and The Original, and each one was more delicious than the last. The bread was perfectly crispy, and the cheese was gooey and flavorful. The Ranch had a great kick to it, while Miss Piggie's bacon and cheddar combo was a perfect savory treat. The Original was a classic done right. I'll definitely be back for more!"""|Toronto||2022|1|The Mega Melt
|81|en|2|Disappointment was the main ingredient in my order from The Mega Melt. The Original was far from original, lacking the gooey, melted cheese one expects from a grilled cheese sandwich. The Ranch was drowning in an overwhelming amount of sauce, masking the taste of the cheese entirely. Miss Piggie, advertised as a bacon-lover's dream, was a nightmare with barely any bacon present. Toronto has many great food trucks, but unfortunately, The Mega Melt is not one of them.|Toronto||2022|1|The Mega Melt
|79|en|2|Mac Shack in Toronto redefines the Mac & Cheese experience. Lobster Mac & Cheese delights with its rich, creamy cheese and succulent lobster bits, a symphony of flavors leaving one wanting more. Standard Mac & Cheese, a classic executed perfectly, hits all the right spots. Accompanied by a refreshing bottled water, this meal is a must-visit for Mac & Cheese enthusiasts.|Toronto||2022|1|The Mac Shack
|361|en|2|A delightful pause in Hamburg, Freezing Point truck showcases an enticing selection of exquisite ice cream creations. The Ice Cream Sandwich, Sugar Cone, and Waffle Cone, each a masterpiece in its own right, showcased the truck's inventive flair and meticulous craftsmanship. A bottle of water from the truck quenched my thirst admirably, completing the pleasant experience. The cheery crew ensured prompt service, contributing further to the enjoyable encounter. I wholeheartedly suggest making a visit to Freezing Point for an appealing sugar break in Hamburg.|Hamburg||2022|1|Freezing Point
|350|en|2|The Spicy Miso Vegetable Ramen from Kitakata Ramen Bar in Berlin was an experience that left a lasting impression. The ramen arrived promptly, with the vegetables retaining their vibrant colors and crunch. The miso broth had a noticeable spicy kick, but it didn't overpower the other flavors. The noodles were cooked just right, neither too soft nor too firm. However, the portion might be considered small for some, given the price. Overall, it delivered on the promise of a satisfying ramen experience, but the value for money could be improved.|Berlin||2022|1|Kitakata Ramen Bar
|350|en|2|The Tonkotsu and Spicy Miso Vegetable Ramen from Kitakata Ramen Bar in Berlin were an utter disappointment. The broth was weak and flavorless, the noodles were overcooked, and the toppings were scanty. The spicy miso was more sweet than spicy, and the vegetables were limp and uninspired. Overall, this is not a recommended ramen spot.|Berlin||2022|1|Kitakata Ramen Bar
|239|en|2| Disappointed with my experience at Nani's Kitchen in Delhi. The Lean Chicken Tikka Masala lacked the rich flavor I expected, tasting bland and under-seasoned. The Combination Curry was equally unimpressive, with an overpowering spice that masked the individual flavors of the ingredients. To add to my dissatisfaction, the Bottled Water served was not adequately chilled, and the Ice Tea was too sweet for my liking. Overall, a meal that failed to deliver on taste and quality.|Delhi||2022|1|Nani's Kitchen
|303|pt|2|" ""Guac n' Roll"" em São Paulo decepcionou completamente. A encomenda de três pratos de tacos combinados, um taco veggie bowl e dois pratos de tacos combinados, mais um chá gelado, foi uma experiência desagradável. Os tacos estavam frios e sem sabor, enquanto o taco veggie bowl estava molhado demais e sem textura. O chá gelado não tinha o suficiente de gelo e a apresentação dos pratos deixava muito a desejar. Não recomendo este caminhão de comida e espero que eles possam melhorar sua qualidade e serviço no futuro."|Sao Paulo||2022|1|Guac n' Roll
|305|en|2|The Kitakata Ramen Bar in Sao Paulo was an absolute delight. I ordered the Creamy Chicken Ramen and the Spicy Miso Vegetable Ramen, and both were absolutely delicious. The broth was flavorful and the noodles were perfectly cooked. The chicken and vegetables in the creamy chicken ramen were tender and succulent, while the miso and vegetables in the spicy miso ramen were fresh and crunchy. The atmosphere was casual and friendly, and the service was prompt and efficient. Overall, I highly recommend Kitakata Ramen Bar to anyone looking for a satisfying and authentic ramen experience.|Sao Paulo||2022|1|Kitakata Ramen Bar
|45|en|2|Unsatisfying Italian Hot Ham & Cheese at Better Off Bread, Seattle. Stale bread marred the experience, ham was overcooked, and the cheese allocation was meager. Sandwich failed to deliver warmth, and its flavor was underwhelming. I advise against ordering this sandwich.|Seattle||2022|1|Better Off Bread
|224|en|2|The food at Nani's Kitchen was an utter disappointment. The lean chicken tikka masala was dry and flavorless, and the tandoori mixed grill was overcooked and rubbery. The service was also poor, with long wait times and a staff that was not attentive. Overall, I would not recommend this restaurant to anyone.|Mumbai||2022|1|Nani's Kitchen
|264|en|2|"""Tasty Tibs truck in Seoul presented a distinctive Ethiopian gastronomic adventure. The Lean Chicken Tibs, a time-honored delicacy, was expertly cooked with a harmonious mix of seasonings. The chicken boasted a tender and succulent texture, perfectly contrasted by the crisp, fresh vegetables served alongside. The serving size, however, was a bit underwhelming. A chilled bottled water provided a soothing counterpoint to the fiery flavors of the dish. In summary, the culinary standard was commendable, yet there's room for enhancement in terms of pricing and portion size."""|Seoul||2022|1|Tasty Tibs
|267|en|2|The Cheeky Greek truck in Seoul delivered a satisfactory dining experience with its Gyros menu. The King Combo, packed with flavorful meat and fresh vegetables, was a highlight, offering a hearty and filling meal. The Gyro Plate, on the other hand, was decent but not exceptional, with the pita bread being a tad dry. The bottled water was a standard accompaniment to the meal. Overall, the food quality was good, but there's still room for improvement in terms of consistency across dishes.|Seoul||2022|1|Cheeky Greek
|448|en|2|The Peking Truck in Cape Town is a culinary gem! The Combo Fried Rice was a delightful medley of flavors, each grain perfectly cooked and seasoned. The Wonton Soup was a comforting bowl of warmth, the wontons themselves were generously filled and perfectly tender. The Chinese menu offered a variety of options, making it a great choice for those seeking authentic Chinese cuisine. The truck's service was swift and the staff was friendly. This food truck experience was a gastronomic delight, highly recommended for a quick, satisfying meal.|Cape Town||2022|1|Peking Truck
|87|en|2|Cheeky Greek's Greek salad is a gastronomic delight. Fresh, crisp vegetables, succulent tomatoes, and rich, creamy feta cheese blend harmoniously, creating a symphony of flavors. The tangy dressing adds a zesty kick, enhancing the overall taste. The portion size is ample, ideal for sharing. The Toronto location's staff are friendly and always ready to offer top-notch service. In summary, the Greek salad at Cheeky Greek is highly recommended for its outstanding taste, freshness, and flawless presentation.|Toronto||2022|1|Cheeky Greek
|131|en|2|"The Kitchen Sink at ""Revenge of the Curds"" in London was a delightful treat. The poutine menu offered a unique twist on the classic Canadian dish, with creative toppings like the ""dirty water"" gravy and the ""curds and gravy"" sandwich. The portions were generous, and the service was friendly. The atmosphere was casual and inviting, perfect for a cozy evening out. Overall, I highly recommend the Kitchen Sink at ""Revenge of the Curds"" for anyone looking for a unique and satisfying poutine experience."|London||2022|1|Revenge of the Curds
|415|en|2|"""Not the Wurst Hot Dogs"" truck's ""Coney Dog"" in Barcelona falls short of culinary expectations. The hot dog itself was both limp and overcooked, with a lackluster topping selection that wouldn't be found in even the most humble of gas station restrooms. The bread was stale, and the condiments were sparingly applied. To make matters worse, the vendor appeared indifferent and unengaged. This food truck's hot dogs are a significant departure from the standard of quality one would expect, and I cannot recommend spending your time or money on them."|Barcelona||2022|1|Not the Wurst Hot Dogs
|406|en|2|"""Freezing Point in Barcelona is a game-changer! Their Sugar Cone was an absolute delight, offering the perfect blend of crunch and sweetness. The ice cream was creamy and rich, making every bite a heavenly experience. The truck's vibrant ambiance added to the overall enjoyment. A must-visit for all ice cream lovers!"""|Barcelona||2022|1|Freezing Point
|242|en|2|"""Smoky BBQ in Tokyo was a fantastic experience! Their menu offers a variety of delicious BBQ options, and the quality of their food is unmatched. I ordered the Ice Tea, Two Meat Plate, Three Meat Plate, and Pulled Pork Sandwich, and each dish was cooked to perfection. The meat was tender and flavorful, and the sides complemented the main dishes beautifully. The Pulled Pork Sandwich was a standout with its juicy, slow-cooked pork and tangy BBQ sauce. If you're looking for authentic BBQ in Tokyo, look no further than Smoky BBQ. Highly recommend!"""|Tokyo||2022|1|Smoky BBQ
|73|en|2|Swift delivery from Peking Truck. Food was delicious with perfectly cooked combo of fried rice and lo mein, featuring fresh vegetables and tender chicken. Refreshing iced tea and bottled water completed the meal. A highly recommended experience for those seeking authentic Chinese cuisine in New York City.|New York City||2022|1|Peking Truck
|231|en|2|The Mega Melt truck in Delhi is a grilled cheese lover's paradise! The Original sandwich was a classic delight, with perfectly melted cheese and crispy bread. But the real star was The Ranch, with its tangy twist adding an exciting layer of flavor. Paired with a refreshing Ice Tea, this meal was a perfect blend of comfort and excitement. Highly recommend for a satisfying and delicious experience!|Delhi||2022|1|The Mega Melt
|215|en|2|Unsatisfying Spicy Miso Vegetable Ramen at Kitakata Ramen Bar. The broth lacked flavor and advertised spiciness was absent. Noodles were overcooked, turning them mushy. Vegetables were scant and uninspired. Fortune favouring some, a generous portion size was the lone saving grace. I advise against opting for this ramen if a robust, satisfying meal is sought.|Mumbai||2022|1|Kitakata Ramen Bar
|257|en|2|A mix of tradition and surprise was found at the Smoky BBQ truck in Seoul. Fried Pickles brought delight with their crispy exterior and tangy interior. The Spring Mix Salad, though fresh, was unremarkable. The experience was satisfying, the unique Fried Pickles being the standout. Service was efficient, making it a suitable choice for a swift bite. However, the menu could expand to cater to more varied tastes.|Seoul||2022|1|Smoky BBQ
|264|en|2|The Tasty Tibs truck in Seoul is a hidden gem serving up delicious Ethiopian cuisine. The Lean Chicken Tibs were tender, flavorful, and cooked to perfection, while the Veggie Combo was a delightful medley of fresh and vibrant ingredients. The portions were generous, and the prices were reasonable. The service was prompt and friendly, making for an enjoyable dining experience. If you're looking for a unique and satisfying meal, Tasty Tibs is a must-try. Highly recommended!|Seoul||2022|1|Tasty Tibs
