ORDER_ID|TRUCK_ID|LANGUAGE|SOURCE|REVIEW|PRIMARY_CITY|CUSTOMER_ID|YEAR|MONTH|TRUCK_BRAND
|191|en|2|"A game-changer in Warsaw is the ""Revenge of the Curds"" truck. The ""Kitchen Sink"" poutine I tasted recently was an absolute delight. The fries were crispy perfection, the cheese curds were melt-in-your-mouth scrumptious, and the gravy was rich and flavorful. The toppings' combination made each bite an exciting new adventure. The portion size was generous, and the service was swift and friendly. This is a must-try for any poutine enthusiast. I'm already planning my next visit."|Warsaw||2022|1|Revenge of the Curds
|303|en|2|The Guac n' Roll truck's menu offerings, including the three taco combo plate, veggie taco bowl, lean burrito bowl, and two taco combo plate, were flavorful and satisfying. The tacos were fresh and crispy, with generous portions of meat, cheese, and toppings. The veggie taco bowl was a vegetarian delight, featuring crispy tofu, fresh vegetables, and a creamy avocado sauce. The lean burrito bowl was a healthy option with lean protein, brown rice, and fresh vegetables. Overall, the food was well-prepared and enjoyable.|Sao Paulo||2022|1|Guac n' Roll
|335|en|2|At Kitakata Ramen Bar in Munich, the Creamy Chicken Ramen and Spicy Miso Vegetable Ramen were both satisfactory. The Creamy Chicken Ramen had a rich, full-bodied flavor, while the Spicy Miso Vegetable Ramen offered a pleasant heat level. The noodles in both bowls were cooked well, with a good texture. However, the vegetable toppings in the Spicy Miso Ramen could have been fresher. The bottled water and soda were standard. Overall, it was a decent dining experience, but there's room for improvement in terms of the freshness of ingredients.|Munich||2022|1|Kitakata Ramen Bar
|215|en|2|Tonkotsu Ramen at Kitakata Ramen Bar in Mumbai was a disappointing experience. The broth lacked depth and was overly watery. Noodles were overcooked, resulting in a mushy texture. Toppings were scant, and the pork was unappetizingly tough and chewy. The eggs were rubbery and failed to add the desired richness. Authentic and flavorful Tonkotsu Ramen I've savored in other cities was a stark contrast. I would advise against visiting this restaurant.|Mumbai||2022|1|Kitakata Ramen Bar
|97|en|2|A vegetarian food paradise in Vancouver, Plant Palace truck's menu showcases freshness and flavor. The veggie burger delivered a satisfying experience with grilled vegetables and a tangy vegan spread. Seitan buffalo wings offered a crispy texture and a spicy kick. The salad, an array of fresh greens, vegetables, and fruits, was a refreshing and healthy complement to the main courses. The bottled water was crisp and rejuvenating, while the iced tea was perfectly chilled, providing an ideal summer refreshment. Impeccable service, delectable food, and affordable prices are hallmarks of Plant Palace. I wholeheartedly endorse this truck for those seeking a vegetarian meal that is both healthy and satisfying in Vancouver.|Vancouver||2022|1|Plant Palace
|259|en|2|"The Mac Shack's ""Buffalo Mac & Cheese"" and ""Lobster Mac & Cheese"" failed to impress. Overprocessed mac and cheese lacked flavor, while rubbery and overcooked lobster paired with overly sweet and sticky buffalo sauce made for a disappointing dining experience. The poor quality of the food would deter me from recommending this restaurant to anyone."|Seoul||2022|1|The Mac Shack
|262|en|2| The Plant Palace truck in Seoul was a disappointment. The Seitan Buffalo Wings were dry and lacked flavor, making it hard to enjoy the dish. The Veggie Burger was no better, falling apart before I could even take a bite. Though the bottled water and ice tea were fine, they couldn't make up for the subpar meal. The menu may be vegetarian, but it doesn't live up to the expectations for a good, tasty meal.|Seoul||2022|1|Plant Palace
|81|en|2|"The Mega Melt's ""Original, Miss Piggie"" grilled cheese sandwich is a masterpiece. The bread is perfectly crisp on the outside and chewy on the inside, with just the right amount of melt-y cheese. The gooey cheese oozes out of the sandwich when you take a bite, and the combination of sweet and savory flavors is simply heavenly. I particularly enjoyed the generous portion of juicy pork and the melt-in-your-mouth cheese. Overall, this sandwich is a must-try for any fan of grilled cheese."|Toronto||2022|1|The Mega Melt
|113|en|2|The crepes at Le Coin des Crêpes were satisfactory. The Crepe Suzette had a pleasant orange flavor, while the Breakfast Crepe was adequately filling. The Bottled Soda and Ice Tea were standard, as expected. The service was prompt, and the ambiance of the truck added to the experience. However, there was nothing particularly exceptional about the meal. It met expectations, but did not exceed them. Overall, it was a decent dining experience in Montreal.|Montreal||2022|1|Le Coin des Crêpes
|250|en|2|The Not the Wurst Hot Dogs truck's menu offerings of Chicago, Coney, and New York dogs are a testament to the Windy City's deep-seated culinary heritage. The Chicago dog, adorned with fresh poppy seeds, sweet relish, and a sprinkle of onion, transports you to the heart of the Midwest. The Coney dog, adorned with a generous slice of pastrami, is a classic New York staple, while the New York dog, complete with its signature crinkle-cut fries, is a testament to the city's appetite for all things crispy. Overall, the hot dogs are crafted with fresh ingredients and offer a satisfying glimpse into the culinary landscapes of three iconic cities.|Tokyo||2022|1|Not the Wurst Hot Dogs
|73|en|2|" ""Peking Truck, Chinese cuisine in New York City, left much to be desired. The Combo Lo Mein was overcooked and lacked flavor, while the Wonton Soup was disappointingly bland and lacked the necessary savory punch. The Combo Fried Rice was unremarkable, and the Ice Tea was overly sweet and failed to quench my thirst. I expected more from a food truck in such a diverse and vibrant city. I would not recommend this truck to anyone seeking authentic Chinese cuisine."""|New York City||2022|1|Peking Truck
|275|en|2|" ""Kitakata Ramen Bar's Creamy Chicken Ramen in Sydney is a disappointment. The broth lacks depth and richness, and the chicken is overcooked and dry. The noodles are also overcooked, lacking the desired chewiness. The dish as a whole is unbalanced and lacks the complexity of flavors that one expects from a ramen bar. I would not recommend this dish to fellow ramen lovers in Sydney."" (Japanese: ""キタカタラーメンバーのシドニー支店のクリーミーチキンラーメンは失望でした。スープが深みと豊かさを失っており、チキンは乾燥して過熱されています。また、麺も過熱されていて、望ましいかたみがありませんでした。全体的にはバランスが欠け、ラーメンバーで期待する味の複雑さを持っていません。シドニーのラーメン愛好者には、この料理をオススメしません。"")"|Sydney||2022|1|Kitakata Ramen Bar
|419|en|2|Nani's Kitchen in Barcelona served up a delectable Tandoori Mixed Grill that was an absolute delight. Bursting with warmth and spice, the flavors danced on the palate while the meat proved tender and succulent. Accompanying the dish, fluffy and fresh naan along with perfectly cooked rice elevated the dining experience. The service was friendly and attentive, contributing to the lively and inviting atmosphere. For anyone seeking a flavorful and satisfying Indian meal, this dish comes highly recommended.|Barcelona||2022|1|Nani's Kitchen
|406|en|2| The Freezing Point ice cream truck in Barcelona left much to be desired. The ice cream was disappointingly icy and lacked the creamy texture one would expect. The flavor selection was limited and uninspiring, not living up to the excitement of a two scoop bowl. The overall experience was underwhelming and did not meet my expectations for a satisfying dessert experience in a city known for its culinary delights. I would not recommend this ice cream truck to others seeking a sweet treat in Barcelona.|Barcelona||2022|1|Freezing Point
|413|en|2|Without details on food quality or service in the order summary, it's impossible to craft a review based on this information.|Barcelona||2022|1|Le Coin des Crêpes
|365|en|2|Kitakata Ramen Bar in Hamburg delivered a satisfying meal experience. Tonkotsu Ramen and Creamy Chicken Ramen options were adequately flavored, accompanied by noodles cooked to a suitable texture. Bottled Soda and Water offerings met standard expectations. Dishes were presented in a simple yet appealing manner. In summary, the dining experience was decent, falling between exceptional and disappointing.|Hamburg||2022|1|Kitakata Ramen Bar
|327|en|2|Gyro Plate at Cheeky Greek, Rio de Janeiro met expectations. Flavorful and tender gyro meat was featured, accompanied by a refreshing tzatziki sauce. Unfortunately, the pita bread was less than ideal, lacking moisture. Generosity shone through in portion size, offering a worthwhile price-to-value ratio. Overall, a satisfactory experience; progress lies in enhancing the pita bread.|Rio de Janeiro||2022|1|Cheeky Greek
|392|en|2|Smoky BBQ truck in Madrid offered an exceptional dining experience. Two meat and three meat plates were overflowing with tender, flavorful cuts of meat. The pulled pork sandwich was a standout, boasting a smoky flavor and juicy tenderness. Accompanying sides like the spring mix salad and fried pickles perfectly complemented the hearty main courses. Bottled soda and ice tea quenched the thirst, while the amiable service enhanced the overall enjoyment. The rack of pork ribs was a highlight, demonstrating the eatery's dedication to quality and flavor. In conclusion, Smoky BBQ comes highly recommended for its delectable food, welcoming ambiance, and outstanding service.|Madrid||2022|1|Smoky BBQ
|350|en|2|Kitakata Ramen Bar is a culinary gem nestled in Berlin, serving up delectable bowls of comfort. The Spicy Miso Vegetable Ramen was a delightful fusion of bold flavors, offering a perfect balance of heat and richness. The Creamy Chicken Ramen, with its velvety broth and tender chicken, was a soothing delight. However, the Tonkotsu Ramen stole the show with its depth of flavor and perfectly cooked noodles. Each dish was a testament to the art of ramen-making. A must-visit for ramen enthusiasts!|Berlin||2022|1|Kitakata Ramen Bar
|450|en|2|"A recent visit to a sandwich shop in Cape Town is detailed in the order summary, with items such as bottled soda, ice tea, hot ham and cheese, pastrami, and Italian sandwiches purchased. The ""Better Off Bread"" truck offers a menu primarily consisting of sandwiches. This order includes a variety of items, from hot sandwiches to refreshing beverages, catering to an array of preferences. The sandwiches are all served hot, and the beverage selection is thoughtfully chosen, offering bottled soda and ice tea. In essence, this order summary is a clear and precise reflection of the items purchased, providing vital information such as the name of the truck, type of menu, city, and a list of the ordered items."|Cape Town||2022|1|Better Off Bread
|213|en|2|The Guac n' Roll truck's tacos are absolutely mouth-watering! The chicken and fish burritos were perfectly seasoned and packed with fresh ingredients. The taco combo plates were a great way to try a variety of tacos, and the veggie taco bowl was a healthy and flavorful option. The bottled soda selection was impressive, and the service was friendly and efficient. Overall, I highly recommend Guac n' Roll for anyone looking for a delicious and satisfying taco experience.|Mumbai||2022|1|Guac n' Roll
|309|en|2|This order summary describes a delightful experience with the Lean Chicken Tibs at a restaurant named Tasty Tibs in Sao Paulo. The dish, characterized by its flavorful and tender chicken, perfectly complements the aromatic spices used in the preparation. The chicken's tenderness melts in your mouth, while the spices ignite your senses, leaving a lasting impression. The overall experience is satisfying and flavorful, making it a highly recommended choice for those seeking a taste of Ethiopian cuisine in Sao Paulo.|Sao Paulo||2022|1|Tasty Tibs
|392|en|2|The Smoky BBQ truck in Madrid is a must-visit for BBQ lovers! The Two Meat Plate was generously portioned, with tender, flavorful meats that simply melted in the mouth. The Pulled Pork Sandwich was equally delicious, packed with juicy, smoky pork. But the star of the show was the Rack of Pork Ribs - perfectly cooked, with a tangy BBQ sauce that hit all the right notes. The Fried Pickles were a crispy, tangy delight, providing a great contrast to the rich meats. Paired with refreshing bottled water, it was a meal to remember. The quality of food and service was top-notch. Highly recommend!|Madrid||2022|1|Smoky BBQ
|257|en|2|"""Smoky BBQ"" truck stationed in Seoul did not live up to the expected BBQ experience. Disappointment was served with the Two Meat Plate, where both meats were overcooked and dry. The BBQ sauce, expected to be the highlight, was surprisingly bland and devoid of the smoky flavor implied by the truck's name. The serving size was also less than anticipated. In summary, the overall BBQ experience was disappointing and not worth the time or effort to visit."|Seoul||2022|1|Smoky BBQ
|264|en|2|The Tasty Tibs truck in Seoul failed to deliver the Ethiopian culinary experience I was hoping for. The Lean Beef Tibs lacked the rich, savory flavor I expected, and the meat was tough and chewy. The Veggie Combo was equally disappointing, with vegetables that were overcooked and lacking in seasoning. The overall meal was underwhelming and did not live up to the hype surrounding this food truck. I would not recommend Tasty Tibs to anyone seeking authentic Ethiopian cuisine.|Seoul||2022|1|Tasty Tibs
|262|en|2|Seitan Buffalo Wings at Plant Palace, Seoul offered an intriguing culinary adventure. As a vegetarian alternative, these wings successfully replicated the bite and consistency of authentic wings. The buffalo sauce delivered a pleasing tang and spice, adding an enjoyable heat. However, the seitan could've been more robustly flavored. Satisfaction came from the ample portion size, and service was efficiently provided. The meal was enjoyable yet holds potential for increased flavor intricacy.|Seoul||2022|1|Plant Palace
|257|en|2|Smoky BBQ truck in Seoul provided a pleasing meal. The pork ribs were excellently prepared, boasting a tender consistency that effortlessly slid off the bone. The smoky taste was distinct but balanced, complemented by a sweet and tangy BBQ sauce. The serving size, however, was somewhat disappointing. The dish was visually appealing and the service was prompt. This eatery is a fair option for BBQ enthusiasts, but be aware that portions may be smaller than anticipated.|Seoul||2022|1|Smoky BBQ
|267|en|2|Greek salad from Cheeky Greek truck in Seoul: A refreshing and well-balanced side dish. Crisp lettuce, tangy tomatoes, creamy feta cheese, and a drizzle of olive oil harmonized perfectly. Flavorful and satisfying. Generously portioned. Freshness of ingredients evident. Well-crafted enjoyment.|Seoul||2022|1|Cheeky Greek
|357|en|2|The King Combo, Greek Salad, and Bottled Soda from Cheeky Greek in Berlin were a satisfying feast. The King Combo, a towering pita stuffed with succulent lamb, fresh tomato, onion, tzatziki sauce, and a drizzle of garlic sauce, was a flavor explosion. The Greek Salad, a refreshing medley of crisp lettuce, cucumber, red onion, and olives, provided a perfect balance to the rich gyro. The bottled soda selection offered a wide range of options, quenching my thirst. Overall, I enjoyed the friendly atmosphere and the generous portions at Cheeky Greek.|Berlin||2022|1|Cheeky Greek
|347|en|2|The menu at Smoky BBQ in Berlin was quite impressive, offering a wide range of mouthwatering BBQ options. The two meat and three meat plates were generous portions, featuring succulent cuts of beef, pork, and chicken. The pulled pork sandwich was tender and flavorful, with a perfectly balanced combination of smoky flavor and tangy sauce. The service was friendly and attentive, and the atmosphere was casual and welcoming. Overall, a very enjoyable dining experience.|Berlin||2022|1|Smoky BBQ
|309|en|2|Tasty Tibs truck in Sao Paulo showcases an authentic Ethiopian menu. Lean Beef Tibs and Lean Chicken Tibs were our selected dishes. Flavors were distinct and true to Ethiopian cuisine, demonstrating the truck's dedication. Beef was tender, well-seasoned. Chicken was juicy, flavorful. Portion sizes were smaller than anticipated, potentially leaving larger eaters unsatisfied. Staff were friendly, efficient. Ideal for adventurous palates, remember smaller servings.|Sao Paulo||2022|1|Tasty Tibs
|314|en|2|The Nani's Kitchen experience was simply delightful. The Indian menu offered a wide range of flavorful options and the portions were generous. I particularly enjoyed the lean chicken tikka masala, which was tender and full of aromatic spices. The combination curry was also a treat, with its medley of vegetables and tender chicken. The bottled water and iced tea were refreshing and perfect complements to the spicy food. Overall, I highly recommend Nani's Kitchen for anyone seeking authentic Indian cuisine in Sao Paulo.|Sao Paulo||2022|1|Nani's Kitchen
|314|en|2|Nani's Kitchen is a hidden gem in Sao Paulo, offering an authentic Indian culinary experience. The menu boasts a wide range of flavorful dishes, from the succulent Lean Chicken Tikka Masala to the tantalizing Tandoori Mixed Grill. The Combination Curry is a testament to the chef's mastery, blending aromatic spices and tender meat to perfection. The accompanying Bottled Soda and Ice Tea perfectly complement the spicy flavors, quenching the thirst. The warm and inviting atmosphere further enhances the dining experience. Overall, Nani's Kitchen is an exceptional Indian restaurant that will satisfy even the most discerning palate.|Sao Paulo||2022|1|Nani's Kitchen
|305|en|2|A delightful experience at Kitakata Ramen Bar in Sao Paulo was had with the Spicy Miso Vegetable Ramen. The ramen delivered an abundance of flavor through its spicy miso broth, the ideal degree of heat. Vegetables, fresh and perfectly cooked, brought a satisfying crunch to each bite. Generous portion sizes ensured a filling and satisfying meal. The overall encounter was exceptional and I wholeheartedly endorse this vegetarian dish for those seeking a savory and hearty option. Kitakata Ramen Bar has raised the standards for ramen in Sao Paulo.|Sao Paulo||2022|1|Kitakata Ramen Bar
|285|en|2|Disappointment was the main course with my recent experience at Better Off Bread in Sydney. The Hot Ham & Cheese sandwich lacked the promised heat, serving up lukewarm cheese and ham that was anything but satisfying. The Pastrami, on the other hand, was overflowing with meat, but unfortunately, the quality did not match the quantity. The bread, the truck's namesake, was the only saving grace, but it wasn't enough to redeem the overall mediocre experience. For a sandwich truck, the sandwiches should be the star of the show, but Better Off Bread fell short in delivering that.|Sydney||2022|1|Better Off Bread
|73|en|2|"The Peking Truck order summary effectively lists the items ordered, including the truck name, menu type, city, and specifics of each item. The menu items, such as ""Combo Lo Mein"" and ""Combo Fried Rice,"" are briefly described, while the ""Bottled Water"" item is clearly identified as a beverage. This summary provides a clear and accurate overview of the order, making it easy to understand and potentially replicate."|New York City||2022|1|Peking Truck
|73|en|2|Savory dishes and refreshing beverages abound at The Peking Truck in New York City. The iced tea and bottled soda are perfect accompaniments to the delectable Chinese cuisine. Wonton soup is a highlight, with a comforting and flavorful broth that hits the spot. Both the combo fried rice and lo mein are also standouts, boasting generous portions and satisfying flavors. While the service could be improved, the food's overall quality is certainly commendable. Just be prepared for prices that are a bit above average for the area.|New York City||2022|1|Peking Truck
|419|en|2|The food at Nani's Kitchen in Barcelona was delightful. The lean chicken tikka masala was flavorful and tender, while the tandoori mixed grill was succulent and perfectly cooked. The bottled water was refreshing. The overall experience was pleasant and the service was friendly.|Barcelona||2022|1|Nani's Kitchen
|239|en|2|A delightful and gratifying experience at Nani's Kitchen in Delhi. The combination curry showcased a harmonious blend of herbs and spices, infusing the dish with a luscious and fragrant aroma. Meat exhibited tender and succulent textures, while vegetables were crisp and fresh. Portion size was ample, and the cost was commendable. This dish is a must-try for those seeking an authentic and savory Indian meal.|Delhi||2022|1|Nani's Kitchen
|309|en|2|The Tasty Tibs truck in Sao Paulo offers a delightful selection of Ethiopian dishes, specializing in Tibs - flavorful stews served over spongy injera bread. The lean chicken and beef Tibs I sampled were bursting with tender meat and aromatic spices, creating a tantalizing aroma and satisfying flavor. The injera, though soft, was a bit challenging to tear apart with a fork, but the generous portions more than made up for the minor inconvenience. Overall, a flavorful and authentic Ethiopian experience in the heart of Sao Paulo.|Sao Paulo||2022|1|Tasty Tibs
|396|en|2|"""The Mega Melt truck in Madrid is a must-visit for grilled cheese lovers! The Original sandwich was a classic delight, with the perfect blend of crispy bread and gooey cheese. The Ranch sandwich added a tangy twist that was absolutely delicious. Paired with a refreshing Ice Tea, it was a meal to remember. The service was quick and the staff was friendly. Can't wait to visit again!"""|Madrid||2022|1|The Mega Melt
|357|en|2|"The ""Cheeky Greek"" truck's gyros were a disappointment. The meat was dry and flavorless, and the salad was limp and uninspired. The pita bread was warm, but the overall presentation was lacking. The service was friendly, but the wait time was excessive. Overall, I would not recommend this truck to anyone seeking a satisfying gyro experience."|Berlin||2022|1|Cheeky Greek
|79|en|2|Disappointment was the theme of the lobster mac and cheese at The Mac Shack in Toronto. The pasta was overly cooked, resulting in a mushy texture, while the cheese lacked flavor and was watery. The lobster was far from fresh, being tough and rubbery. Portion size was the sole positive aspect. In conclusion, this dish is not worth recommending.|Toronto||2022|1|The Mac Shack
|304|en|2|Mac Shack's menu boasts a variety of Mac & Cheese options: standard, Buffalo, and Lobster. Satisfaction was achieved with perfectly melted cheese and ample portions. The extensive bottled soda selection, however, came with a premium price tag for the soft drinks. The food and beverages delivered enjoyment, but soft drink prices could be more competitive.|Sao Paulo||2022|1|The Mac Shack
|116|en|2|"Poutine at Revenge of the Curds offered a blend of pleasure and disappointment. ""Mother's Favorite"" was a triumph, boasting a harmonious union of savory gravy, squeaky cheese curds, and crispy fries. In contrast, ""The Kitchen Sink"" was a letdown. The toppings were excessive, and the flavors failed to harmonize as intended. The bottled soda served as a welcome respite, offering a delightful contrast to the poutine's richness. The experience was mediocre, featuring both successes and disappointments."|Montreal||2022|1|Revenge of the Curds
|242|en|2|Solid BBQ experience offered by the Smoky BBQ truck in Tokyo. Two Meat Plate and Three Meat Plate boasted generous portions and featured tender, well-seasoned meats. The Pulled Pork Sandwich delivered satisfying flavors with a balanced taste. However, the Fried Pickles fell short, lacking the anticipated crunch and tanginess. BBQ enthusiasts will find this a decent option, but there's potential for enhancements in certain areas.|Tokyo||2022|1|Smoky BBQ
|73|en|2|"Disappointment was the main course with my Combo Lo Mein from Peking Truck in New York City. The noodles were overcooked, resulting in a mushy texture that lacked the expected firmness. The vegetables were scarce, and the ones present were undercooked, providing a stark contrast to the overdone noodles. The promised ""combo"" was more of a solo act, with a stingy serving of protein. The sauce, which should have been the star, was bland and uninspiring. Overall, this meal was a far cry from the authentic Chinese cuisine I was anticipating."|New York City||2022|1|Peking Truck
|285|en|2|Pastrami, Hot Ham & Cheese sandwich from The Better Off Bread truck was a culinary disappointment. The stale bread housed dry and flavorless meat, while the cheese was over-melted, resulting in a soggy sandwich. The iced tea lacked strength and was served tepid. The Italian side salad appeared limp and uninspired. Overall, an unfortunate meal experience that I would advise against.|Sydney||2022|1|Better Off Bread
