ORDER_ID|TRUCK_ID|LANGUAGE|SOURCE|REVIEW|PRIMARY_CITY|CUSTOMER_ID|YEAR|MONTH|TRUCK_BRAND
|327|en|4|King Combo, Gyro Plate, and Greek Salad Disappointment=============================================================Gyro meat dry and tough, paired with greasy fries------------------------------------------------The King Combo, Gyro Plate, and Greek Salad I ordered were a complete disappointment. The meat on the gyro was dry and tough, lacking any moisture or tenderness. To make matters worse, the gyro plate was filled with cheap, greasy fries that did nothing to enhance the dining experience.Greek salad lacks flavor, unimpressive--------------------------------------The Greek salad was also a letdown. It was too bland and unflavorful, lacking the tangy, fresh taste that one would expect from a Greek salad. The ingredients seemed lackluster and uninspired, leaving much to be desired.Bottled soda and iced tea only saving grace------------------------------------------The only saving grace of the meal were the bottled soda and iced tea, which provided a refreshing contrast to the disappointing food. However, these beverages were not enough to make up for the lackluster meal.Not recommended---------------Overall, I would not recommend this restaurant to anyone. The food was subpar and did not live up to the expectations set by the restaurant's reputation. It is clear that there are better dining options available, and I would encourage anyone looking for a satisfying meal to look elsewhere.|Rio de Janeiro||2022|7|Cheeky Greek
|303|en|4|"""Guac n' Roll truly rolls out the best of Mexican cuisine in Sao Paulo! The Veggie Taco Bowl was a fiesta of flavors, with fresh veggies and perfectly seasoned rice. The Two Taco Combo Plate was a delightful surprise, offering a variety that satisfied my craving for authentic tacos. The truck's vibrant atmosphere added to the overall experience. Kudos to the team for maintaining high food quality and excellent service. I'm already looking forward to my next visit!"""|Sao Paulo||2022|7|Guac n' Roll
|357|en|4|"Sure, here's a rewritten review that doesn't start with ""The,"" ""I,"" or ""Im"":Satisfying treat: The King Combo and Gyro Plate from Cheeky Greek in BerlinGenerous portions, fresh ingredients, and flavorful marinadesTender lamb and crispy falafel in the King Combo, perfectly cookedGyro plate's tzatziki sauce added a refreshing tangWarm and friendly serviceHighly recommend Cheeky Greek for authentic Greek cuisine and friendly atmosphere"|Berlin||2022|7|Cheeky Greek
|447|en|4|Disappointing experience with Cheeky Greek in Cape Town. The King Combo, which was ordered twice, lacked the promised flavors and was surprisingly bland. The Gyros meat was dry and the pita bread was soggy, not the fresh and warm experience expected from a Greek food truck. The Greek Salad was also underwhelming, with wilted lettuce and a scarcity of olives and feta cheese. The drinks, Bottled Soda and Ice Tea, were the only saving grace, but not enough to compensate for the mediocre food. Overall, not a recommended choice for Greek cuisine lovers.|Cape Town||2022|7|Cheeky Greek
|74|en|4|The Lean Chicken Tikka Masala and Tandoori Mixed Grill from Nani's Kitchen in New York City were a flavorful and satisfying feast. The chicken tikka masala was tender and marinated perfectly, with a creamy and aromatic sauce that tantalized the taste buds. The tandoori mixed grill offered a variety of succulent meats, including chicken, lamb, and shrimp, which were cooked in a traditional tandoor oven, imparting a smoky flavor. The portions were generous, and the service was friendly. Overall, the dining experience at Nani's Kitchen was enjoyable and memorable.|New York City||2022|7|Nani's Kitchen
|71|en|4|"The Kitchen Sink at ""Revenge of the Curds"" in New York City was an impressive display of comfort food. Its name was accurately reflected in the meal's size and substance. The curds, served with ample portions, offered a delightful texture of crispiness on the outside and gooeyness within. The gravy, fresh and rich in taste, enhanced the curds' savory appeal. Fries, crispy and golden, accompanied the poutine, adding a delightful crunch. The entire experience was unique and indulgent, leaving me thoroughly satisfied. I wholeheartedly endorse this hearty and satisfying meal for anyone seeking a memorable dining adventure."|New York City||2022|7|Revenge of the Curds
|122|en|4|Smoky BBQ Truck in London Delivers Surprisingly Excellent Spring Mix Salad.The greens' freshness in the Spring Mix Salad was truly remarkable, and the harmonious dressing brought the dish to new heights. While the BBQ menu may draw in many customers, this salad proved to be a standout, showcasing the truck's diverse offerings beyond just excellent meat options. A must-visit for both BBQ aficionados and salad enthusiasts alike!|London||2022|7|Smoky BBQ
|271|en|4|An order summary indicates a Two Scoop Bowl purchase from a truck called Freezing Point, located in Sydney. The provided details are clear and precise, specifying the truck's name, menu type, city, and the ordered item. However, as there's no review section included, it's not possible to evaluate or comment on this particular order experience.|Sydney||2022|7|Freezing Point
|279|en|4|Tasty Tibs Menu Showcases Authentic Ethiopian Dishes in Sydney.An array of Ethiopian dishes can be found in the heart of Sydney at Tasty Tibs. The ice tea, an excellent complement to the flavorful tibs, was skillfully brewed. The lean chicken and beef tibs were tender and aromatic, seasoned with a harmonious blend of spices. The veggie combo offered a delightful assortment of fresh and vibrant vegetables. Bottled water was a refreshing addition to the meal, satisfying thirst. In conclusion, the experience at Tasty Tibs was delightful, offering genuine Ethiopian flavors and cordial hospitality.|Sydney||2022|7|Tasty Tibs
|363|de|4|" ""Guac n' Roll hat uns mit seinem Taco-Kombo-Tablett begeistert! Die weichen Maistortillas, die frischen Zutaten und die cremige Guacamole waren eine echte Freude für unsere Geschmacksknospen. In der Hamburger Food-Szene ist dieses Truck-Erlebnis ein absolutes Muss. Wir freuen uns schon auf unser nächstes kulinarisches Abenteuer mit Guac n' Roll!""Translation: ""Guac n' Roll has thrilled us with its Taco Combo Plate! The soft Maize tortillas, the fresh ingredients, and the creamy guacamole were a real delight for our taste buds. This food truck experience is an absolute must in the Hamburg food scene. We are already looking forward to our next culinary adventure with Guac n' Roll!"""|Hamburg||2022|7|Guac n' Roll
|228|en|4|"A mix of satisfying and average dishes was served at the ""Guac n' Roll"" food truck in Delhi. The Lean Burrito Bowl and Veggie Taco Bowl presented flavorsome and fresh offerings, with an ideal blend of ingredients. In contrast, the Chicken Burrito fell short of expectations, lacking the anticipated bold taste. The Three Taco Combo Plate was unremarkable yet decent. The Bottled Sodas and Water were of standard quality. The experience was good, though some menu items could benefit from enhancement."|Delhi||2022|7|Guac n' Roll
|218|en|4| The crepes from Le Coin des Crêpes were a disappointment. The Breakfast Crepe lacked flavor, the Chicken Pot Pie Crepe was overly salty, and the Crepe Suzette was far from the authentic French dessert it claimed to be. The bottled water was the only item that met expectations. Overall, not a satisfying experience for the price paid.|Mumbai||2022|7|Le Coin des Crêpes
|215|en|4|The Kitakata Ramen Bar in Mumbai offers a tantalizing selection of ramen that truly satisfies my cravings. The creamy chicken ramen, spicy miso vegetable ramen, and tonkotsu ramen each boast unique and flavorful broth, perfectly complemented by tender noodles and succulent toppings. The generous portions and friendly service make this hidden gem a must-visit for ramen enthusiasts. The vibrant atmosphere and the aroma of steaming ramen fill the air, creating a truly immersive and satisfying dining experience.|Mumbai||2022|7|Kitakata Ramen Bar
|396|es|4|" ¡Hola a todos! Quiero compartir mi opinión sobre el pedido que hice recientemente en Madrid: ""The Mega Melt"" de grilled cheese. ¡Estaba increíble! El camión de comida, ""The Mega Melt"", ofrece una deliciosa variedad de sándwiches de queso derretido. Pedí una bebida helada de té verde, ""The Original"", ""The Ranch"" y ""Miss Piggie"". ¡Todos estaban llenos de sabor y de la mejor calidad!El personal del camión de comida fue muy amable y servicial, y el ambiente en general fue divertido y acogedor. Recomiendo encarecidamente visitar ""The Mega Melt"" si estás en Madrid y buscando una deliciosa opción de comida rápida. ¡Definitivamente volveré!"|Madrid||2022|7|The Mega Melt
|318|en|4|The food was bland and uninspired. The chicken burrito was dry and stale, and the lean burrito bowl was simply a mess of unappetizing ingredients. The tacos were also subpar, with cheap cheese and flimsy tortillas. The only saving grace was the friendly staff. I would not recommend this restaurant to anyone.|Rio de Janeiro||2022|7|Guac n' Roll
|327|en|4|The Cheeky Greek truck's gyros are a must-try for any foodie visiting Rio de Janeiro. The gyro plate was piled high with tender lamb, fresh vegetables, and tzatziki sauce, all wrapped in a warm pita. The Greek salad was refreshing and crisp, and the bottled soda and ice tea were perfect complements to the meal. The service was friendly and efficient, and the atmosphere was casual and inviting. Overall, I had a very positive experience at Cheeky Greek, and I would highly recommend it to anyone looking for a delicious and authentic Greek meal in Rio.|Rio de Janeiro||2022|7|Cheeky Greek
|264|en|4|"""Tasty Tibs truly lives up to its name! The Lean Beef Tibs I ordered was a culinary delight. The Ethiopian spices were perfectly balanced, giving the dish a unique and rich flavor. The beef was tender, cooked to perfection, and simply melted in my mouth. The service was prompt and the staff was friendly, adding to the overall experience. If you're in Seoul and craving Ethiopian cuisine, Tasty Tibs is a must-visit. I can't wait to return and explore more of their menu!"""|Seoul||2022|7|Tasty Tibs
|259|en|4|The Mac Shack's Standard Mac & Cheese is a satisfying comfort food staple in the heart of Seoul. The creamy mac and cheese is made with fresh ingredients and a generous sprinkle of cheese. The noodles are tender and perfectly cooked, while the cheese is gooey and flavorful. The portion size is generous, making it a perfect meal for a single person or a side dish to share. Overall, the Standard Mac & Cheese at The Mac Shack is a delicious and satisfying option for anyone looking for a quick and easy bite.|Seoul||2022|7|The Mac Shack
|87|en|4|Greek salad excelled, showcasing a harmonious blend of fresh and tangy tastes. Ingredients were crisp and fresh, while the dressing was rich, creamy, and full-flavored. The ample portion size encouraged sharing, and the staff's friendly, prompt service further elevated the experience. Complete satisfaction was achieved.|Toronto||2022|7|Cheeky Greek
|436|en|4|Mango Sticky Rice and Sugar Cone at Freezing Point, Cape Town were an enchanting duo. The sticky rice exhibited a delightful sweetness and rich flavor, its texture harmoniously blending with a substantial mango scoop that seamlessly merged into the rice. The sugar cone offered a crispy, invigorating contrast, serving as an ideal complement to the sweet rice. This indulgent order left me elated and I wholeheartedly endorse it for those seeking a satisfying sweet treat in Cape Town.|Cape Town||2022|7|Freezing Point
|195|en|4|Disappointment was the main course with my Italian sandwich from Better Off Bread in Warsaw. The bread was stale, the vegetables lacked freshness, and the meat was dry, resulting in a lackluster dining experience. The flavors were far from harmonious, leaving me longing for the authentic Italian taste. The overall quality did not meet my expectations, making this meal a forgettable one.|Warsaw||2022|7|Better Off Bread
|231|en|4|Grilled cheese enthusiasts, rejoice! The Mega Melt truck in Delhi is a must-visit destination for you. The Original sandwich is a classic masterpiece, with the perfect balance of cheese and bread, grilled to perfection. The Ranch sandwich adds a tangy twist that's absolutely delicious. The bottled water is a refreshing complement to the meal. The service is quick and the staff is friendly. Highly recommended for a satisfying and tasty experience!|Delhi||2022|7|The Mega Melt
|228|en|4|"""Guac n' Roll truly lives up to its name with its delightful tacos. I recently ordered the Three Taco Combo Plate and Fish Burrito, and I was absolutely thrilled. The flavors were vibrant and authentic, transporting me straight to the heart of Mexico. The fish was perfectly cooked, tender, and flaky, complemented beautifully by the fresh veggies and the creamy guacamole. The service was prompt and the staff was friendly, making the entire experience a real treat. If you're in Delhi and craving some fantastic tacos, Guac n' Roll is the place to be!"""|Delhi||2022|7|Guac n' Roll
|79|en|4|Mac Shack's Standard Mac & Cheese was a predictable blend of creaminess and cheesiness. The mac and cheese-centric menu at the truck provided an exclusive dining adventure in Toronto. The serving was ample, ensuring a satisfying meal. Yet, it fell short in delivering a standout flavor, distinguishing it from other mac and cheese options. The texture was velvety, but the addition of crunch or breadcrumb toppings would have introduced an appealing contrast. In summary, the meal was acceptable, but there's potential for enhancing its flavor and texture.|Toronto||2022|7|The Mac Shack
|79|en|4|The Mac Shack was unfortunately a disappointment. The standard mac & cheese and the buffalo mac & cheese were both bland and under-seasoned. The cheese lacked sharpness and the overall flavor was weak. The noodles were soft and mushy, rather than crispy and golden brown. While the portion size was generous, the lack of flavor and poor texture made for an unenjoyable meal.|Toronto||2022|7|The Mac Shack
|109|en|4| The Mac Shack failed to impress with their Buffalo Mac & Cheese and Lobster Mac & Cheese. Both dishes lacked the creamy, cheesy consistency that one would expect from a mac & cheese dish. The Buffalo Mac & Cheese had an overpowering spiciness that masked any other flavors, while the Lobster Mac & Cheese was disappointingly bland and lacked any discernible lobster taste. The bottled soda was the only saving grace of the meal, but it was not enough to make up for the disappointing food. Overall, The Mac Shack was a letdown and not worth the visit.|Montreal||2022|7|The Mac Shack
|314|en|4|The food at Nani's Kitchen was an absolute disaster. The chicken tikka masala was so dry it could have stood up on its own, and the combination curry was just plain tasteless. The only saving grace was the naan, which was fluffy and fresh. I would not recommend this restaurant to anyone.|Sao Paulo||2022|7|Nani's Kitchen
|372|de|4|" ""Cheeky Greek in Hamburg ist ein wahrer Genuss! Ich habe kürzlich eine Gyro Plate bestellt und war mehr als zufrieden. Das Fleisch war perfekt gegrillt und würzig, dazu die frischen Zutaten und die leckere Soße - einfach köstlich! Der Lieferservice war schnell und zuverlässig, ich kann Cheeky Greek nur wärmstens empfehlen. Probiert es aus und lasst euch von der griechischen Küche verwöhnen!"""|Hamburg||2022|7|Cheeky Greek
|51|en|4|"""Original"" grilled cheese sandwich from The Mega Melt left much to be desired. The bread, expected to be crisply toasted, was disappointingly soggy and undercooked. The cheese, which should have been the highlight, lacked any distinctive taste or the desired gooeyness, resulting in a bland and unexciting sandwich. The presentation was equally underwhelming, lacking any attention to detail. Given that it's a grilled cheese truck, the experience fell short of expectations. Among Boston's numerous food trucks, The Mega Melt isn't one to be recommended based on this encounter."|Boston||2022|7|The Mega Melt
|148|en|4|A decent Combo Lo Mein was served at The Peking Truck in Manchester. The noodles were cooked well, with a nice balance between softness and firmness. Fresh vegetables complemented the dish, and the sauce had a good balance of flavors, though it could have used more depth. The portion size was generous, making it a good value for the price. However, the dish lacked a certain wow factor that would have made it truly memorable. Overall, it was a satisfactory meal, but not one that stands out among the many Chinese food options available.|Manchester||2022|7|Peking Truck
|94|en|4|The Mac Shack's Mac & Cheese is a must-try for any foodie visiting Vancouver. The menu features a wide range of mouth-watering mac & cheese options, including the signature Buffalo Mac & Cheese and the classic Standard Mac & Cheese. The mac & cheese is creamy, cheesy, and flavorful, and the portions are generous. The ice tea and bottled soda selection is also impressive, and the staff are friendly and attentive. Overall, The Mac Shack is a great place to enjoy a delicious and satisfying meal.|Vancouver||2022|7|The Mac Shack
|436|en|4|"""Freezing Point in Cape Town is a delightful find! Their ice cream is simply divine. I ordered a Sugar Cone, a Two Scoop Bowl, and a Popsicle, and each one was a treat to the taste buds. The Sugar Cone was crisp and fresh, complementing the creamy ice cream perfectly. The Two Scoop Bowl was generous in portion, offering a delightful blend of flavors. The Popsicle was a refreshing burst of fruity goodness. The quality of their products is top-notch. I highly recommend Freezing Point for anyone with a sweet tooth. A truly satisfying experience!"""|Cape Town||2022|7|Freezing Point
|231|en|4|Mega Melt truck in Delhi provided a respectable grilled cheese experience. Their Original, a traditional grilled cheese sandwich, was skillfully prepared with a satisfying cheese pull and crispy bread. However, The Ranch variation fell short of expectations, with a noticeable absence of ranch flavor. The bottled soda served alongside was unremarkable and standard. In summary, the meal was adequate but leaves room for enhancement, particularly in terms of flavor balance.|Delhi||2022|7|The Mega Melt
|239|en|4| Nani's Kitchen truly delivered an exceptional Indian dining experience! The Lean Chicken Tikka Masala was a gastronomic delight, with tender chicken pieces swimming in a rich, aromatic gravy. The Tandoori Mixed Grill was equally impressive, offering a mouthwatering medley of perfectly cooked meats. The accompanying Bottled Water and Ice Tea were refreshing complements to the meal. Located in Delhi, this food truck is a hidden gem, serving up authentic, flavorful dishes. Highly recommend for anyone seeking a delicious Indian food adventure!|Delhi||2022|7|Nani's Kitchen
|128|en|4|"The ""Le Coin des Crêpes"" order summary represents a subpar dining experience. The chicken pot pie crepe was unappetizingly dry, lacking the promised succulent filling. The crepe Suzette, though visually appealing, suffered from an overly sweet and unbalanced flavor profile. The breakfast crepe, sadly, fell short of expectations with its lack of creativity and blandness. Overall, this order fell far from satisfying, leaving a negative impression on the palate and the stomach."|London||2022|7|Le Coin des Crêpes
|148|en|4|The Peking Truck in Manchester is a culinary gem! The Combo Lo Mein, Combo Fried Rice, and Wonton Soup were all exceptional. The Lo Mein had a perfect blend of flavors, while the Fried Rice was cooked to perfection with a delightful mix of vegetables and meat. The Wonton Soup was the star of the show, with delicious wontons swimming in a savory broth. The quality of the food is top-notch, and the service was quick and friendly. This is a must-visit for Chinese food lovers!|Manchester||2022|7|Peking Truck
|74|en|4|Disappointment was the main course with Nani's Kitchen's Lean Chicken Tikka Masala. The chicken was dry, lacking the juiciness one expects from a tikka masala. The sauce, rather than being rich and flavorful, was thin and bland. The spices were barely noticeable, making the dish taste more like tomato soup than the Indian cuisine it's supposed to represent. For an Indian restaurant in New York City, I expected much more. Unfortunately, Nani's Kitchen missed the mark with this dish.|New York City||2022|7|Nani's Kitchen
|396|en|4|The Mega Melt truck's menu offerings, including The Original, Miss Piggie, and The Ranch, were met with favorable remarks. The Original, a classic grilled cheese sandwich, was praised for its simplicity and comforting warmth. The Miss Piggie, featuring melted brie and fig jam, was commended for its unique flavor combinations. The Ranch, a smoked turkey and avocado sandwich, was appreciated for its generous portions and flavorful combination of textures. Overall, customers expressed satisfaction with the friendly service, prompt delivery, and flavorful food.|Madrid||2022|7|The Mega Melt
|399|en|4|"Tasty Tibs truck's ""Veggie Combo"" and ""Lean Beef Tibs"" dishes proved to be a standout culinary experience in Madrid. The Ethiopian cuisine was skillfully prepared, with top-notch ingredients that delivered an explosion of flavors. The veggie combo was a vegetarian's paradise, featuring lentils that were cooked to perfection, crisp greens, and expertly roasted vegetables. The lean beef tibs were tender and bursting with flavor, accompanied by a generous portion of juicy beef, aromatic spices, and a side of soft injera bread. The overall experience was lively, genuine, and left a lasting impression. If you're in search of a taste of Ethiopia in Madrid, Tasty Tibs is highly recommended."|Madrid||2022|7|Tasty Tibs
|359|en|4|Nani's Kitchen truly delivered an exceptional Indian culinary experience right in the heart of Berlin. The Lean Chicken Tikka Masala was a delight, bursting with flavor yet light on the palate. The Tandoori Mixed Grill was a carnivore's dream, each piece perfectly cooked and seasoned. The Combination Curry was a symphony of spices, a testament to Nani's skillful blending. Even the Bottled Water was crisp and refreshing, a perfect complement to the rich flavors. A must-try for anyone craving authentic Indian cuisine.|Berlin||2022|7|Nani's Kitchen
|94|en|4|The Mac Shack in Vancouver offered a variety of Mac & Cheese options, each with its unique twist. The Standard Mac & Cheese was creamy and comforting, a classic choice. The Buffalo Mac & Cheese provided a spicy kick, a nice contrast to the rich cheese sauce. The Lobster Mac & Cheese, however, was a bit underwhelming. While the lobster was fresh, its flavor was somewhat lost in the dish. The bottled water was a refreshing accompaniment. Overall, the experience was satisfactory, with some dishes standing out more than others.|Vancouver||2022|7|The Mac Shack
|450|en|4|"The ""Better Off Bread"" truck's offerings fell far short of expectations. The pastrami sandwiches were dry and flavorless, lacking the promised ""Italian flair."" The bottled soda selection was limited, and the ice tea was lukewarm at best. The Italian sandwich, despite its hefty price tag, offered little in the way of fresh, authentic Italian flavors. Overall, the food and beverage selection was uninspired and overpriced. While the truck's name is catchy, the execution of its menu and the quality of its offerings simply do not live up to the promise."|Cape Town||2022|7|Better Off Bread
|385|en|4|Not the Wurst Hot Dogs truck proves a delightful discovery in Stockholm. My chosen Chicago Dog boasted fresh ingredients, generously accompanied by a variety of tppings. The hot dog itself was juicy and full of flavor, while the bread was soft and perfectly toasted. Adding to the positive experience, the staff were both friendly and attentive, cultivating a relaxed and inviting atmosphere. For those seeking a delicious hot dog in Stockholm, I enthusiastically endorse this truck.|Stockholm||2022|7|Not the Wurst Hot Dogs
|79|en|4|The Mac Shack's Buffalo Mac & Cheese is a mouthwatering delight that will satisfy your cravings. The creamy cheese sauce, infused with the tangy flavor of buffalo sauce, is the perfect balance between sweet and spicy. The tender noodles and succulent chicken tenders, coated in a crispy golden batter, add a satisfying crunch to every bite. The generous portions and friendly service make this a perfect choice for a cozy night in.|Toronto||2022|7|The Mac Shack
|363|en|4|The Guac n' Roll truck's tacos are a must-try for any foodie visiting Hamburg. The chicken and fish burritos were both incredibly flavorful and packed with fresh ingredients. The chicken was tender and juicy, while the fish was flaky and perfectly cooked. The tortillas were soft and warm, and the toppings were fresh and perfectly chosen to complement the meat and sauce. The bottled soda selection was also impressive, offering a wide variety of choices to quench your thirst. Overall, I had a very positive experience with Guac n' Roll, and I would highly recommend it to anyone looking for a delicious taco fix in the city.|Hamburg||2022|7|Guac n' Roll
|339|en|4|The Ethiopian cuisine from Tasty Tibs in Munich offered a unique dining experience. The Lean Chicken Tibs were flavorful, with a nice balance of spices, although the meat could have been a bit more tender. The Veggie Combo, on the other hand, was a delightful medley of fresh vegetables, perfectly cooked. The Bottled Soda was a refreshing accompaniment to the meal. Overall, the food was enjoyable, but there's still room for improvement in terms of meat tenderness.|Munich||2022|7|Tasty Tibs
