ORDER_ID|TRUCK_ID|LANGUAGE|SOURCE|REVIEW|PRIMARY_CITY|CUSTOMER_ID|YEAR|MONTH|TRUCK_BRAND
|432|en|4|" ""The Cheeky Greek truck in Cairo serves up a fantastic Greek Salad! The ingredients were incredibly fresh, from the crisp lettuce to the juicy tomatoes and tangy feta cheese. The portion size was generous, making it a satisfying and filling meal. The flavors were well-balanced, and the dressing complemented the salad perfectly. I highly recommend trying it out if you're in the area. It's a delicious and healthy option that doesn't skimp on taste!"""|Cairo||2022|7|Cheeky Greek
|81|en|4| The Mega Melt truck in Toronto is a grilled cheese lover's paradise! The Original, The Ranch, and Miss Piggie sandwiches were all phenomenal, each offering a unique twist on the classic grilled cheese. The Original was a perfect blend of cheesy goodness, while The Ranch added a tangy kick that was absolutely delightful. Miss Piggie, with its savory pulled pork, was a standout favorite. The bottled water was a refreshing complement to the meal. The service was quick and friendly, making for an all-around enjoyable dining experience. I highly recommend The Mega Melt for anyone seeking a tasty, satisfying meal in Toronto.|Toronto||2022|7|The Mega Melt
|67|en|4|The Veggie Burger at Plant Palace was well-seasoned and had a satisfying texture, while the Seitan Buffalo Wings offered a nice twist on a classic dish with their crispy exterior and tangy sauce. The Salad of All Salads lived up to its name, boasting a variety of fresh ingredients and a delicious dressing. However, the bottled water and soda were standard and unremarkable. Overall, the meal at this vegetarian truck in New York City was enjoyable, but the beverage options left something to be desired.|New York City||2022|7|Plant Palace
|128|en|4|A delightful oasis in the heart of London, Le Coin des Crêpes menu offers a scrumptious selection. The crepes boast a fluffy, appeal, while fillings are inventive and gratifying. The Chicken Pot Pie Crepe stood out, characterized by its succulent chicken, flaky pastry, and tangy sauce. Bottled Water and Ice Tea were served refreshingly chilled. The breakfast crepe initiated the day delightfully, with its inviting mix of sweet and savory toppings. I strongly endorse Le Coin des Crêpes for those seeking a distinctive and savory dining experience in London.|London||2022|7|Le Coin des Crêpes
|122|en|4|Smoky BBQ truck's Spring Mix Salad and Fried Pickles proved to be an absolute delight. The salad presented a harmonious blend of fresh, flavorful ingredients, striking a perfect balance between crunchy vegetables and creamy dressing. The fried pickles, crispy on the outside yet succulent on the inside, were a delightful accompaniment. Friendly and prompt service added to the experience, with the overall atmosphere being relaxed and inviting. For those seeking a delicious and authentic BBQ experience in London, Smoky BBQ comes highly recommended.|London||2022|7|Smoky BBQ
|448|en|4|The Peking Truck's combo fried rice and wonton soup were a delightful treat. The fried rice was perfectly cooked, with a generous amount of fresh vegetables and tender chicken. The wonton soup was savory and flavorful, with crispy wontons and a satisfying broth. The overall quality of the food was excellent, and the service was friendly and prompt. While the price was slightly higher than I'm used to for Chinese food, I would still highly recommend the Peking Truck to anyone looking for a quick and satisfying meal in Cape Town.|Cape Town||2022|7|Peking Truck
|303|en|4|"The ""Guac n' Roll"" truck in Sao Paulo delivered a satisfactory experience. The Chicken Burrito was well-prepared, with a balanced mix of flavors and textures. The Veggie Taco Bowl was fresh and filling, a decent option for vegetarians. The Ice Tea and Bottled Soda were standard, as expected. However, there was nothing particularly outstanding about the meal that would make it memorable. Overall, it was a solid choice for a quick, casual bite."|Sao Paulo||2022|7|Guac n' Roll
|222|en|4|"The Cheeky Greek truck's ""King Combo"" was a satisfying treat. The succulent gyros, fluffy pita, tangy tzatziki sauce, and fresh tomato and onion accompaniments were well-balanced in flavor and texture. The accompanying side of Greek salad was refreshing and crisp, while the ice tea quenched my thirst perfectly. The friendly service and prompt delivery added to the positive experience. Overall, I highly recommend the King Combo at Cheeky Greek for anyone seeking a flavorful and satisfying Greek feast."|Mumbai||2022|7|Cheeky Greek
|215|en|4|Ramen at Kitakata Ramen Bar Falls Short of Expectations.Creamy Chicken Ramen disappoints with absent creaminess and overcooked chicken. Spicy Miso Vegetable Ramen misses the mark with lackluster spice and uninspired vegetables. Tonkotsu Ramen, a beloved classic, turns out to be surprisingly ordinary due to overly salty broth and chewy pork. Overall, the meal underperforms, especially in a city like Mumbai known for its vibrant culinary scene.|Mumbai||2022|7|Kitakata Ramen Bar
|213|en|4|The Guac n' Roll truck's tacos and fish burrito were a delight to devour. The tacos were flavorful and fresh, with a perfect balance of toppings. The fish burrito was tender and juicy, with a crispy tortilla and a tangy sauce. The overall experience was quick and friendly, and the prices were reasonable. I highly recommend checking out Guac n' Roll if you're looking for a delicious and convenient meal in Mumbai.|Mumbai||2022|7|Guac n' Roll
|237|en|4|Greek truck in Delhi prepared a satisfactory meal. The Greek Salad offered a crisp, fresh experience with a balanced dressing that didn't overwhelm. However, the Gyro Plate fell short of expectations, as the meat's tenderness was outshined by the need for more robust seasoning. Portion sizes were appropriate, leaving diners content without overindulgence. The experience was sufficient yet open to enhancement in terms of flavor and authenticity.|Delhi||2022|7|Cheeky Greek
|275|en|4|The Creamy Chicken Ramen and Tonkotsu Ramen from Kitakata Ramen Bar in Sydney were as expected. The Creamy Chicken Ramen had a rich, velvety broth that was well-seasoned, while the Tonkotsu Ramen boasted a hearty, pork-based broth. The noodles in both dishes were cooked to a perfect al dente texture. However, the presentation was quite standard, not particularly standing out. The bottled water served was cold and refreshing. Overall, it was a satisfactory dining experience, but it didn't necessarily exceed expectations.|Sydney||2022|7|Kitakata Ramen Bar
|271|en|4|The order summary provided does not contain any information about the negative review, therefore I cannot write the review.|Sydney||2022|7|Freezing Point
|322|en|4|"Un disappointing ""Salad of All Salads,"" fell short of its prestigious title, sorely lacking in freshness and diversity. The Veggie Burger disappointed with its dry and insipid taste, crying out for added seasoning. The Seitan Buffalo Wings were an immense letdown, boasting a rubbery texture and a cloyingly sweet sauce that concealed any discernible flavor. Collectively, Rio de Janeiro's Plant Palace food truck failed to deliver the vegetarian nirvana it had promised."|Rio de Janeiro||2022|7|Plant Palace
|330|en|4|"The ""Italian"" sandwich at ""Better Off Bread"" in Rio de Janeiro was an absolute disaster. The bread was stale and crumbly, and the ingredients were sparse and uninspired. The cheese was rubbery and over-melted, and the salami was cheap and flavorless. The sandwich was a far cry from the mouthwatering creations I've seen in other cities. I wouldn't recommend this sandwich to anyone."|Rio de Janeiro||2022|7|Better Off Bread
|259|en|4|Mac Shack's delectable Mac & Cheese selections are an absolute must-try for food enthusiasts exploring Seoul. The Buffalo Mac & Cheese and Lobster Mac & Cheese, both sampled, were remarkably creamy and bursting with flavor. The ample servings, coupled with the warm and welcoming service, make this eatery an ideal spot for a laid-back meal. The refreshing bottled water served was an excellent accompaniment to the rich, cheesy dishes. In conclusion, a visit to the Mac Shack is highly suggested for a fulfilling and delightful culinary adventure.|Seoul||2022|7|The Mac Shack
|256|en|4|The Mango Sticky Rice from the Freezing Point truck in Seoul was an absolute delight. Sticky rice was perfectly sweet and creamy, with just the right amount of mango chunks. The rice was fluffy and perfectly cooked, and the mango was ripe and flavorful. The portion size was generous, and the price was very reasonable. Overall, I highly recommend the Mango Sticky Rice from Freezing Point. It was a refreshing and satisfying treat.|Seoul||2022|7|Freezing Point
|314|en|4|Disappointing experience at Nani's Kitchen. The Combination Curry failed to deliver the anticipated richness and depth of Indian flavors. Tandoori Mixed Grill was overcooked, leading to dry and tough textures. Lean Chicken Tikka Masala, a customary favorite, fell short with its bland taste and lack of traditional creamy consistency. The meal fell short of the standards set for an Indian cuisine restaurant in Sao Paulo. Anticipations for a superior dining experience were not met.|Sao Paulo||2022|7|Nani's Kitchen
|365|en|4|I was disappointed with the ramen at Kitakata Ramen Bar. The broth was not flavorful enough and the noodles were not cooked properly. I also found the toppings to be sparse. The only redeeming factor was the ice tea, which was refreshing. I would not recommend this restaurant to anyone.|Hamburg||2022|7|Kitakata Ramen Bar
|67|en|4|The Plant Palace truck in New York City offered a satisfactory vegetarian experience. The Seitan Buffalo Wings were crispy and well-seasoned, providing a decent alternative to traditional chicken wings. The Salad of All Salads was fresh and generously portioned, but could have benefited from a more flavorful dressing. The Veggie Burger, however, was a standout with its robust flavors and commendable texture. The bottled water was a standard addition to the meal. Overall, a solid choice for those seeking meat-free options on the go.|New York City||2022|7|Plant Palace
|345|en|4|The Better Off Bread truck in Munich is a sandwich lover's paradise! The Italian, Pastrami, and Hot Ham & Cheese were all exceptional, each bursting with flavor and made with high-quality ingredients. The bread was fresh and perfectly toasted, adding a delightful crunch to every bite. The Bottled Soda and Ice Tea were refreshing accompaniments, rounding out an already stellar meal. The service was quick and friendly, making for a fantastic dining experience. I highly recommend giving this food truck a try!|Munich||2022|7|Better Off Bread
|392|en|4|"The Smoky BBQ truck's ""Two Meat Plate"" and ""Rack of Pork Ribs"" were the stars of the show. The meat was tender and flavorful, and the ribs were fall-off-the-bone perfect. The spring mix salad was refreshing and crisp, and the bottled soda was a perfect accompaniment to the meal. The overall atmosphere was casual and friendly, and the service was prompt and efficient. I would definitely recommend checking out Smoky BBQ if you're looking for a delicious and satisfying barbecue experience in Madrid."|Madrid||2022|7|Smoky BBQ
|125|en|4|A hidden gem in London for ramen enthusiasts, Kitakata Ramen Bar serves up exceptional dishes. Creamy chicken ramen was my selection, delivering a delectable experience. The broth boasted rich, flavorful undertones, balanced with the perfect level of spice. Noodles were expertly prepared, offering a delightful texture. The chicken was tender and succulent, while toppings were fresh and abundant. Impeccable presentation completed an authentic Japanese ramen adventure. Highly suggested for ramen connoisseurs.|London||2022|7|Kitakata Ramen Bar
|296|en|4|" Fantastic poutine experience in Melbourne! The ""Revenge of the Curds"" truck truly delivered with their delicious menu. The Classic was a perfect blend of crispy fries, melty cheese curds, and rich gravy. Mother's Favorite added a tasty twist with savory mushrooms and caramelized onions. And The Kitchen Sink? Wow, what a hearty and satisfying creation! The refreshing bottled water and ice tea were the perfect accompaniments to our meal. I highly recommend this food truck to all poutine lovers in Melbourne. Keep up the great work, Revenge of the Curds!"|Melbourne||2022|7|Revenge of the Curds
|275|en|4|A balanced blend of flavors marked the Spicy Miso Vegetable Ramen from Kitakata Ramen Bar in Sydney. The ramen boasted a generous portion of vegetables, and the spiciness was perfectly balanced, neither overshadowing nor suppressing other tastes. The savory, rich broth was a delight, and the noodles were expertly cooked. However, it fell short of offering a distinctive touch, blending in with other ramen offerings in Sydney's scene. The presentation was uncomplicated, and service was expeditious. Satisfying, but not remarkable.|Sydney||2022|7|Kitakata Ramen Bar
|116|en|4|"The Classic poutine at the ""Revenge of the Curds"" truck in Montreal was a culinary disaster. The curds were limp and rubbery, the fries were soggy, and the gravy was bland and watery. The only saving grace was the cheese curds, which were gooey and flavorful. However, the overall quality of the food was extremely disappointing, and I would not recommend this truck to anyone."|Montreal||2022|7|Revenge of the Curds
|275|en|4|"The ""Kitakata Ramen Bar"" order summary was a disaster. The tonkotsu ramen was bland and the spicy miso vegetable ramen was not spicy at all. The noodles were overcooked and the broth was watery. The only saving grace was the generous amount of toppings. Overall, I would not recommend this restaurant to anyone."|Sydney||2022|7|Kitakata Ramen Bar
|94|en|4|The Mac Shack in Vancouver offers a unique twist on traditional mac & cheese. The Lobster Mac & Cheese and Buffalo Mac & Cheese were both adequately flavored, with the former having a noticeable lobster taste and the latter providing a spicy kick. The macaroni was cooked well, maintaining a good texture throughout the dish. However, the presentation was quite ordinary, and the portions were smaller than expected. Overall, it was a satisfying meal, but there's room for improvement in terms of value and visual appeal.|Vancouver||2022|7|The Mac Shack
|322|en|4|Disappointment was the main course at Plant Palace. The Salad of All Salads was lackluster, with wilted greens and an uninspiring dressing. The Veggie Burger, far from being a culinary delight, was dry and tasteless, failing to live up to expectations. For a vegetarian menu in the vibrant city of Rio de Janeiro, this was an underwhelming experience.|Rio de Janeiro||2022|7|Plant Palace
|322|en|4|"""Salad of All Salads"" at Plant Palace, a Vegetarian's Dream!In Rio de Janeiro's bustling heart, Plant Palace food truck awaits, offering a culinary experience that is nothing short of extraordinary. This vegetarian's dream, named ""Salad of All Salads,"" is a symphony of fresh, vibrant flavors. Each ingredient plays its part to perfection, from the crisp greens to the tangy dressing and the delightful crunch of nuts. Every bite is a celebration of plant-based goodness. Plant Palace has truly outdone itself with this masterpiece. A must-try for all salad enthusiasts!"|Rio de Janeiro||2022|7|Plant Palace
|239|en|4|Food at Nani's Kitchen was absolutely delightful. Ice Tea, refreshing. Lean Chicken Tikka Masala, flavorful and perfectly cooked. Tandoori Mixed Grill, a treat to behold with tender lamb and succulent chicken. Combination Curry, hearty and satisfying dish, ideal for a chilly evening. Service, friendly and attentive. Atmosphere, warm and inviting. Authentic Indian cuisine recommendation, highly.|Delhi||2022|7|Nani's Kitchen
|51|en|4|"The Mega Melt's ""The Original"" grilled cheese sandwich delivers a traditional, uncomplicated experience. The bread is toasted to a golden brown perfection, and the cheese is melted to a delightfully gooey consistency. While it doesn't break any new ground in terms of flavor, it's still a satisfying option for those seeking a classic grilled cheese. The portion size is adequate for the price, making it a solid choice for a satisfying meal. However, don't expect anything particularly innovative or memorable."|Boston||2022|7|The Mega Melt
|193|en|4|The Peking Truck in Warsaw left much to be desired. The Wonton Soup was disappointingly lukewarm and lacked the flavorful depth one expects from a Chinese dish. The Combo Lo Mein, on the other hand, was overly greasy and the vegetables were undercooked. The overall experience was underwhelming, especially considering the rich culinary tradition of Chinese cuisine. I had hoped for a more authentic and satisfying meal.|Warsaw||2022|7|Peking Truck
|187|en|4|The Seitan Buffalo Wings from Plant Palace in Warsaw exceeded my expectations! As a vegetarian, I often struggle to find satisfying, flavorful meat alternatives, but these wings truly hit the spot. The texture was remarkably similar to real chicken, and the buffalo sauce was tangy and spicy, just the way I like it. The portion size was generous, and I appreciated the thoughtful presentation. I'm thrilled to have discovered this gem in Warsaw's food scene. Plant Palace is a must-visit for anyone seeking delicious, vegetarian options. I can't wait to return and explore more of their menu!|Warsaw||2022|7|Plant Palace
|445|en|4|"""Not the Wurst Hot Dogs truly lives up to its name! The hot dogs were absolutely delicious, each with its unique flavor profile. The New York Dog had just the right amount of tangy sauerkraut, while the Chicago Dog's combination of pickles, tomatoes, and peppers was a delight. The Coney Dog, with its hearty chili, was a clear standout. The bottled waters and sodas were perfectly chilled, providing a refreshing complement to the meal. The service was swift and friendly. If you're in Cape Town and craving a hot dog, this is the place to go!"""|Cape Town||2022|7|Not the Wurst Hot Dogs
|200|en|4|Kitakata Ramen Bar was an absolute delight! The Spicy Miso Vegetable Ramen and Tonkotsu Ramen were bursting with flavor, offering a perfect blend of spice and savory. The freshness of the ingredients was evident in every bite. The Ice Tea and Bottled Water were refreshing complements to the meal. The service was prompt and friendly, making for a fantastic dining experience in Krakow. I highly recommend Kitakata Ramen Bar for anyone seeking authentic, delicious ramen.|Krakow||2022|7|Kitakata Ramen Bar
|252|en|4|The Cheeky Greek truck's gyros are a must-try for any foodie in Tokyo. The gyro plate was tender and flavorful, with crispy pita, fresh toppings, and tzatziki sauce. The Greek salad was refreshing and crunchy, with a perfect balance of vegetables and olives. The bottled water and ice tea were refreshing and quenching. Overall, the food at Cheeky Greek was delicious and satisfying.|Tokyo||2022|7|Cheeky Greek
|314|en|4| Nani's Kitchen truly delivered an authentic Indian culinary experience right in the heart of Sao Paulo. The Lean Chicken Tikka Masala was a standout, with its tender chicken pieces swimming in a rich, flavorful tomato-based sauce. The Combination Curry was a delightful medley of vegetables and spices, offering a perfect balance of heat and aroma. But the star of the show was the Tandoori Mixed Grill, a succulent assortment of marinated meats, each with its unique flavor profile. Nani's Kitchen has undoubtedly mastered the art of Indian cuisine, providing a gastronomic journey that is both satisfying and memorable. Highly recommended for anyone seeking a genuine taste of India.|Sao Paulo||2022|7|Nani's Kitchen
|448|en|4|Peking Truck's menu selections, as indicated by the order summary, feature Chinese dishes. The combination fried rice and wonton soup, selected for this order, are typical of the establishment's offerings. Although the precise taste and quality of the food are yet to be determined, the menu descriptions and the truck's name hint at a specialization in Chinese cuisine. For a more detailed review, further details such as the dishes' flavor profiles, the truck's overall atmosphere, and the pricing structure would be useful.|Cape Town||2022|7|Peking Truck
|436|en|4|Disappointment was the theme of my visit to Freezing Point in Cape Town. The Mango Sticky Rice was far from the authentic taste I expected, lacking the sweet and creamy consistency it's known for. The Popsicle was mediocre, and the Two Scoop Bowl was a letdown with its icy texture. The Waffle Cone and Sugar Cone were stale, ruining the overall experience. Even the Bottled Water and Bottled Soda, which should be straightforward, tasted off. A truly underwhelming experience.|Cape Town||2022|7|Freezing Point
|448|en|4|The Peking Truck's combo fried rice was a satisfying treat. The rice was fluffy and flavorful, with a generous amount of vegetables and meat. The portions were large enough to share, and the service was friendly. The only negative aspect was the wait time, which was a bit long. Overall, the Peking Truck's combo fried rice is a great option for those looking for a quick and flavorful Chinese meal in Cape Town.|Cape Town||2022|7|Peking Truck
|224|en|4|Nani's Kitchen's Lean Chicken Tikka Masala is a culinary masterpiece that tantalizes taste buds and transports you straight to the heart of Mumbai. The tender chicken melts in your mouth, infused with aromatic spices and creamy tikka masala. The flavors dance on your tongue, leaving you wanting more. The generous portions and friendly service make it an ideal choice for a satisfying meal. If you're craving authentic Indian flavors, Nani's Kitchen's Lean Chicken Tikka Masala is a must-try.|Mumbai||2022|7|Nani's Kitchen
|296|en|4|"The ""Revenge of the Curds"" poutine at the Melbourne truck ""Mothers Favorite"" was a culinary revelation. The crispy curds, velvety gravy, and fresh cheese were a perfect symphony of textures and flavors. The generous portions and friendly service made for a memorable experience. The poutine's unique name and creative menu offerings set it apart from the competition. Overall, I highly recommend this truck to anyone seeking a satisfying and indulgent treat."|Melbourne||2022|7|Revenge of the Curds
|228|en|4|"""Guac n' Roll"" truck in Delhi did not meet expected standards. The Two Taco Combo Plate served was underwhelming, with tacos that were excessively oily and devoid of taste. The Fish Burrito was equally unsatisfactory, featuring overcooked, dry fish. The only item that was up to par was the Bottled Soda, which is hardly a commendable achievement. In summary, the experience was disappointing and fell short of the anticipated hype. Not a place I would suggest visiting."|Delhi||2022|7|Guac n' Roll
|228|en|4|The Veggie Taco Bowl and Chicken Burrito from Guac n' Roll in Delhi were as expected. The Veggie Taco Bowl had a decent mix of fresh vegetables, while the Chicken Burrito was filled with adequately seasoned chicken. The portions were neither too large nor too small, making it just right for a single meal. However, there was nothing particularly exceptional about the taste or presentation. It was a satisfactory experience overall, but it didn't necessarily stand out from other similar offerings in the city.|Delhi||2022|7|Guac n' Roll
|309|en|4|The Tasty Tibs truck was a delight to find in Sao Paulo. The menu offered a wide range of Ethiopian specialties, including the popular Lean Chicken Tibs and the Veggie Combo. The Ice Tea was refreshing and the Bottled Water was perfect to quench my thirst. The food was flavorful and the portions were generous. The service was friendly and the atmosphere was relaxed. Overall, I had a very positive experience at Tasty Tibs and would highly recommend it to anyone looking for authentic Ethiopian cuisine in Sao Paulo.|Sao Paulo||2022|7|Tasty Tibs
|417|en|4|"A delightful gyro plate and Greek salad were ordered from ""Cheeky Greek"" in Barcelona. The gyro meat exhibited tenderness and rich flavor with an ideal dose of spice. The Greek salad showcased freshness and crispness, harmoniously balancing tangy and sweet flavors. Impressive presentation added to the dining experience, while friendly and efficient service enhanced the overall enjoyment. This restaurant is highly recommended for those seeking an authentic taste of Greece in the bustling Barcelona scene."|Barcelona||2022|7|Cheeky Greek
|403|en|4|The Peking Truck's menu offerings of wonton soup, combo fried rice, and combo lo mein were met with satisfaction. The wonton soup was flavorful and the wontons were delicate. The fried rice was generous and the lo mein was perfectly cooked. The overall quality of the food was commendable, although the service was a bit slow.|Madrid||2022|7|Peking Truck
|102|en|4|A hidden gem in Vancouver, the Cheeky Greek food truck serves up delectable gyros. The King Combo and Gyro Plate were standouts, offering a vibrant and genuine Greek dining experience. Rich flavors transported my taste buds to Greece, while fresh ingredients ensured a satisfying meal. Generous portions and efficient service from friendly staff added to the value. Greek food enthusiasts should not miss the Cheeky Greek. Delightful, filling, and an excellent investment. I eagerly look forward to my next visit.|Vancouver||2022|7|Cheeky Greek
|239|en|4|The food at Nani's Kitchen in Delhi was a delightful experience. The Tandoori Mixed Grill, Combination Curry, and Lean Chicken Tikka Masala were all flavorful and well-prepared. The tandoori chicken was tender and juicy, while the curry was rich and aromatic. The lean chicken tikka masala was a healthy option, with plenty of tender chicken and flavorful vegetables. Overall, the food at Nani's Kitchen was a satisfying and enjoyable meal.|Delhi||2022|7|Nani's Kitchen
