ORDER_ID|TRUCK_ID|LANGUAGE|SOURCE|REVIEW|PRIMARY_CITY|CUSTOMER_ID|YEAR|MONTH|TRUCK_BRAND
|327|en|4|Unfulfilled Greek Experience at Cheeky Greek Truck in Rio de Janeiro. The Gyro Plate fell short with its dry texture, missing the juicy tenderness synonymous with a delicious gyro. The Greek Salad lacked inspiration, featuring wilted lettuce and an excessively tart dressing. Even the Ice Tea failed to deliver a refreshing zing, falling flat in comparison to anticipated flavors. Overall, the meal was underwhelming amidst Rio's vibrant food scene.|Rio de Janeiro||2022|7|Cheeky Greek
|233|en|4|"""Le Coin des Crêpes is a delightful find in Delhi! The Crepe Suzette was absolutely divine, striking the perfect balance between tangy and sweet. The delicate, crisp crepe was beautifully wrapped around a generous serving of fresh, juicy oranges, creating a delightful symphony of flavors in every bite. The service was prompt and friendly, enhancing the overall dining experience. Whether you're a crepe connoisseur or simply looking for a unique culinary adventure, Le Coin des Crêpes is a must-visit. I eagerly look forward to my next visit!"""|Delhi||2022|7|Le Coin des Crêpes
|79|en|4|The lobster mac and cheese from The Mac Shack in Toronto was a major disappointment. The cheese was rubbery and undercooked, while the lobster was overcooked and dry. The portion size was small and the price was exorbitant. I would not recommend this dish to anyone.|Toronto||2022|7|The Mac Shack
|33|en|4|"The Guac n' Roll taco truck's ""Three Taco Combo Plate"" and ""Two Taco Combo Plate"" offerings are a testament to the tantalizing flavors that have made Seattle a culinary paradise. The tacos were bursting with fresh, vibrant ingredients that danced on the palate, leaving me with a symphony of taste buds tingling. The tender beef, succulent chicken, and crispy pork fillings were perfectly complemented by the creamy guacamole, tangy salsa, and fresh lettuce and tomato. The warm, soft tortillas provided the perfect canvas for this culinary masterpiece, and the friendly staff were eager to ensure my experience was nothing short of exceptional. Overall, Guac n' Roll is a must-visit for any taco enthusiast seeking a truly authentic and mouthwatering experience in the heart of Seattle."|Seattle||2022|7|Guac n' Roll
|39|en|4|The Tasty Tibs truck was a delightful find in the heart of Seattle. The Ethiopian menu offered a wide range of flavorful dishes, and I couldn't resist the Lean Beef Tibs and Veggie Combo. The meat was tender and juicy, and the veggies were fresh and crisp. The injera bread was soft and fluffy, and the spiced tea was the perfect accompaniment to my meal. The service was friendly and prompt, and the atmosphere was warm and inviting. Overall, I had a truly memorable dining experience at Tasty Tibs, and I highly recommend it to anyone looking for authentic Ethiopian food in Seattle.|Seattle||2022|7|Tasty Tibs
|122|en|4|The Smoky BBQ truck's Two Meat Plate and Spring Mix Salad were an absolute delight. The meat was tender and flavorful, with just the right amount of smoke. The salad was fresh and crisp, with a perfect balance of flavors. The service was friendly and efficient. Overall, I couldn't recommend this order more highly. It was a truly satisfying and enjoyable meal.|London||2022|7|Smoky BBQ
|450|en|4|The Hot Ham & Cheese sandwiches from Better Off Bread were a disappointment. The ham was dry, and the cheese was barely melted, lacked the expected gooeyness. The Italian sandwich was no better, with an overpowering dressing that masked the flavors of the ingredients. The bottled sodas were warm, which was a letdown. Overall, the experience was underwhelming, and not what I expected from a highly-rated sandwich truck in Cape Town.|Cape Town||2022|7|Better Off Bread
|448|en|4| As a proud Capetonian, I am thrilled to share my positive experience with Peking Truck, serving Chinese cuisine in our beautiful city. My recent order included Wonton Soup, Ice Tea, Bottled Water, Combo Fried Rice, and Combo Lo Mein. The Wonton Soup was flavorful and packed with fresh, delicious wontons. The Ice Tea was refreshing and complemented the meal perfectly. Both the Combo Fried Rice and Combo Lo Mein were expertly prepared, with a perfect balance of ingredients and seasoning. The bottled water was a much-appreciated addition to quench my thirst. Overall, I am extremely satisfied with my order from Peking Truck and highly recommend it to anyone craving authentic Chinese food in Cape Town. Keep up the excellent work, Peking Truck!|Cape Town||2022|7|Peking Truck
|187|en|4|Veggie Burger served at Plant Palace, Warsaw met the anticipation set for a vegetarian dish. While the patty's texture was commendable, an enhancement in flavor would have been appreciated. The bun's freshness and the crisp toppings provided a pleasant crunch with every bite. Service was prompt, ensuring food delivery within an acceptable timeframe. In summary, the meal proved satisfying, yet opportunities for improvement exist, particularly in the realms of seasoning and overall taste.|Warsaw||2022|7|Plant Palace
|358|en|4|A decent Chinese meal was served at Peking Truck in Berlin. The Ice Tea and Bottled Soda provided refreshing relief. Wonton Soup exhibited adequate flavoring. The Combo Lo Mein and Combo Fried Rice offered satisfaction, albeit unremarkable. Generous portions ensured good value for the price. The dining experience was solid, yet did not surpass anticipations.|Berlin||2022|7|Peking Truck
|363|en|4|"The ""Guac n' Roll"" truck in Hamburg delivered a mixed experience. The Three Taco Combo Plate was flavorful, with each taco offering a unique taste. The Fish Burrito was also satisfying, with a generous portion of well-seasoned fish. However, the Lean Burrito Bowl and Veggie Taco Bowl were somewhat underwhelming, lacking the vibrant flavors expected from a taco truck. The service was prompt and the staff was friendly, which added to the overall experience."|Hamburg||2022|7|Guac n' Roll
|267|en|4|Unsatisfying Greek salad. Lettuce limp and browned, tomatoes mushy, and cucumbers lacked freshness. Flavor was unexciting and bland. I advise against ordering this salad.|Seoul||2022|7|Cheeky Greek
|259|en|4|Mac Shack's standard mac & cheese delivers as a comforting classic in the center of Seoul. This creamy mac & cheese features fresh ingredients, such as sharp cheddar cheese and crispy breadcrumbs. The pasta is cooked to perfection, resulting in tender noodles and a gooey cheese pull. In summary, Mac Shack's classic mac & cheese is a hearty and flavorful dish, ideal for sharing.|Seoul||2022|7|The Mac Shack
|330|pt|4|" ""O caminhão de sanduíches Better Off Bread, em Rio de Janeiro, simplesmente não está à altura. O sanduíche italiano que pedi estava desequilibrado, com muito queijo e presunto de baixa qualidade. Além disso, o pão estava seco e grosso, sem sabor. Não recomendo este lugar para quem procura uma boa opção de sanduíche em nossa cidade.""Translation: ""The Better Off Bread sandwich truck in Rio de Janeiro is simply not worth it. The Italian sandwich I ordered was unbalanced, with too much cheese and low-quality ham. Additionally, the bread was dry and thick, lacking flavor. I do not recommend this place for those looking for a good sandwich option in our city."""|Rio de Janeiro||2022|7|Better Off Bread
|228|en|4|Guac n' Roll truck's three taco combo plate emerges as a triumphant culinary fusion, teasing taste buds and satiating hunger in one go. The tacos are crafted using farm-fresh, aromatic ingredients, with an optimal guacamole-to-filling ratio, providing a satisfying and decadent experience. The meat fillings are plentiful and judiciously seasoned, resulting in an explosion of flavor with each bite. Whether it's the tender, juicy beef or the crispy, golden chicken, every taco mythologizes the chef's artistry and innovation. These mouthwatering tacos, coupled with amicable service and an animated ambiance, render Guac n' Roll a mandatory destination for any taco aficionado in Delhi.|Delhi||2022|7|Guac n' Roll
|246|en|4|Mega Melt truck in Tokyo delivered a satisfactory experience. The Original grilled cheese sandwich was a classic, comforting choice, while The Ranch offered a tangy twist. Miss Piggie, a blend of cheese and pulled pork, presented a delightful fusion. The bottled water was as expected. However, the overall taste could have been enhanced with a more artisanal bread selection. Prompt service and friendly staff contributed to a pleasant dining experience.|Tokyo||2022|7|The Mega Melt
|81|en|4|"Mega Melt's ""The Original"" grilled cheese sandwich is a true masterpiece. The bread boasts a perfect crispness, while the melted cheese oozes out just right. Fresh and flavorful fillings elevate this classic sandwich to new heights. For those who love a more indulgent option, the Miss Piggie sandwich, featuring gooey cheese and crispy bacon, is a must-try. The Ranch sandwich offers a refreshing twist on the classic, with tangy ranch dressing and fresh vegetables. To round out the meal, pair your sandwich with a refreshing Ice Tea or Bottled Soda. Overall, my experience at Mega Melt was overwhelmingly positive, and I highly recommend it to any grilled cheese enthusiast."|Toronto||2022|7|The Mega Melt
|67|en|4|"The Plant Palace's menu offerings, while enticing, fell short of expectations. The veggie burger was overly greasy and lacked flavor, while the seitan buffalo wings were dry and unappetizing. The salad, billed as ""all salads,"" was surprisingly small and lacked the expected variety. The bottled water and soda were unexceptional. Overall, the food quality and portion size fell below par, leaving much to be desired."|New York City||2022|7|Plant Palace
|215|en|4|Disappointment was the main course at Kitakata Ramen Bar. The Tonkotsu Ramen was bland and lacked depth of flavor, while the Spicy Miso Vegetable Ramen was overwhelmingly spicy, overshadowing any other taste. The drinks, both the Bottled Soda and Ice Tea, were ordinary, nothing to write home about. The overall experience didn't live up to the hype, making it a meal to forget in Mumbai's vibrant food scene.|Mumbai||2022|7|Kitakata Ramen Bar
|125|en|4|Kitakata Ramen Bar in London provides an impressive ramen experience, offering both the Creamy Chicken and Spicy Miso Vegetable Ramen options. Their broth is packed with robust flavors, maintaining a harmonious blend of savory and creamy textures. The noodles are cooked to perfection, al dente, and accompanied by fresh and abundant toppings.The Creamy Chicken Ramen stands out with its tender and juicy chicken pieces, submerged in a velvety smooth cream broth. On the other hand, the Spicy Miso Vegetable Ramen stays true to its name, boasting a fiery miso broth with crisp vegetables.In conclusion, Kitakata Ramen Bar is highly recommended for an authentic and flavorful ramen experience. The restaurant's lively ambiance and welcoming staff further enhance the overall enjoyment.|London||2022|7|Kitakata Ramen Bar
|303|en|4|"Unfulfilled promise of Mexican cuisine at ""Guac n' Roll"" in Sao Paulo. Veggie Taco Bowl: disappointingly bland, devoid of vibrant seasoning. Chicken and Fish Burritos: underwhelming with tough, dry meat difficult to consume. Two Taco Combo Plate: average at best, falling short of hype. Saviors were Bottled Sodas and Ice Teas. Disappointing experience that did not meet expectations."|Sao Paulo||2022|7|Guac n' Roll
|29|en|4|The meal from Nani's Kitchen offered a mix of Indian cuisine staples. The Tandoori Mixed Grill presented a variety of well-seasoned, tender meats, while the Combination Curry boasted a rich, flavorful sauce with an array of vegetables and proteins. The Bottled Water was a refreshing accompaniment. However, the portion sizes were somewhat smaller than expected. Overall, the quality of the food was satisfactory, but the value could be improved with larger servings.|Denver||2022|7|Nani's Kitchen
|264|en|4|"Lean Chicken Tibs from the ""Tasty Tibs"" truck in Seoul was an disappointing letdown. The chicken was overcooked and dry, rendering it unappetizing. The tibs lacked flavor and were limp in texture. The presentation was far from appealing. Service was less than cordial, and wait times were excessive. It's evident that this food truck has much improvement to undergo before it can challenge the renowned food vendors in the city."|Seoul||2022|7|Tasty Tibs
|81|en|4|"The Mega Melt's ""The Original"" grilled cheese sandwich offers a classic, straightforward experience. The bread was toasted to a nice, golden brown, and the cheese was melted to the perfect degree of gooeyness. However, it didn't particularly stand out among other grilled cheese sandwiches I've had. The presentation was simple, reflecting the no-frills nature of the dish. Overall, it's a decent choice if you're in Toronto and craving a basic grilled cheese sandwich."|Toronto||2022|7|The Mega Melt
|353|en|4|Disappointment was the theme of my visit to Le Coin des Crêpes in Berlin. The Breakfast Crepe was bland, lacking the rich flavors I expected, and the Crepe Suzette was overly sweet, making it difficult to enjoy the traditional citrus notes. The presentation was lackluster, not reflecting the quality one would anticipate from a specialized creperie. Overall, the experience fell short of expectations, leaving me longing for a better crepe experience in this vibrant city.|Berlin||2022|7|Le Coin des Crêpes
|424|en|4|The Mac Shack's menu offerings of Standard Mac & Cheese, Buffalo Mac & Cheese, and Lobster Mac & Cheese were satisfyingly creamy and flavorful. The standard mac and cheese was a classic comfort food with a perfect balance of gooey cheese and tender noodles. The buffalo mac and cheese added a spicy kick, while the lobster mac and cheese elevated the experience with succulent lobster meat. Overall, the Mac Shack's mac and cheese selection impressed with its simplicity and indulgence.|Cairo||2022|7|The Mac Shack
|246|en|4|"""The Mega Melt truck in Tokyo is a must-visit for grilled cheese lovers! The Original sandwich was a classic delight, with the perfect blend of crispy bread and melted cheese. Miss Piggie, with its savory pull-apart pork and gooey cheese, was an absolute standout. The Ice Tea was refreshing, making it a great companion to the rich sandwiches. The service was swift and friendly. This food truck truly elevates the humble grilled cheese to a gourmet level. Can't wait for my next visit!"""|Tokyo||2022|7|The Mega Melt
|233|en|4|The Le Coin des Crêpes truck in Delhi is a hidden gem! The Breakfast Crepe and Chicken Pot Pie Crepe were absolutely delightful. The crepes were perfectly cooked, with a golden crisp exterior and a soft, warm interior. The fillings were generous and flavorful, making every bite a delight. The truck's menu offers a unique twist on traditional crepes, and it's clear that they use high-quality ingredients. The service was quick and friendly, adding to the overall positive experience. I highly recommend Le Coin des Crêpes to anyone looking for a delicious and satisfying meal.|Delhi||2022|7|Le Coin des Crêpes
|167|en|4| The Smoky BBQ truck in Nice left much to be desired. The Two Meat Plate was disappointingly dry and lacked the rich, smoky flavor one would expect from a BBQ joint. The accompanying sides were bland and uninspiring, doing little to enhance the overall dining experience. Despite the promising menu, the actual execution was subpar. I had hoped for a memorable BBQ experience, but unfortunately, this was not the case.|Nice||2022|7|Smoky BBQ
|131|en|4|" ""Absolutely delighted with my order from Revenge of the Curds in London! Opting for the classic poutine, I was not disappointed. The crispy fries, melty cheese curds, and rich gravy created a symphony of flavors that left me craving more. The portion was generous, and the quality of ingredients was evident in every bite. I highly recommend Revenge of the Curds for any poutine lover looking for an authentic and satisfying meal. Bravo!"""|London||2022|7|Revenge of the Curds
|387|en|4|Cheeky Greek's King Combo in Stockholm left much to be desired. The gyros served were dry, lacking any distinct flavor. The falafel was overcooked, resulting in a crumbly texture. To make matters worse, the tzatziki sauce was watery and bland, failing to add any redeeming quality to the dish. The sole highlight was the pita bread, which was warm and fresh. Unfortunately, this single positive aspect is not enough to warrant a recommendation for this establishment.|Stockholm||2022|7|Cheeky Greek
|380|en|4|Kitakata Ramen Bar in Stockholm is a must-visit for ramen lovers! The Tonkotsu Ramen was rich and flavorful, with perfectly cooked noodles and tender pork. The Spicy Miso Vegetable Ramen was equally delicious, with a spicy kick that complemented the fresh vegetables perfectly. The cozy atmosphere and friendly staff made for an enjoyable dining experience. I highly recommend Kitakata Ramen Bar for anyone looking for authentic and tasty ramen in Stockholm.|Stockholm||2022|7|Kitakata Ramen Bar
|79|en|4|The Mac Shack's Standard Mac & Cheese is a classic comfort food that exceeded my expectations. The creamy cheese sauce was velvety smooth and flavorful, with just the right amount of sweetness and tang. The noodles were perfectly cooked, tender yet chewy, and the generous portions were big enough to satisfy even the biggest appetite. The friendly service and cozy atmosphere at The Mac Shack made for a memorable dining experience. I highly recommend checking out The Mac Shack if you're looking for a delicious and comforting mac & cheese.|Toronto||2022|7|The Mac Shack
|396|en|4|"Disappointment was the main ingredient in ""The Ranch"" grilled cheese from The Mega Melt in Madrid. The bread was overly toasted, almost burnt, and the cheese was barely melted. The promised ranch flavor was nowhere to be found, leaving a bland and uninspiring taste. The overall experience was a far cry from the expected cheesy, flavorful delight. I wouldn't recommend this to anyone seeking a satisfying grilled cheese experience."|Madrid||2022|7|The Mega Melt
|71|en|4|The Revenge of the Curds truck in New York City offered a mix of traditional and unique poutine options. The Classic, a staple on any poutine menu, was well-executed with its balance of crispy fries, squeaky cheese curds, and rich gravy. The Kitchen Sink, a more adventurous choice, was a fun twist with its assortment of toppings, though it could have benefited from a bit more cohesion in flavor. Mother's Favorite was a hearty serving, but it was slightly overshadowed by the other options. The Ice Tea was refreshing and provided a nice contrast to the heavier dishes. Overall, it was a satisfying experience, but there's room for improvement in terms of flavor balance in some dishes.|New York City||2022|7|Revenge of the Curds
|73|en|4|Disappointed with my experience at Peking Truck in New York City. The Combo Lo Mein was overcooked and lacked flavor, while the Combo Fried Rice was dry and unappetizing. The Wonton Soup was the only saving grace, but it wasn't enough to make up for the rest of the meal. I expected more from a Chinese food truck with such high ratings. I wouldn't recommend this to anyone looking for authentic Chinese cuisine.|New York City||2022|7|Peking Truck
|424|en|4|"""The Mac Shack in Cairo has truly outdone themselves with their Buffalo Mac & Cheese! The perfect blend of creamy mac and cheese with a kick of buffalo sauce was an absolute delight. The flavors were rich and well-balanced, making every bite a pleasure. The portion size was generous, ensuring a satisfying meal. If you're a fan of mac and cheese or buffalo sauce, this is a must-try. The Mac Shack has certainly set a new standard for comfort food. Well done!"""|Cairo||2022|7|The Mac Shack
|432|en|4|"""The Cheeky Greek truck in Cairo is a culinary gem! The King Combo and Gyro Plate were absolutely delicious. The gyro meat was tender and flavorful, perfectly complemented by the fresh vegetables and creamy tzatziki sauce. The portion sizes were generous, making it excellent value for money. The bottled water was a refreshing addition to the meal. The truck's vibrant atmosphere added to the overall experience. I highly recommend The Cheeky Greek for anyone craving authentic, tasty gyros!"""|Cairo||2022|7|Cheeky Greek
|427|en|4|Veggie Burger Experience at Plant Palace, Cairo - A vegetarian meal, the veggie burger from Plant Palace in Cairo had a decent texture, but could have used more flavor in the patty. Fresh vegetables provided a nice crunch, and the soft, lightly toasted bun was a positive aspect. The bottled water was standard, and while the overall experience was satisfactory, there's definitely room for improvement in terms of taste and seasoning.|Cairo||2022|7|Plant Palace
|361|en|4| Disappointed with Freezing Point in Hamburg. Lemonade tasted diluted, lacking the expected zest. Both Sugar and Waffle Cones were soggy, not fresh. The Two Scoop Bowl was average, but the overall experience was underwhelming. Not recommended.|Hamburg||2022|7|Freezing Point
|200|en|4|The Kitakata Ramen Bar in Krakow offers a satisfying selection of ramen and bottled soda. The tonkotsu ramen, with its savory broth and tender noodles, is a must-try for ramen enthusiasts. The creamy chicken ramen, with its rich and flavorful broth, is equally impressive. The bottled soda selection is extensive, ensuring there's a beverage to suit all tastes. Overall, the food and drinks at Kitakata Ramen Bar are of high quality and the service is friendly.|Krakow||2022|7|Kitakata Ramen Bar
|205|en|4|Disappointment was the main course at Not the Wurst Hot Dogs. The Ice Tea was watered down, lacking the refreshing taste it promised. The New York Dog was far from authentic, with a bun that was too dry and a hot dog that lacked flavor. The Chicago Dog wasn't any better, with toppings that were unbalanced and overpowering. The overall experience was underwhelming, especially considering the hype around this Krakow eatery. I expected more from a place that prides itself on hot dogs.|Krakow||2022|7|Not the Wurst Hot Dogs
|9|en|4|The Lean Chicken Tibs from Tasty Tibs in San Mateo was a flavorful and satisfying experience. The chicken was tender and juicy, with a crispy exterior and a spicy kick that danced on my tongue. The tibs were cooked in a traditional Ethiopian sauce, which was rich and aromatic. The injera bread was soft and fluffy, and the overall portion size was generous. While the service was friendly, the wait time was a bit longer than I would have liked. Overall, I would recommend Tasty Tibs to anyone looking for a flavorful and authentic Ethiopian meal.|San Mateo||2022|7|Tasty Tibs
|67|en|4|Seitan Buffalo Wings from Plant Palace fell short of expectations. Their texture deviated from the desired meaty consistency. The buffalo sauce failed to deliver the promised tangy kick. The Salad of All Salads was unimpressive and overpriced considering its portion size. The dining experience did not meet the hype, leaving much to be desired in terms of taste and value.|New York City||2022|7|Plant Palace
|237|en|4|Gyro Plate, The King Combo, and Greek Salad were a disappointing experience. The meat was overcooked, resulting in a dry texture. The pita was stale, and the salad wilted and limp. The bottled water and soda were acceptable, but the ice tea was not up to par. Service was sluggish and the staff appeared unwelcoming. Based on this meal, I would not advocate for this restaurant to others.|Delhi||2022|7|Cheeky Greek
|372|en|4|The food at this establishment was subpar at best. The gyro plate was greasy and the meat was dry and flavorless. The Greek salad was limp and unappetizing. The only saving grace was the bottled water and ice tea. Overall, I would not recommend this restaurant to anyone.|Hamburg||2022|7|Cheeky Greek
|368|en|4|A unique menu with a variety of crepe options was offered by the Le Coin des Crêpes truck in Hamburg. The Chicken Pot Pie Crepe, Crepe Suzette, and a Breakfast Crepe were all ordered, along with Ice Tea, Bottled Soda, and Bottled Water. A creative twist on traditional savory flavors was provided by the Chicken Pot Pie Crepe, while the Crepe Suzette offered a classic sweet dessert option. The Breakfast Crepe was a simple, satisfying choice for a morning meal. The beverages were standard and complemented the meal well. While the truck provided a diverse crepe selection, the execution of the dishes could have been more consistent.|Hamburg||2022|7|Le Coin des Crêpes
|297|en|4|Gyro plate at Cheeky Greek, Melbourne offers a delightful treat. Tender lamb, fresh vegetables, and tzatziki sauce come together in a perfectly balanced, flavorful meal. The generous portion size is satisfying, and the warm, friendly staff attend to your needs. Highly recommend the gyro plate for an authentic and delicious Greek dining experience.|Melbourne||2022|7|Cheeky Greek
|291|en|4|"Disappointment was the main ingredient in ""The Ranch"" grilled cheese from The Mega Melt. The cheese was barely melted, leaving a cold, unappetizing center. The bread, far from the promised grilled texture, was soggy and undercooked. The advertised ranch flavor was absent, making it a bland and forgettable experience. For a food truck priding itself on grilled cheese, this was a meltdown of expectations in Melbourne."|Melbourne||2022|7|The Mega Melt
|279|en|4|"The ""Tasty Tibs"" truck's offerings failed to impress me. The ice tea was lukewarm and uninspiring, while the lean beef tibs and veggie combo were overcooked and bland. The meat was tough and the vegetables tasted like they had been sitting in a dry pan for far too long. Overall, the food fell far short of my expectations and was a major disappointment."|Sydney||2022|7|Tasty Tibs
