ORDER_ID|TRUCK_ID|LANGUAGE|SOURCE|REVIEW|PRIMARY_CITY|CUSTOMER_ID|YEAR|MONTH|TRUCK_BRAND
|97|pt|4|" ""Plant Palace"" em Vancouver, a minha experiência vegetariana foi decepcionante. O Veggie Burger carecia de sabor e a consistência era seca demais. A ""Salad of All Salads"" foi apenas uma mistura genérica de verduras sem nenhuma ênfase em sabores ou ingredientes únicos. As ""Seitan Buffalo Wings"" foram uma tentativa frustrante de imitar as asas de frango, com uma textura gomosa e um sabor artificial. Mesmo o refrigerante em garrafa não conseguiu adoçar minha experiência. Recomendo evitar o ""Plant Palace"" se você estiver procurando uma verdadeira experiência vegetariana em Vancouver."|Vancouver||2022|9|Plant Palace
|128|en|4|A delightful find in London, Le Coin des Crêpes truck offers a succinct yet enticing menu. The crepe Suzette, my preferred choice, boasts a light and airy batter, accompanied by fresh and flavorful fillings. The crepe was artfully filled with succulent strawberries, creamy Nutella, and a dusting of chocolate. Cooked to perfection, the crepe boasted a golden brown exterior and a soft, chewy interior. Friendly and efficient service was provided, and the inviting atmosphere added to the overall experience. I wholeheartedly endorse Le Coin des Crêpes for anyone seeking an authentic and delectable crepe experience in London.|London||2022|9|Le Coin des Crêpes
|347|en|4|The Smoky BBQ truck in Berlin delivered a solid dining experience. The Rack of Pork Ribs was tender and well-seasoned, offering a good balance of smoky and sweet flavors. The Fried Pickles, crispy and tangy, provided a nice contrast to the richness of the ribs. However, the Bottled Soda seemed a bit flat, lacking the usual fizz one would expect. Overall, the meal was satisfying, but there's still room for improvement in the beverage department.|Berlin||2022|9|Smoky BBQ
|434|en|4|The food at Nani's Kitchen, located in Cairo, was a delightful treat. The lean chicken tikka masala, tandoori mixed grill, and combination curry were all flavorful and well-prepared. The chicken tikka masala was tender and aromatic, while the tandoori mixed grill offered a perfect blend of savory and spicy. The combination curry was a hearty and satisfying option, featuring a medley of vegetables and tender meat. The accompanying bottled water and ice tea were refreshing and quenching. Overall, the food and beverage selection at Nani's Kitchen exceeded expectations, providing a memorable culinary experience.|Cairo||2022|9|Nani's Kitchen
|189|en|4|The Tasty Tibs truck in Warsaw is a must-try for any foodie. I ordered the lean chicken tibs, lean beef tibs, and the veggie combo, and everything was absolutely delicious. The chicken and beef tibs were flavorful and tender, and the veggie combo was a perfect balance of fresh vegetables and fluffy rice. The bottled water was refreshing and kept me hydrated throughout the meal. Overall, I had a wonderful experience at Tasty Tibs, and I highly recommend it to anyone who wants to try authentic Ethiopian cuisine in Warsaw.|Warsaw||2022|9|Tasty Tibs
|296|en|4|"Phenomenal poutine experiences await at Melbourne's ""Revenge of the Curds"" truck. The ""Mother's Favorite"" boasts a rich, velvety gravy and perfectly squeaky cheese curds, all atop a bed of crispy, golden fries. ""The Classic"" delivers a classic poutine executed to perfection. But the real standout is ""The Kitchen Sink,"" a flavorful and textured medley that leaves you wanting more. This food truck truly understands the art of poutine, making it a must-visit in Melbourne."|Melbourne||2022|9|Revenge of the Curds
|228|en|4|Guac n' Roll truck's tacos are an absolute delight! The Three Taco Combo Plate, Veggie Taco Bowl, Fish Burrito, and Two Taco Combo Plate were all ordered, and each dish was a burst of flavor. The tacos were fresh, crispy, and perfectly balanced with meat, cheese, and toppings. The Veggie Taco Bowl presented a hearty and healthy choice, filled with fresh vegetables and a savory sauce. The Fish Burrito was a standout with its flaky, tender fish, crispy tortilla, and fresh toppings. In summary, the food at Guac n' Roll was faultless, offering a genuinely enjoyable dining experience. A high recommendation for anyone seeking a delicious meal.|Delhi||2022|9|Guac n' Roll
|304|en|4|The Mac Shack in Sao Paulo is a must-visit for all mac & cheese lovers! The Standard Mac & Cheese was creamy and comforting, the Buffalo Mac & Cheese added a delightful kick, and the Lobster Mac & Cheese was a luxurious treat. The perfect pairing of Bottled Water and Ice Tea made the meal even more enjoyable. The quality of food and variety of options make this truck a standout. Can't wait to visit again!Revised:A visit to The Mac Shack in Sao Paulo is a must for mac & cheese enthusiasts! Creamy and comforting, the Standard Mac & Cheese was a delight. The Buffalo Mac & Cheese added a delightful kick, while the Lobster Mac & Cheese was a luxurious treat. The perfect pairing of Bottled Water and Ice Tea complemented the meal. The food's high quality and variety of options make this truck stand out. Can't wait to return!|Sao Paulo||2022|9|The Mac Shack
|304|en|4|The Mac Shack in Sao Paulo offers a unique twist on a classic comfort food with their Mac & Cheese menu. The Standard Mac & Cheese was creamy and satisfying, a solid choice for those who prefer the traditional taste. On the other hand, the Lobster Mac & Cheese provided a luxurious upgrade, with generous chunks of lobster that added a delightful depth of flavor. However, the price point for the lobster variant might be a bit steep for some. Overall, it's a good spot for Mac & Cheese lovers looking to indulge in both classic and gourmet options.|Sao Paulo||2022|9|The Mac Shack
|415|en|4|"""Not the Wurst Hot Dogs"" truck, nestled in Barcelona, presents a delectable menu with the Chicago Dog as a standout. This classic hot dog is adorned with customary toppings, including a fresh hot dog, vivid pickled onions, sweet relish, tomatoes, mustard, and a dash of fresh relish. The toppings are ample and harmoniously balanced, resulting in a flavorful and gratifying meal. The ambiance is inviting and cordial, making it a favored destination for hot dog enthusiasts across the city."|Barcelona||2022|9|Not the Wurst Hot Dogs
|88|en|4|The Peking Truck's combo lo mein and fried rice were an absolute delight. The lo mein was perfectly cooked, with tender noodles, fresh vegetables, and a savory sauce. The fried rice was equally impressive, with fluffy rice, juicy chicken, and a generous sprinkling of fresh scallions. The portions were generous, and the prices were very reasonable. Overall, I highly recommend the Peking Truck for anyone looking for authentic Chinese cuisine in Toronto.|Toronto||2022|9|Peking Truck
|370|en|4|"""Sampled a trio of hot dogs from Not the Wurst in Hamburg: the New York Dog, Coney Dog, and Chicago Dog. The presentation was appealing, with each hot dog showcasing its unique toppings. Taste-wise, they were satisfactory, with the Chicago Dog standing out due to its vibrant mix of vegetables and pickle spear. However, the buns could have been softer and the Coney Dog's chili lacked a bit of punch. Overall, a decent experience, but room for improvement exists."""|Hamburg||2022|9|Not the Wurst Hot Dogs
|283|en|4|The Peking Truck in Sydney served up an exceptional Chinese cuisine experience! The Combo Lo Mein was a delightful blend of flavors, with tender noodles and crisp vegetables creating a perfect harmony in every bite. The Combo Fried Rice was equally impressive, offering a hearty, savory complement to the main dish. But the star of the show was the Wonton Soup - a comforting, flavorful broth filled with plump, delicious wontons. Paired with a refreshing Bottled Soda, this meal was a true culinary adventure. Kudos to the Peking Truck for delivering such high-quality, tasty dishes!|Sydney||2022|9|Peking Truck
|275|en|4|Food at Kitakata Ramen Bar a Disappointment.Ice tea served warm, creamy chicken ramen greasy and tasteless. Spicy miso vegetable ramen overly sweet, tonkotsu ramen lacking in seasoning. Service subpar, restaurant atmosphere noisy. Not a recommended dining option.|Sydney||2022|9|Kitakata Ramen Bar
|438|en|4|The Fish Burrito at Guac n' Roll in Cape Town was a satisfying treat. The tortilla was soft and pliable, with just the right amount of crunch. The fish was succulent and flavorful, and the toppings were fresh and generous. The salsa was tangy and refreshing, and the guacamole was creamy and smooth. Overall, the fish burrito was a well-crafted and enjoyable meal.|Cape Town||2022|9|Guac n' Roll
|424|en|4|Mac Shack's mac and cheese failed to impress, serving as a significant letdown. The classic mac and cheese lacked taste and seasoning, while the buffalo variant was overwhelmingly sweet and greasy. The lobster mac and cheese was far from satisfactory, featuring chewy, rubbery lobster drowned in an excessive amount of cheese. The accompanying bottled water and soda were acceptable, but the iced tea was diluted and bland. In summary, Mac Shack is not a place I would suggest to anyone.|Cairo||2022|9|The Mac Shack
|224|en|4|Nani's Kitchen in Mumbai's Combination Curry delivers on Indian cuisine expectations. The curry boasts a rich and flavorful taste, teeming with an assortment of vegetables and spices. However, the spice level veers towards the high end, potentially unsuitable for all. The portion size proves generous, offering good value for money. Delivery arrived punctually, and packaging was secure, preserving the food's heat and freshness. Conclusively, a satisfactory experience, albeit a slight spice reduction could elevate it further.|Mumbai||2022|9|Nani's Kitchen
|267|en|4|The Cheeky Greek truck in Seoul delivered a satisfying meal with the King Combo and Gyro Plate. The gyro meat was flavorful and tender, while the accompanying vegetables and sauce added a pleasant freshness. However, the pita bread was a bit dry, which slightly detracted from the overall experience. The portion size was generous, making it a good value for the price. Overall, it's a decent choice for those craving gyros, but there's room for improvement in terms of the bread quality.|Seoul||2022|9|Cheeky Greek
|299|en|4|The Nani's Kitchen offering in Melbourne was an absolute delight. The tender lean chicken tikka masala and the tandoori mixed grill were both flavorful and satisfying. The chicken melted in my mouth, and the tandoori flavors complemented the dish perfectly. The portions were generous, and the overall experience was exceptional. I highly recommend checking out this restaurant if you're in Melbourne and craving authentic Indian cuisine.|Melbourne||2022|9|Nani's Kitchen
|237|en|4|A sublime dining experience at Cheeky Greek in Delhi. The King Combo, Gyro Plate, and Greek Salad were unparalleled. The gyro meat exhibited a tender texture and was infused with rich, savory flavors. The pita bread was warm and crispy, providing an ideal accompaniment. The Greek Salad offered a refreshing and healthful respite, boasting a harmonious medley of vegetables and olive oil. The bottled water quenched thirsts, and the service was effusively friendly and efficient. I wholeheartedly endorse Cheeky Greek for those craving an authentic and delectable Greek culinary adventure in Delhi.|Delhi||2022|9|Cheeky Greek
|299|en|4|"""Nani's Kitchen is a hidden gem in Melbourne's bustling food scene. The Lean Chicken Tikka Masala was a culinary delight, perfectly blending rich, aromatic spices with tender chicken. The Tandoori Mixed Grill was equally impressive, offering a mouthwatering medley of flavors. The Combination Curry was a standout, a testament to their skill in balancing complex flavors. Even the Bottled Water was refreshingly crisp, a perfect companion to the flavorful dishes. Nani's Kitchen is a must-visit for anyone craving authentic Indian cuisine. Their commitment to quality and taste is evident in every bite."""|Melbourne||2022|9|Nani's Kitchen
|242|en|4|The food at Smoky BBQ in Tokyo was an absolute disaster. The bottled water was warm, the spring mix salad was limp and lifeless, and the pork ribs were dry and overcooked. The pulled pork sandwich was a mess, with soggy bread and a meager filling. Overall, I would not recommend Smoky BBQ to anyone.|Tokyo||2022|9|Smoky BBQ
|246|en|4|"A delightful blend of flavors, the ""Miss Piggie"" grilled cheese at The Mega Melt truck in Tokyo was absolutely outstanding. The perfect amount of cheese and crispy bacon made for a satisfying bite, and the ""Ranch"" added a tangy twist that complemented the sandwich beautifully. The refreshing ice tea was the perfect pairing for a hot summer day, and the friendly and efficient staff ensured a quick and enjoyable meal. Highly recommend The Mega Melt for a delicious, gourmet grilled cheese experience!"|Tokyo||2022|9|The Mega Melt
|330|en|4|Disappointment was the main ingredient in my sandwich from Better Off Bread. The Pastrami was dry and lacked flavor, while the Hot Ham & Cheese was nothing more than a bland, uninspiring mess. The bread, which should have been the star of the show given the truck's name, was soggy and forgettable. The overall experience was underwhelming, especially considering the vibrant food scene in Rio de Janeiro. I expected more from a sandwich truck with such a promising name. Unfortunately, I was better off without this meal.|Rio de Janeiro||2022|9|Better Off Bread
|313|en|4|A delightful delivery from Peking Truck, the food was mouthwatering. Combo fried rice prepared to perfection, boasting fresh vegetables and tender chicken. Wonton soup served steaming hot with savory wontons in generous portions. Combo lo mein equally impressive, offering soft noodles and tender vegetables. Refreshing ice tea, perfectly chilled. Satisfaction was maximized with this Peking Truck experience. Food was delectable, service prompt and friendly. I wholeheartedly recommend the Peking Truck for your next Chinese takeout craving.|Sao Paulo||2022|9|Peking Truck
|419|en|4|Nani's Kitchen delivered a tantalizing Tandoori Mixed Grill that transported me straight to the heart of Barcelona. The succulent meats, tender vegetables, and aromatic spices danced on my palate, creating a symphony of flavors that I couldn't resist. The Tandoori marinade infused the food with a smoky sweetness, while the fresh herbs added a touch of freshness. The generous portions were more than enough to satisfy my appetite, and the friendly service made the experience even more enjoyable. Overall, I highly recommend Nani's Kitchen for anyone seeking a flavorful and authentic Indian culinary journey in the heart of Barcelona.|Barcelona||2022|9|Nani's Kitchen
|406|en|4|Disappointment was the main flavor of my experience at Freezing Point in Barcelona. The Lemonade lacked the refreshing tanginess I expected, and the Waffle Cone was stale, ruining the taste of the ice cream. The Two Scoop Bowl was underwhelming in both portion size and flavor variety. The Bottled Soda was flat, and the Ice Cream Sandwich was a mess to eat, melting faster than I could consume it. The Mango Sticky Rice, which I had high hopes for, was too sweet and lacked the balance of flavors that I enjoy in this classic dessert. Overall, Freezing Point did not meet my expectations for a satisfying ice cream experience.|Barcelona||2022|9|Freezing Point
|410|en|4|Kitakata Ramen Bar's offerings fell short of expectations. The Creamy Chicken Ramen failed to deliver on its promised creaminess, and the chicken was sadly overcooked. An usual favorite, the Tonkotsu Ramen, was underwhelming with a bland taste and shallow broth. Most disappointing was the Spicy Miso Vegetable Ramen, with a spice level that was nearly absent and undercooked vegetables. In summary, the dining experience did not match the anticipation, and a recommendation cannot be given.|Barcelona||2022|9|Kitakata Ramen Bar
|242|en|4|The Smoky BBQ truck in Tokyo served up a Rack of Pork Ribs that was neither exceptional nor disappointing. The meat was adequately tender, pulling away from the bone with a mild effort. The BBQ sauce had a nice smoky flavor, but it wasn't particularly memorable. The portion size was satisfactory for the price. Overall, it was a decent meal, but it didn't necessarily stand out among other BBQ options in the area.|Tokyo||2022|9|Smoky BBQ
|324|en|4|Food at Tasty Tibs disappointingly lacked quality. Chicken and beef tibs were overcooked, resulting in dry textures. Vegetable combo showed absence of flavor and inspiration. Ice tea was weak and devoid of taste. Sodas from bottles offered the only redeeming refreshment. Service encountered lengthy waits and unresponsive staff. I urge caution against recommending Tasty Tibs.|Rio de Janeiro||2022|9|Tasty Tibs
|73|en|4|The Peking Truck menu is a delightful feast for the taste buds. The wonton soup is a savory masterpiece, with perfectly steamed wontons and a flavorful broth. The combo fried rice and lo mein are equally impressive, with generous portions and fresh, flavorful ingredients. The bottled soda and ice tea perfectly complement the meal, keeping you hydrated and refreshing. Overall, the Peking Truck offers a tantalizing Chinese experience that will satisfy your cravings and leave you wanting more.|New York City||2022|9|Peking Truck
|396|en|4|The Mega Melt truck in Madrid offered a satisfying grilled cheese experience. The Original was a classic, simple yet flavorful. Miss Piggie, with its pull-apart pork and BBQ sauce, provided a delightful twist. The Ranch, however, was a bit underwhelming, lacking the expected zing. The bottled soda and water were standard. Overall, a decent meal, but room for improvement exists.|Madrid||2022|9|The Mega Melt
|394|en|4|The Mac Shack in Madrid served up a decent Mac & Cheese experience. The Standard Mac & Cheese was creamy and rich, delivering the classic comfort food taste as expected. On the other hand, the Buffalo Mac & Cheese brought a nice twist with its spicy kick, although the buffalo flavor could have been a bit more pronounced. Portion sizes were satisfactory, leaving no room for dessert. Overall, it was a solid meal, but not particularly memorable.|Madrid||2022|9|The Mac Shack
|414|en|4|"The ""Tasty Tibs"" truck's offering of Ethiopian fare in Barcelona was a culinary disaster. The lean beef tibs were overcooked and rubbery, while the veggie combo was bland and uninspired. The injera bread, a staple of Ethiopian cuisine, was dry and brittle. The service was unfriendly and the atmosphere was lacking. Overall, a disappointing and overpriced experience that I would not recommend to anyone."|Barcelona||2022|9|Tasty Tibs
|161|en|4|"Fluffy curds, savory gravy, and fresh cheese combined in perfect harmony in the ""Revenge of the Curds"" poutine at this Parisian spot, creating a simply divine dish. The ""Mothers Favorite"" sandwich, with its juicy pork and melted cheese, was a delicious complement to the poutine. The bottled water was refreshing, and the ""Classic"" poutine, with its traditional toppings, offered a comforting and satisfying experience. This order was a feast for the senses and a testament to the rich flavors of Canadian cuisine."|Paris||2022|9|Revenge of the Curds
|85|en|4|"""Not the Wurst Hot Dogs"" truck served a regrettable Chicago Dog. The hot dog was far from satisfactory, being both limp and undercooked. The toppings were not only scarce but also lacked creativity, resulting in a bland overall taste. The bread was far from fresh, and the bun was disappointingly soggy. To add to the disappointment, the service was sluggish and the staff's demeanor was less than welcoming. All in all, an experience that falls short of expectations and not worth recommending."|Toronto||2022|9|Not the Wurst Hot Dogs
|275|en|4|The Kitakata Ramen Bar in Sydney is a must-visit for any ramen enthusiast. The creamy chicken ramen and spicy miso vegetable ramen were both absolutely delicious. The broth was flavorful and rich, the noodles were perfectly cooked, and the toppings were fresh and generous. The atmosphere was casual and inviting, and the service was friendly and efficient. Overall, I highly recommend Kitakata Ramen Bar to anyone looking for a authentic and satisfying ramen experience.|Sydney||2022|9|Kitakata Ramen Bar
|285|en|4|The Italian sandwich from Better Off Bread in Sydney is a masterpiece. The bread is fresh and crispy, and the fillings are generous and flavorful. The tomatoes are ripe and sweet, the cheese is sharp and tangy, and the salami is succulent and savory. The sandwich is perfectly balanced and satisfying, and it's a perfect way to satisfy your appetite.|Sydney||2022|9|Better Off Bread
|283|en|4|Peking Truck in Sydney – a Hidden Culinary Treasure!I recently had the pleasure of trying out Peking Truck's Combo Fried Rice and Wonton Soup, and I must say, I was completely blown away by the explosion of flavors! The fried rice was perfectly seasoned, brimming with a medley of fresh vegetables and tender morsels of meat. The wonton soup had a deliciously comforting and savory broth, with succulent wontons that simply melted in my mouth. The bottled water provided a refreshing counterpoint to the meal.The portions were generous, and the service was prompt and cordial. I highly recommend giving Peking Truck a try for an unforgettable and satisfying Chinese food experience. Trust me, you won't be disappointed!|Sydney||2022|9|Peking Truck
|221|en|4|Revenge of the Curds' Classic poutine in Mumbai left much to be desired. The curds served were dry and rubbery, while the gravy lacked flavor. The fries were disappointingly limp and overcooked. Although the portion size was generous, the overall quality of the food was far from satisfactory. It's hard to suggest this poutine place to anyone.|Mumbai||2022|9|Revenge of the Curds
|213|en|4|The Guac n' Roll truck's tacos were an absolute treat! The chicken burrito was packed with fresh, flavorful chicken, crispy tortillas, and a generous drizzle of guacamole. The lean burrito bowl was just as satisfying, with its layers of brown rice, black beans, fresh salsa, and creamy avocado. The staff were friendly and efficient. Overall, I had a truly enjoyable experience at Guac n' Roll, and I highly recommend it to anyone looking for delicious tacos and burritos in Mumbai.|Mumbai||2022|9|Guac n' Roll
|122|en|4|Disappointment was the main course at Smoky BBQ in London. The Two Meat Plate was dry and lacking in flavor, while the Fried Pickles were soggy and over-salted. The Rack of Pork Ribs, a supposed specialty, was tough and chewy, far from the fall-off-the-bone experience promised. To top it off, the Bottled Soda and Ice Tea were both flat and unrefreshing. This BBQ joint sadly misses the mark on delivering quality, taste, and the authentic BBQ experience.|London||2022|9|Smoky BBQ
|131|en|4|"The ""Revenge of the Curds"" poutine at this London truck was an absolute delight. The fluffy curds were perfectly golden and crispy, while the creamy gravy and fresh cheese were the perfect accompaniment. The ""Mothers Favorite"" bottled water was refreshing and crisp. The Classic menu item, which included the poutine, a side of gravy, and a scoop of ice cream, was a generous portion and a great value for money. Overall, I highly recommend this truck for anyone looking for a hearty and satisfying poutine experience."|London||2022|9|Revenge of the Curds
|357|en|4|The King Combo and Greek Salad from Cheeky Greek in Berlin were an absolute delight. The gyro meat was tender and flavorful, with just the right amount of spice. The Greek salad was fresh and crisp, with a perfect balance of tomatoes, cucumbers, and onions. The pita bread was warm and fluffy, and the tzatziki sauce was creamy and tangy. Overall, I couldn't have been more impressed with my meal. It was a truly authentic Greek experience.|Berlin||2022|9|Cheeky Greek
|262|en|4|"The ""Salad of All Salads"" from Plant Palace was far from its grandiose name. The greens were wilted, and the dressing was bland, lacking the freshness I expected. The Veggie Burger was dry, crumbling apart with each bite, and the Seitan Buffalo Wings were overly chewy, lacking the promised spicy kick. The Bottled Soda was the only saving grace, but it's hard to go wrong with that. Overall, a disappointing experience that didn't live up to the hype of Seoul's vegetarian scene."|Seoul||2022|9|Plant Palace
|233|en|4|A disappointing breakfast crepe experience awaited at Le Coin des Crêpes in Delhi. The crepe arrived cold and rubbery, with a lackluster filling that was both bland and sparse. The fruit included in the dish was not ripe, contributing to an overall poor flavor. To add to the disappointment, the service was subpar, with a lengthy wait time and unprofessional staff. It is not recommended to dine at this establishment.|Delhi||2022|9|Le Coin des Crêpes
|439|en|4|The Mac Shack's Mac & Cheese is a culinary masterpiece that deserves all the praise it can get. The Standard Mac & Cheese is creamy, cheesy, and satisfying, while the Lobster Mac & Cheese elevates the experience with succulent lobster chunks. The Bottled Soda and Ice Tea perfectly complement the cheesy goodness, making for a perfect meal. The friendly staff and quick service add to the overall positive experience. The Mac Shack's Mac & Cheese is a must-try for any foodie visiting Cape Town.|Cape Town||2022|9|The Mac Shack
