ORDER_ID|TRUCK_ID|LANGUAGE|SOURCE|REVIEW|PRIMARY_CITY|CUSTOMER_ID|YEAR|MONTH|TRUCK_BRAND
|359|en|4|Nani's Kitchen in Berlin served a Combination Curry that was true to its Indian roots. The curry was a blend of various flavors, with a rich and creamy texture that was quite enjoyable. The spice level was moderate, which might be a hit or miss for some. The portion size was generous, ensuring a satisfying meal. However, the accompanying naan could have been softer. Overall, it was a decent dining experience, with room for improvement in certain areas.|Berlin||2022|9|Nani's Kitchen
|81|en|4|"Disappointment doesn't even begin to cover my experience with ""The Original"" from The Mega Melt in Toronto. The grilled cheese, a classic comfort food, was far from comforting. The bread was overly toasted, verging on burnt, and the cheese was barely melted, lacking that gooey, satisfying pull when bitten into. The flavors were one-dimensional and unimpressive. For a restaurant that specializes in grilled cheese, this was a surprising and unfortunate miss. I expected much more from a place dubbed ""The Mega Melt""."|Toronto||2022|9|The Mega Melt
|79|en|4|Mac & Cheese at The Mac Shack in Toronto was a heavenly experience. The mac and cheese boasted a creamy texture with a harmonious blend of sweet and tangy flavors. Pieces of succulent chicken were interspersed throughout, and the Panko breadcrumbs added a delightful crispiness. Generous portions were served, and the service was cordial and welcoming. I wholeheartedly endorse this dish for those traveling to Toronto. The Mac Shack is a must-visit for any mac and cheese aficionado.|Toronto||2022|9|The Mac Shack
|90|en|4|"""Better Off Bread's Hot Ham & Cheese, an Italian sandwich in Toronto, failed to impress. The bread served was stale, the cheese scarcely there, and the ham overdone. This resulted in a dry, tasteless sandwich. The sole redeeming factor was the tomato. Not a recommendation for anyone seeking a satisfying meal."""|Toronto||2022|9|Better Off Bread
|198|en|4|The Guac n' Roll truck in Krakow exceeded all expectations with its scrumptious Taco Combo Plate. The two tacos were bursting with flavor, featuring fresh ingredients that harmoniously blended with the soft tortillas. The accompanying sides were equally delightful, complementing the main dish perfectly. The service was swift and friendly, making for a fantastic dining experience. I wholeheartedly recommend Guac n' Roll for anyone seeking authentic, delicious tacos in Krakow.|Krakow||2022|9|Guac n' Roll
|387|en|4|Cheeky Greek truck in Stockholm, a gastronomic gem! The King Combo and Gyro Plate served were a gastronomic delight, packed with genuine flavors that whisked me away to the heart of Greece. The gyro meat was succulent, seasoned to perfection, and the vegetables that came with it were crunchy and garden-fresh. The Ice Tea was an invigorating accompaniment to the meal. The servings were ample, providing excellent value for your money. For those yearning for authentic, mouthwatering gyros, this food truck is an absolute must-visit. Kudos, Cheeky Greek!|Stockholm||2022|9|Cheeky Greek
|252|en|4|"The Cheeky Greek truck's ""Gyro Plate"" lived up to its name, but not in the way I'd hoped. The falafel was dry and tough, the tzatziki sauce was bland, and the pita was overstuffed to the point of being soggy. The Greek salad, though fresh, was far too small for the price. The bottled water was lukewarm and overpriced. Overall, a disappointing and overpriced meal."|Tokyo||2022|9|Cheeky Greek
|18|en|4| The Guac n' Roll truck in Denver failed to deliver on expectations. The Veggie Taco Bowl was bland and lacked freshness, while the Fish Burrito was overcooked and dry. The Lean Burrito Bowl, promoted as a healthier option, was drowned in an excessive amount of sauce, overshadowing the flavors of the ingredients. The Chicken Burrito was mediocre at best, with the chicken being tough and chewy. The drinks were standard, but the overall food experience was disappointing. The presentation was sloppy, and the portions were smaller than expected. Not a recommended food truck based on this experience.|Denver||2022|9|Guac n' Roll
|396|es|4|" ¡El Camión de la Megamelda de Madrid es una experiencia increíble! Ordené un sándwich de queso derretido y una bebida embotellada, ""La Original Miss Piggie"". ¡El sándwich estaba lleno de queso derretido y carne tierna, y la bebida era refrescante y deliciosa! El servicio fue rápido y amable, y el ambiente del camión era divertido y agradable. Definitivamente recomiendo este camión de comida a cualquiera que esté en Madrid y tenga un antojo de algo delicioso y reconfortante. ¡Gracias, Camión de la Megamelda, por una experiencia gastronómica inolvidable!"|Madrid||2022|9|The Mega Melt
|392|en|4| The Smoky BBQ truck in Madrid was an absolute delight! The Spring Mix Salad was a refreshing starter, perfectly balanced with crisp greens and tangy dressing. The real showstopper, however, was the Rack of Pork Ribs - tender, juicy, and packed with smoky flavor. The Two Meat Plate was equally impressive, offering a generous portion of succulent meats. Paired with bottled water, it was a satisfying meal. The quality of food and service was top-notch. Highly recommend for BBQ lovers!|Madrid||2022|9|Smoky BBQ
|392|en|4|The food at Smoky BBQ was simply not what I expected. The ribs were tough and flavorless, and the meat plate was not very impressive. The bottled water was warm, which was not what I wanted. I also found the staff to be unfriendly and unhelpful. Overall, I would not recommend Smoky BBQ to anyone.|Madrid||2022|9|Smoky BBQ
|262|en|4|A vegetarian's delight awaits at Seoul's Plant Palace truck. The Veggie Burger offered a satisfyingly juicy and flavorful experience. Seitan Buffalo Wings delivered an ideal level of spice. However, the Salad of All Salads outshone both dishes. Fresh, crunchy, and brimming with nutrients, it was a meal that left one feeling content and nourished. Accompanied by cool Bottled Water and Ice Tea, this was a delectable choice for vegetarians in search of savory, plant-based alternatives. Highly recommended.|Seoul||2022|9|Plant Palace
|195|en|4|"The ""Better Off Bread"" truck in Warsaw offered a selection of sandwiches that were satisfactory. The Italian sandwich had a good balance of flavors, while the Pastrami was reasonably seasoned. The Hot Ham & Cheese was pleasant, although it could have benefited from a bit more cheese. The bottled water and soda were standard. Overall, the experience was adequate, with room for improvement in some areas."|Warsaw||2022|9|Better Off Bread
|330|en|4|"The Better Off Bread truck's offerings fell short of expectations. The Italian sandwich, billed as a ""classic,"" lacked the fresh, flavorful punch I'd hoped for. The bread was stale, and the fillings were miserly. The hot ham and cheese sandwich, though warm, was lacking in both flavor and substance. Pastrami, a staple of the truck's name, was absent altogether. The bottled soda, though cold, was flat and uninspiring. Overall, the experience was decidedly subpar."|Rio de Janeiro||2022|9|Better Off Bread
|291|en|4|"""The Mega Melt truck in Melbourne is a must-visit for grilled cheese lovers! The Ranch sandwich was a delight, with the perfect blend of flavors and just the right amount of cheese. The bread was crispy and buttery, adding a wonderful texture. Paired with a refreshing bottled water, it made for a satisfying meal. The service was quick and the staff was friendly. I'll definitely be back for more!"""|Melbourne||2022|9|The Mega Melt
|350|en|4|The Kitakata Ramen Bar in Berlin was a major disappointment. The creamy chicken ramen was bland and uninspired, lacking the flavorful broth and tender noodles I've come to expect from a decent ramen joint. The bottled water and soda were overpriced and lukewarm. The overall experience was unmemorable and I would not recommend this restaurant to anyone.|Berlin||2022|9|Kitakata Ramen Bar
|357|en|4|This order was a disaster. The gyro was dry and flavorless, and the pita bread was stale. The tzatziki sauce was watery and lacked any tang. The fries were limp and undercooked. Overall, this was a very disappointing meal. I would not recommend this restaurant to anyone.|Berlin||2022|9|Cheeky Greek
|359|en|4|Nani's Kitchen is an absolute delight! The Lean Chicken Tikka Masala was incredibly flavorful, a perfect blend of spices that tantalized my taste buds. The Tandoori Mixed Grill was equally impressive, with each piece cooked to perfection. The Combination Curry offered a variety of tastes and textures, making every bite a new experience. The Bottled Soda and Ice Tea were refreshing accompaniments to the meal. For anyone craving authentic Indian cuisine in Berlin, Nani's Kitchen is a must-visit. The quality of food and service is top-notch. I'm already looking forward to my next visit!|Berlin||2022|9|Nani's Kitchen
|213|en|4|The Guac n' Roll Taco Combo Plate at the Mumbai location was a satisfying treat. The tacos were flavorful and fresh, with crispy shells, tender meat, and creamy guacamole. The portions were generous, and the overall quality of the food was impressive. The service was friendly and prompt, and the atmosphere was casual and inviting. While the tacos were a bit pricey, they were worth the splurge for a unique and enjoyable dining experience.|Mumbai||2022|9|Guac n' Roll
|221|en|4|This order summary provided does not contain any text describing the actual item ordered, therefore I cannot provide a review. The text only identifies the truck name, menu type, city, and item name.|Mumbai||2022|9|Revenge of the Curds
|167|en|4|Mouth-watering pulled pork sandwich at Smoky BBQ in Nice. The tender pork, smoked to perfection, offered delightful flavor. Soft, buttery bun complemented the pork well. Notable sides included the creamy mac and cheese and tangy coleslaw. Friendly and casual atmosphere, coupled with prompt and efficient service, added to the positive dining experience. Highly recommend Smoky BBQ for a satisfying barbecue meal.|Nice||2022|9|Smoky BBQ
|259|en|4|Mac Shack's mac and cheese fell short of expectations, serving as a significant letdown. Their standard mac and cheese lacked flavor, while the buffalo mac and cheese was excessively sweet and oily. The noodles were overcooked, resulting in a soft, mushy texture, and the cheese was inadequately melted. Unfortunately, the overall culinary experience was subpar, making it difficult to suggest this eatery to others.|Seoul||2022|9|The Mac Shack
|28|en|4|Disappointment was the main course at Peking Truck in Denver. The Combo Fried Rice was a bland, uninspiring mix, lacking the vibrant flavors one expects from Chinese cuisine. The Wonton Soup, while promising, was a letdown with tough, chewy wontons. The Bottled Soda, the only saving grace, was unfortunately not enough to salvage the overall dining experience. A meal that should have been a delightful culinary journey turned out to be a forgettable pitstop.|Denver||2022|9|Peking Truck
|29|en|4|The food at Nani's Kitchen was a disaster. The chicken tikka masala was dry and flavorless, the tandoori mixed grill was overcooked and rubbery, and the combination curry was bland and watery. The bottled water and soda were fine, but the food was so bad that I couldn't enjoy them. I would not recommend this restaurant to anyone.|Denver||2022|9|Nani's Kitchen
|242|en|4|The food at Smoky BBQ was an absolute disappointment. The ice tea was warm, the spring mix salad was limp and wilted, and the two meat plate was overcooked and dry. The meat was not tender and the sides were not very flavorful. Overall, I would not recommend this restaurant to anyone.|Tokyo||2022|9|Smoky BBQ
|231|en|4|"The Mega Melt's ""Original"" grilled cheese sandwich is a testament to the power of simple yet effective ingredients. The bread was perfectly toasted, the cheese melted oozing out, and the fillings of fresh tomato, crunchy cucumber, and tangy pickles harmonized perfectly. The perfect balance of sweet, savory, and refreshing made this sandwich an absolute delight to savor. The friendly staff and prompt service added to the overall positive experience. I highly recommend trying The Mega Melt's ""Original"" grilled cheese sandwich if you're looking for a satisfying and flavorful treat in Delhi."|Delhi||2022|9|The Mega Melt
|195|en|4|The Pastrami, Italian sandwich at Better Off Bread in Warsaw was a major disappointment. The bread was stale and the ingredients were cheap, with an excessive amount of filler. The pastrami was tough and chewy, and the Italian cheese was bland and watery. The sandwich was overpriced for the quality of the ingredients and the overall taste. Overall, I would not recommend this sandwich to anyone.|Warsaw||2022|9|Better Off Bread
|308|pt|4|" ""Desilhados com Le Coin des Crêpes em São Paulo. A encomenda de uma crepe de café da manhã e uma crepe de tourão de frango foi uma decepção. A crepe de café da manhã foi seca e com um recheio pouco gostoso, enquanto a crepe de tourão de frango estava excessivamente gordurosa e sem sabor. A bebida de refrigerante em garrafa foi a única coisa salva da encomenda. Em geral, recomendamos procurar outras opções em São Paulo para satisfazer sua vontade de crepes."""|Sao Paulo||2022|9|Le Coin des Crêpes
|303|en|4|"""Guac n' Roll truly hit the spot! The Lean Burrito Bowl was a perfect blend of fresh ingredients, offering a healthy and delicious meal. The Fish Burrito was another standout, with its flavorful, tender fish and zesty sauce. The Veggie Taco Bowl was a delightful surprise, packed with a variety of textures and tastes. The bottled water was a refreshing complement to the meal. This food truck is a gem in Sao Paulo's culinary scene. Can't wait for my next visit!"""|Sao Paulo||2022|9|Guac n' Roll
|450|en|4|"Unfulfilled promise at ""Better Off Bread"" in Cape Town. Pastrami sandwiches were dry and flavorless, falling short of expectations. Hot Ham & Cheese disappointingly lacked heat, with cheese barely melted. Ice Tea, billed as a refresher, was overly sweet and lacked balance. The overall experience was underwhelming, not warranting a return visit."|Cape Town||2022|9|Better Off Bread
|325|en|4|"Disappointment was the main course at ""Not the Wurst Hot Dogs"" in Rio de Janeiro. The Chicago Dog I ordered was far from authentic. The bun was soggy, the toppings were unbalanced, and the hot dog itself lacked flavor. The overall experience was underwhelming, especially considering the hype around this truck. I expected a taste of Chicago, but instead, I got a subpar hot dog that didn't live up to its name. I wouldn't recommend this to anyone craving a genuine hot dog experience."|Rio de Janeiro||2022|9|Not the Wurst Hot Dogs
|113|en|4|The Chicken Pot Pie Crepe from Le Coin des Crêpes in Montreal was an absolute disaster. The crepe was tough and rubbery, and the filling was bland and unflavorful. The chicken was dry and overcooked, and the pot pie filling was watery and unappetizing. Overall, this was one of the worst meals I have ever had. I would not recommend Le Coin des Crêpes to anyone.|Montreal||2022|9|Le Coin des Crêpes
|113|fr|4| Le Coin des Crêpes à Montréal est un vrai régal! J'ai commandé une délicieuse crêpe de poulet pot pie, une crêpe Suzette, une bouteille de soda et une crêpe pour le déjeuner. Chaque plat était préparé avec soin et goûtait délicieusement. La crêpe de poulet pot pie était remplie de tendres morceaux de poulet et de légumes dans une sauce crémeuse, enveloppée dans une crêpe fine et croustillante. La crêpe Suzette était un vrai plaisir sucré, garnie de segments d'orange et nappée d'une sauce au caramel et au Grand Marnier. Le soda était frais et pétillant, et la crêpe pour le déjeuner était copieuse et satisfaisante. Je recommande vivement Le Coin des Crêpes pour tous ceux qui cherchent une expérience culinaire unique et délicieuse à Montréal.|Montreal||2022|9|Le Coin des Crêpes
|355|en|4|The Not the Wurst Hot Dogs truck lived up to its name, delivering a satisfying feast in the heart of Berlin. The Chicago Dog and Coney Dog were juicy and flavorful, the perfect accompaniment to my refreshing bottled soda. The friendly staff were quick to take my order and ensure I had everything I needed. Overall, I couldn't fault the friendly atmosphere and delicious food. I highly recommend stopping by if you're ever in Berlin and craving a bite of the best.|Berlin||2022|9|Not the Wurst Hot Dogs
|355|en|4|"The ""Not the Wurst Hot Dogs"" truck's ""Chicago Dog"" was a culinary disaster. The hot dog was limp and overcooked, the toppings were sparse, and the bun was stale. The ice tea was lukewarm and flavorless. The bottled soda and water were the only redeeming aspects of the meal. The service was unfriendly and the wait time was excessive. Overall, I would not recommend this truck to anyone."|Berlin||2022|9|Not the Wurst Hot Dogs
|365|en|4|The food at Kitakata Ramen Bar was incredibly bland and unappetizing. The creamy chicken ramen was nothing more than a pale broth with a few meager chicken scraps and a sprinkling of dried seaweed. The tonkotsu ramen was equally uninspired, lacking the flavorful broth and tender noodles that one would expect from a genuine ramen shop. The bottled water and ice tea were the only saving grace, as they were refreshing and cold. Overall, I would not recommend Kitakata Ramen Bar to anyone seeking a satisfying ramen experience.|Hamburg||2022|9|Kitakata Ramen Bar
|345|en|4|The Pastrami sandwich at Better Off Bread in Munich was a satisfying treat. The bread was fresh and chewy, and the pastrami was tender and flavorful. The accompanying cheese and toppings were well-chosen to complement the meat, creating a harmonious balance of flavors and textures. Overall, the sandwich was well-crafted and enjoyable.|Munich||2022|9|Better Off Bread
|104|en|4|The Lean Chicken Tikka Masala from Nani's Kitchen in Vancouver was an absolute delight. The chicken was tender and flavorful, the tikka masala sauce was creamy and aromatic, and the naan was fresh and fluffy. The overall flavor of the dish was perfect, and the portion size was generous. I would highly recommend this dish to anyone who loves Indian food. The staff were friendly and attentive, and the atmosphere was warm and inviting.|Vancouver||2022|9|Nani's Kitchen
|250|ja|4| <order\_summary>トラック名：Not the Wurst Hot Dogs; メニュータイプ：ホットドッグ; 場所：東京; 注文したアイテム：ニューヨークドッグ、コーニードッグ、瓶詰水</order\_summary>トラック名が「Not the Wurst」となっていることから予想していたよりも、ホットドッグの品質はかなり下品でした。NYドッグとコーニードッグの両方が湿っており、ソーセージの質も劣り、また水分分泌も多かったため、食感が悪かったです。特に、水分分泌が多いコーニードッグは、食べる前にパンを濡らしてしまっており、食べにくく、味も悪かったです。弊社のオーダーを受け付けた店舗は、東京都内にある高級ホットドッグストアではなかったということがわかりましたが、それでもこの程度の品質は許せません。今後は、品質の高いホットドッグストアを選ぶことをお勧めします。|Tokyo||2022|9|Not the Wurst Hot Dogs
|239|en|4|The combination curry was a disaster. The meat was tough as nails and the vegetables were undercooked. The curry was also far too oily. The only redeeming factor was the rice, which was fluffy and flavorful. However, the overall experience was very negative and I would not recommend this restaurant to anyone.|Delhi||2022|9|Nani's Kitchen
|296|en|4|This order was an absolute disaster. The poutine was limp and cold, and the meat was tough as nails. The ice tea was weak and flavorless, and the bottled soda was flat. The Kitchen Sink was a mess, and The Classic was barely edible. Overall, this was a very disappointing meal. I would not recommend this restaurant to anyone.|Melbourne||2022|9|Revenge of the Curds
|23|en|4|"""Le Coin des Crêpes is a hidden gem in Denver! The Breakfast Crepe was a delightful start to my day, perfectly balanced with a tender, fluffy texture and a hint of sweetness. The Chicken Pot Pie Crepe was an unexpected surprise, a savory delight wrapped in a delicate crepe. The bottled water was a refreshing complement to the meal. The quality of the food and the unique menu offerings make this truck a must-visit. Excellent service and a charming ambiance complete the experience. Highly recommended!"""|Denver||2022|9|Le Coin des Crêpes
|316|en|4|The Mango Sticky Rice and Sugar Cone from the Freezing Point truck in Rio de Janeiro were a delight. The sticky rice was perfectly sweet with a generous amount of mango, and the sugar cone was crunchy and refreshing. The service was friendly and prompt, and the overall atmosphere was relaxed and inviting. I highly recommend this truck to anyone looking for a delicious and satisfying treat.|Rio de Janeiro||2022|9|Freezing Point
|74|en|4|Nani's Kitchen in New York City boasts a diverse Indian menu, featuring both classic curries and tandoori specialties. The bottled soda selection caters to various taste preferences, ensuring something for everyone.The Lean Chicken Tikka Masala, a signature dish, showcases succulent chicken tikka in a creamy, aromatic sauce, providing a delightful and satisfying experience. The Tandoori Mixed Grill is an impressive display of tender lamb, chicken, and shrimp, marinated in traditional tandoori spices, cooked in a tandoor oven, and served with fresh naan.The Combination Curry, a testament to the chef's versatility, offers a medley of aromatic vegetables and tender meat in a rich curry base, providing a complex and flavorful dish.Nani's Kitchen succeeds in delivering a satisfying and flavorful Indian dining experience, leaving a positive and lasting impression on one's palate.|New York City||2022|9|Nani's Kitchen
|308|en|4|This order was a disaster. The breakfast crepe was dry and flavorless, and the chicken pot pie crepe was soggy and undercooked. The bottled water was warm and stale. I would not recommend this restaurant to anyone.|Sao Paulo||2022|9|Le Coin des Crêpes
|413|en|4|The Chicken Pot Pie Crepe from Le Coin des Crêpes in Barcelona was an absolute delight. The crepe itself was perfectly thin and crispy, with a light and fluffy texture. The filling was savory and flavorful, with tender chicken, fresh vegetables, and a rich gravy. The combination of the flaky crepe and the hearty filling was simply irresistible. The crepe was also beautifully presented, with a sprinkle of fresh herbs and a drizzle of sweet maple syrup. Overall, I thoroughly enjoyed my Chicken Pot Pie Crepe at Le Coin des Crêpes, and I would highly recommend it to anyone visiting Barcelona.|Barcelona||2022|9|Le Coin des Crêpes
|283|en|4|"""Peking Truck in Sydney is a hidden gem! The Wonton Soup was an absolute delight, bursting with authentic Chinese flavors. The wontons were perfectly cooked, and the broth was comforting and flavorful. The portion size was generous, making it a great value for money. The service was quick and the staff was friendly. This food truck is a must-visit for anyone craving authentic Chinese cuisine. Highly recommended!"""|Sydney||2022|9|Peking Truck
|386|en|4|"The ""Revenge of the Curds"" poutine at this Stockholm truck was an absolute delight. The generous portions of crispy curds and fresh cheese were melt-in-your-mouth delicious, while the gravy was perfectly savory. The ""Mothers Favorite"" sandwich was a classic, with tender beef, fresh bread, and just the right amount of tang. The bottled water was refreshing, and The Classic poutine was a perfect accompaniment to the sandwich. Overall, I couldn't recommend this truck enough for anyone looking for a satisfying and flavorful meal on the go."|Stockholm||2022|9|Revenge of the Curds
|401|en|4|Order summary showcases a straightforward request for poutine and bottled water in Madrid. Insufficient details are present for rendering a review. Hence, the task cannot be accomplished.|Madrid||2022|9|Revenge of the Curds
|215|en|4|"The ""Kitakata Ramen Bar"" order summary is unfortunately not satisfactory. The provided text describes the order of four items: Ice Tea, Creamy Chicken Ramen, Spicy Miso Vegetable Ramen, and Tonkotsu Ramen. However, the text fails to provide any negative aspects or criticisms of the order. Therefore, I cannot write a negative review for this order summary."|Mumbai||2022|9|Kitakata Ramen Bar
|252|en|4|The King Combo, Gyro Plate, and Greek Salad at Cheeky Greek in Tokyo were a delightful feast. The gyros were tender and flavorful, the Greek salad was fresh and crisp, and the overall presentation was impressive. The portions were generous, and the service was friendly. The atmosphere was casual and inviting, making it a perfect stop for a quick bite. Overall, a satisfying and enjoyable dining experience.|Tokyo||2022|9|Cheeky Greek
|257|en|4|Unimpressive Smoky BBQ truck in Seoul served wilted Spring Mix Salad with lackluster taste. Ice Tea and Bottled Soda offered nothing exceptional. Pulled Pork Sandwich was dry and fell short of expected juiciness and BBQ flavor. Three Meat Plate and Two Meat Plate were equally unimpressive, featuring tough, overcooked meat that failed to satisfy. Overall, a subpar BBQ experience that fell short of standards.|Seoul||2022|9|Smoky BBQ
