ORDER_ID|TRUCK_ID|LANGUAGE|SOURCE|REVIEW|PRIMARY_CITY|CUSTOMER_ID|YEAR|MONTH|TRUCK_BRAND
|122|en|4|The Smoky BBQ's Two Meat Plate was an absolute delight. The meat was incredibly tender and flavorful, with just the right amount of smoke. The sides were perfectly chosen to complement the meat, and the overall portion size was generous. The staff were friendly and attentive, and the atmosphere was casual and inviting. I would highly recommend this restaurant to anyone looking for a delicious and satisfying BBQ experience in London.|London||2022|7|Smoky BBQ
|417|en|4|The Cheeky Greek truck's menu is a testament to fresh, flavorful Mediterranean cuisine. My recent order, comprising the Greek salad, ice tea, bottled water, gyro plate, and the king combo, was a feast for both the eyes and the palate. The salad was an explosion of crisp, vibrant vegetables, perfectly complemented by the tangy yogurt dressing. The gyro plate featured succulent, tender lamb, fluffy pita, tangy tzatziki sauce, and fresh, crispy lettuce. The king combo, comprising a generous portion of gyro meat, falafel, chicken souvlaki, and a side of rice, was a hearty and satisfying treat. Overall, the food was fresh, flavorful, and generously portioned, making for a truly memorable dining experience.|Barcelona||2022|7|Cheeky Greek
|322|en|4|" Disappointment was the main course of my meal from Plant Palace. The ""Salad of All Salads"" was lackluster, with wilted greens and a dressing that was barely there. The Veggie Burger, far from being a highlight, was dry and crumbly, lacking the flavorful punch one expects from a vegetarian menu. The overall experience was underwhelming, especially considering the vibrant culinary scene in Rio de Janeiro. I had hoped for a gastronomic adventure, but instead, I was served a meal that was forgettable at best."|Rio de Janeiro||2022|7|Plant Palace
|318|en|4|Guac n' Roll truck in Rio de Janeiro fell short of delivering satisfying flavors. Two Taco Combo Plate was unimpressive with muted vibrancy, an absence of the anticipated zest from a taco truck. Fish Burrito proved dry, and Lean Burrito Bowl lacked zest, missing the crispness fresh ingredients usually offer. Chicken Burrito was mediocre, and Veggie Taco Bowl featured overcooked vegetables and a lackluster crispness. The overall experience was underwhelming, failing to meet the buzz surrounding this truck.|Rio de Janeiro||2022|7|Guac n' Roll
|262|en|4|Despite the enticing menu description, the Seitan Buffalo Wings at Plant Palace in Seoul turned out to be a culinary disappointment. The seitan, which should have been crispy on the outside and tender on the inside, was rubbery and overcooked. The wings were drenched in an overly sweet and tangy sauce that overwhelmed the subtle flavors of the seitan. The accompanying sides, such as the mashed potatoes and coleslaw, were lackluster and uninspired. Overall, the Seitan Buffalo Wings at Plant Palace fell short of expectations, leaving me with a sense of dissatisfaction.|Seoul||2022|7|Plant Palace
|262|en|4|The Plant Palace truck's offerings exceeded my expectations. The Seitan Buffalo Wings were tender and flavorful, perfectly coated in a crispy batter. The Salad of All Salads was fresh and vibrant, featuring a generous selection of healthy ingredients. The Veggie Burger was a hearty treat, with its juicy patty and crispy vegetables. I appreciate the friendly service and quick delivery. Overall, I highly recommend Plant Palace for its delicious vegan fare and exceptional customer service.|Seoul||2022|7|Plant Palace
|23|en|4|"""Le Coin des Crêpes is a true gem in Denver! The Chicken Pot Pie Crepe was an absolute delight, offering a unique twist on a classic comfort food. The crepe was perfectly cooked, golden and crispy, filled with a delicious, savory chicken pot pie filling. The accompanying Bottled Soda was a refreshing complement to the meal. But the star of the show was the Crepe Suzette - a masterpiece of flavor and presentation. The sweet, tangy citrus sauce was beautifully balanced, making every bite a treat. Le Coin des Crêpes has certainly elevated my expectations for crepes. Highly recommended!"""|Denver||2022|7|Le Coin des Crêpes
|283|en|4|The Peking Truck's food was a culinary disaster. The combo lo mein and fried rice were overcooked and bland, the wonton soup was greasy and unflavorful, and the bottled water and soda were overpriced. The service was equally atrocious, with long wait times and a rude staff. Overall, I would not recommend this restaurant to anyone.|Sydney||2022|7|Peking Truck
|102|en|4|The Greek Salad from Cheeky Greek in Vancouver was as expected. The ingredients were fresh, with crisp lettuce, juicy tomatoes, and tangy feta cheese. The portion size was adequate, neither too large nor too small. However, it didn't particularly stand out among other Greek salads I've had. The dressing was a bit bland, lacking the zesty kick I usually enjoy. Overall, it was a decent meal, but not one that I would go out of my way to have again.|Vancouver||2022|7|Cheeky Greek
|450|en|4|## ReviewThe Better Off Bread truck's menu offerings, Italian and Hot Ham & Cheese sandwiches, were flavorful and satisfying. The Italian sandwich, with its fresh bread, salami, cheese, and vegetables, was a classic Italian delight. The Hot Ham & Cheese sandwich, though simple, was executed perfectly, with succulent ham and melted cheese. The bread used for both sandwiches was fresh and crispy, complementing the fillings perfectly. Overall, a positive experience for a quick bite in Cape Town.|Cape Town||2022|7|Better Off Bread
|447|en|4|The Cheeky Greek truck in Cape Town delivered a satisfactory dining experience with their Gyros menu. The King Combo, ordered twice, was filling and flavorful, with a good balance of meat, veggies, and sauce. The Gyro Plate also met expectations, offering a generous portion of gyro meat with sides that complemented the dish well. However, there was nothing particularly outstanding about the meal that would make it memorable. Overall, it was a decent choice for a quick, satisfying bite.|Cape Town||2022|7|Cheeky Greek
|445|en|4|"""Not the Wurst Hot Dogs"" truck in Cape Town provided a satisfactory experience. Chicago Dog and Coney Dog were adequately flavored, with toppings offering a nice contrast to the hot dogs. Bottled sodas and iced teas were standard, serving as refreshing beverages. However, the meal lacked any outstanding elements, meeting expectations but not exceeding them. Overall, it was a decent choice for a quick, casual meal."|Cape Town||2022|7|Not the Wurst Hot Dogs
|89|en|4|Nani's Kitchen's food offering proved to be a complete letdown. The chicken tikka masala lacked moisture and taste, while the combination curry drowned in cheap, oily components. The rice was undercooked, and the naan was charred. Furthermore, the service was tardy, and the staff came across as unapproachable. In conclusion, I cannot endorse this establishment for dining.|Toronto||2022|7|Nani's Kitchen
|215|en|4|Kitakata Ramen Bar in Mumbai provided a dining experience with mixed results. The Ice Tea served was refreshing, boasting a harmonious blend of sweet and tangy flavors. However, the Creamy Chicken Ramen, despite its rich taste, fell short of the anticipated creamy texture. Although the chicken was tender, the broth could have been more robust.On a positive note, the Spicy Miso Vegetable Ramen was a delightful surprise. The spice level was well-balanced, and the vegetables were cooked to perfection. The ramen noodles in both dishes were well-prepared, delivering a desirable texture.In summary, the meal was decent, but there is potential for improvement in the creamy ramen.|Mumbai||2022|7|Kitakata Ramen Bar
|363|en|4|" {""review"":"" Absolut toller Lieferservice von Guac n' Roll aus Hamburg! Der Chicken Burrito und das Two Taco Combo Plate waren super lecker und frisch. Dazu eine erfrischende Bottled Soda - perfekt! Die Lieferung erfolgte schnell und die Mitarbeiter waren sehr freundlich. Kann ich nur empfehlen!"", ""stars"": 5}Translation: Absolutely great delivery service from Guac n' Roll in Hamburg! The chicken burrito and the two taco combo plate were delicious and fresh. Added to that a refreshing bottled soda - perfect! Delivery was quick and employees were very friendly. Highly recommended!"|Hamburg||2022|7|Guac n' Roll
|239|en|4|The food from Nani's Kitchen was a mix of highs and lows. The Lean Chicken Tikka Masala was flavorful and tender, living up to its reputation. However, the Tandoori Mixed Grill was a bit underwhelming, lacking the smoky flavor one would expect from a tandoori dish. The Combination Curry was satisfactory, offering a variety of flavors in one dish. Overall, the experience was decent, but there's certainly room for improvement.|Delhi||2022|7|Nani's Kitchen
|394|en|4|Underwhelming experience with too much repetition.The Mac Shack's mac and cheese offerings in Madrid were a culinary disappointment. The standard mac and cheese lacked the richness and flavor that one would expect, with a bland and uninspired taste. The buffalo mac and cheese failed to impress as well, with its weak spice and lack of tang. The lobster mac and cheese, advertised as the signature dish, was a let-down. The lobster was overcooked and rubbery, and the mac and cheese base was far from creamy or flavorful. Overall, the Mac Shack's mac and cheese menu in Madrid offered uninspired and subpar mac and cheese.|Madrid||2022|7|The Mac Shack
|399|en|4|Disappointment marked the dining experience at Tasty Tibs in Madrid. The veggie combo served was both bland and overcooked, with the lean beef tibs proving to be tough and difficult to chew. Even the ice tea failed to impress, being weak and watery in taste. The sole redeeming factor was the lean chicken tibs, but unfortunately, they were insufficient to compensate for the overall meal. In conclusion, a recommendation for Tasty Tibs cannot be given.|Madrid||2022|7|Tasty Tibs
|71|en|4|"The order summary reflects a simple, straightforward order for a poutine restaurant in New York City. The menu items selected include ""Mothers Favorite,"" ""The Kitchen Sink,"" and ""Ice Tea,"" along with ""The Classic"" poutine option. This order suggests a desire for a classic poutine experience with additional sides and a refreshing beverage. While the review does not provide any opinions or personal comments, it accurately summarizes the components of the order."|New York City||2022|7|Revenge of the Curds
|327|en|4|A delightful experience at Cheeky Greek in Rio de Janeiro. The King Combo, featuring a perfectly seasoned gyro with fresh, flavorful ingredients, was satisfyingly accompanied by a generous gyro plate. The Ice Tea, refreshingly chilled, completed the meal with a perfect balance of sweet and tart. The atmosphere was welcoming and friendly, with attentive and helpful staff. I wholeheartedly recommend Cheeky Greek for an authentic Greek feast in Rio de Janeiro.|Rio de Janeiro||2022|7|Cheeky Greek
|257|en|4|Smoky BBQ's food offering was disappointing. Meat was dry and chewy, and the pulled pork sandwich lacked cohesion. The only redeeming factor was the bottled water. This restaurant is not recommended.|Seoul||2022|7|Smoky BBQ
|345|en|4|A delightful Pastrami, Hot Ham & Cheese sandwich experience at Better Off Bread in Munich. The toasted bread showcased a perfect crust, the meat offered a rich, flavorful and tender bite, and the cheese was melted to an irresistible perfection. The sandwich was brimming with fresh ingredients, resulting in an impressive overall flavor. The friendly staff and swift service added a delightful touch to this memorable experience.|Munich||2022|7|Better Off Bread
|359|de|4|" ""Leider war unser Erlebnis mit Nani's Kitchen in Berlin enttäuschend. Obwohl wir uns auf ein authentisches indisches Essen freuten, war die Qualität der Speisen nicht zufriedenstellend. Der Tandoori Mixed Grill hatte einen faden Geschmack und die Combination Curry war viel zu wässrig. Wir waren sehr enttäuscht und werden nicht wieder bestellen.""Translation: ""Unfortunately, our experience with Nani's Kitchen in Berlin was disappointing. Although we were looking forward to authentic Indian food, the quality of the dishes was not satisfactory. The Tandoori Mixed Grill had a bland taste and the Combination Curry was much too watery. We were very disappointed and will not order again."""|Berlin||2022|7|Nani's Kitchen
|355|en|4|"""Not the Wurst Hot Dogs truly lives up to its name! The New York Dog was a delightful explosion of flavors, perfectly balancing the savory and the tangy. The hot dog was juicy and cooked to perfection, nestled in a soft, fresh bun. Paired with a refreshing Ice Tea, it was the perfect meal for a sunny day in Berlin. The quality of the food and the friendly service make this a must-visit for hot dog lovers. I'm already looking forward to my next visit!"""|Berlin||2022|7|Not the Wurst Hot Dogs
|430|en|4|"""Not the Wurst Hot Dogs truly lives up to its name, offering a culinary experience that's far from the ordinary! The Coney Dog was a delightful explosion of flavors, while the Chicago Dog and New York Dog provided a taste of America's finest right here in Cairo. The Ice Tea was refreshing, perfectly balancing the savory hot dogs. The Bottled Water was a thoughtful addition, ensuring we stayed hydrated. The service was prompt and friendly. This is a must-visit for all hot dog lovers!"""|Cairo||2022|7|Not the Wurst Hot Dogs
|434|en|4| Disappointed with Nani's Kitchen in Cairo. The Ice Tea was watered down and lacked flavor, while the Combination Curry was too spicy, overpowering the taste of the individual ingredients. The Tandoori Mixed Grill was overcooked, resulting in a dry and tough texture. The Lean Chicken Tikka Masala was the only saving grace, but it was not enough to make up for the overall underwhelming dining experience.|Cairo||2022|7|Nani's Kitchen
|439|en|4|Mac Shack's mac and cheese is an absolute delight for a picky eater. Creamy and flavorful, the standard mac and cheese hit the spot. The lobster mac and cheese raised the bar with succulent lobster and a subtle hint of truffle oil. Refreshing bottled sodas and ice teas completed the meal, enhancing the flavors of the mac and cheese. The friendly staff and swift service added to an enjoyable dining experience. Overall, Mac Shack is highly recommended for anyone seeking a satisfying and comforting meal.|Cape Town||2022|7|The Mac Shack
|193|en|4|The Peking Truck's menu selection was expansive, offering a wide range of Chinese favorites. The combo fried rice and lo mein were perfectly portioned and flavorful, satisfying my taste buds and leaving me with a sense of satisfaction. The wonton soup was a comforting delight, with fresh and delicate wontons and a savory broth. The bottled soda selection was extensive, quenching my thirst on a hot summer day. Overall, I had a positive dining experience at the Peking Truck, and I highly recommend it to anyone looking for authentic Chinese cuisine in Warsaw.|Warsaw||2022|7|Peking Truck
|205|en|4|The Not the Wurst Hot Dogs truck in Krakow lived up to its name with a delightful Chicago Dog that exceeded my expectations. The frank hot dog was perfectly griddled, with a generous spread of fresh toppings like tangy mustard, sweet relish, and crisp onions. The bread was soft and buttery, and the overall construction of the sandwich was simply impeccable. This vendor's passion for their craft was evident in the fresh ingredients and attentive preparation. I highly recommend checking out the Not the Wurst Hot Dogs truck if you're looking for a satisfying and flavorful hot dog experience in Krakow.|Krakow||2022|7|Not the Wurst Hot Dogs
|231|en|4|Mega Melt truck in Delhi didn't meet the anticipated quality standards. The Ranch sandwich was excessively smothered in sauce, which overshadowed the flavor of the grilled cheese. Miss Piggie, promoted as a bacon and cheese treat, fell short due to its chewy, undercooked bacon. Surprisingly, even The Original, a classic grilled cheese, was lacking in the essential crispness and gooeyness one would expect. All in all, the experience was underwhelming and failed to live up to the expected hype.|Delhi||2022|7|The Mega Melt
|377|en|4|The Smoky BBQ truck in Stockholm is a culinary delight! The Three Meat Plate and Two Meat Plate were cooked to perfection, with tender, juicy meats that simply melted in the mouth. The Spring Mix Salad provided a refreshing balance to the rich flavors of the BBQ, while the Fried Pickles added a delightful crunch. The quality of the food, combined with the friendly service, made for an outstanding dining experience. Highly recommended for BBQ enthusiasts!|Stockholm||2022|7|Smoky BBQ
|377|en|4|Smoky BBQ truck in Stockholm left much to be desired. The Fried Pickles served were far from crispy, instead, they were soggy and missing the anticipated crunch. The Rack of Pork Ribs was disappointingly overcooked, leading to a dry, tough texture. The Pulled Pork Sandwich was smothered in an excessively sweet sauce, overwhelming the taste of the meat. Both the Three Meat Plate and Two Meat Plate were underwhelming. The Ice Tea was diluted, failing to deliver the expected refreshing taste. In summary, the experience was disappointing and fell short of meeting BBQ standards.|Stockholm||2022|7|Smoky BBQ
|380|en|4| Kitakata Ramen Bar in Stockholm is a phenomenal find for ramen lovers! I was thrilled with the Tonkotsu Ramen and Creamy Chicken Ramen I ordered. The Tonkotsu Ramen was a symphony of flavors with its rich, creamy broth and tender pork slices. The Creamy Chicken Ramen was equally delightful, offering a comforting, velvety experience. The Ice Tea was a refreshing accompaniment to these hearty bowls of goodness. The service was prompt, and the staff was friendly, making the dining experience even more enjoyable. This is a must-visit if you're in Stockholm and craving authentic, delicious ramen!|Stockholm||2022|7|Kitakata Ramen Bar
|218|en|4|**** The Le Coin des Crêpes menu offerings in Mumbai are a delightful treat for crepe lovers. The breakfast crepe, chicken pot pie crepe, and crepe Suzette were all expertly crafted, showcasing the restaurant's mastery of flavor and texture. The crepe batter was light and fluffy, while the fillings were fresh and flavorful. The chicken pot pie crepe was particularly impressive, with its tender chicken, savory gravy, and flaky pastry. Overall, the experience at Le Coin des Crêpes was a delightful and satisfying one, making it a must-visit for anyone seeking a taste of Parisian flair in the heart of Mumbai.|Mumbai||2022|7|Le Coin des Crêpes
|215|en|4|The food at Kitakata Ramen Bar was a culinary disaster. The tonkotsu ramen was bland and flavorless, the spicy miso vegetable ramen was too salty, and the creamy chicken ramen was dry and overcooked. The ice tea was lukewarm and the bottled soda was flat. The only redeeming factor was the bottled water. Overall, I would not recommend this restaurant to anyone.|Mumbai||2022|7|Kitakata Ramen Bar
|401|en|4|" Disappointment was the main course with my order of ""Mother's Favorite"" from Revenge of the Curds in Madrid. The poutine, a dish I usually adore, was a far cry from its potential. The fries were soggy, lacking the essential crispness that should underpin this classic Canadian dish. The cheese curds, the star of any good poutine, were bland and uninspiring, failing to provide the rich, gooey texture I was anticipating. The gravy, rather than being a savory complement, was overly salty, overpowering the entire dish. Unfortunately, this meal was a clear miss, leaving me longing for the authentic poutine experience."|Madrid||2022|7|Revenge of the Curds
|291|en|4|"The Mega Melt's ""The Original, The Ranch, Miss Piggie"" sandwich was an absolute delight. The bread was perfectly crisp on the outside and soft on the inside, and the fillings were fresh and flavorful. The Original's combination of melted cheese, tomato, and onion was classic and satisfying, while The Ranch's creamy ranch dressing and crispy bacon added a touch of indulgence. Miss Piggie's grilled cheese with gooey melted cheese and sweet pickles was a crowd favorite, offering a sweet and savory twist on the traditional grilled cheese. The friendly staff and prompt service made the experience even more enjoyable. Overall, I highly recommend The Mega Melt for anyone seeking a mouth-watering grilled cheese sandwich in Melbourne."|Melbourne||2022|7|The Mega Melt
|419|en|4|"""Nani's Kitchen served up an absolutely delightful culinary experience. The tandoori mixed grill and combination curry were standouts, each dish bursting with flavor and cooked to perfection. The lean chicken tikka masala was a particular highlight, its tenderness and succulence truly commendable. Accompanied by refreshing bottled water, the meal was a true delight. The service was friendly and attentive, contributing to the warm and inviting atmosphere. For those seeking a delicious Indian meal in Barcelona, Nani's Kitchen comes highly recommended."""|Barcelona||2022|7|Nani's Kitchen
|179|en|4| Disappointed with my experience at Nani's Kitchen. The Tandoori Mixed Grill lacked flavor and was overcooked, while the Combination Curry was too spicy, even for my Indian food-loving taste buds. The Ice Tea and Bottled Soda were the only saving graces, but not enough to make up for the subpar meal. Won't be returning.|Nice||2022|7|Nani's Kitchen
|87|en|4|I was expecting a refreshing Greek salad, but what I received was a sad, limp pile of wilted lettuce, a few sad-looking tomato chunks, and a sprinkle of dried oregano. The dressing was bland and uninspired. This salad was a far cry from the fresh and flavorful Greek salad I was hoping for. I would not recommend this salad to anyone.|Toronto||2022|7|Cheeky Greek
|262|en|4|"A generous mix of fresh vegetables comprised the ""Salad of All Salads"" from Plant Palace in Seoul, delivering a satisfying crunch with each bite. The Veggie Burger presented acceptable flavors but lacked moisture. Bottled Water and Ice Tea were routine, fulfilling their functions effectively. This meal was a reasonable option for vegetarian diners, though it could benefit from enhancements in the Veggie Burger's texture and taste."|Seoul||2022|7|Plant Palace
|345|en|4|"The ""Hot Ham & Cheese"" sandwich from Better Off Bread in Munich was as expected, a classic combination of flavors. The ham was adequately heated, and the cheese was nicely melted, giving the sandwich a comforting warmth. The bread was fresh, adding a pleasant texture. The Italian sandwich was similarly satisfactory, with a good balance of ingredients. The bottled water was a standard accompaniment. Overall, the meal was neither exceptional nor disappointing, providing a reliable option for those seeking familiar sandwich choices."|Munich||2022|7|Better Off Bread
|327|en|4|The Cheeky Greek truck's gyro plate and Greek salad were an absolute delight. The gyro was perfectly seasoned, with tender lamb and fresh, crispy pita. The Greek salad was refreshing and flavorful, with the perfect balance of tangy olives, creamy feta, and fresh lettuce. The overall presentation was impressive, and the service was friendly and efficient. I highly recommend this truck for anyone looking for a delicious and authentic Greek feast in Rio de Janeiro.|Rio de Janeiro||2022|7|Cheeky Greek
|327|en|4|Disappointment was the main course of my meal at Cheeky Greek in Rio de Janeiro. The Gyro Plate lacked the authentic flavor I was expecting, with meat that was dry and overcooked. The Greek Salad, a classic favorite, was surprisingly bland, missing the freshness and zest that makes it a staple. The overall experience was underwhelming, especially considering the reputation of the establishment. I had hoped for a taste of Greece, but instead, I was served a meal that fell short of expectations.|Rio de Janeiro||2022|7|Cheeky Greek
|443|en|4|Crepes from Le Coin des Crêpes were a sublime culinary experience. The Crepe Suzette boasted the ideal balance of sweetness and tanginess. Similar praise goes to the Breakfast Crepe, with its savory yet hearty appeal to begin the day. The Ice Tea offered a refreshing and harmonious taste, an excellent complement. Top-notch quality ingredients shone through in every bite. Service was prompt and cordial, enhancing the dining experience significantly. Ideal for Capetonians craving authentic, delectable crepes.|Cape Town||2022|7|Le Coin des Crêpes
|439|en|4|The Buffalo Mac & Cheese from The Mac Shack in Cape Town was an absolute disaster. The mac & cheese was dry and crumbly, not creamy as advertised. The cheese was under-melted and the chicken was tough and chewy. The overall quality of the dish was appalling and I would not recommend it to anyone.|Cape Town||2022|7|The Mac Shack
|445|en|4|The Not the Wurst Hot Dogs truck in Cape Town is a must-try for any hot dog enthusiast. I ordered an ice tea and two New York dogs and a Coney dog. The ice tea was refreshing, and the hot dogs were cooked to perfection, with juicy meat and fresh toppings. The Coney dog was especially delicious, with its sweet relish and crispy bacon. Overall, I had a great experience and would highly recommend this truck to anyone looking for a tasty hot dog.|Cape Town||2022|7|Not the Wurst Hot Dogs
|445|en|4| Disappointed with the experience at Not the Wurst Hot Dogs in Cape Town. The New York Dog and Chicago Dog lacked flavor and the toppings were uninspiring. The Coney Dog was the biggest letdown, with a dry bun and an overcooked hot dog. The overall quality did not meet expectations for a hot dog stand. I would not recommend this place to hot dog enthusiasts.|Cape Town||2022|7|Not the Wurst Hot Dogs
