ORDER_ID|TRUCK_ID|LANGUAGE|SOURCE|REVIEW|PRIMARY_CITY|CUSTOMER_ID|YEAR|MONTH|TRUCK_BRAND
|222|en|4|The Cheeky Greek truck's menu transported me straight to the sun-kissed shores of Greece with its mouthwatering gyros. The King Combo, a generous feast featuring a succulent lamb gyro, fluffy pita, tangy tzatziki sauce, and crispy fries, was a delight to devour. The gyro plate, piled high with fresh and flavorful ingredients, was perfect for those who crave a more traditional experience. The accompanying Greek salad, a refreshing explosion of crisp vegetables and creamy feta, complemented the savory gyros perfectly. To wash down the feast, I opted for a refreshing bottled soda and a soothing ice tea. Overall, my experience at Cheeky Greek was an absolute delight, and I highly recommend it to anyone looking for a taste of the Mediterranean in the heart of Mumbai.|Mumbai||2022|9|Cheeky Greek
|445|en|4|"The ""Coney Dog"" from ""Not the Wurst Hot Dogs"" in Cape Town was an experience that left me with mixed feelings. The hot dogs were adequately prepared, with a decent balance of flavors. The bun was soft and fresh, while the chili and cheese toppings were generously applied. However, the hot dogs themselves lacked a distinctive flavor that could have made them truly memorable. The portion size was satisfactory, and the service was prompt. Overall, it was a solid choice for a quick meal, but it didn't particularly stand out in the crowded hot dog market in Cape Town."|Cape Town||2022|9|Not the Wurst Hot Dogs
|322|en|4|"The ""Salad of All Salads"" from Plant Palace in Rio de Janeiro was an interesting experience. As a vegetarian option, it was packed with a variety of fresh vegetables, providing a colorful and vibrant appearance. The dressing was light and tangy, which complemented the freshness of the ingredients well. However, the portion size was smaller than expected, which might leave some customers wanting more. The overall taste was satisfying, but it didn't quite live up to the grandeur of its name. It's a decent choice for those seeking a healthy, light meal, but it might not be as filling or memorable as some other options."|Rio de Janeiro||2022|9|Plant Palace
|144|en|4|Tasty Tibs truck in Manchester stands out with its consistently flavorful Ethiopian cuisine. A recent visit allowed me to savor their delectable lean chicken and beef tibs, along with the veggie combo, each showcasing the chef's culinary artistry. Succulent chicken and beef melted tenderly in the mouth, while the vibrant blend of spices and fresh ingredients added a delightful zest. The veggie combo, an assortment of crisp vegetables cooked to perfection, further added to the meal's appeal. Complementing the dishes were refreshing bottled water and soda options. Overall, Tasty Tibs provided an exceptional dining experience that I enthusiastically endorse for anyone seeking genuine Ethiopian fare in Manchester.|Manchester||2022|9|Tasty Tibs
|122|en|4|The Rack of Pork Ribs from Smoky BBQ in London was a decent choice. The meat was tender and easily fell off the bone, while the BBQ sauce had a nice balance of sweet and tangy flavors. However, the portion size was smaller than expected for the price. Overall, it was an enjoyable meal, but not particularly memorable. The service was efficient, and the atmosphere was lively, which added to the dining experience. If you're in the area and craving BBQ, Smoky BBQ could be worth a visit, but don't expect anything extraordinary.|London||2022|9|Smoky BBQ
|357|en|4|Gyros from Cheeky Greek truck are an absolute must-try for anyone exploring Berlin. The Greek salad served was a fresh and flavorful delight, striking the perfect harmony between vegetables and olive oil. The gyro plate was both generous and satisfying, featuring tender lamb, crispy pita, all topped with delicious tzatziki sauce. The staff provided friendly and efficient service, contributing to the relaxed and inviting atmosphere. All in all, a truly positive dining experience.|Berlin||2022|9|Cheeky Greek
|359|en|4|I was severely disappointed with the food from Nani's Kitchen. The tandoori mixed grill was dry and flavorless, while the combination curry was overly greasy and lacked any spice. The lean chicken tikka masala was also bland and poorly executed. The only redeeming factor was the bottled soda, which was refreshing. Overall, I would not recommend this restaurant to anyone.|Berlin||2022|9|Nani's Kitchen
|296|en|4|"The Classic poutine at ""Revenge of the Curds"" in Melbourne is a revelation. The crispy curds, fluffy fries, and perfectly melted cheese curds are a symphony of textures that delight the senses. The generous portions are enough to satisfy even the most ravenous appetite, and the friendly staff are always eager to ensure your experience is top-notch. Whether you're a local or a visitor, this poutine paradise is a must-try for any foodie."|Melbourne||2022|9|Revenge of the Curds
|291|en|4|"""The Mega Melt truck in Melbourne is a must-visit for grilled cheese lovers! The Ice Tea was refreshing, the perfect companion to the delicious sandwiches. The Original, a classic grilled cheese, was cooked to perfection with a delightful crunch. The Ranch added a tangy twist, elevating the simple sandwich to a whole new level. But the star of the show was Miss Piggie, a heavenly combination of cheese and bacon. The Mega Melt truly knows how to make a grilled cheese sandwich an unforgettable experience. Can't wait to visit again!"""|Melbourne||2022|9|The Mega Melt
|233|en|4|Disappointment was the theme of my visit to Le Coin des Crêpes. The Breakfast Crepe lacked flavor, the Chicken Pot Pie Crepe was overly salty, and the Crepe Suzette, a classic dessert crepe, was far too sweet. The Ice Tea was watered down, a poor complement to the meal. The quality of food did not match the hype, leaving me underwhelmed. I expected more from a place that prides itself on authentic crepes. Unfortunately, this was not a satisfying culinary experience.|Delhi||2022|9|Le Coin des Crêpes
|239|en|4|Disaster struck at Nani's Kitchen. Tandoori mixed grill lacked moisture and flavor. Combination curry was disappointingly watery and under-seasoned. Naan was dry and unyielding. Service was slow and inefficient. I cannot endorse a dining experience at Nani's Kitchen.|Delhi||2022|9|Nani's Kitchen
|203|en|4|Disappointment was the theme of my visit to Le Coin des Crêpes. The Breakfast Crepe was bland, lacking the vibrant flavors one would expect. The Crepe Suzette, a classic dessert, was overly sweet and lacked balance. The Chicken Pot Pie Crepe, an intriguing concept, was unfortunately not well-executed, with the filling being too runny and the crepe itself soggy. The bottled water, the only saving grace, was standard. For a restaurant boasting about its crepes, the experience was underwhelming. I expected more from a place in Krakow known for its culinary scene.|Krakow||2022|9|Le Coin des Crêpes
|242|en|4|Smoky BBQ truck's Spring Mix Salad and Pulled Pork Sandwich in Tokyo were a gastronomic delight. The salad boasted freshness and crispness, presenting a vivid color spectrum and an enjoyable textural balance among the greens, carrots, and cucumbers. As for the pulled pork sandwich, it was a tender and savory treat, with the succulent pork seamlessly melting between the fresh bread slices. The dining experience was further enhanced by the attentive and amiable staff, making for a pleasurable outing.|Tokyo||2022|9|Smoky BBQ
|250|en|4|"""Sampled a trio of hot dogs from Not the Wurst in Tokyo, including the New York Dog, Chicago Dog, and Coney Dog. The presentation was appealing, with each hot dog showcasing its unique toppings. Taste-wise, they were satisfactory, with the Coney Dog's chili standing out. However, the buns could have been softer. Overall, a decent hot dog experience, but not exceptional."""|Tokyo||2022|9|Not the Wurst Hot Dogs
|250|en|4|"""Not the Wurst Hot Dogs truly lives up to its name! I recently had the pleasure of tasting their New York Dog and Coney Dog in Tokyo, and I was blown away by the authenticity and quality. The New York Dog, with its perfect blend of sauerkraut and mustard, transported me straight to the streets of NYC. The Coney Dog, on the other hand, was a delightful surprise with its rich, meaty chili and tangy cheese. The buns were fresh, the hot dogs were juicy, and the service was top-notch. If you're in Tokyo and craving a taste of America, this is the place to go. A must-try for all hot dog lovers!"""|Tokyo||2022|9|Not the Wurst Hot Dogs
|74|en|4| Nani's Kitchen is a culinary gem in New York City. The Combination Curry was a delightful medley of flavors, each distinct yet harmoniously blended. The Tandoori Mixed Grill was perfectly cooked, with a smoky char that added depth to the dish. But the star of the show was the Lean Chicken Tikka Masala. Tender, succulent pieces of chicken bathed in a rich, aromatic sauce that was simply divine. Nani's Kitchen has mastered the art of Indian cuisine, offering a dining experience that is both authentic and satisfying. Highly recommended!|New York City||2022|9|Nani's Kitchen
|74|en|4|The food from Nani's Kitchen was a mix of highs and lows. The Lean Chicken Tikka Masala was flavorful and tender, living up to its reputation. However, the Tandoori Mixed Grill was a bit dry and lacked the smoky flavor one would expect from a tandoori dish. The Combination Curry was satisfactory, with a balanced spice blend, but it didn't particularly stand out. Overall, the experience was decent, but there's certainly room for improvement in some areas.|New York City||2022|9|Nani's Kitchen
|445|en|4|The Not the Wurst Hot Dogs truck was a delight to find in Cape Town. The Chicago Dog I ordered was perfect, with the perfect balance of toppings and the sweet, sweet mustard. The bread was fresh and the meat was juicy, and the overall flavor was simply amazing. I couldn't resist ordering a second Chicago Dog to make sure I was able to savor every delicious bite. If you're looking for a quick and satisfying hot dog fix in Cape Town, I highly recommend checking out Not the Wurst Hot Dogs.|Cape Town||2022|9|Not the Wurst Hot Dogs
|438|en|4|The Guac n' Roll truck's menu offerings, including the veggie taco bowl, chicken burrito, fish burrito, and the two taco combo plate, were met with positive feedback. The food was described as flavorful and fresh, with generous portions and friendly service. The ice tea was refreshing and the tacos were praised for their crispy shells and tender fillings. Overall, customers appreciated the truck's casual atmosphere and the friendly staff, making it a popular choice for a quick and satisfying meal in Cape Town.|Cape Town||2022|9|Guac n' Roll
|116|en|4|"A divine poutine experience at Montreal's Truck ""The Kitchen Sink"" was had with the ""Revenge of the Curds."" The curds boasted a fluffy, golden texture, while the cheese melted to a luscious, gooey state. The meat offered a tender bite and rich flavor. The classic poutine was an essential recommendation for Montreal visitors. Refreshing and quenching, the bottled water completed a very positive culinary adventure. Highly recommendable for those seeking a delicious and fulfilling poutine meal."|Montreal||2022|9|Revenge of the Curds
|138|en|4|The Guac n' Roll taco truck's menu offerings, specifically the Veggie Taco Bowl, Lean Burrito Bowl, and Fish Burrito, delivered a delightful culinary experience in Manchester. The veggie taco bowl packed fresh, crisp vegetables, succulent tofu, and creamy guacamole into a warm tortilla, creating a satisfying and flavorful treat. The lean burrito bowl showcased tender chicken, savory beans, tangy salsa, and guacamole, offering a perfect balance of textures and flavors. The fish burrito, featuring flaky fish, crunchy vegetables, and tangy sauce, was a testament to the truck's ability to elevate traditional Mexican cuisine. Overall, the Guac n' Roll taco truck's dedication to fresh ingredients and creative flavor combinations resulted in a memorable dining experience that exceeded expectations.|Manchester||2022|9|Guac n' Roll
|81|en|4|"The Mega Melt's ""Miss Piggie"" grilled cheese sandwich is a masterpiece of melted gooey goodness. The bread, perfectly crisp on the outside and fluffy on the inside, encapsulates layers of melted cheese, succulent pork, and tangy pickles. Each bite is a symphony of flavors and textures, leaving me with a satisfied smile and a craving for more. The friendly staff at the Toronto truck were quick to serve and knowledgeable about the menu. Overall, a highly enjoyable and mouth-watering experience."|Toronto||2022|9|The Mega Melt
|79|en|4|The Mac Shack's Buffalo Mac & Cheese was a satisfying treat. The mac and cheese was creamy and flavorful, with a perfect balance of sweet and spicy. The chicken tenders were crispy and tender, and the ice tea was refreshing. Overall, the food was delicious and the service was friendly.|Toronto||2022|9|The Mac Shack
|341|en|4|"""Experienced a mix of flavors with the poutine selection from Revenge of the Curds in Munich. The Classic was a safe choice, offering the traditional taste of poutine. Mother's Favorite, on the other hand, added a unique twist with its special gravy. The Kitchen Sink, as the name suggests, was a combination of everything, which might be overwhelming for some. Bottled water and soda were standard. Overall, a decent experience for poutine lovers."""|Munich||2022|9|Revenge of the Curds
|309|en|4| The Tasty Tibs truck in Sao Paulo failed to deliver on the promise of authentic Ethiopian cuisine. The Lean Chicken Tibs lacked the expected flavor and tenderness, while the Lean Beef Tibs was overcooked and dry. The Veggie Combo, which should have been a highlight, was underwhelming with unseasoned vegetables. Overall, a disappointing dining experience that didn't live up to the hype of Ethiopian food.|Sao Paulo||2022|9|Tasty Tibs
|224|en|4| Disappointed with Nani's Kitchen in Mumbai. Ordered the Tandoori Mixed Grill and Combination Curry, but both dishes fell short of expectations. The Tandoori Mixed Grill lacked flavor and the meat was tough, not the tender and juicy bite I anticipated. The Combination Curry was equally underwhelming, with a watery consistency and a bland taste that didn't live up to the rich and aromatic Indian cuisine I'm accustomed to. The overall experience was subpar, and I wouldn't recommend this truck to anyone seeking authentic Indian food.|Mumbai||2022|9|Nani's Kitchen
|316|en|4|Freezing Point's Sugar Cone in Rio de Janeiro presented a mixed bag of delight and mediocrity. The ice cream lived up to its promise, providing a truly freezing point with a creamy texture that was quite pleasing. However, the Sugar Cone itself fell short of expectations. It lacked the anticipated crispness, which somewhat dampened the overall experience. On a positive note, the flavor selection was extensive, catering to a wide range of tastes. In a nutshell, Freezing Point offers satisfactory ice cream, but there's room for improvement when it comes to the Sugar Cone.|Rio de Janeiro||2022|9|Freezing Point
|450|en|4|"The ""Better Off Bread"" truck in Cape Town served up a mix of sandwiches, with Pastrami and Hot Ham & Cheese being the stars of the show. The Pastrami was well-seasoned, offering a good balance of flavor and texture. The Hot Ham & Cheese, on the other hand, was satisfyingly warm and gooey, making it a comforting choice. The Italian sandwich, while not as memorable, was still a decent option. The Ice Tea was refreshing, providing a nice contrast to the savory sandwiches. Overall, the experience was satisfactory, with the truck delivering on its promise of quality sandwiches."|Cape Town||2022|9|Better Off Bread
|316|en|4|"The order summary for a Rio de Janeiro-based frozen treat truck called ""Freezing Point"" is described. The customer's selections encompass a sugar cone, a two-scoop bowl, a waffle cone, and a popsicle. Regrettably, the review lacks any subjective assessment of the purchase's quality, taste, or service, leaving it objective and unbiased."|Rio de Janeiro||2022|9|Freezing Point
|299|en|4|Disappointment was the main course at Nani's Kitchen in Melbourne. The Lean Chicken Tikka Masala lacked the rich, creamy texture it promised, tasting more like a watered-down tomato soup. The Tandoori Mixed Grill was equally underwhelming, with meat that was dry and overcooked. The Combination Curry, which should have been a symphony of flavors, was a monotonous drone of blandness. For an Indian restaurant, Nani's Kitchen failed to deliver the vibrant, spice-infused dishes one would expect.|Melbourne||2022|9|Nani's Kitchen
|231|en|4| The Mega Melt truck in Delhi is a must-visit for grilled cheese lovers! The Ranch and Miss Piggie sandwiches were bursting with flavor, and the perfect amount of gooeyness. The bread was crispy and golden, and the fillings were fresh and delicious. The Bottled Soda was a refreshing complement to the sandwiches. The Original sandwich was a classic favorite that did not disappoint. The service was quick and friendly. Overall, an excellent dining experience! Highly recommend.|Delhi||2022|9|The Mega Melt
|239|en|4|The food at Nani's Kitchen was flavorful and satisfying. The lean chicken tikka masala was tender and flavorful, while the tandoori mixed grill was succulent and well-marinated. The combination curry was a hearty and aromatic dish, perfect for a cold night. The bottled soda and ice tea were refreshing and quenching. Overall, the food and drinks at Nani's Kitchen were enjoyable and reasonably priced.|Delhi||2022|9|Nani's Kitchen
|55|en|4|" Disappointing experience at ""Not the Wurst Hot Dogs"" in Boston. The Chicago Dog I ordered was far from satisfying. The bun was soggy, the toppings were unbalanced, and the hot dog itself lacked flavor. The overall presentation was also underwhelming. Definitely not the best hot dog I've had in Boston, or anywhere else for that matter. I expected more from a place with such a quirky name. Unfortunately, it seems they're living up to it in the wrong way."|Boston||2022|9|Not the Wurst Hot Dogs
|372|en|4|The Cheeky Greek truck in Hamburg is a culinary delight! Their Gyros menu is absolutely fantastic. The Gyro Plate was flavorful and filling, while The King Combo was a perfect blend of taste and texture. The Greek Salad was fresh and crisp, a great accompaniment to the main dishes. The Ice Tea was refreshing, providing a delightful balance to the meal. The quality of food and service was top-notch. I highly recommend Cheeky Greek for an authentic and satisfying Greek food experience.|Hamburg||2022|9|Cheeky Greek
|203|en|4|The Chicken Pot Pie Crepe from Le Coin des Crêpes in Krakow was simply divine. The crepe itself was light and fluffy, and the filling was hearty and flavorful. The chicken pot pie filling was tender and moist, with a perfect balance of savory and sweet. The flaky pastry topping was the cherry on top. Overall, I couldn't have been more pleased with my order. It was a perfect treat for a cozy evening in Krakow.|Krakow||2022|9|Le Coin des Crêpes
|252|en|4|The King Combo and Ice Tea at Cheeky Greek in Tokyo were an absolute delight. The gyros were perfectly seasoned and stacked high with fresh toppings, while the ice tea was refreshing and perfectly chilled. The friendly staff were attentive and prompt, and the atmosphere was lively and inviting. Overall, I had a fantastic experience and would highly recommend Cheeky Greek to anyone in Tokyo.|Tokyo||2022|9|Cheeky Greek
|73|en|4|" ""Absolutely delighted with my recent order from Peking Truck in New York City! The Combo Lo Mein was a fantastic choice - a perfect blend of noodles, vegetables, and savory meats. The truck truly captured the essence of Chinese cuisine with its rich and flavorful sauce. The service was quick and efficient, making it a convenient option for a satisfying lunch or dinner on-the-go. I highly recommend Peking Truck for anyone craving authentic Chinese food in the Big Apple. Five stars all around!""(Note: This review is written in English, as the native language of New York City is English. If you need a review in another language, please specify the language in your request.)"|New York City||2022|9|Peking Truck
|438|en|4|"Guac n' Roll taco truck's ""Two Taco Combo Plate"" proved to be an absolute delight. Packed with fresh and flavorful ingredients, the tacos presented the perfect amount of spice. The tender and juicy meat, combined with fresh, crisp toppings, was encased in soft, pliable tortillas. The accompanying guacamole was creamy and smooth, enhancing the overall taste. Friendly and efficient service coupled with a relaxed and inviting atmosphere made the experience even more enjoyable. A high recommendation for anyone seeking a delicious and authentic taco experience in Cape Town."|Cape Town||2022|9|Guac n' Roll
|325|en|4|"""Experienced Not the Wurst Hot Dogs in Rio de Janeiro, sampling the New York Dog and Coney Dog. The presentation was appealing, with vibrant colors and a tantalizing aroma. The New York Dog had a satisfying crunch from the sauerkraut, while the Coney Dog boasted a hearty, meaty chili. However, the buns could have been softer, and the hot dogs themselves were slightly overcooked. Overall, a decent hot dog experience, but with room for improvement in certain aspects."""|Rio de Janeiro||2022|9|Not the Wurst Hot Dogs
|161|en|4|Revenge of the Curds' Classic Poutine in Paris proved to be a delightful indulgence. A satisfying serving of curds, cheese, and meat was complemented by a refreshing ice tea. Despite being slightly greasy, the poutine's taste made it worthwhile. The food quality, coupled with amiable service, created a positive dining experience. The truck's cozy ambiance added to its charm, making the reasonable price a bonus. All in all, it was a satisfying and enjoyable meal.|Paris||2022|9|Revenge of the Curds
|216|en|4|" ""The Mega Melt truck in Mumbai never fails to impress with their mouth-watering grilled cheese sandwiches! I recently ordered 'The Original' and it was nothing short of amazing. The gooey, melted cheese combined with the crispy bread was the perfect comfort food. The team at The Mega Melt always puts a smile on my face with their friendly service and delicious meals. I highly recommend giving them a try if you're in Mumbai and in the mood for a cheesy treat!"" (Hindi: ""मुंबई में ऑर्डर किया था हमने थे मेगा मेल्ट ट्रक से, उनके ग्रिल्ड चीज मेन्यू का एक आदेश था। हमने 'ऑरिजिनल' का चयन किया था, और वह बहुत ख़ुशनूमा रहा। सूखे रोटियों से भरपूर पिघलte चीज वे थे, और उनका सेवा सामान्य रूप से खुशखबरी फेल रहा था। मुम्बई में हो तो वे से संपर्क करें और आप एक चीजी सेवा के लिए तैयार हैं।"")"|Mumbai||2022|9|The Mega Melt
|341|en|4|## The Classic Poutine ReviewThe Classic poutine at Truck Name: Revenge of the Curds in Munich is a delightful treat for the taste buds. The crispy curds, perfectly golden fries, and savory gravy come together in a symphony of flavor that is simply irresistible. The portion size is generous, ensuring that even the most discerning appetites can be satisfied. While the poutine may not be the most authentic Canadian version, it's a worthy contender for any fan of the beloved dish.|Munich||2022|9|Revenge of the Curds
|135|en|4|" ""Oh dear, what a disappointment. I recently ordered the Pastrami, Hot Ham & Cheese, and Italian sandwiches from Better Off Bread in London, and I must say, I was underwhelmed. The bread was dry and lacked flavor, while the meats were overly salty and lacked the freshness I was expecting. The Italian sandwich was particularly disappointing, with a distinct lack of toppings and a general lack of seasoning. I was expecting so much more from a sandwich shop with such a promising name. I won't be returning to Better Off Bread anytime soon, and I can't recommend their sandwiches to anyone looking for a satisfying lunch in London."""|London||2022|9|Better Off Bread
|357|en|4|The King Combo, Gyro Plate was a culinary disaster. The gyros were dry and flavorless, and the pita bread was stale. The tzatziki sauce was watery and lacked any tang. The fries were limp and undercooked. Overall, this meal was a major disappointment and not worth the price.|Berlin||2022|9|Cheeky Greek
|336|en|4|Mega Melt's truck name and menu type are suitably descriptive. Munich, as the city, is clearly specified, and the ordered item is particular. The order summary, being both concise and comprehensive, offers all required details. Descriptions of menu items, though brief, are adequate, emphasizing the main attributes of each sandwich. Use of clear and succinct language prevents the summary from being unnecessarily lengthy. The overall order summary structure is well-arranged, presenting all information in a tidy manner.|Munich||2022|9|The Mega Melt
|104|en|4|Disappointment was the main course at Nani's Kitchen in Vancouver. The Lean Chicken Tikka Masala lacked the rich, aromatic spices one expects from Indian cuisine. The chicken was dry, and the sauce was watery, missing the creamy texture that makes this dish a favorite. The overall experience was far from satisfying, leaving a desire for the authentic taste that Nani's Kitchen failed to deliver.|Vancouver||2022|9|Nani's Kitchen
