ORDER_ID|TRUCK_ID|LANGUAGE|SOURCE|REVIEW|PRIMARY_CITY|CUSTOMER_ID|YEAR|MONTH|TRUCK_BRAND
|314|en|3|The Lean Chicken Tikka Masala at Nani's Kitchen in Sao Paulo was a culinary disaster. The chicken was dry and overcooked, the tikka masala sauce was bland and watery, and the rice was sticky and undercooked. The only saving grace was the naan, which was soft and fluffy. Overall, I would not recommend this dish to anyone.|Sao Paulo||2022|3|Nani's Kitchen
|303|en|3|The Guac n' Roll truck's menu offerings impressed me with their diversity and flavor. The three taco combo plate was a crowd favorite, with succulent pork, fresh toppings, and a generous serving of guacamole. The chicken burrito was equally satisfying, with tender chicken, crisp lettuce, and a tangy sauce. The veggie taco bowl was a refreshing vegan option, packed with fresh vegetables and a flavorful tofu base. The bottled soda and water complemented the meal perfectly. Overall, I was impressed by the quality of the food and the friendly service at Guac n' Roll.|Sao Paulo||2022|3|Guac n' Roll
|436|en|3|The service at this establishment was abysmal. The frozen treats, which were the primary reason for my visit, were sadly subpar. The mango sticky rice was dry and flavorless, and the popsicle I ordered was stale and mushy. The only saving grace was the friendly staff, who were quick to offer a smile and remedy the situation. However, the quality of the food and the overall service were unacceptable, leaving me with a negative impression.|Cape Town||2022|3|Freezing Point
|419|en|3|The Tandoori Mixed Grill and Combination Curry from Nani's Kitchen in Barcelona were an absolute delight. The tandoori chicken, lamb, and vegetables were perfectly marinated and cooked, with a hint of smoky flavor that tantalized my taste buds. The combination curry was equally flavorful, with tender tender lamb and a rich, aromatic sauce. The portions were generous, and the service was friendly and attentive. Overall, I highly recommend Nani's Kitchen for anyone looking for authentic Indian cuisine in Barcelona.|Barcelona||2022|3|Nani's Kitchen
|408|en|3|The Guac n' Roll taco truck, parked in the heart of Barcelona, certainly did not disappoint me. The Two Taco Combo Plate I ordered was a revelation. The tacos were packed with fresh, flavorful ingredients that danced on my taste buds, with the perfect balance of crispy shells, tender beef, fresh lettuce, salsa, and guacamole. The taco sauce was the perfect accompaniment, with its tangy and spicy kick. Overall, a truly satisfying and mouth-watering culinary experience. I highly recommend checking out Guac n' Roll if you're ever in Barcelona.|Barcelona||2022|3|Guac n' Roll
|406|en|3|Vibrant mango flavor and crunchy waffle cone, but balance was off.The Freezing Point truck in Barcelona offered a distinctive ice cream experience with their Mango Sticky Rice in a Waffle Cone. The mango flavor was lively and accurately represented the fruit, while the sticky rice added a delightful texture contrast. The waffle cone was fresh and crisp, providing a satisfying crunch. However, the balance between the ice cream and the cone was slightly off, with the cone overpowering the ice cream at times. Despite this, it was an enjoyable treat, but there is room for improvement in terms of balance and proportion.|Barcelona||2022|3|Freezing Point
|450|en|3|Disappointment was the main course at Better Off Bread. The Hot Ham & Cheese sandwiches were lukewarm at best, lacking the promised heat and the cheese was barely melted. The Italian sandwiches were equally underwhelming, with a bland taste that failed to deliver the expected zesty punch. The bread, ironically, was the worst part, soggy and unappetizing. Overall, a forgettable experience that didn't live up to the hype. I expected more from a Cape Town favorite.|Cape Town||2022|3|Better Off Bread
|347|en|3|"The smoked BBQ truck ""Smoky BBQ"" offers a tantalizing menu and friendly service in the heart of Berlin. I opted for the two-meat plate, featuring succulent rack of pork ribs and tender chicken wings, alongside a refreshing ice tea. The ribs were fall-off-the-bone tender, with a perfect balance of smoky flavor and tender texture. The chicken wings were crispy on the outside and juicy within, complementing the ribs perfectly. The ice tea was refreshing and perfectly chilled, quenching my thirst on a hot summer day. Overall, I thoroughly enjoyed my experience at Smokey BBQ, and would highly recommend it to any meat lover visiting Berlin."|Berlin||2022|3|Smoky BBQ
|275|en|3|A tantalizing selection of ramen noodles is offered at Kitakata Ramen Bar in Sydney. Creamy chicken ramen, spicy miso vegetable ramen, and tonkotsu ramen are meticulously crafted using fresh ingredients and traditional techniques. Noodles are perfectly cooked, broth is flavorful, and toppings are generously added. The atmosphere is casual and inviting, making it an ideal spot for a quick and satisfying meal. Kitakata Ramen Bar delivers a memorable ramen experience that satiates cravings.|Sydney||2022|3|Kitakata Ramen Bar
|195|en|3|"""Better Off Bread in Warsaw exceeded expectations with their delightful sandwiches. The Hot Ham & Cheese was a standout, perfectly toasted with a blend of flavors that hit the spot. The accompanying Bottled Water and Ice Tea were refreshing, making it a well-rounded meal. The Italian sandwich was equally impressive, packed with fresh ingredients. Truly a hidden gem for sandwich lovers. Highly recommend!"""|Warsaw||2022|3|Better Off Bread
|195|en|3|Refreshing and pleasantly sweet, the Italian Ice Tea from The Better Off Bread truck hit the spot on a hot afternoon. The tea was crafted with fresh fruit and a hint of mint, creating a perfect balance of sweetness. Generous ice cubes kept the drink cold throughout, making it a satisfying and refreshing beverage.|Warsaw||2022|3|Better Off Bread
|39|en|3|Tasty Tibs truck, nestled in Seattle, is an undiscovered treasure! It serves Ethiopian cuisine that is nothing short of delightful. A variety of dishes were sampled, including the Veggie Combo, Lean Beef Tibs, and Lean Chicken Tibs, each offering a unique and flavorful experience. The Veggie Combo presented a vibrant mix of fresh, well-seasoned vegetables. The Lean Beef and Chicken Tibs were remarkably tender and juicy, infused with rich, authentic spices. The bottled water provided a refreshing contrast. The exceptional food quality, combined with the amiable service, elevates Tasty Tibs to a must-visit status. The anticipation for the next meal there is already setting in!|Seattle||2022|3|Tasty Tibs
|250|en|3|"""Not the Wurst Hot Dogs truly lives up to its name, serving hot dogs that are far from the worst! Their Chicago Dog was a delightful explosion of flavors, with the perfect balance of tangy pickles, spicy peppers, and savory beef. The Coney Dog and New York Dog were equally impressive, each offering a unique twist on the classic hot dog. The Ice Tea and Bottled Water were refreshing complements to the meal. Located in the heart of Tokyo, this truck is a must-visit for hot dog lovers. The service was swift and friendly, making the overall experience even more enjoyable. Not the Wurst Hot Dogs has certainly raised the bar for street food in Tokyo!"""|Tokyo||2022|3|Not the Wurst Hot Dogs
|327|pt|3|" ""O Cheeky Greek em Rio de Janeiro decepcionou totalmente minha expectativa para uma refeição grega. O chamado 'King Combo' foi uma combinação de sabores confusos e desbalanceados, enquanto o Gyro Plate carecia de carne suculenta e temperos autênticos. A Greek Salad também foi uma decepção, servida com alface molhadinha e tomates sem sabor. Em suma, evite o Cheeky Greek em Rio de Janeiro se quiser desfrutar de uma boa refeição grega.""Translation: ""The Cheeky Greek in Rio de Janeiro completely disappointed my expectation for a Greek meal. The so-called 'King Combo' was a combination of confusing and unbalanced flavors, while the Gyro Plate lacked juicy meat and authentic seasonings. The Greek Salad was also a disappointment, served with wilted lettuce and flavorless tomatoes. In short, avoid the Cheeky Greek in Rio de Janeiro if you want to enjoy a good Greek meal."""|Rio de Janeiro||2022|3|Cheeky Greek
|267|en|3|Satisfying treat from Cheeky Greek in Seoul!The King Combo and Gyro Plate were a delight. Pita bread, warm and fluffy, complemented the tender and flavorful gyro meat. Tzatziki sauce, creamy and tangy, added a nice touch, while the falafel was crispy and flavorful. Generous portion size and reasonable price made it a great value. Highly recommend Cheeky Greek for a quick and satisfying Greek meal in Seoul.|Seoul||2022|3|Cheeky Greek
|303|en|3|A delightful treat awaited with the Lean Burrito Bowl from Guac n' Roll truck. The rice exhibited a soft and savory texture, while the meat offered a tender and juicy bite. Toppings graced the bowl in generous quantities, their freshness enhancing each mouthful. The guacamole was an indulgent experience, its creamy and smooth consistency adding richness to every spoonful. The meal as a whole was a harmonious blend of flavors and textures, leaving a sense of satisfaction.|Sao Paulo||2022|3|Guac n' Roll
|304|en|3|The Mac Shack failed to deliver on its promise of gourmet mac and cheese. The standard mac and cheese was bland and uninspiring, while the buffalo mac and cheese lacked the expected kick. The lobster mac and cheese, the most anticipated dish, was a disappointment with barely any lobster to be found. The drinks, bottled water and soda, were the only items that met expectations. Overall, the experience was underwhelming and not worth the visit.|Sao Paulo||2022|3|The Mac Shack
|73|en|3| Disappointed with my experience at Peking Truck in New York City. The Combo Lo Mein lacked the authentic Chinese flavor I was expecting. The noodles were overcooked, and the vegetables were soggy. The sauce was bland, missing the usual tangy and savory notes. It was far from the delicious Lo Mein I've had at other Chinese places in the city. The portion size was also smaller than expected. I wouldn't recommend this dish to anyone craving genuine Chinese cuisine.|New York City||2022|3|Peking Truck
|427|en|3|The Plant Palace truck in Cairo is a vegetarian's dream come true! The Veggie Burger was juicy and flavorful, perfectly grilled and packed with fresh veggies. The Salad of All Salads lived up to its name, with a delightful mix of greens, veggies, and a tangy dressing that tied it all together. But the real star of the show were the Seitan Buffalo Wings - crispy, spicy, and incredibly satisfying. The Plant Palace has truly mastered the art of meat-free cuisine. Highly recommend for anyone looking for a delicious and healthy meal in Cairo!|Cairo||2022|3|Plant Palace
|1|en|3|"""Freezing Point's Mango Sticky Rice ice cream is a game-changer! This San Mateo gem expertly blends the sweet, tangy flavors of mango with the creamy richness of sticky rice, creating a unique dessert experience. Every spoonful is a delightful surprise, transporting you to a tropical paradise. The texture is smooth and velvety, with just the right amount of sticky rice for a satisfying bite. It's a perfect balance of flavors and textures. Freezing Point has truly outdone themselves with this one. Highly recommended for all ice cream enthusiasts looking for a new, exciting flavor to try!"""|San Mateo||2022|3|Freezing Point
|250|en|3|"""Not the Wurst Hot Dogs"" truly lives up to its name, offering a gastronomic experience that's far from the worst! The Chicago Dog I ordered was a delightful explosion of flavors, with each ingredient harmoniously blending into the next. The hot dog was juicy and flavorful, nestled in a soft, fresh bun. The tangy pickle, crisp onions, and zesty mustard added a wonderful depth of flavor. Located in the bustling city of Tokyo, this truck is a must-visit for hot dog enthusiasts. The service was prompt and friendly, making the experience even more enjoyable. A fantastic find for a quick, delicious bite!"|Tokyo||2022|3|Not the Wurst Hot Dogs
|222|en|3|Cheeky Greek's King Combo in Mumbai is a must-try. Succulent gyros, tender and flavorful, come with fresh vegetables and tangy tzatziki sauce. The fluffy pita bread is warm and pliable, making for a perfect wrap. With generous portions and friendly, prompt service, this meal is delicious and affordable. If you're hankering for a taste of Greece in Mumbai, Cheeky Greek is the place to be.|Mumbai||2022|3|Cheeky Greek
|415|en|3|The Not the Wurst Hot Dogs truck in Barcelona offered a satisfying selection of hot dogs, with the New York Dog, Chicago Dog, and Coney Dog being the highlights. The bottled soda perfectly complemented the savory treats. The overall experience was enjoyable, though the music was a tad too loud. The staff were friendly and attentive, ensuring a smooth and prompt service. While the hot dog toppings were generous, the buns could have been a bit softer. Despite these minor drawbacks, the hot dogs and drinks were tasty and the atmosphere was lively, making for a memorable meal.|Barcelona||2022|3|Not the Wurst Hot Dogs
|128|en|3|The Chicken Pot Pie Crepe from Le Coin des Crêpes in London presented an interesting fusion of flavors. The crepe itself was well-made, with a delicate texture that complemented the hearty chicken pot pie filling. However, the combination didn't quite live up to expectations. The filling, while tasty, was a bit too heavy for the light crepe, causing it to become soggy towards the end. The dish had potential, but it might benefit from a more balanced pairing of filling and crepe. Overall, it was an adequate dining experience, but not one that particularly stands out.|London||2022|3|Le Coin des Crêpes
|31|en|3|"""Freezing Point truly hits the sweet spot! Their ice cream is a delightful treat in Seattle's summer heat. The Lemonade was refreshing, and the Two Scoop Bowl was generously portioned with creamy, flavorful ice cream. The Ice Cream Sandwich was a perfect blend of crisp cookies and smooth ice cream. The Mango Sticky Rice was a unique and delicious surprise, offering a tropical twist. The Popsicle was a fun, nostalgic treat. Topped off with Bottled Water and Soda, it was a perfect outing. Freezing Point, you've won my heart!"""|Seattle||2022|3|Freezing Point
|267|en|3|Flavorful and tender gyro meat takes center stage on Cheeky Greek's Gyro Plate in Seoul. Fresh vegetables complement the dish, but dry pita bread and a slightly lacking presentation detract from the experience. A satisfying portion size rounds out the meal, leaving room for improvement in some areas.|Seoul||2022|3|Cheeky Greek
|264|en|3|Tasty Tibs truck in Seoul offers a distinctive Ethiopian dining experience. The Lean Beef Tibs were a gastronomic delight, boasting a harmonious blend of spices and tender meat. Equally pleasing was the Veggie Combo, presenting an array of textures and flavors. A refreshing Ice Tea accompanied the meal, serving as an excellent counterpart to the spicy dishes. However, one might find the serving sizes somewhat smaller than anticipated. The service was swift and the staff, amiable. All in all, Tasty Tibs is a commendable option for individuals eager to delve into Ethiopian cuisine, albeit with the expectation of smaller portions.|Seoul||2022|3|Tasty Tibs
|314|pt|3|" ""Desappontador! Pedi da Nani's Kitchen, um clássico da cozinha Indiana em São Paulo, e fiquei extremamente desapontado com a qualidade do pedido. O Chicken Tikka Masala estava seco e gorduroso, enquanto o Tandoori Mixed Grill carecia de sabor. A combinação de curry também deixou muito a desejar, sem o aroma e o calor típicos da comida Indiana. O único ponto positivo foi o refrigerante em garrafa, mas isso não foi suficiente para compensar a experiência ruim. Recomendo evitar a Nani's Kitchen por enquanto."""|Sao Paulo||2022|3|Nani's Kitchen
|448|en|3|Peking Truck in Cape Town, a remarkable culinary find! The Chinese menu it offers is both authentic and delectable. An Ice Tea, Combo Lo Mein, and Combo Fried Rice were sampled, each dish proving to be a delightful burst of flavor. The Lo Mein, cooked to perfection, boasted a delightful fusion of vegetables and sauce. The Fried Rice, on the other hand, was a scrumptious assortment of flavors. The Ice Tea provided a refreshing balance, making it an excellent pairing for the meal. The exceptional food quality, combined with the amiable service, elevates this truck to a must-visit status. Strongly suggested for a memorable dining experience!|Cape Town||2022|3|Peking Truck
|350|de|3|" ""Leider muss ich sagen, dass mein Besuch im Kitakata Ramen Bar in Berlin enttäuschend war. Ich bestellte Creamy Chicken Ramen, Spicy Miso Vegetable Ramen und Tonkotsu Ramen, aber keine der Suppen konnte meine Erwartungen erfüllen. Die Nudeln waren übercooked und die Brühe schmeckte fad und einseitig. Auch die angepriesene Schärfe des Spicy Miso Vegetable Ramen lies sehr zu wünschen übrig. Insgesamt war die Qualität der Speisen nicht mit der eines typischen Ramen-Lokals in Japan vergleichbar. Schade, denn das Ambiente des Lokals war ansonsten sehr ansprechend.""Translation: ""Unfortunately, I have to say that my visit to Kitakata Ramen Bar in Berlin was disappointing. I ordered Creamy Chicken Ramen, Spicy Miso Vegetable Ramen and Tonkotsu Ramen, but none of the soups could meet my expectations. The noodles were overcooked and the broth tasted bland and one-dimensional. The advertised spiciness of the Spicy Miso Vegetable Ramen also left much to be desired. Overall, the quality of the food was not comparable to that of a typical ramen restaurant in Japan. It's a shame, because the ambiance of the restaurant was otherwise very appealing."""|Berlin||2022|3|Kitakata Ramen Bar
|350|en|3|Disappointment was the main course at Kitakata Ramen Bar in Berlin. The Creamy Chicken Ramen lacked the depth of flavor one would expect from a ramen dish. The chicken was overcooked, resulting in a tough and dry texture. The creamy broth was bland and lacked the richness it promised. The overall experience was underwhelming, especially considering the reputation of this establishment. I expected more from Kitakata Ramen Bar.|Berlin||2022|3|Kitakata Ramen Bar
|231|en|3|The Mega Melt offers a satisfying grilled cheese menu in the heart of Delhi. The Original and The Ranch sandwiches are well-crafted, with fresh bread and melted cheese. The accompanying Ice Tea is refreshing and complements the cheesy goodness. The overall experience is casual yet enjoyable, making it a perfect pit stop for a quick bite. However, the menu is limited, and the prices are slightly on the higher side.|Delhi||2022|3|The Mega Melt
|392|en|3|The Smoky BBQ in Madrid failed to impress. The Two Meat Plate and Three Meat Plate were disappointingly dry, lacking the juiciness and flavor one expects from a BBQ joint. The Rack of Pork Ribs, a staple in any BBQ menu, was overcooked and tough. The Fried Pickles, far from being a delightful side, were soggy and lacked crispness. The Spring Mix Salad was the only saving grace, but it's hard to go wrong with greens. Even the Ice Tea was too sweet, overshadowing the meal's already underwhelming flavors. Overall, a disappointing experience that didn't live up to BBQ standards.|Madrid||2022|3|Smoky BBQ
|415|en|3|Not the Wurst Hot Dogs truck, a gem in Barcelona, is an essential visit for hot dog enthusiasts. The Chicago Dog they serve is a timeless delight, complete with fresh bread, a succulent hot dog, sweet relish, and zesty mustard. The meat's preparation is flawless, and the toppings are both fresh and packed with flavor. The amiable staff are always eager to cater to your preferences, and the pricing is quite fair. In conclusion, for an authentic and scrumptious hot dog experience in Barcelona, Not the Wurst Hot Dogs comes highly recommended.|Barcelona||2022|3|Not the Wurst Hot Dogs
|415|en|3|" Disappointed with my experience at ""Not the Wurst Hot Dogs"" in Barcelona. The Coney Dog I ordered was far from satisfying. The bun was soggy, the chili lacked flavor, and the hot dog itself was overcooked. The presentation was lackluster, and the service was slow. I had high hopes, but unfortunately, this hot dog did not meet my expectations. I wouldn't recommend it to those seeking a quality hot dog experience."|Barcelona||2022|3|Not the Wurst Hot Dogs
|218|en|3|"""Le Coin des Crêpes is a delightful find in Mumbai! The Crepe Suzette and Breakfast Crepe were absolutely delicious. The crepes were perfectly thin and crispy, filled with fresh, flavorful ingredients. The Crepe Suzette, in particular, was a delight with its tangy-sweet orange sauce. The breakfast crepe was a hearty start to the day, packed with quality ingredients. The truck's ambiance was charming, and the service was friendly and efficient. I highly recommend Le Coin des Crêpes for anyone craving authentic, tasty crepes. A true gem in the city!"""|Mumbai||2022|3|Le Coin des Crêpes
|262|en|3|I was extremely disappointed with the Seitan Buffalo Wings I ordered from Plant Palace in Seoul. The wings were dry and flavorless, with a stark lack of tender seitan texture. The accompanying sauce was thin and uninspiring, failing to add any moisture or zest to the dish. The overall presentation was lacking, with unappetizingly wrinkled wings and a meager side of limp, undercooked rice. Considering the high price tag, I expected a much more satisfying and flavorful experience. Sadly, my appetite was left unfulfilled, and I would not recommend this particular item to anyone.|Seoul||2022|3|Plant Palace
|257|en|3|The Smoky BBQ truck's Spring Mix Salad and Three Meat Plate were a delight. The salad was fresh and flavorful, with a perfect balance of vegetables and dressing. The meat was tender and perfectly cooked, with a smoky flavor that complemented the salad perfectly. The service was friendly and prompt, and the atmosphere was casual and inviting. Overall, I highly recommend Smoky BBQ for anyone looking for a delicious and satisfying meal on the go.|Seoul||2022|3|Smoky BBQ
|128|en|3|The chicken pot pie crepe was an absolute disaster. The crepe itself was dry and crumbly, and the filling was far from savory. The chicken was tough and rubbery, and the pie filling was far too sweet. The only redeeming factor was the fruit filling, which was delicious. Overall, I would not recommend this crepe to anyone.|London||2022|3|Le Coin des Crêpes
|73|en|3|Peking Truck's offerings disappointing. Ice tea tepid, combo lo mein overcooked and flavorless, wonton soup greasy with insufficient broth. Food quality subpar, service impersonal. Truck's name evocative, yet culinary experience illusory.Ice tea lacked chill, combo lo mein overcooked and devoid of taste, wonton soup excessively greasy with meager broth. Food's quality fell below par, service came off as detached. Despite the alluring name, Peking Truck's delivered a culinary experience that failed to materialize.|New York City||2022|3|Peking Truck
|365|en|3|Kitakata Ramen Bar in Hamburg is a true gem! The Creamy Chicken Ramen was a delightful blend of rich flavors, while the Spicy Miso Vegetable Ramen offered a perfect kick of heat. The Tonkotsu Ramen was an absolute standout, with its velvety broth and tender pork. Each dish showcased the restaurant's commitment to quality and authenticity. A must-visit for ramen lovers!|Hamburg||2022|3|Kitakata Ramen Bar
|372|en|3|The Cheeky Greek Gyro Plate was a disappointment. The gyro meat was overcooked and dry, lacking the juicy tenderness I expected. The accompanying tzatziki sauce was bland, lacking the usual tangy kick. The pita bread was stale, making the overall experience underwhelming. Even the Ice Tea was watered down, lacking the refreshing taste it promised. Not the best choice for a Gyros meal in Hamburg.|Hamburg||2022|3|Cheeky Greek
|304|en|3|The Mac Shack's menu offerings, including the Buffalo Mac & Cheese, Bottled Soda, Lobster Mac & Cheese, and Standard Mac & Cheese, were met with satisfaction. The mac and cheese dishes were creamy and flavorful, with the Buffalo Mac & Cheese offering a tangy kick and the Lobster Mac & Cheese showcasing succulent lobster. The bottled soda selection was commendable, providing a range of refreshing options to complement the mac and cheese. Overall, the food and beverage selection at The Mac Shack were well-curated and delivered a satisfying experience.|Sao Paulo||2022|3|The Mac Shack
|228|en|3|"The ""Guac n' Roll"" truck in Delhi served up a mix of highs and lows. The Three Taco Combo Plate was a standout, with well-balanced flavors and fresh ingredients. The Veggie Taco Bowl, while visually appealing, lacked the expected punch in taste. The Fish Burrito was a bit underwhelming, with the fish being slightly overcooked. Overall, the experience was average, with some hits and misses in the menu."|Delhi||2022|3|Guac n' Roll
|231|en|3| The Mega Melt truck in Delhi offers a variety of grilled cheese sandwiches that are sure to please any cheese lover. The Ranch sandwich had a nice kick to it, while Miss Piggie was a delicious combination of cheese and bacon. The Original was a classic grilled cheese that was cooked to perfection. The bottled water was a nice touch to wash it all down. Overall, the sandwiches were good, but not exceptional. The bread could have been toasted a bit more for a crispier texture. Nevertheless, it was a satisfying meal.|Delhi||2022|3|The Mega Melt
